placeId,reviewId,reviewRate,reviewUser,reviewDate,reviewContent
20512,2233890,1,manu013,14/08/2022,"A horror, a horrible night, we were right next to a parking lot where young people made a mess! They started at 12:30 a.m. until 1:30 a.m. and it continued from 5 a.m. to 6 a.m., music from their car, shouting, 30€ per night (August 13), 4 ampere electricity, not enough to put on an air conditioning. Only 1 star for the reception and the direct access to the beach."
20512,2226623,4,agravia,13/08/2022,"Very good area with impeccable bathrooms but small plots, a lot of noise at night and as already mentioned, from 7am workers, cars and other annoyances. However, the best in the area. Thanks."
20512,2219928,4,viajero.,11/08/2022,"It is a place with a lot of charm!, but…. extortionate prices in July, August and part of September. For them it is high season in winter. Let's park at the door, which is legal."
20512,2185859,4,monfermat,06/08/2022,"Perfect for going to the beach... the owner is very nice and the facilities are good, very adequate for its price. The town is not much, very simple."
20512,2121247,2,W2T,25/07/2022,"The place has everything, but the sanitary facilities are getting old. Direct access to a beautiful sandy beach. However, at night very loud music from nearby bars and early in the morning construction workers & street noise."
20512,2118260,3,SPQR56,24/07/2022,"Beach at 150 m. Fill water: more than 470 ppm. For me, not drinkable!"
20512,2109784,5,ErikThomann,23/07/2022,"Nice place, the price is okay. The sanitary facilities are very clean and it is only a 3-minute walk to the beach. I would recommend it..."
20512,2071577,5,Hoi15,14/07/2022,Beautiful pitch by the sea. Nice owners. Quiet location.
20512,2051836,3,Rutera13,08/07/2022,"In area it is correct, but I don't like that they leave caravans, because some set up some semi-fixed beach bars that believe that the area belongs to them and are very scandalous, for that it is better to go to a campsite."
20512,2024219,4,latecoaire,30/06/2022,Very good nothing to complain about! Avoid places on the dusty and noisy side of the road.
20512,2020747,4,Carjan,29/06/2022,"3 days very pleasant for €15 pd including electricity. Facilities well taken care of, easy access to nice beach. Restaurants, ice cream parlor and spar within walking distance. Friendly owner. So fine. Just the many dogs with their owners who don't pay close attention. Barking, growling, sometimes loose."
20512,2008240,4,edugiansante,25/06/2022,"15 euro with energy, water, showers in June so pretty good. Only downside is that there’s literally nothing around. Beautiful sand beach dog friendly, but no chiringuitos. Supermarket is prob 2km or more away - there are two or three small restaurants but no dogs inside. Staff here is friendly and it’s good to chill."
20512,1971626,5,Calileo,12/06/2022,Great !! Very clean and very well maintained area by top staff - More than fair price for an area that offers the same services as a campsite.
20512,1944988,3,bernard695,04/06/2022,Nice campsite from June 15€ the pitch then July August 20€ close to the beach a little far from the shops.
20512,1927983,4,traveljw,29/05/2022,"Ideal for campers (10€ without electricity). Nice greeting from staff and fellow tenants. Close to the sandy beach. Water and toilets OK. Just a little tight places. Build a solar system. Let's see if that makes a difference on the electricity price (electricity in Spain is expensive and time-dependent, see app 'Precio de la Luz' )"
20512,1923579,3,peoplecalled,28/05/2022,"Value for money is really great. For 10€ with showers and toilet you can't say anything. But it is a ""white mobile home landscape"". The place and beach is not particularly nice. Very narrow places."
20512,1910161,4,Calimero125,23/05/2022,"If we disregard the vacant lot that we cross on arrival, this motorhome area is really very pleasant. All services are offered, as explained in previous comments, the nights are very quiet, the beach is directly accessible. No wonder campers stay there for months! In progress for a few days, a giant inflatable pool!"
20512,1908453,5,RubenSuarez,22/05/2022,"SPECTACULAR! Overnight for €10 (without electricity), flat land, separate plots with drinking water intakes, cleaning supplies included, toilets and showers (hot water included), direct access to the beach (100 meters), close to the town (bars and restaurants)...tranquility, the manager is very nice and gives good information to visit, where to eat...in short, we will repeat because this place is a jewel!"
20512,1907833,5,maxbois,22/05/2022,Very clean maintained quiet area well located nearby beach to recommend price 10 euros all inclusive bravo
20512,1905677,5,milenasca,21/05/2022,"excellent rest area, hot showers, wifi, services and electricity if you want. very quiet place with a beautiful beach, fair price"
20512,1882942,5,lightonia,11/05/2022,"Access to this campsite is off the main road and is actually called La Finca. Direct access to the wide beach, very friendly management, green plots, dogs allowed & incl., hot showers, clean sanitary facilities, free wifi = for only €10 per night. If you stay longer even cheaper.. (washing machine + electricity extra) Here you can relax wonderfully!"
20512,1874055,4,f283,06/05/2022,"beautiful area, well thought out, very clean toilets and showers, 10€+4€ electricity we recommend the place"
20512,1866338,5,patoune65,02/05/2022,superb area for 10€ per night all services included and the longer you stay the price fucks (showers WC sink Washing machine) superb welcome and the person who manages the area is super nice I recommend it
20512,1845166,5,F.Alvarez,22/04/2022,A few meters from the beach and the restaurant area. Highlight the kindness of the workers. Improvable facilities.
20512,1802264,3,MimoOnTour,31/03/2022,"Price and cleanliness okay, but we felt like sardines in a can. Small pitches, more like a parking lot. We didn't want to spend more than one night here. Attention: Many permanent campers who seem to spend several weeks/months on the site.."
20512,1800929,3,Terloo,30/03/2022,"camper place itself is neat, safe and very quiet. 20m from the beach. the environment is desolate and dead. dilapidated buildings with no charm. good place for 1 night in transit."
20512,1755067,5,techsol,13/02/2022,nice and clean with super hot powerfully showers!
20512,1751659,3,BUnger,09/02/2022,"We were there 3 nights. Unfortunately, in the end, instead of paying €8-€10 per night without electricity, you were averse. The place is quite nice so far. close to the beach. Many permanent campers who stand there for several months."
20512,1740275,5,olafohlrogge,24/01/2022,Simply great!!! Great location!
20512,1739807,3,antoniovassalo,23/01/2022,good friendly staff. only problem the light doesn't work well and for the price you pay I had the light turned off. everything else clean I'll definitely be back but with good electricity for the fridge
20512,1736874,1,looky,19/01/2022,we arrived at around 5pm on January 17 but no more room. we were able to sleep in a parking lot not far away. another motorhome was with us.
20512,1735161,2,carlosll,16/01/2022,"If you are looking for tranquility then this is your place. They have a problem with the light sockets. The normal would be a scale between 220-230V, but I have been able to verify oscillations that barely reach 210V and even drop to 190V. This is very detrimental to your electrical consumables, especially if you have a trivalent refrigerator, as it can damage the plate. All this checked with a multimeter."
20512,1709645,3,FindusPettson,13/12/2021,"Actually a nice parking space, as described, but with 5 amps electricity, not even the refrigerator works in the winter. The main fuse blows all the time. There you can also be self-sufficient."
20512,1708144,5,audreycalys,11/12/2021,"The village died in this season but what a rest! Very good night. The gentleman welcomes you kindly. The wifi is available everywhere. The showers in the prefab are large, hot and clean. Right on the beach, wasteland to take the dog out just stuck (it would be good to pick up the poop even if it's a wasteland, we will end up not being able to avoid it) 14th all inclusive"
20512,1706397,4,sugary,08/12/2021,"We came across this place and ended up staying a week. Pretty good site, lovely staff, clean facilities and lovely hot showers lovely beach but the town is very quiet this time of year. O.k if that's what you want. Would return if in the area."
20512,1700042,4,jamesm633,29/11/2021,"Nice staff, nothing really open in the area in winter season but no fault of the site, who stay open. Next to a nice clean beach. Great cycling routes nearby. facilities are fine, could do with benches in the shower area's but everything is cleaned daily."
20512,1699620,3,fredetmaryno,28/11/2021,"A nice place but nothing more, 5 amps for 4 € suddenly the ALDE heaters in poverty because only 1 kilowatts otherwise it farts. The shops are almost all closed, on the other hand the managers are welcoming. I'm not sure I'll go back there, a bit sad at this time."
20512,1691090,4,marjonhauloglas,16/11/2021,"Do not be tempted to follow the navigation, you will be led over a cart track that a motorhome cannot pass. Just go through the town, on asphalt roads and be guided by the signs."
20512,1681804,4,SuitillosVan,07/11/2021,"On these dates just to spend the night since there is nothing in the town, but in summer it is very good, next to the beach. The price in November 10 € night AC two adults and two girls, it has a water connection every two plots and electricity equally."
20512,1678440,4,BidochonandCo,05/11/2021,Pleasant and quiet motorhome area
20512,1654928,4,smeetjeee,21/10/2021,Clean facilities. A bit easy Made and older. Only 1 laundry machine was working so there was a line the whole day. Very short walk to the beach.
20512,1652381,3,hexle78,19/10/2021,"Clean toilets and showers. Washer and dryer. The lady at the reception prepared delicious sangria for us. ;-) Very close to the beach. It smelled bad at our place, so we didn't feel so comfortable."
20512,1651152,3,Machu,18/10/2021,"Small pitches and not all equipped with electricity, sanitary facilities in Algeco old-fashioned but clean. At that time everything is closed around, only the beach… the teutonic people, the blondes from the north, have taken possession of the place… it's teutonengrill… sunbathing… sunbathing… sunbathing…."
20512,1641945,5,john221221221,13/10/2021,"Excellent site next to the beach, good wifi all around site. Hot showers and good facilities. The lady on reception is very helpful. nice clean beach and Spar shop nearby. long stay discount. Highly recommend. large pitches."
20512,1635185,2,maxohagan,09/10/2021,Facilities a bit old. Stunning location!! Rudest campsite staff member ever dealt with and very insulting. Won’t be returning
20512,1612649,5,andreasliebe,27/09/2021,"For us one of the best pitches in Spain. Nicely laid out, good sanitary facilities, washing machine, only 35m from the beach with its own access to the natural sandy beach with dunes behind. Skyscrapers only to the north, to the south only nature. Spar store with everything you need within walking distance, a pharmacy, a few open restaurants, but otherwise almost everything is closed over the winter. Coming for the 3rd time."
20512,1589196,5,jferfre,18/09/2021,"A great place to be near the sea. In September, it is important to call ahead. Motorhome prohibited in the outdoor area"
20512,1573056,5,VillaG,12/09/2021,A good area next to the beach and with very friendly staff. We will be back.
20512,1549419,5,isabelle59160,05/09/2021,Very nice land direct access to the beach very clean shower and toilet
20512,1531543,5,IdolinaParra,30/08/2021,"Area with everything you need, next to the beach and very close to all kinds of shops. Very friendly owner. We will be back."
20512,1486025,5,cocofifi31,20/08/2021,"2nd visit, always so clean, beach next to the sand but beware of the waves which can be a risk for the little ones. Trade and restaurant within walking distance"
20512,1476383,4,apolloxi,18/08/2021,"We came last year and we have repeated, it is a magnificent place, there is 1 minute until we get to the beach, the price has gone up last year, the price has been € 30 5 people, surely next year we will return"
20512,1461876,5,lapitufa,15/08/2021,Fantastic weekend. We will return without hesitation. Thank you very much Andrei.
20512,1433850,5,RiRiRita,10/08/2021,We went in to change the water in the van for 5 euros and they let us take a shower. Very friendly treatment by the person in charge. Very clean campsite with good facilities.
20512,1398018,4,chispeantes,03/08/2021,Simple but pleasant campsite. little shade yet. € 20 in high season is fine. I flicker with people who complain in another comment that the owner has set up a pool and a soccer field. Is that really a bad thing? it is an improvement !! They have also added a small trampoline for the children.
20512,1360343,5,weekendvario,24/07/2021,Good paid area for campers. Big spots with trees on both sides. If you park in the middle of to campers you will have shadow both in the afternoon and morning. Water access between every spot. Electricity can be used with CEE plug and normal EURO-plug. 20EUR for 2 persons for 1 night. Showers and bathrooms were very clean.
20512,1318869,4,carthago27,12/07/2021,"Nice sea nearby not always very clean on weekends for the high traffic, too bad for 20 € per night. Go to the small Los Delfines restaurant next to the area, the salmon is to die for."
20512,1302466,5,quckamper,07/07/2021,"We have loved this area super close to the beach and super clean bathrooms and services, it has a large pool for children and inflatable mats, the managers there are super friendly and always ready to give you a hand! We will come back for sure"
20512,1288923,5,Sescapa,01/07/2021,"Put in the locator Plaza la safor, it is on the right."
20512,1286123,5,F.Alvarez,30/06/2021,"We stayed for three nights and great. The beach is accessible a few meters from the nearby area, shops and bars as well. The bathrooms, sinks etc, in quite good condition and clean. We will repeat"
20512,1278642,3,pawsitive.dogz,26/06/2021,"Very well maintained, large showers with hot water (incl.), Direct access to the beach. A few meters further, the access with a ramp and footbridge to the water is much more pleasant in winter. In summer, and especially on weekends, it's like camping in the children's playground. Quite exhausting as a childless. But great for children."
20512,1273035,3,serge3292,23/06/2021,"Very disappointed, increase of € 6 in June. More and more caravans with very large and very noisy families. It's not really a CC area anymore. The owner even installed a small inflatable pool and a mini football field for the children. Very unfortunate because we spent great years there."
20512,1261814,5,miclou,18/06/2021,"Very cozy next to a deserted beach, we spent 3 great days with all the services and very good wifi for € 15 a day the plot with light, a marvel. We have booked another 3 days for July, and the price in July-August is € 20. very acceptable."
20512,1245309,5,momoontour1991,09/06/2021,Very very warm welcome from the owner!!! Super nice and easy to handle with all you need. Calm and super relaxing -thanks for all!!!
20512,1232783,5,JudithFeskens,02/06/2021,"For 5 euros you can empty the gray and black water tank, fill your father-in-law, use WiFi and take a shower. Very nice service!"
20512,1226107,5,pataetes,30/05/2021,"Very quiet place, very friendly staff and a fantastic beach !! We will repeat for sure"
20512,1203508,5,sanandres,17/05/2021,"The street that you have to put in the navigator so that you do not get on roads is carrer del garbi, Andrei a phenomenal person, the services are good and clean, with access to the beach directly from an area that will be walking 20 meters or less from the area to the beach, we liked it so much that next weekend we will go again"
20512,1192689,4,JensRonn,11/05/2021,"We spent 7 nights in our mini van at this place, spot 27B  Only lack of time forced us to leave La Finca.  Everything perfect, Mr.Andrei leads the place perfectly, we will be back."
20512,1179294,5,Frankia84400,25/04/2021,Superb area by the sea. All comfort for a very reasonable price out of season. Accessible to all sizes. Be careful not to rely on the GPS coordinates. Go straight to the beach and walk along it on your right to the end. the entrance is in front of the Italian restaurant
20512,1171513,5,sergicondal,10/04/2021,Beautiful fine sand beach .... area to touch ... all services clean ... reasonable price ... wifi only in reception .... friendly and helpful guy
20512,1169539,5,binloren,07/04/2021,"Very clean and large pitches, you can take out chairs and tables, 40 m from the beach"
20512,1168506,3,kitti,05/04/2021,Place ok so far
20512,1156556,4,lastortugas,24/03/2021,"ACCESS IS THROUGH GARBI STREET, the locator indications ARE WRONG. Quiet place, 50 meters from the beach and very clean. otally recommended."
20512,1152008,4,isaway,15/03/2021,"Very good plan, it's clean, practical, the locations are very correct and the atmosphere is rather nice. beach a few dozen meters away, free wifi at reception. clean sanitary and hot water (once you've let the morning rush through)"
20512,1150328,5,JR.,12/03/2021,"Very quiet, clean campsite with all services, very well attended by Andrei and Antonio"
20512,1135455,3,hasenteufel,06/02/2021,Also ok for a beach vacation with swimming.
20512,1134441,5,happy666campers,01/02/2021,"Stayed here from 13/01 for 12 nights, it cost €7 a night without electricity. Good site, everything clean. On the edge of the town. Plenty of places to cycle to. Looks a bit basic from the outside but don’t let this put you off, great guy in charge. Recommend"
20512,1122033,5,NinaLat,18/12/2020,Brilliant place. Have stayed for 2 weeks for € 7.00 per night. Electric € 3.00 per night. Nice warm showers. Washing machine costs € 4.00 and € 3.00 for the dryer. Very pleasant. Nice owner. Spar close by for the necessary shopping.
20512,1121259,4,bitesize,14/12/2020,"We stayed here for 3 nights. Very friendly owner, excellent spoken English. Services are a little dated but kept very clean. Tip: try to shower when others are not otherwise you run out of hot water. Everywhere was clean and tidy on site. Quite busy even though the town was completely closed apart from the Spar shop. Gravel track behind the site to the beach. Fabulous beach."
20512,1108974,5,wmuijters,29/10/2020,"Everything we need is there, beach almost right at the door. Very nice operator. Very spacious places"
20512,1108129,5,sanru,28/10/2020,A very clean and spacious area next to the sea. We will be back
20512,1105427,4,Eduroig,25/10/2020,"Good place, clean and spacious; direct access to the great beach; neat bathrooms and showers; friendly staff."
20512,1099278,3,DESCHIRON,19/10/2020,"Sleeped one night on 10/18/20 suitable area, spacious showers and correct price: 9 euros without electricity, only 5 amp, the gray water drains are done at the exit not terrible for those who want to get out you block the passage but no problems at the moment not many people covid oblige."
20512,1074673,5,lauraonddanielroadtrip,29/09/2020,It's a great place. We recommend him to others. The showers are large and you have warm water no matter what time of day or night. Toilet is clean. You can empty gray water and fill up drinking water. Tap directly in front of the pitch. The beach is very close. We paid € 9 without electricity.
20512,1051630,4,lorenza,16/09/2020,"Well placed area, by the sea. Friendly welcome. Clean. Small pitch, one on top of the other in high season. Concrete city and intensive cultivation of oranges. Beautiful beach. 9 euros without electricity in September."
20512,1032271,5,eternel46,07/09/2020,it's been the fourth time we've come to this area despite Marcella no longer there the reception is the same too bad the covid19 bother people because the place is very pleasant unhappy I see that there is very little camping- because and very little French compared to other years.
20512,975523,5,anditz33,17/08/2020,"Excellent atention. Near the beach. With showers, toilets, sink, drain, electricity ... perfect !!"
20512,973220,5,esarh,17/08/2020,"It is a very cozy and familiar camping area. The atmosphere is nice. It is next to the beach It is clean and the staff is very nice, they are a charm The pitches are of different sizes, with little shade but you can take out awnings and chairs, so you enjoy being outside They have ice and beers cold, which always come in handy. There are some shops within walking distance. We will repeat!"
20512,965916,5,Muchynos,15/08/2020,"A wonderful place, cleanliness, super friendly people. Andrew keeps everything impeccable and is super aware of all the needs of the clients."
20512,965897,5,alfgarcia,15/08/2020,"Nice campsite, good facilities, close to the beach nice and attentive staff. In summer it is a pleasure to go with children as it is a cozy family campsite. recommended 100 x 100. the worker is always pending and attentive to the clientele a 10 x the boy."
20512,954304,1,miquelrace,12/08/2020,"Those in charge are friendly and attentive, but it is an area with several “haimas” set up with many children shouting without anyone saying anything until after 00:00 hours, little respect for the rest of others. The electric current is only 5 Amp. We will not be back."
20512,881463,5,idanere,19/07/2020,Camper park a few meters from the beach. With very correct facilities and friendly and helpful staff. Nearby there are restaurants to order paella to take away. Recommended to be able to get an awning and tables near the beach in the middle of summer!
20512,843017,4,latecoaire,30/06/2020,Very good area 15 euro with electricity!
20512,803137,5,WhiteRastas,18/05/2020,"Shortly before Christmas 2019, we found this space via a parking space app. We actually only wanted to stay there for a few days, but it was a three-month stay. The longer you stay, the cheaper the daily price becomes. We only paid € 6 a day, including water and sewage. Electricity costs € 3 extra per day. Fresh water can be used in individual places. There is a floor inlet for disposal, as well as a chemical toilet disposal station. Containers have free showers, toilets and an opportunity to clean dishes. Washer and dryer are also available, which can be used with euro coins. In the back corner of the square, there is a large linen laundry area where you can hang your laundry. You can use free WiFi at the reception, but there are tables and chairs that are perfect during use. The parking spaces are spacious and parceled out on gravel. The course is equipped with everything you need for a comfortable stay. In the place there is a very well-stocked savings, on the square a gas man regularly comes to the bottle sale. The sea can be reached in a few minutes on foot. You can hear it in the evening. Dogs are allowed on the pitch. Sorted rubbish can be disposed of free of charge. We lacked nothing on the pitch. Most of the guests there have been coming there for the winter for years, know each other and usually come together for games or small celebrations. We can only recommend this place and hope that we can spend the next winter there again."
20512,792268,5,carlosll,07/03/2020,"Good area at a good price next to the beach. € 8 plus € 3 for electricity (optional). If you arrive late and cannot enter, you can sleep outside without problem and enter the next day. In summer it may not be allowed to spend the night outside because there is a prohibited sign."
20512,779832,5,CCShakti,13/02/2020,"Motorhome area extended to gain a few places. The staff is really great, the commons are clean and the off-season rate for us in February 2020 is very correct. Many thanks to the staff. (Hasta pronto)"
20512,772173,4,Transcamp,24/01/2020,Friendly staff. Located directly on the beach. All VE available.
20512,768904,4,Marianve,15/01/2020,"Great location. Hot showers, good toilets, great reception. certainly in terms of price / quality ratio worthwhile to return again. every day we were there it was completely full at 5 pm."
20512,754269,4,derMartn,16/12/2019,Nice campsite with everything you need. In the low season there is absolutely nothing going on in the area. Up to the beach about 200m.
20512,749086,4,Corcho,01/12/2019,"Large area, with showers, bathrooms, sink, washing machine and water loading and unloading. For only € 8, with light € 11. Direct access to the beach. Very quiet place although somewhat away from Tavernes. It has neither a bike path nor a promenade, so if you do not travel by vehicle you are a bit ""locked up""."
20512,747794,4,Europetravelor64,27/11/2019,Super pitch for great conditions (11 € / night including electricity). Supermarket (Spar) within walking distance within the village.
20512,747339,4,LYP,26/11/2019,"Clean CampingCarPark, narrow spaces bordering beach without soul. Between concrete Mediterranean and industrialized orange groves"
20512,745179,4,JensRonn,20/11/2019,"We had two nights with our mini van. WC and shower very clean. Living room with wood burning stove. Staff very nice and helpful. Speaks and understands all main languages. The place is well-visited and can easily be found. Should it be filled, there is a large space outside. Price: 8.00 €, electricity: 3: 00 €. We'll be back."
20512,738477,5,Ahiru,04/11/2019,We have spent two nights and very well. Departure near the beach. Showers and toilet very clean. The super friendly girl. Large spaces Chairs and tables can be taken out.
20512,738153,5,edugu,04/11/2019,Very well maintained and clean area. Next to the beach. Good price. Thank you.
