placeId,reviewId,reviewRate,reviewUser,reviewDate,reviewContent
111355,522791,3,U11216,20/06/2019,"Kind of messy. No delimited boxes provided. Dusty. Very nicely situated on the beach with chiringuito. We have not used toilets, but they do not seem really clean."
111355,513431,3,BieneMaja,12/06/2019,"Simple but beautiful parking space without shade. Toilets not very clean. 7 euros per night without service. left next to the pitch has a nudist beach, very nice, clean and not so many people as the beach directly at the pitch."
111355,493472,5,stef.de.cherbourg,26/05/2019,"Great place in the middle of the wild coast ....... area on the beach ..... Chiringuito very nice ...... like Domingo the boss (among other things, he can bring you bread or others) ...... Bike or other means necessary to do the shopping ..... Calabardina to 3 kilometers .... Aguilas to 10 .... We will come back ...."
111355,482648,5,Abuelo,12/05/2019,"Perfect site, it has a magnificent location, the services are more than acceptable, Domingo the owner is very kind and friendly, very good quality price, I recommend it totally"
111355,478888,2,packandtrek,08/05/2019,"The place costs 7 € and everything else is charged extra. Electricity 3 €, shower (cold water in a dilapidated container) per person 1.50 € even for a few months old baby. Washing machine 3 €. Not a nice beach. Place did not convince us."
111355,470015,1,Ginebrino48,28/04/2019,Terrible host very uneven place and toilets or talk place to leave for those who love the beach that is close nudist otherwise I do not recommend
111355,469311,4,2momsontheroad,27/04/2019,"Super nice place! Grandiose view and great beach with beach bar. Super dear operator, very helpful. When it's busy, you're pretty close. The sanitary facilities are not so great. Toilet is shared with guests from the beach bar. But if you have a toilet on board that is unimportant anyway. This place does not have such stuffy people as you often meet. So if you like it a little cooler, go there. Every now and then a ""green"" breeze blows from the beach bar."
111355,458129,5,Ulfender,18/04/2019,"Absolutely great parking space with electricity, water and sewage. Another feeling in the middle of hotels and tourist places. Highly recommended if you love it lonely. The operator and the staff are super nice and help where they can!"
111355,444390,5,funkyronster,25/03/2019,"Right on the beach for less than €10 ... funky place, nice owner. Potable water is available at a central tap for €2/100L. Recommended."
111355,435303,5,demelsa,02/03/2019,Good Morning! Can someone give me a phone to book or an address to go. Many thanks
111355,434703,5,vinangel,28/02/2019,"What a  lovely place, electricity, emptying and a beach bar too. Great views, dog friendly beach. With ehu  €10 a night. Very friendly people when we were there. Negatives are no drinkable water ( didn’t bother us as have lots on board) and no hot showers ( again we have our own on board) we will return"
111355,433847,4,tibertrix,26/02/2019,Excellent rest area near the cliff. Interesting and peaceful place.
111355,428358,4,nelsona,11/02/2019,Just arrived here and it’s beautiful. Right on the beach and with its own bar It’s a real find. Only downside no hot showers! but very reasonable site fees more than compensate. €7 plus €3 for electric. Stay a week and it’s €6 and 2!
111386,2494425,1,Traxxxx,13/11/2022,Today there were about 6 different vehicles. But I drove on because there is a sign saying that camping is forbidden.
111386,2015026,4,luisautostaro,27/06/2022,"The appointment was great but as of 06 23 2022 and shortly after closing a nearby car park with clearance, some users have received notification of a 480 euro penalty just when they open a camping area near the place"
111386,1735784,1,JeJe68,17/01/2022,"the place is not bad, except qie being in berlingo with roof tent we were fired by the civil police following denunciation of the inhabitants nearby ..."
111386,943783,3,Josemanolo,09/08/2020,"The site is not bad, but a lot of cars with rare lots and they leave all the garbage thrown away and stop that it is from the motorhomes and the caravans are the ones who take care of the environment the most. We always pay just for a sinner"
111386,759044,1,Lilias01,29/12/2019,There are now signs saying no overnight parking or camping.
111388,1076749,3,F.Miranda,30/09/2020,"Huge park only used once a year. Very lonely but it has a little village near. It has a good thing, a water channel near by very good for hike or bike. It has a lot of wild animals near like little “Bambi” gazelles. It is not a bad place but a little alone here..."
111388,741152,2,Tornjak,10/11/2019,"Quiet, tarmac, generally level parking and accessible to all sizes. Out of season the Sanctuary represents a relative interest. Emergency parking or lunch. I did not spend the night here. Optimal satellite and 4G reception."
111393,2885355,5,Craigy24,23/06/2023,"Amazing! Shade, cold showers and toilets with toilet paper. Very quiet in all aspects. Absolutely beautiful sunset and a great base for walking / cycling. 
As stated the last section of road is pretty steep with a couple of hairpins and it's not really ideal for big vans."
111393,2680143,5,JMRB,18/04/2023,Phenomenal place between pines !!! Highly recommended for small or medium vehicle.
111393,2421609,5,AntonioAlvarez,03/10/2022,"Shady parking lot, very crowded in the mornings and quiet in the middle of the afternoon/night. Bathrooms and drinking water and containers. Perfect for starting trekking routes, such as the famous snow cellars or the top of Montcabrer. Let's take care of these sites"
111393,1163191,2,Abriluchi,01/04/2021,"Perfect site. Bathrooms, water and tables. But a forester came to remind us that we couldn't sleep there, we had to go."
111393,1072421,3,gneomo,27/09/2020,We have already gone several times and the place is great but the last (10/26/2020) at 3:30 in the morning was a car and it was for a while with the doors open and music at full volume and around 4 o'clock many people passed by Screaming it seems they made a bottle on the picknic tables.
111393,900880,5,riftercoco,26/07/2020,"Very quiet place. We have spent a night and a day in the shade of the pine trees. At night not a sound. It has clean toilets (the showers were closed), water taps, picnic tables, and bins. Within 5 minutes there is a small waterfall to cool off."
111393,789107,1,Vincentmr,01/03/2020,"No sooner had the ranger asked us to leave than we were not allowed to stay for the night. Too bad, the place is beautiful."
111393,786725,4,stvn,25/02/2020,"Wouldn't recommend larger than a small van. Nice walking track, definitely worth a stop. 'Ranger' (a guy with green cloth) told us, that we are not allowed to spend the night. But he actually didn't make the impression, that he really cares. Just told us, because he was there anyway."
111393,749832,5,Cathconnell,04/12/2019,"Wonderful overnight stop surrounded by woods but not so good for a big van. We are 7.5m and we struggled in the rain on the wet road surface. Great facilities, clean loos with paper but showers were locked. Too rainy for us to hike unfortunately"
111393,500604,5,tichylibor,01/06/2019,"We stayed one night, alone, no another car. Quiet and clean place. Nice sunset. Near is restaurant (2km)."
111393,445783,4,jrrks,28/03/2019,Nice picnic area in pine shade. Toilets open 24h and water on taps little above them. Also garbage bins. Steep road on final 1km. Not very big parking lot and 2 MH would fit without blocking it. Good for treks on Sierra Mariola and overnight stay.
111394,2855232,5,Knet,14/06/2023,Perfect if you are autonomous. Very quiet in the morning at 1/2 nine. 4 fishermen did not bother you. The view alone was worth stopping for
111394,2729601,5,LorraineundManuel,07/05/2023,"Very nice place - you have to walk down to the lake. A flock of sheep comes by in the morning and evening. If you want to stand, like in the photos, you have to be early. 6 vehicles don't fit there."
111394,2683753,5,MarionLaulhe,20/04/2023,"Great location, wonderful view."
111394,2606717,5,peninsulacampertribe,12/03/2023,"We spent 1 night, there were about 4 more motorhomes, we felt accompanied, the place is very beautiful, beautiful views of the lake, right next to a road but it is not very busy and at night there was no noise. The access is a little difficult if you have a very low car, since the step of the road is quite high, but with care you can access it well."
111394,2581441,5,Alix06,18/02/2023,"Very nice view and fairly quiet road. The location is excellent to go do the Caminito del Rey the next day. On the other hand, if there is wind the place is very exposed and in the van, we felt the gusts of wind all night long."
111394,2434013,4,rolanda,09/10/2022,A very nice location. Beautiful view! Ideal place to leave the next day to the start of the caminito del rey.
111394,2386820,4,PtiBedo,19/09/2022,"Very quiet place where we spent 2 nights without any problem Nice view of the lake and the mountain. Arrived around 7pm, there are quite a few flies until 8/8:30pm then nothing. The spot is under an airplane trajectory but it's very quiet at night."
111394,2218294,4,paulaundsamiontour,11/08/2022,"Very nice parking space, probably not really allowed because there are some signs in the area. But we had no problems. We collected some rubbish, it's a pity that there is so much lying around. View of the lake is definitely worth it :)"
111394,2004587,5,elhinchon,23/06/2022,We have spent 2 super quiet nights. beautiful views of the stars. plane routes pass through there!
111394,1941296,5,AnnaRi91,03/06/2022,"Perfect view of the lake, beautiful sunset. Quiet night, stayed for one night in early June and all by myself. No trash or legacies. A little off the street."
111394,1925790,4,daniundleoontour,28/05/2022,A nice pitch on a hill overlooking the lake. We stayed one night and felt very safe.
111394,1880321,5,3pleL,09/05/2022,"Nice view, level places, some other campers, felt safe and spent a quiet night here."
111394,1851382,4,squakypanda,24/04/2022,"Nice place with beautiful view. Some motorhomes. You are fairly straight. No traffic at night, but in the morning there is."
111394,1785159,5,Waild-Fahmuhlee,16/03/2022,A good spot to stay for a few nights with beautiful mountainous surroundings....very peaceful and relaxing especially after driving through the horror that is Costa del sol...
111394,1778974,5,noordepagter,10/03/2022,Beautiful spot. Kind of flat. Beautiful walk to the lake. Sheep’s walking by with shepherd. Quiet night. Only 5 minutes away from entrence caminito del rey.
111394,1765184,4,TeamS,25/02/2022,"Perfect spot for the night, some road noise, but mostly very quiet apart from the wind. Stunning views over the lake."
111394,1762916,4,Laurel22,22/02/2022,Good for spending the night before or after El caminito del rey. Not too much traffic on the nearby road.
111394,1751742,4,Beardedgrouch,09/02/2022,"Great location to stay overnight. No services, no trash can. Nice view over the water."
111394,1749305,5,Boch51,06/02/2022,"Access to the spot is a little tricky for longer motorhomes but is a doable if you go slowly. If you have a 4x4, there are even more possibilities if you continue further. It's next to the road but still calm and quiet. Beautiful landscape and walk around the reservoir. Herd of sheep passes by 2x a day! Tranquil spot where we spent 2 days."
111394,1733506,5,EGPH,13/01/2022,Perfect. A breathtaking view and a quiet place despite the proximity to the road. Optimal!
111394,1667411,5,cmlaura,29/10/2021,"We have slept two nights with other motorhomes and even a camperized bus, very quiet. Quite a few cars pass but you can park a bit far from the road. This area is no longer a natural park so they can't tell you anything about staying overnight."
111394,1643280,5,OscaryVirgi,13/10/2021,"Good place to spend a quiet day with the family and in nature, some potholes in the last section."
111394,1180629,5,Jelmerbaten,27/04/2021,Fantastic place!
111394,794722,5,katy47,12/03/2020,"Very nice place difficult to access but super quiet, a good place to land."
111394,781611,4,Priscila2020,16/02/2020,Good place to spend the day by the water .. easy access for large AC
111394,527313,5,NuriaFD,24/06/2019,Beautiful landscape over the reservoir.
111394,446573,5,Perrine_et_Gabriel,30/03/2019,"Ability to descend on the path that goes right, 4 * 4 more, but goes very well with a Vito."
111394,440946,5,sutnicaj,17/03/2019,A magic wild spot! Perfect to relax and feel the nature! Recommende.
111394,432148,4,djouls,22/02/2019,Wild place without commodity
111394,428982,5,Julesmick,13/02/2019,Perfect
111396,3130332,4,nellypulik,12/08/2023,"Very nice spot, really avoid going there in a motorhome, it is very tight and very complicated to turn around once at the end if you are in a motorhome / we were in a Vito and it was perfect. Incredible view"
111396,2413565,5,tourguideucantrust,30/09/2022,"Very nice place and giving two stars because you overlook a sign? Yes, oh dear police, unfortunately I didn't see that it was a 30 zone and drove 100, I can't help it. No very nice place, but unfortunately not overnight, that's the rules in the nature reserve. Better take your rubbish with you, otherwise this will never change."
111396,1754013,2,Fontain,12/02/2022,"Very nice, however, access is prohibited for campers. Didn't see the sign and less than 5 minutes later the GNR was there and I was allowed to pay 60 euros."
111396,1746023,5,b2basics,02/02/2022,"Great view, turquoise bathing water, very good gravel road through a small farm"
111396,1677409,1,KikiCiki,04/11/2021,"In the village at the entrance to the road that leads to this place there is a ban on access to campers. In Portugal now not only can you not stay overnight anywhere, but not even access to parking during the day .. really sad"
111396,1603340,4,MaribeliaEnMovimiento,23/09/2021,An extraordinary view and a cove to enjoy. For 4-5 campervan.
111396,1468308,2,dirisarri,16/08/2021,The site is spectacular but the police have arrived at 9 o'clock at night and have thrown us out of the 4 vans that we were
111396,1105242,5,dan2020,25/10/2020,The trail along the coastline is breathtaking.
111396,1068374,4,MarkusMarko,24/09/2020,"Wonderfull cliff setting to stay with the camper, only spoiled by traffic sign at the beginning of the road that forbids campervans.
Nevertheless we stayed for one night with 2 other campers and were lucky that the GNR didn't show up."
111396,1050381,5,janatimo,15/09/2020,Wonderful place. We would sleep there again in a heartbeat. There were 3 other vans / RVs with and there. It was very quiet. Great sunset over the sea :)
111396,1019309,5,maddyp,01/09/2020,The best place we stayed on the portugal coast! Beautiful sunset and private beach. A few local fisherman at night and in the morning. We stayed overnight without a problem just a few reminders from the locals that you weren’t allowed to camp. Highly recommend 10/10 even just for a dinner and sunset views
111396,1014502,2,LaraAf,30/08/2020,"Wonderful to see, we didn't stay overnight because it was so airy the car was moving. There was no other car or camper, so we suspect that they may not allow you to stay overnight. But the sunset and the descent to the beaches spectacular. All wild."
111396,978362,5,HannaHbd,18/08/2020,"Rather 6/5 stars, so beautiful!! Small sandy path, accessible for campervans and smaller campers. Marvelous beach with few people. Police came by around 10am and kicked us nicely out."
111396,953254,5,cyrilpiga,12/08/2020,"Coming from the North, certainly the best stop I could have made in Portugal"
111396,869502,5,Manjerico,14/07/2020,"Very busy, but we arrived late and still got a place. Although we had several neighbors, it was a very peaceful night. Wonderful view and “private” beach."
111396,796787,5,WeeRoam,20/03/2020,"We stayed there for a week during the beginning of the coronavirus confinement, this place was our home. We spent time on the beach, met very nice people, enjoyed the sun. We even found a public shower in the village nearby, just at the end of the road, you can walk there. I already miss our spot and we're planning on going back. It's sometimes a little bit windy but you can move back a little and there's a weird guy who kept coming and looking at us in the morning but we're used to it..."
111396,732485,5,missaline24,28/10/2019,"We ate here, beautiful spot, the beach accessible by the stairs is sublime !!"
111396,694307,5,ruben-lm,17/09/2019,Good access by dirt road without potholes. Spectacular views. Recommendable.
111396,681939,5,gomezlau,08/09/2019,"Spectacular site on the edge of the cliff with beautiful views. It has access to a cove through some stairs and way to walk the Vincentian Route. There is not much room, we were late and everything was already busy (3/9/19), but we slept in one of the ledges that are a few meters before arriving. Totally recommended!"
111396,678049,5,SolineRobin,05/09/2019,"Magnificent. A beautiful night with a beautiful sunset. Our best night so far. Some waste. Remember to take yours with you, and why not pick up some of them"
111396,644470,5,Derrickette,19/08/2019,"Small parking above a beach with a beautiful view, some places easily accessible, we spent a very quiet night in the middle of August."
111396,622684,5,phinie88,12/08/2019,"One of the nicest spots we have been to. However, this is due to the popularity of a slightly different place. When we were there, it was very busy and some people think that they can behave with tents, etc., as if they were in a campsite."
111396,617692,4,karramarro,11/08/2019,"Stunning views, very quiet. But there are not many places, since it is a track (about 3 km of track between farmhouses). It is not advisable for vehicles over 6.5 meters long. There is no defined place to turn the vehicle around. They have told us that the police usually pass and they kick you out of here."
111396,599450,5,AmAyVi,04/08/2019,Beautiful quiet view! In August there is already a lot of camper's but accessible only to vans no caravan or large camper. Ideal place to admire the beautiful sunset and have a good night.
111396,587145,1,Wintermute,31/07/2019,GNR asked us to leave in the evening.
111396,578833,5,jellejo,27/07/2019,"Most beautiful spot in Europe. If you’re reading this; you’ll regret it if you don’t go. We were the only campervan staying overnight, place for 8 I would say. Make sure to walk away from the lighthouse onto the other cliffs for amazing views. Please keep this one a secret ?."
111396,574982,5,carmenpenarodriguez,25/07/2019,"One of the most precious sites we have encountered. Cliffs and even dunes. Quiet and pleasant, 1 km from the town where there are shops and services. A beach below. Few people. Sometimes there is fog / fog in the first meters of coastline, then disappears with heat. PLEASE, PICK UP THE PAPERS AFTER MAKING YOUR NEEDS, in some more hidden areas it was really disgusting to pass, it costs nothing to clean and among all we can keep this place as wonderful as it is."
111396,569032,5,HeleneWi,22/07/2019,"Small natural parking, almost wild. At the edge of the cliff, magnificent view. Ideal between the lighthouse and the loans. To preserve, take back trash and hygienic papers please! No service."
111396,546651,5,robro,10/07/2019,"Absolutely stunning! The view, the almost private beach, the hiking path to the lighthouse... There are quite a few fishermen coming and going, but other than that this spot is super quiet. Toilet paper is starting to accumulate here and there. Please use a dry/ composting toilet! Bucket   Trashbag   Woodchips = 15€ // Clean and enjoyable nature = priceless :)"
111396,533774,5,Victorveron,30/06/2019,Superb place! Quiet night we were alone! Just fishermen at night and in the morning as well as some hikers but otherwise perfect place to sleep :)
111396,510428,5,alina1795,10/06/2019,Super nice spot. Only suitable for a few womos and vans. Beautiful view. Small beach and hiking trails. Highly recommended.
111401,2763304,3,Dariods92,19/05/2023,"the clearing is large and quite flat. But if you arrive on the weekend at night it is a meeting place for kids with disco music until five in the morning, mopeds and screams. Not recommended if you like silence."
111401,2706968,4,km1005,29/04/2023,"Good location within the town if you want to visit one of the many bars, restaurants or pizzerias in the area. I would echo the earlier comment that says not to follow google maps directions via the petrol station, as it takes you along something that is more of a wide walkway than a proper road - instead continue on up the motorway and take the exit just after the parking."
111401,2674050,4,Juanypatry,16/04/2023,"a place to drink bottles on weekends, but without any kind of problem... very quiet, with water and sports courts"
111401,2642672,4,patviviendolavida,06/04/2023,"We only use it to sleep, very quiet in the middle of Easter."
111401,2641909,5,AmandaAluja,05/04/2023,"Great, flat, quiet during the night and during the day, people walking and strolling along the river that is next to it. We spent two whole days with the motorhome. We took the 33 bus to go to Granada center. All perfect!"
111401,2607864,4,Blaidelta,13/03/2023,"I spent a very quiet Sunday night. Somewhat level. Be careful with Google, do not enter the Genil River promenade from the Galp gas station. On Monday morning it is full of cars next to the school, do not stand there. After all, calm down. People doing sports, walking the pet."
111401,1815265,4,Kikidou309,11/04/2022,"Not very nice but still a good and safe place, conform to the description !

>>> keep your trash, take care of environment, leave no trace  <<<"
111401,1779506,4,FritzFitz,10/03/2022,"Okay for one night, but it feels like everyone from the village comes here with their dog to escape. Quiet is something else, but really ok for one night."
111401,1758186,2,jpaaxx,17/02/2022,Great potential wasted by waste
111401,1622852,3,Joss44,02/10/2021,"We spent 3 nights by the road. The site makes it easy to go to Granada by bike via the path that runs along the stream, 7 km to go to the cathedral. It is a place for evening walks and sports (cycling, running)"
111401,1215956,3,FredX,24/05/2021,"Spent a quiet night here on the large sand court. Alhambra can be reached by bike in 40 minutes, or by bus (59 minutes) Unfortunately, the place is used as a dog toilet by the locals. Nobody picks up the excrement of their darling ... It's like that in Spain and nobody cares ... except us?"
111401,799606,4,Pequenoplaneta,25/04/2020,We stayed on a Sunday night in February and it is quiet. There is plenty of room.
111401,788846,4,pierremotorhome,29/02/2020,Very good to spend a night there.
111401,425560,4,chavilin,29/01/2019,Site highly recommended.
111404,2457727,4,Montse07,23/10/2022,We have been at the bottom of the parking lot and we have been great. A lot of movement since it is one of the closest car parks to the center but we have found ourselves safe. You can find large spaces to park. It has no services.
111404,2287729,1,masqcamping,23/08/2022,"Do not park here, very dangerous due to robberies and cars are always parked, it is better to park in the Fornas neighborhood, on the sand esplanade next to the Mossos (Police)"
111404,2264878,1,rkrjacint,19/08/2022,always busy and bad neighborhood
111404,2220073,1,gerardtarrago,12/08/2022,"It is better that no one spends even an afternoon there, I no longer say night because with the levels of crime there are, no one considers spending the night there. Avoid sleeping there and in any area of the old quarter."
111404,1217027,1,JOJUSA,25/05/2021,Parking poorly indicated to arrive and the spaces poorly indicated and occupied by other vehicles so we left and the city council would need to devote a little more interest to it.
111404,1147192,1,davidharolopez,05/03/2021,A city like Valls with such bad and lousy services
111404,643586,3,bouget,19/08/2019,Large car park with plenty of space not specifically for cc but we can park there
111404,450318,1,Europetraveler,07/04/2019,Entrance to parking is via a narrow street. Once we arrived we discovered that all places that are reserved for campers were occupied by cars.
111404,425528,1,FamilyMaspairet,29/01/2019,7 exclusive places for motorhomes and mostly occupied by cars. The municipal police of Valls makes deaf ears to complaints and do not fine cars parked in those places.
111418,1560283,3,nodetenerse,08/09/2021,"Nice and peaceful, but to sleep here it feels a bit desolate... there is little water and it is not fully bathable..."
111418,1497285,3,LaPatoneta,22/08/2021,"Somewhat dry this summer, good access with AC and a shady spot. Ideal to spend the night but with hardly any water, the bathroom is prohibited and without services, it does not seem such a good option to spend the day."
111418,1079032,5,rre372002,02/10/2020,"Quiet place to rest. There are no services, just an untreated water source."
111418,528095,5,pit,25/06/2019,"Very nice and large picnic area, continues for several hundred meters to a very small lake. We just had lunch there, must be perfect for staying overnight."
111418,516210,4,Mawa000,15/06/2019,"It is a very quiet recreational area, during the day there are few people and at night we have slept alone. Without services, the source at least now, brings little water and is not certified as potable. You can make a path called The Water Route that runs through a very beautiful swamp."
111418,476507,4,Alma05,05/05/2019,"Recreational area without services, only a fountain at the entrance of the area. Very quiet place with lots of hiking trails and a beautiful reservoir. The village is about 2 km with all services."
