placeId,reviewId,reviewRate,reviewUser,reviewDate,reviewContent
20076,2900877,3,ptiCol,28/06/2023,"It wasn't very easy, we didn't have the right tip to aim for a smaller diameter..!"
20076,2785249,4,Iberiancouple,25/05/2023,"So. Can change grey and black water and refill water tank. Here's the thing: when emptying black water you kinda need to rinse the cassette... so one should always use water, and 2€ for that is really not bad. The water access was open, seems like someone decided to do a free for all. Let's be respectful of the place and use it properly ;)"
20076,2760121,4,C.owen,18/05/2023,used to drop grey waste and toilet no fees
20076,2611289,1,Annakas26,16/03/2023,"non potable water. 
2 euros for the water to rinse the toilet, not worth it"
20076,2610268,3,camillafr,15/03/2023,"3 stars because it’s free, but it was sooo dirty!! People had been using the grey water for black water, so there was paper and poo on the ground… The hole(!) in the white box/building is for black water!"
20076,2517763,3,VanTrack,09/12/2022,It is fine to fill and empty since in the entire Natural Park it is very difficult to do it for free. Not drinkable water as already stated in other comments.
20076,2508597,1,FraserMcQuade,29/11/2022,this is not drinking water
20076,2459972,5,Yanira,24/10/2022,"We have just been in this station, it is true that it is not in very good condition, it is more the water came out of the hose, an adapter for the hose is necessary, it has a 1/2 thread. But, he has not charged us anything. We've also put air in the tires, free of charge. And used the bathrooms, which are pretty clean. In general, it does its job."
20076,2449164,3,NosyTsara,17/10/2022,"actually in poor condition, but functional for 2 euros"
20076,2384423,3,JavierCorchado,19/09/2022,"Good place to spend a night if you happen to be on your way. You can empty for free, and the night is quiet, paved and flat. Many truckers spend the night here."
20076,1835740,4,uVebyuVe,18/04/2022,"Free emptying of black and gray water next to the truck wash. You have to lift a square metal cover next to the water intake. For the water intake you have to ask for the key, it is not drinkable but it comes out clean, not as I have seen in other comments."
20076,1758718,2,rocky60,17/02/2022,Disappointed became paying 2 euros to fill the water it's new
20076,1757473,5,MrHesse,16/02/2022,"It is true that it is not overly prepared, they are improving it right now. I put 5 stars because they have been very kind and a place like this is appreciated. Even the boy has loaded the cylinder for us in the AC. We will be back"
20076,1724707,4,pablopez,03/01/2022,"It's a bit shabby and rundown but it does its job and for free. We empty gray water, WC and fill the water tank. It is not drinkable but to shower and wash it is worth it."
20076,1714648,3,tata13,23/12/2021,"Although it is very old, it does its job. All free. I did not find where to change toilet water. If you are on the road, it is a good option."
20076,1673648,4,hectorin84,01/11/2021,Rudimentary but non-potable water fulfills its function
20076,1655179,2,oldman65xxl,21/10/2021,The floor around the disposal is very dirty. Have drained the wastewater in the car wash. Toilets disposed of over the grate. We didn't take any fresh water.
20076,1654148,1,loan13,20/10/2021,"Very dirty and completely dilapidated area! We drained the gray water and refill with water by disinfecting the tap with bleach (essential) we used this area obliged, urgently because no other solutions"
20076,1538261,5,petitetribu,01/09/2021,"I have emptied and filled with water even if it is not drinkable, it is not necessary to go to the checkout to ask for anything, but I have taken advantage of it and I have taken some tokens to wash the camper."
20076,1344570,3,memeloo,20/07/2021,Currently functional. WC emptying and filling and cleaning area. It could be in better condition but it works perfectly. I refueled accordingly.
20076,1306525,4,hansd72,08/07/2021,"The black, gray and clean water area is next to the truck wash, it is a bit dusty but it does its job. in the water it says Not Drinking, we have not loaded. For the emptying of black and gray it is not necessary to go to the gas station to ask for permission or to refuel, even so we have done it, due to the service they provide. It does its job and that's it."
20076,1169849,4,Bobby79,07/04/2021,You can empty it for free and also use water to clean the cassette. Disposal is to the right of the truck wash. There is probably fresh water at the gas station. But can't say what it costs.
20076,1123590,5,bikesonworldtour,24/12/2020,We filled up with LPG here. It works with an adapter for German bottles. Tire pressure control right next door.
20076,1120338,5,Meria275,09/12/2020,"Passage to do the oil changes everything works but poorly maintained, it's free and functional stop complaining! Truck wash just next door to clean up the motorhome, and it's cheap!"
20076,1104990,5,paulnsheryl,25/10/2020,Works fine. Black waste down a circular waste drain pipe. Water available marked as Non Potable. Useful free stop.
20076,778900,1,MayaRaf,11/02/2020,"Is not working correctly, small really bad and the conditions are not optimal to deal with the black waters , is just a contamination point."
20076,772681,3,hwneumann,26/01/2020,"Not nice, but it works and is free. I better not fill up with water."
20076,766642,4,gerardcc,09/01/2020,"Services are free, poorly maintained but free!"
20076,765456,5,Trusky366,06/01/2020,"Free water GOOD. Also free emptying of gray and black water (you have to lift a metal plate next to it). Be careful, the water is NOT taken from the emptying station: it is taken from the water / air pump to inflate wheels (said by the gas station staff). Water doesn't smell bad or anything. Other comments were probably taken from the side of the emptying station, which makes a distaste."
20076,722972,2,larryette,16/10/2019,Not terrible but we empty everything.
20076,690085,1,nicola33,14/09/2019,"Warning! Do not load the tank with this water !!! The water is not only ""not drinkable"", it is DIRTY. river water. We filled a canister and were shocked. Not even good for the shower. I repeat: it is dirty water !! It's okay just to rinse the toilet. Now we have the dirty tank, good problem. Thanks to the manager."
20076,532228,4,campervida,29/06/2019,Free places where empty are appreciated.
20076,472934,3,bumblebussing,01/05/2019,They have refillable lpg which is excellent! however services not so pretty.
20076,429887,5,Trisss,16/02/2019,There is water at will. Free. Faucet in bad condition
20076,420691,4,Bizza,06/01/2019,Perfect for unloading and loading .... you can also wash the Camper
20076,409898,3,chrislrx09,25/11/2018,Repsol station with gas bottle GpL water drain free service .. Friendly welcome To the gift of existing !!
20076,275555,5,Conescom,26/06/2018,"Gray, black and recharge ok, all for free next to pressure washing trucks, thanks!"
20076,246510,1,Fr3spiritz,05/05/2018,"No toilet waste here, not even connected"
20076,235691,3,gerardcc,11/04/2018,In poor condition but makes service!
20076,227754,4,chauvifitte,15/03/2018,"Gray water services and chemical toilets Ok and free, free access. Thank you !"
20076,226667,3,Domenicodepalma,09/03/2018,"A bit run down, but all working and free."
20076,220117,2,Latti,25/01/2018,"Dispose of easily possible, for the water no key is needed. After trying it, we did not catch water, did not taste good and smelt strongly of chlorine."
20076,219007,4,gerardcc,15/01/2018,"Everything is in bad shape but free. The faucets are free to access, the door is gone!"
20076,216788,3,jimpascaline,31/12/2017,No need for a key
20076,197484,3,bidochons,25/09/2017,"At the Repsol gas station. Drainage wastewater and WC. Water tap, no need to ask for the pump."
20076,197358,4,jejo,24/09/2017,"Water load and discharge of gray and black. Gratuitous. Something neglected maintenance, although everything works."
20076,157429,5,alvarobi,24/07/2017,"Emptying of water, WC and water to load. Gratuitous"
20076,109195,5,vevedol35,08/10/2016,Very good for free services
20076,98962,4,filoujuju,23/08/2016,"Refill in water, drain water plus wc convenient and free. In addition to the karcher next and very good and cheap. I paid € 2 to wash the camper."
20076,75028,5,Rogerdeflor,29/05/2016,Emptying gray and black water and filling water. Free.
20076,41066,1,ste3371,08/07/2015,All quite abandoned and badly reduced but still usable (the CS is next to the truck washing station)
20093,2714526,5,cruuzedogg11,01/05/2023,"Great spot to spend a night, clean, 8 parking spaces, amazing views, shielded from the winds,.."
20093,2588195,4,whiteren,23/02/2023,"We had a quiet night. You can hear cars, but in the end it's a place by the main road ;) The place is a bit neglected but with beautiful views."
20093,1880099,2,nodetenerse,09/05/2022,"Small and careless. For a stop along the way and contemplation, but on foot: from the parking lot nothing at all, you only hear the road, tourists passing by and due to orientation against the mountain, you miss the sunset !!!"
20093,1861562,4,michel43,30/04/2022,"Nice view, good 4G reception, a little off the road, the pitches are not large, made for children under 6m."
20093,1810577,3,pticlod,08/04/2022,very beautiful view. possible night
20093,1797870,4,JREY,27/03/2022,"I have coincided with the operator who is in charge of cleaning the area. He tells me that since the acs come, the bins are filled with garbage bags. He tells me that if we took the garbage bags to throw them in a container that we would go more unnoticed and it would be better. Already when there is more than one ac they take photos to inform. Thanks for taking care of him."
20093,1779706,4,femke22,11/03/2022,"Fantastic place to stay with very nice view! Place is close to the road so you hear the traffic. At night you will not be bothered by this because then the road is quiet. There are 8 spots. They are normal parking spaces, so not suitable for very large motorhomes."
20093,1773812,4,aubrysmt,05/03/2022,Very quiet spot for a night stop and superb view. Do not hesitate.
20093,1764207,4,JackKhousto,23/02/2022,"Obviously, with a 10m, 3 axles with trailer, it's far too narrow to park, except in the space reserved for coaches. But for those who know how to travel a little ""shorter"", it is a very pleasant place, with continuing a little further on the road or climbing to the belvedere a superb view as far as the Rock of Gibraltar."
20093,1751914,5,Hugonaught71,10/02/2022,"Really good park up for vans and normal size motorhomes. picnic area, firepit, bins and views to die for. be at the viewing point before sunrise for the best day ever. No facilities as is a picnic park up."
20093,1750763,5,Minti,08/02/2022,"Very nice view, the night was quiet. Not suitable for larger motorhomes as there are only normal parking spaces"
20093,1706066,3,gyzmo35,08/12/2021,"A bit close to the road, but superb view. Some come to honk their horns and party at around 3/4 a.m. Night a little rough. One question is bothering me ... these Spaniards, they don't work? They don't go to class? They never sleep?"
20093,1687102,4,martapH,13/11/2021,"We have been very quiet, nice place and with a picnic area"
20093,1589396,4,drapier,18/09/2021,Very good spot to relax before visiting Ronda.Very clean site
20093,1351895,1,spiderman100,22/07/2021,Very dirty and some nights there is a bottle.
20093,1214045,4,edumb,23/05/2021,"We really liked the place to sleep. With picnic tables, bins and incredible views."
20093,1132202,4,lakorne,22/01/2021,"The place is clean and quiet to spend the night, nice view. the only small drawback, if you come from Algatocin you will not be able to enter it unless you enter the wrong way."
20093,1111726,3,davidmalaga,03/11/2020,"I want to remind you that it is a viewpoint and not a camping area, which is what I found on November 2, the 8 places had occupied 6 out of 3 AC chairs and a dog shop, we wanted to stop for breakfast and we continued on .. Unpresentable .. And don't tell them anything, get cool. That is why they do not like us in many places, for this type of behavior"
20093,1111117,1,jorme,01/11/2020,"Unkempt and dirty place. To the 4 friends who were there on the night of November 1, tell them that you are pathetic and that because of you they will always see our group as criminals because that's what you guys seemed like, guys. Occupying two places with your chairs and bicycles. Without education, dirty, noisy and badly educating your children."
20093,1038333,1,RobertoCruz,10/09/2020,The Genal viewpoint is totally abandoned. There is dirt and they do not take care of their environment or their facilities.
20093,765427,4,patandjonontour,06/01/2020,Amazing park up with amazing views! We stayed for one night as it was a little chilly in January.
20093,751842,5,Grunfnik,09/12/2019,"We have spent the night very well, near the road but at nightfall nobody passes, absolute silence. recommendable"
20093,751618,5,TrashTroopers,08/12/2019,"Great spot next to a viewing point with spectacular views. Paved parking, trash bins, picknick tables. 
We cleaned up quite some trash here, PLEASE HELP KEEP THE AREA CLEAN by picking up some trash you find there (even if it is not yours). If it is not for the environment, then it is for keeping the goodwill of the ayuntamiento and locals. Thanks!"
20093,694864,4,papaya,17/09/2019,Good clean location and beautiful viewpoint.
20093,461706,5,GlobeAdventure,21/04/2019,"Arrived with the rain but this morning, what show at the top of the belvedere. The clouds hung in the hills and these little white villages sprinkled here and there. Superb. Very calm night."
20093,399633,3,segolo,27/10/2018,"Amazingly quiet place at night especially on a Friday night. After 22h no car stops and little passage on the road. Area not very clean though. Very beautiful view. If need water, there is a fountain 2 km away, at the exit of Algatocin near sports fields."
20093,291187,4,djoacamper,17/07/2018,"No one there. nice views. nice place had good nights here. 20 min drive from here to beautiful river hike, rio genal"
20093,242926,5,aston2,29/04/2018,"Bad luck, it's raining, despite all the magnificent views"
20093,218172,3,Tornjak,08/01/2018,Very nice point of view set back from the road with picnic tables. No service but satellite reception and 4G optimal.
20093,130012,5,Souti26,21/04/2017,"Very nice place and very well sheltered from the wind to be there with a strong southerly wind, we were quiet. Tables and chairs, impeccable"
20093,36962,2,momo3008,18/05/2015,"Quiet night, despite the proximity of the road, well sheltered from the wind."
20105,2643195,1,catetphiphi50,06/04/2023,attention impossible in motorhome
20105,2545269,1,encoresurlaroute,07/01/2023,No possibility of parking. Maybe with a very small vehicle. But really on the side of the road…
20105,1099684,1,dontpanic,20/10/2020,"No Trespassing. And anyway, it is next to the road, there are quieter places in this area"
20105,40924,4,smitti086,07/07/2015,This spot is now restricted however there is a road on the right a few hundred meters up the road which leads up to a great area.
20110,3219823,5,kecorahe,26/08/2023,To repeat. Everything very careful and quiet environment
20110,3185987,1,altohe24,20/08/2023,Camping with bad shower facilities that you have to bend over. I'm 1.80 cm tall. Small plots. €40 a night very expensive and irregular plots
20110,3154441,1,madugr,15/08/2023,"Through my journey along the Mediterranean I came across this place. Contrary to the other comments, I unfortunately have to give it a lower rating. It's a small campsite with my campervan I can't extend the awning in width because the pitches are too narrow. The way to the beach leads along the freeway entrance and with a 3 year old child too dangerous, the way to the tunnel is pulled down and up by a huge blackberry hedge, so watch out for the thorns. The beach is dirty is not part of the site but if someone wants to go to the beach there are definitely others this one is not worth visiting. You can't adjust the temperature when showering, it changes from cold to warm and back again. When I took a shower there was so little water that I was allowed to shower against the wall. I paid €56 for 2 adults and 2 children, which is far too expensive for what is offered. I will not come back. Unfortunately I don't like who I like."
20110,3021844,4,inkus,26/07/2023,"Small campsite with all the necessary comfort. Even if the pool is semi-covered in July, deckchairs in the lawn were available. The staff is neither friendly nor rude. You can hear the road a lot but in Marbella, there are few places where you can't hear it. dangerous access"
20110,2997017,4,AryWonderW,21/07/2023,"Small campsite, well equipped, good value for money. A bit noisy due to the motorway but I recommend it!! Clean services, clean swimming pool, super mini market and restaurant! Friendly staff! Convenient taxi service outside the campsite which took us to Estepona, a beautiful city. Possibility of going by bus n79 but to take it is far away. Uncomfortable and dangerous access to the beach!"
20110,2914305,5,WalterT5,02/07/2023,"Places with tropical plants, mostly under trees, beautiful old well-kept vegetation. toilet clean. 2 hidden footpaths 5 minutes to the beach. Good restaurant on site, pool, shop, everything simple and OK, friendly staff. € 29.- with 3 people without electricity (from 2 days). Some street noise. Beach lined with large hotel complexes. We will be back."
20110,2859474,5,escherianonegro,16/06/2023,"Delimited and shady pitches, clean and well cared for. €18.50 2 people and dog with camper per night, with electricity and utilities included, if you leave before 10am, otherwise €30. Quiet night."
20110,2851240,5,CN29,13/06/2023,Very nice little campsite. The staff is very kind. Small supermarket on site and access to the restaurant by the campsite. The sanitary facilities are regularly cleaned and the swimming pool is very good. Sunny or shaded pitches. 25€ per night 2 people with electricity. We recommend
20110,2843019,5,Jimmy6868,11/06/2023,"Large, airy pitches, everything available, modern sanitary facilities. Restaurant and shop not inviting, there is still potential."
20110,2833275,3,kilkenny-fan,08/06/2023,"The beach is easy to reach, but not very suitable for swimming. You have to fight sivh over a few meters of stones before you stand on sand. I can't fault anything about the sanitary facilities. A bit difficult to reach by bike, had to go towards the cars. I think 22€ per night for a tent is steep, but I have to get used to it slowly."
20110,2788343,4,EliderEisbaer,26/05/2023,"Very nicely laid out campsite. Many beautiful plants between the terraces. Showers, toilets and washing machine ok but not outstanding. Unfortunately to hear constant street noise and a bit expensive. Paid €33 per night for 2 people including electricity and campervan. Overall ok and recommended for a stopover."
20110,2729214,3,Kristin11,06/05/2023,We personally didn't like it that much here. Our toilets weren't that clean and a small jet came down the wall from the shower. There was also no possibility to deposit things in the cabin. The air in the hall by the pool was unbearable. Wlan works very well for this if you then asked for the code.
20110,2726920,4,lelecaporal,06/05/2023,"if you are passing through a relaxing day, excellent campsite in the middle of a former nursery with a hot pool in a greenhouse. tried going to the beach a scary tunnel and beach not great. clean toilets nearby there is a restaurant where you ate well"
20110,2710930,4,Pepito7,30/04/2023,pleasant campsite even if there is the motorway nearby in the evening it remains correct in terms of noise. swimming pool and impeccable service. to visit the region it is perfect and Estepona is a magnificent city.
20110,2642367,4,dafnos,05/04/2023,"good facilities, smallish plots, very noisy as next to a main road, shop, loads of cats that seemed to keep taunting my dog, no fear! good on site restaurant but hated the walk to the beach, over rough ground and through a drainage tunnel under the main road, but we did it several times and it didn’t take very long. nice cycle/walk prom to Estapona but parts were closed and had to go on main road"
20110,2596517,3,Michel1248,02/03/2023,"Very nice staff. The place is unfortunately right at an intersection, so it's a bit noisy. The sanitary facilities are good and are cleaned very often. Cycling to Estepona is very easy via a cycle path along the sea. The bus to Marbella is also great."
20110,2573274,4,mjj81,10/02/2023,"Parque Tropical is a nice place. Convenient, clean, well located although you can hear the noise from the highway. Not too expensive at least in January. The lady at the reception is friendly. We stayed there for a week"
20110,2567533,5,FredFlintsone,03/02/2023,Unfortunately the campsite was full & we didn't get a place. The lady at reception was very nice. For €3 per person we were allowed to use the hot shower with good pressure. Sanitary facilities super clean.
20110,2561721,3,Beckydawson,27/01/2023,Nice enough site but very small pitches. beach not as close as you think and having to walk alongside very busy roads
20110,2560749,4,EmJerv,26/01/2023,"Shady leafy campsite, relaxed vibe. Small plots but fine for 6.5 m RV. 5 minute walk to the beach. You have to pass under the road via a tiny tunnel. Showers warm and then cold and then warm again. But fine. Very well stocked shop at reception. Receptionist is super sweet and helpful. Avocados were delicious from their garden. Didn’t use the pool but it looked clean. The facilities are all clean."
20110,2554788,5,TilloconFury,18/01/2023,"Beautiful campsite with lots of banana plants and palm trees. Pitches small but sufficient. The indoor pool is nice and warm (the hall, not the water). The only negative point is that the shower heads hang a bit low. Everything super clean."
20110,2554363,3,HeikeXLI,17/01/2023,"Small plots, narrow paths. Loud on the freeway. A stroll to the beach is not possible. We only stayed one night. The lady at the reception very nice."
20110,2550658,3,Chilham,13/01/2023,"It’s okay, but for this money (€21 with ACSI), it should be so much better. Facilities need a significant overhaul to justify that. Route to beach a disaster. Restaurant is good but overpriced."
20110,2543530,4,silvia71cat,06/01/2023,"The campsite is very well maintained and clean. The girl at the reception and the maintenance guy are very attentive and helpful. the cleaning lady is unwilling to help and shakes the mop without looking if it is splashing someone. Relatively narrow plots. 2 people in Camper with ACSI €21 Washing machine €5 Dryer €5 When paying with ACSI it has been cheap, but in reality camping is expensive."
20110,2541018,3,jd07,04/01/2023,The campsite is nice and pleasant. very friendly reception. I give the evaluation of 3* because it seemed excessively expensive for a 2-person camper that enters at 7 in the afternoon and leaves the next morning (€30.80).
20110,2540383,4,Basoline,03/01/2023,"Spacious pitches on gravel between beautiful plants. Very friendly staff. Discharging gray water a bit inconvenient: when you're done you have to make a tour of the campsite. Environment has not much to offer. We were traveling through so no problem for us. Too bad we couldn't easily go to the beach. Furthermore, certainly a nice small-scale campsite!"
20110,2534533,4,Helton,30/12/2022,"Small, friendly and clean site with all facilities, including an open pool (in winter!). Asci rate is €20 per night. 

Downsides are proximity to a very busy and noisy road and pedestrian access to the wonderful beach via a drainage tunnel under the road, which was flooded when we were there."
20110,2534234,3,PeteNui,30/12/2022,We stayed here for 2 nights and it cost us €48.58 without electric. overall is good enough. found a hard way to get down to the beach. swimming pool weren't heated.
20110,2533529,5,7g7g,30/12/2022,lots of shade but easy to drive around even with 8m. 20e acsi including electric. the supermarket has everything and the staff are very friendly. the walk to the beach is not good but there is a better way if you walk down the road left of the restaurant on the roundabout. about 150m there is a path on your left to the cycle path. cycle to Estepona is great and easy going with good views.
20110,2514816,4,CriviR6,06/12/2022,"Quiet and as the best option due to its proximity to Marbella, in contrast, in this one the spaces are larger for long vehicles. Friendly staff, heated pool that we did not try because we did not wear clothing. Regarding the tunnel towards the beach, well, that is as it is due to its proximity to the highway, it is not a thing of the campsite. Diversity of flora and very complete services. With ACSI €20 and electricity."
20110,2499388,1,corase,18/11/2022,"Chose the spot for hookup on the beach. Tunnel through which you can reach the beach on foot. To reach this tunnel you have to walk behind the crash barriers on both expressways. Doesn't work at all, was honked at by the drivers. Dangerous! I wouldn't do it at home either."
20110,2442183,3,Niki420,14/10/2022,"Beautiful, cozy CP with lots of nature. Unfortunately a bit expensive: VW T5, 2 people electricity for 27.60/night. Check out at 12pm"
20110,2419075,3,Princesse07,02/10/2022,"nice campsite, a little expensive. friendly welcome, the only problem is this one. getting to the beach not very practical and quite dirty route, lots of trash cans and a disgusting tunnel to pass."
