placeId,reviewId,reviewRate,reviewUser,reviewDate,reviewContent
20459,170077,4,larryvigo,10/08/2017,"Good camping to visit Burgos, you can go walking or by bicycle. If you are on a route, it is also a good place to spend the night."
20459,169441,4,BD,09/08/2017,Step camp convenient. Bus in front of campsite (26th). 1 per hour and 1 euro the way (15 minutes). Last return from town at 21h. Beware the bar and snacks from the campsite closes at 22h. Sanitary clean. Well as a whole.
20459,168628,4,lesbigorgne,08/08/2017,"City campsite impeccable and calm. A bit expensive 34,50 € for our Van, 4 people, without water or electricity. Sanitary very clean and in good condition, rather appreciable. Pool not bad. We recommend without hesitation."
20459,159608,5,kaleboxor,28/07/2017,Camping quiet and close to the city.
20459,157280,4,Srjosan,24/07/2017,Quiet campsite and fairly clean services. At the door you can take the bus directly to the center of burgos. recommendable
20459,153628,4,canario65,18/07/2017,"Campground spacious, quiet and well equipped, clean services. Highly recommended"
20459,141816,5,yvo44,09/06/2017,"In early June, not many people."
20459,129991,4,braoum,21/04/2017,Good campsite but too expensive so park 300 meters further because several spacious and free parking without problems for the night.
20459,119043,4,fuligule,30/01/2017,"Camping for one night after visiting Burgos on the day of the patronal feast of Saint Lesme, the 29/1. Locations grass well stabilized. Only one sanitary block open, very clean, well heated (4 degrees tonight). And very hot water. Wifi performance. 19 € with ACSI card."
20459,118373,1,llacer,15/01/2017,"For me nothing recommendable, very dirty and in extremely dirty cases. Loose dogs urinating and defecating by the plots, hot water non-existent, playground in very poor condition ....."
20459,86151,4,BERLIOZ,28/07/2016,"Great campsite, very welcoming staff, very clean and above all very quiet. A pool with animators and lifeguards to monitor and play with the children. 39 € all inclusive (camper place 2 adults, 2 children and service)."
20459,82686,5,ste3371,17/07/2016,"Excellent campsite, quiet, services in excellent condition, functional camper Service. With the cycle path you reach the city in no more than 10 minutes through a beautiful and shady park. Recommended"
20459,76909,4,annicketmarcel,14/06/2016,"Ideal for visiting Burgos, its cathedral and its castle. 5 to 6 buses per day (every 2.5 hours)."
20459,75403,5,DOMIBREIZH,02/06/2016,"Good welcome, nice pitch for camper van, 2 people €20"
20459,74562,3,R_V_L,25/05/2016,Fuentas Blancos campsite is huge and very expensive. Lots of clean toilets and showers but lots of facilities we didn't use and then the cheek of charging for weak Wi-Fi! Brilliant flat path to cycle or walk into the city and a bus home for €1 each (no 27)
20459,74400,2,beatricebl,23/05/2016,"We went to spend a night. But he asked us €27 for a night for two people with electricity but without wifi, it was extra. So we didn't stay, too expensive. Too bad we couldn't visit the city."
20459,59400,3,robertoph,03/11/2015,We stayed overnight in November 2015 for 10 euros with an overnight rate from 10 p.m. to 8 a.m. You can take water and chemical and gray cleaning. perfect!
20459,33068,4,pheclaf,06/04/2015,Comfortable and practical campsite for stopover or visit to Burgos (Bus or bike). Very friendly welcome.
20459,29950,3,jltriffaut@gmail.com,25/12/2014,Very practical and correct step
20484,3121267,5,lybelule,11/08/2023,"Alright . We spent a quiet night there. The city is not very far. We visited it by bike, but possible to do it on foot. Dinner in a restaurant not far away (Dom Pedro) small but very well eaten. Thanks to the city for this space, with electricity, water, toilet."
20484,2952446,4,LaKarwuay,12/07/2023,"Wide area, clean and in a pleasant environment. A bit far from the city. With all services including clean water in the same plots and free electricity. It is quiet throughout the day, even despite the nearby road."
20484,2866856,5,ligofer,18/06/2023,"Quiet place, free electricity and water. Location 15 min walk from the center but very very well organized. Thanks to the town hall for such a privileged place. We stayed 2 nights. One of them totally alone. A pity it does not have more users"
20484,2757861,5,dimard,17/05/2023,"Very good. Free services, electricity too. Very quiet night"
20484,2711026,1,Fernandotkd,30/04/2023,"It's a shame those who are CAMPED all year sucking electricity exclusively. The area is fine but you have to control the people who make disproportionate use occupying many spaces, motorhome, car, and car to live there"
20484,2659861,5,fdezmallo,10/04/2023,"Very quiet area and with all the services, it has free electricity for those who need it, amazing how well they have this service, many cities in Spain should take note. Thank you"
20484,2650442,5,LasseOnTheRoad,08/04/2023,Excellent and quiet place thanks to the municipality for free electricity
20484,2631950,5,NicoleBosse,31/03/2023,"Very good plan, very quiet, thank you to the municipality. Very pretty little village with keep to visit."
20484,2622152,5,Anna4444,24/03/2023,"Thank you to the community for this wonderful pitch with free electricity! The site is well signposted and easy to reach even with large mobile homes. Everything is very clean and tidy. Since the pitch is big enough, it's not a problem at all that some stay there longer. On the contrary, we received good tips for excursions and information about the place."
20484,2588615,4,walsch,23/02/2023,"a beautiful place with all services for free .... many thanks to the municipality. The only downside is the fairly sloping pitches along the quiet street. Unfortunately, the flat pitches are blocked by two long-term campers with their complete equipment in the longitudinal position...."
20484,2523808,5,RubenyJulia,18/12/2022,"wonderful place, very quiet above all"
20484,2449136,5,didierluc,17/10/2022,a big thank you to the city for this motorhome area with all the free amenities the only downside is that some motorhome drivers park across and turn other motorhomes around who have no more space and being forced to leave some people are not good to others
20484,2428558,4,JWI35,07/10/2022,Please note you cannot gain access to the motorhome parking through the 1st set of sliding gates. Stay on the main road another 100m or so till you see the motorhome parking sign on the right. Quite a slope. Water and electricity available at the parking spaces.
20484,2255488,5,carmisifer,17/08/2022,"Area muito calma, limpa. Tem tudo o que é necessário incluindo eletricidade gratuita. A vila é muito interessante pela sua riqueza historice e cultural e pela natureza que a circunda. Obrigado Freixo de Espada in Cinta. Very quiet, clean area. It has everything you need including free electricity. The village is very interesting for its historical and cultural wealth and the nature that surrounds it. Thank you Freixo from Espada to Cinta. Very quiet and clean neighborhood. It has everything you need, including free electricity. The village is very interesting for its historical and cultural richness and the nature that surrounds it. Thank you Freixo from Espada to Cinta."
20484,2155426,5,familyenjoylife,01/08/2022,"Super area very secure, calm and all the services are free, it's really the best. Not far from the Douro. Magnificent corner. I recommend"
20484,2054142,5,bernard19,09/07/2022,"Very well, you just need to provide shims. Quiet, near the village. If only all areas could be like this!"
20484,1859121,1,FNunes,29/04/2022,All poorly done Far from the Center Too sloping Sloppy space. Residents appreciate free electricity
20484,1828407,5,ElsaMarisaVLemos,16/04/2022,Everything working. Quiet location. Many thanks to the Municipality of Freixo de Espada à Cinta.
20484,1820756,4,J-N.B,14/04/2022,quiet place relatively close to the city with all amenities provide calles
20484,1779415,5,fersamape,10/03/2022,"We have spent two nights to get to know the area, a very quiet area with free electricity, a pleasant town to take a walk through."
20484,1772033,4,AlexandreMartins,03/03/2022,"Closed park, safe for small children and pets. With plenty of space and all the necessary maintenance conditions for caravans. Too bad the total darkness when night falls, despite the existence of streetlights!"
20484,1767422,1,rajiso2000,27/02/2022,"Yesterday a fair began that lasts until March 6 and we could not enter. We had to park on the street, with the permission of the police, and put up with all the cars and people going/returning to the fair. At 2:00 some youths even punched the car and scared us."
20484,1753694,4,THLX,12/02/2022,"Surprising area in terms of its access but once there free water, garbage and electricity. What more could you ask for!!! Immediate environment a little mineral. Many thanks to the municipality. Some abuse it and that's a shame. A CC in Capucine immat in Germany has obviously been installed for a long time with an unpacking that does no honor to motorhome owners"
20484,1738769,5,Anniedidier,22/01/2022,"Great two-day stopover, lighted and closed parking, you open the gate yourself. Drains, water and free electricity, provide the holds. The GR 36 passes nearby, we did a small part of it, but there is no small marked hike, it's up to you to discover. Remember to visit the tower of the old castle, with a 360° view. Very pleasant stay. Thanks to the municipality."
20484,1708873,5,alain1979,12/12/2021,"Fantastic area! Thanks to the people for having such a well-conditioned area. Easy draining of black and gray water and very clean. Several free light points, and several filling taps. It is not very level but with chocks fixed. 10 minutes away there is a restaurant called Zona Verde with a spectacular cod. Very quiet and very safe place. Cool!"
20484,1695734,5,sissi1235,22/11/2021,"For me this is a perfect parking space, water, electricity V / E with floor inlet for tanks, everything is available. Supermarket, restaurants easily accessible, a baker comes every day. The place is well shielded so it is also ideal for dogs, it is just a bit derogatory that you need wedges. The by the way, notices everything for free."
20484,1683664,5,creatisa,09/11/2021,"Very good plan, on the other hand, not easy to find You have to go to the back of the car park, cross a metal gate and move forward and around the building, the air is at the back, provide holds, there is free water, electricity and meat and sun in the morning"
20484,1660945,5,MAXICLiO,24/10/2021,Very quiet and free area even with electricity and very spacious squares. It is a bit on the outskirts of the municipality in a sports and recreational area.
20484,1645761,5,stelladearn,15/10/2021,"After 3 days at the nearby beach area this was an easy find and very welcome, clean and functional. the gate was open when we arrived, a few vans but everything here you need."
20484,1644649,4,Javi_Coyanza,14/10/2021,Very quiet place. Available light. Wide and very accessible. Good unloading areas. Squares a bit uneven but easy to fix
20484,1643814,5,marcela0108,14/10/2021,Excelente place. quiet. water electric near town. only downside is not leveled spots... other than that very good . thank you to the community.
20484,1578388,4,PMesquita,14/09/2021,"Good area for motorhomes, water, electricity and evictions. Quiet place not far from the center. Thanks to the Municipality, whenever possible we try to give back in our own way."
20484,1475817,5,lisalvador,18/08/2021,"Free parking with water, electricity and possibility of eviction of water and toilet. It is possible to stay overnight, quiet and close to restaurants and supermarket. 10 minutes from the river beach of Congida, which is beautiful and has a blue flag."
20484,1470028,4,AnaCarlota,17/08/2021,"For a free motorhome park it's very good, it has light and water and it's quiet. The only negative point is that it is far from the center of Freixo Espada a Cinta , about 1.5 km on foot"
20484,1372863,4,MarianaFreitas,28/07/2021,"Quiet, clean and bright place. is next to a stage so they can have some kind of party on certain dates. no doubt to repeat"
20484,1347778,4,IanM1521,21/07/2021,Empty when we arrived and it didn't feel like a good place. Two other vans came later which made it feel safer. In fact it was a very good place. Free electricity and all services. Lots of taps. And very quiet at night. There is an auditorium nearby and if it was being used would impact largely on the ambience.
20484,1325078,4,DanielAlegria,14/07/2021,"I was unlucky because I was in the place completely alone. Displaced and dark place, in a huge multipurpose park with nothing. The location has nothing to offer. ASA has water, electricity and a dump for water and cassette and it is free."
20484,1298239,4,PinaColadaLiebe,05/07/2021,"Located on the outskirts next to the sports center; paved pitches with incline and power connections, as well as several water taps; hardly any other mobile homes; very quiet, except in the evening until 11pm; pleasantly dark at night; Service station is not optimally designed"
20484,1251489,5,lunazul,12/06/2021,"Area with all services, including electricity. Quiet for the night."
20484,1113481,4,gepetto66,08/11/2020,From 3 to 6/11 excellent place with free water and electricity Good starting point for scooter or motorbike tours magnificent roads superb viewpoints with autumn colors
20484,1111874,5,LucasE,03/11/2020,"Electricity, toilet emptying, gray water drainage and water filling Free! Eskerrik asko, aguyje, thank you very much, much obrigado Freixo De Espada À Cinta."
20484,1034013,5,leaodapraia,08/09/2020,"Very good caravan park next to the sports complex. Water, waste and electricity all free. I recommend"
20484,1028231,5,jaizba,05/09/2020,"area with all services (free), quiet place, with plenty of space and close to town. Delighted to spend the night there."
20484,994577,5,cuevi,23/08/2020,"Huge, very clean and great area. Free. With all the services and very quiet. Upon arrival, a very friendly man accompanied us with his car to the area. Eternally grateful"
20484,970927,4,omotecoolninja,16/08/2020,Very appreciable bivouac site with all the services. Don't forget to thank the city by going to the municipal market open from 9:00 a.m. A very good stay in this Douro valley.
20484,783135,4,Sylvied18,19/02/2020,Very quiet but quite sloping. Impeccable electricity but to open the taps you need a pair of pliers. Supermarket at 800m for a little supplies and a nice village.
20484,743941,2,Tornjak,16/11/2019,"Area accessible to all templates, stabilized and partially sloped. The services are practical and operational (electricity included). Do not follow the injunctions of this German camper (Adria Matrix) who claims to be the ranger of the area. This mischievous and others settle here in position ""sucker"" as at home! Satellite reception and optimal 4G."
20484,738886,5,saeckel,05/11/2019,"Thanks to the community for such a beautiful place, we have been there for the third time and will come again."
20484,727700,3,joelle91,22/10/2019,"Surely, if the previous travelers had not given the procedure to return, we would never have returned on our own. Do not hesitate to stop there, because in this valley of the Douro, sites with such good conditions are extremely rare."
20484,724930,5,Doudou2437,19/10/2019,"Area like we like to find water, all the drainages and free electricity. 10 minutes walk from the village center with shops. Thank you to the municipality for this welcome."
20484,723004,3,ahits,16/10/2019,"Nice big place, bathing at the river down very idyllic. unfortunately the water was turned off"
20484,720198,4,king3tris,13/10/2019,"Very spacious and comfortable space, with a slight slope, inside the fairgrounds. Waste disposal service, load of clean water, electricity, and WC in the main building, although I did not check if it is open at all hours. Nice and clean town. Very welcoming people. Nice cemetery inside its castle (visitable tower) in the upper part. Very grateful to the municipality."
20484,710058,5,ea1qa,01/10/2019,"Excellent area, free light, and very quiet, 10 minutes from downtown. Congratulations Freixo."
20484,709192,4,mimimart,30/09/2019,"Beautiful and paved, the area can accommodate 12 large camper. The night is very calm. The friendly village shops, the church (aujoud hui visit commented in French) and the castle are worth seeing. Thank you to the municipality."
20484,560772,5,BIPBIPCOYOTTE,18/07/2019,Superb location with all functional services. Small flat? draining black water and clogged. There is a stick to push but I do not know which side to take it? Thanks to the municipality?
20484,528809,5,jeannot17,25/06/2019,Thank you to the Municipality to put at our disposal in large park closed free CC parking with water electricity drain. paved ground part located at the bottom of the park on the right entered by big sliding door to close again. Ground completely closed of wire fence. Let's stay qq days to visit the city and make small restaurants. Hardly believable to find such a free site.
20484,524888,5,onb279,22/06/2019,Gate is open. Electricity works. We were all alone.
20484,508195,5,ross.lera,08/06/2019,"Wide and comfortable service area. It has water, electricity and toilets free. Garbage containers, grid for drainage of gray and black water. An area with a tent and some wooden tables. It is not convenient to follow the indications of Google Maps because it leads to steep and very complex slopes absolutely unnecessary. It is easily accessible from the village and there are indications. The main door is open. The town is very beautiful to visit. Castle and cemetery are a nice walk."
20484,441997,2,jannilou,19/03/2019,"Passing for one night on March 19, 2019, the parking is well open for parking. But the water is cut off, the handles of the taps have been removed. wish it passed."
20484,430697,4,anjocores,18/02/2019,The entrance gate is sometimes closed. Simply place the hand on the inside of the lock and release the pawl. Sliding gate.
20484,413861,3,jumaolda,12/12/2018,"Area with all services included Electricity. Ideal for motorhomes with motorbikes, from there you can see many small villas and the viewpoints of the river. It is located in the upper part of the town and is 15 minutes walk to the center."
20484,408078,3,biancathevan,17/11/2018,"We stayed here for a night, visiting the town. The place works fine, but is nothing fancy. It features very large booths, that are however a little slanted. Electricity works fine, there are plenty of outlets. There are water, but unfortunately no handles. You can use them if you have some tools, any pliers or wrench will do. The city features multiple super markets."
20484,403389,4,garciarosuero,03/11/2018,"Large and with free services. Very very quiet, we have slept alone. I do not put 5 stars for the inclination and why the multiple water Tomás do not have a handle to open the tap, you have to separate as you can. a 10 to electricity and space"
20484,398090,5,mariacolin,23/10/2018,"Excellent area, very quiet night, all free.   Thank you"
20484,396978,4,Tuzaro,21/10/2018,I fully agree with the previous comments. Very quiet area Once you pass the entrance you follow your right until you reach the end of everything.
20484,377203,4,fleurette9,19/09/2018,"Confirmation of previous opinions, thank you to the municipality to put this place at our disposal."
20484,327822,5,Vectragt,11/08/2018,"Right behind the scene of village activities. Free light and water and a very quiet site alleged downtown. We have been two days and we are delighted. Next an Austrian says take two months without any problem. Idyllic site from there, go out to do the Arribes routes, contemplate raptors or navigate the Douro River"
20484,256833,5,mymhtrip,21/05/2018,Very quite on edge of town with free electric. Tiny super market so stock up before you arrive. Visit the castle and climb the tower also see the sword strapped to the tree.
20484,245061,5,mastaf22,02/05/2018,"Confirmation of the elements given previously - on the other hand attention at the level of the access precise GPS coordinates: N41,0881 - W6,8154 you are thus in front of the gate of entry of the site"
20484,198401,4,amg01,28/09/2017,"Large parking with water, drain and electricity free. Clean, calm. About 15 minutes walk from shops. Requires fairly high holds, sloping parking. We stayed here for one night only mid-September."
20484,181774,3,fsacramento,21/08/2017,"Clean service area with all conditions. It is located inside a space that belongs to the City Hall, called Multiusos Pavilion. The entrance is not very well marked what makes us walk around to find it."
20484,73306,4,Luc,16/05/2016,"Environment banal, but all free and very quiet it's good for one night!"
20484,51262,3,Bruno44690,21/08/2015,"Clean, calm area. A little too far from the center. A municipal employee comes in the evening to make sure everything is fine."
20485,3240116,5,Timmyboy2407,30/08/2023,"A really great place created with a lot of love and dedication. Absolutely recommended, especially for dog owners."
20485,3209910,5,blobblob,24/08/2023,"great campsite, great welcome! very pleasant campsite where we are not on top of each other. Very friendly and personalized welcome with lots of advice, easy discussions. Clean and functional toilets. price a bit high (29€ 1 van, 2 adults 2 children without elec) but the welcome and the setting are worth it! We just regret that we only stayed 2 days! but we will definitely be back!"
20485,3109850,5,SabineMuller,09/08/2023,"great campsite with a beautiful philosophy of life. shaded squares, all amenities. 20€ per night for 1 motorhome for 2 people. I recommend."
20485,3106741,5,klItaliener,09/08/2023,"Simply fantastic. We were suggested the parking space according to our wishes and made a small tour with the owner. It's a nice place to relax. There is hardly any mobile phone reception... but you don't need it in a place like this. Fantastic view and pleasantly cool pool. Attention: Take cash with you, no card payment possible!"
20485,3079587,5,Agvan,05/08/2023,"my partner and I loved this little corner of paradise. it is immerse in nature, it is quiet and peaceful. there are some beautiful walks

, and one of them starting from the camping. there is a viewpoint to sit and contemplate the sunset, maybe with a glass of local wine. there is a little bar in the camping with wooden benches outside where you can sit and enjoy the songs of the birds"
20485,3073622,5,Daminhacasa,04/08/2023,"Park very well located, with personalized service, in a calm and pleasant environment."
20485,2913316,5,Ripley53,01/07/2023,Just beautiful !!!
20485,2803959,5,TimandNelly,30/05/2023,Best camping experience ever! We were very warmly welcomed by Leonel and his heartwarming family. It is a campsite in the middle of nature and beautifully maintained. You can choose a place yourself. Well maintained sanitary facilities with nice hot water and there is water supply everywhere on the campsite. Overall a super experience. Highly recommended! The sunset and stars are also beautiful here.
20485,2779490,4,clod29,23/05/2023,"great campsite, you just need to have fairly high holds because the terrain is steep"
20485,2767080,5,Mozoom,20/05/2023,"The dream camp on top of a mountain. Nice owners, small-scale and relaxed. There are beautiful walks straight from the campsite, the sunset was breathtaking and the village below is beautiful and has all amenities."
20485,2764251,5,Badelteodoro,19/05/2023,"Magnificent campsite both in terms of the setting and the benevolent welcome I order it from you if you like the mountains, exceptional landscapes"
20485,2763484,5,PYLG,19/05/2023,"Nothing to add, everything is real! Very beautiful region, great motorcycle ride, breathtaking landscapes! Very warm welcome... in short, a corner of paradise!"
20485,2755333,5,kratzalbers,16/05/2023,A really nice quiet place with wonderful hosts. Delicious barbecue evening in the bar. Lots of tips for tours in the area. Just great!
20485,2751323,5,drLeuz,15/05/2023,wonderful place...go and enjoy it!
20485,2751295,5,Mirandamota,15/05/2023,"Excellent place to rest and admire nature, being able to hear the silence. It has all the necessary services and with a swimming pool, it also has a cafeteria. Hosts Leonel, Gustavo and Liliana are very friendly and helpful that make us feel at home"
20485,2737440,5,chrispyduck,09/05/2023,This campsite is very special and in many ways our favourite on an 8 week road trip. Nestled in pine trees above Gouveia you have the tranquility of the Serra da Estrela right with you. Stunning walks all around and a short trip to town for provisions. We arrived for 1 night and stayed 5. A special mention for Leonel and his lovely family for making our stay so memorable. ❤️
20485,2728554,5,rickylivi,06/05/2023,"My intention was to stay two nights to photograph the stars and try typical cheeses... I ended up staying 20 days. The area and the facilities are impeccable and Leonel and his family are exceptional, always ready to do their best to make your stay an unforgettable experience. Serra da Estrela is magical, if you are looking for peace and contact with nature, you will find it here."
20485,2716985,5,Bounder09,02/05/2023,"A hidden gem. Great base for Serra da Estrela. Peaceful, quiet, amazing views and sunset. Wonderful host, who will explain options in local area. Choose own pitch. Plenty of shade. Hot water in showers and washing up. Persevere with the road instructions, just keep going up the hill follow signs, including small green one at fork to right for Curral do Negro. Great place to chill and enjoy nature."
