placeId,reviewId,reviewRate,reviewUser,reviewDate,reviewContent
20895,378015,4,skyontheroad,20/09/2018,"Having in mind one is in the Algarve, 100 meters from the beach or the ferry that travels to Armona island and a motorhome, 2 people, a dog and power supply is around €17 a night, the place is great. Don't know what toilets and showers look like - we have a motorhome, not a tent. The pitchs vary from exposed to quite private, depends on what you can find available. There's a service point for motorhomes, a minimarket and a restaurant on site. Quite during the night."
20895,374142,3,vanvanyr,15/09/2018,"Actually simple camping, small and very tight location but it is 100 m from the beach and the village. Important Info, it offers recharging of propane cylinders."
20895,373661,4,guezys,14/09/2018,Clean. Well located. Correct price. Good welcome
20895,366936,1,Arlindomasp,07/09/2018,Cleaning ladies are not at all amiable They are upset They should be trained to talk to customers
20895,366566,2,Arlindomasp,06/09/2018,Plots very tight and full of dust only good thing is seaside and village center
20895,357193,1,libetxu13,28/08/2018,We arrived at 10pm and the only place left was a dwarf plot with the sink in half and the trash there as well. As we were tired we decided to stay. The staff that attended us very unpleasant. Dirty bathrooms. The plots one on top of the other with 0 privacy. Ours seemed the great way with people passing by all the time. Never to return.
20895,342350,1,poupette04,19/08/2018,"Attention, full camp site the caretaker sent us to a French individual who arranged his land for some vehicles under the pretext of helping us took 10 € per person 10 € for the camper with EDF and 1 shower and a toilet for 14 people who were there, to flee absolutely."
20895,314761,3,alex1dregirard,04/08/2018,"Simple camping, actually in the summer we find ourselves a little on each other, but access to the sea and the city center make us forget this point. Good for 1 or 2 nights to visit the surroundings"
20895,307621,2,Pedrocferreira,30/07/2018,"Nice place to stay one or 2 nights, friendly people"
20895,291247,3,mcpsergent,17/07/2018,"Campsite well placed in fuseta near sea and small town pitches very tight a little on the other clean sanitary 1 camper and 2 adults 13,7 € without correct electricity"
20895,271277,3,PBK,19/06/2018,Welcome in french. Different rates depending on the size of the pitches you have to choose. What is nice is the proximity to the beach. Sanitary ok. Good for one night (17 €).
20895,263736,3,Iisa,04/06/2018,"Fully equipped space in the vicinity of the village, quiet but very busy - difficult to find a suitable place with a large motorhome. Sanitary facilities ok"
20895,251291,3,matouter,11/05/2018,"Good location but no more than 2 nights saw the benefits, a lot of French people who are there for long stays."
20895,248942,4,Marcyy,08/05/2018,Very charming campsite by the sea. The staff was also very friendly. Gladly again.
20895,246170,5,Elisabethgoczon,04/05/2018,Super good
20895,244657,4,fano49,02/05/2018,"Spent one night, very good welcome, speaks French, very clean location, sanitary nickels."
20895,243523,3,Opium2804,30/04/2018,Camping in the village near the sea. Sanitary clean. The sites a little close together. Many people settled for several months. Home mixed according to who is at the reception. We had some nice encounters.
20895,234130,4,soniafernoux,07/04/2018,"Not come for 2 years, very pleasantly surprised by the new sanitary facilities and modern electricity kiosks, the staff at the reception very friendly, the friendliness of the cleaning team morning sanitary is still to improve!"
20895,228797,4,notrepetiteroulotte,21/03/2018,"Nice campsite, friendly staff, we stayed for 2 nights. A place ideally placed for bike rides in the salt marshes, greenways in very good condition."
20895,208109,2,valeric123,31/10/2017,We stayed only one night frankly uncomfortable in this kind of camping-overgrown camper with regulars who feel very much at home. The toilets are dated 20 € a night with a van too expensive!
20895,196804,5,cathlef58,23/09/2017,From more sea to 200 m and town center at the exit of the camp-site ....
20895,196783,5,cathlef58,23/09/2017,"Very good camping, spacious pitches, very nice staff, excellent camping restaurant for 17 € / day electricity, dog, 2 people and motorhome visit Faro, Olhao and Tavira by train, schedules given at the reception that the people request."
20895,173430,1,valou37,13/08/2017,"Who can save, incompetent, aggressive and unkind staff, they forget that they are the tourists who make them food, ashamed"
20895,149487,4,CristinaLlamas,09/07/2017,"We travel with children (3 years and 9 months). To emphasize: careful with the arrival, very full (when we arrived there were only 6 seats left). Positive: close to the beach, quiet, clean, small supermarket, friendly workers, nearby market worthy, and bike lane for sports (near train station). Negative: close to bars with a LOT of noise until 4 in the morning; 6 showers only."
20895,135940,4,luccio,19/05/2017,Very good camping shade but a little on each other. Super ride at night by the sea
20895,119271,1,vivo,03/02/2017,Full to overflowing and more. could nt get on.
20895,118203,3,mirabelle9,12/01/2017,Well located between city and lagoon. It borders on overcrowding. Clients of regulars who believe in a reserved area. High price compared to services.
20895,110663,4,franc1port2,20/10/2016,We have been to this campsite for several years in a row and have enjoyed it all the time. Warm welcome both at the reception and the caretaker .....
20895,103836,3,jepago,08/09/2016,"Totally agree with Chris44. We escaped after three days, too bad, because the corner is superb. Three stars for camping, zero for the atmosphere."
20895,90396,4,afy3340,07/08/2016,Very good camping shaded by places a single flat noise because the evening music is at a very high level on the front and back of the campsite until a very late hour but beach level very well located.
20895,65385,4,movette,14/03/2016,Perfect welcome. We were informed about sporting activities beyond our expectations. Quite satisfactory campsite.
20895,65233,3,iakito,12/03/2016,"Camping very well placed but old as you can not find anywhere. No hot water for washing up or washing clothes, several sized locations numbered from 1 to 6, location based rate. For a motorhome 7 m long, forget 1 to 4, and again when the trees do not interfere with parking. I do not even talk about satellite reception. Rates decrease from 7 nights of presence. Everything is paying in addition to adults and location: trailer, dog, electricity, motorcycle, etc ... Everyone speaks French at the reception and the concierge. Wintering of many French regulars. To ask why ..."
20895,63629,1,quadeur,12/02/2016,"Never place and warn the guards to evacuate us from Fuzeta in the late afternoon, this year we feel proscribed in Portugal, fired from everywhere because of campsites and n the and gb that pollutes it returns in Morocco"
20895,60239,4,gg56,21/11/2015,"Good welcome. Great location near the harbor and beaches. There are 3 sizes of locations to choose from. The sanitary are correct but nothing more. Many motorhomes are installed out of season for 5 to 6 months for some. There is a train to Faro and even to Lagos, which is convenient"
20895,57677,1,christ44,16/10/2015,"We were happy to return to this small municipal campsite after 7 years but then what a disappointment despite the place dreamed between the beach and the small typical Portuguese village, we had the unpleasant surprise to cross (without any hello) a handful of ""old ""French former followers of Morocco who believe in themselves and by their behavior make us really ashamed to be French. And for us are simple and friendly people. Really sorry."
20895,44757,3,cervolix,29/07/2015,Good welcome. Great location near the harbor and beaches. The locations are not very big and we are a bit on each other. The sanitary are correct without more. This campsite must be interesting out of season when there are fewer people.
20895,34886,4,patjak,29/04/2015,"Very clean sanitary facilities, very good reception at the bar, normal reception, sea and city location, very favorable"
20895,33095,3,pheclaf,06/04/2015,"Good campsite, close to the beach, the port and the city, so convenient. The sanitary (clean) are minimalist and need a little renovation (showers without pressure - a single tap hot water dish for all the campsite). Many spend there several months, there is probably a reason."
20923,1217830,4,JosePili06,25/05/2021,"Okay, it is free, difficult to connect hose. It does not have to empty sewage"
20923,1115229,3,PeteAndMel,14/11/2020,Decent park for the night. We stayed in the top carpark. Can be a little noisy as its obviously right next to the highway. It's not a huge service stop but it was safe enough for us
20923,468240,4,baloo75,26/04/2019,"Perfect to empty and fill before arriving in Barcelona. It does not have blacks, so you have to empty them in the grille of the grays, but carefully and throwing water at the end, no problem. In the other sense there is also."
20923,232847,5,richarangi,03/04/2018,"Very good, also when you get home. you leave it clean"
20923,213238,5,Taillandier,01/12/2017,Impeccable to drain sewage and get water
20923,44115,4,oliach,26/07/2015,No place because too much weight to park on Sunday 26/07
20924,2931242,5,siggimueller,06/07/2023,"Fueled with diesel for €1.319, we could use the showers, toilets and the parking space for the mobile home free of charge, everything was included in the price. Friendly service at the gas station and in the restaurant. We ate a menu for €12.00, it was adequate and good. We can recommend the parking lot :-)"
20924,2649740,5,Elenaglez,08/04/2023,"It has a great shower, very good facilities. €2"
20924,2628990,5,Pack53,29/03/2023,Exceptional welcome worthy of a 5-star campsite. Very clean toilets. The ideal place for the motorhome. To recommend. Very friendly staff.
20924,2617537,5,MariLo69,20/03/2023,"Ideal for an overnight trip, magnificent treatment, all services. and a good cafeteria restaurant with great food. Super recommended ☺️"
20924,2604164,5,Tui,09/03/2023,"I spent the night last night using electricity and this morning I took a shower, had breakfast and refueled (in addition to diesel, the lowest price in the area). I only have words of gratitude for the kindness of all the staff, both night and day, and to add that the facilities are impeccable. They have made my day!"
20924,2466148,5,Bird,28/10/2022,"We spent the night there on a Saturday and the truth is that it was very comfortable. Perhaps because it was the weekend there was no car noise, a very large car park, monitored by cameras and free. The very nice gas station attendant"
20924,1779340,3,lianaelmans,10/03/2022,It might have a higher value but for me as a solo female camper driver I didn’t feel comfortable staying overnight here. It’s next to the highway with a huge terrain for truckdrivers. There weren’t any camper vans there only truckers. Sorry but I left… Also the coordinates aren’t right and it takes you to a different area. Better to google for ‘Navatrans Service Area’
20924,1721016,5,leyenda67,31/12/2021,"The best passing area that I have found, the gas station with a good price, breakfast bar, excellent treatment by the girls who run it."
20924,1705582,5,sergito28,07/12/2021,"Good area to rest, eat something, emptying black and gray, clean water available, everything super clean and very friendly staff. Thank you very much for helping us travel better."
20924,1632026,5,flo1310,07/10/2021,We got there late at night. The staff was very nice and opened a room for us with a shower and toilets. We didn't pay anything for it. We were able to spend the night in the pop-up roof without any problems.
20924,1530649,5,celinelo96,30/08/2021,"Perfect area to recharge your batteries, connect to the light for only € 3, keep in mind that there are only 4 plugs. We had a very good dinner, although it took a while. The shower is new and very clean and the staff is very very nice!"
20924,1440699,5,Mokeykamikaze,11/08/2021,"Showers, refueling and a cafeteria to stop along the way. Quiet area despite being next to the highway."
20924,1429348,5,alexxandra22,09/08/2021,"We have been able to empty gray and black water for free and without any problem, great!"
20924,216542,5,Camash67,30/12/2017,"Stop before arriving in Madrid at this petrol station. We were able to take a shower for free because we have refueled (sanitary heated and clean, shower a little less hot). The staff is smiling and friendly. The night was rather calm. We recommend ! Gracias navatrans :)"
20924,194612,4,fito23,17/09/2017,"Navatrans; Ap 601 _ Exit 80. A highly recommended area. The staff is very friendly and attentive. We have stayed overnight and they have not charged us anything. Electricity and exchange is € 2. 2 € showers, but if you have a lunch or dinner at the restaurant, it's free. Very calm. The very good location, between Cuéllar and Segovia, and shortly from Madrid, exit highway n ° 80. We will return !!."
20924,179024,4,cabocop,18/08/2017,Water and toilet discharge I think for free. We have refueled and they have not told us anything. Right next to it there is a rest area.
20926,1947522,1,ang3lj25,05/06/2022,"It is not valid as an AC zone, the valid one is the other one next to it"
20926,1928366,5,anbama,29/05/2022,"This is parking only, in area this about 100 meters."
20926,1794912,5,ASARGA,25/03/2022,"phenomenal area with 10 seats, clean water and gray and black drainage, a 10 for the Town Hall, let's see if others copy"
20926,1668429,1,taviralagoa,29/10/2021,Close to the most touristic points but on weekends there is noise from the bottle and cars spinning. Not recommended
20926,1526613,4,Leliland2,29/08/2021,Quiet night. A slight unevenness. Drinking water source in the park. We slept alone and no problem.
20926,1259633,4,dekapax,17/06/2021,"Five-seater parking slightly inclined but as it is used by motorhomes because the motorhome behind is closed, they allow to put chocks without problems There is no shade but since it is an esplanade it gives enough air In front there is a park with a children's area there is a terrace bar but it is not noisy at this time at least Being between roads there is some noise in the morning"
20926,1128060,5,rqroru,04/01/2021,Quiet place and close to the palace
20926,1116071,4,Papia11,18/11/2020,"We slept well, some noise from the nearby street traffic. Very close to the center of town."
20926,1090474,3,egonro1,12/10/2020,Quite open space
20926,722966,3,ngau,16/10/2019,Ideal to visit the Palace but close to the road to sleep (awakening very early assured).
20926,508422,4,locosporlasalsa,08/06/2019,Very good place only 5 seats quiet although this next to the road there are 2 sinks in which you can empty gray
20926,448630,5,AbandonarelaCiudad,03/04/2019,"Great parking, we spent a night without problems, we made the route: The Path of the Royal Sites. The route is about 11 km circular, easy and beautiful, we did it from there."
20926,444616,4,Morales81,25/03/2019,"Perfect parking, we stayed one night and everything was right and good with a large park in front for the children."
20926,422205,3,anaisma,13/01/2019,"Parking type bus 3 or 4 but when we arrive unoccupied and without signaling for bus. We stop to see La granaja, walk through the gardens of the Palace and the fishing trail around the frozen and circular lake, very beautiful."
20926,389661,5,laurafer,08/10/2018,"We spent a very quiet Saturday night, no noise. Gardens and park for children in front. Ideal to visit the city."
20926,334035,4,elsanadordecaballos,14/08/2018,Quiet and with gardens around
20926,293709,5,bruji,19/07/2018,"Very quiet and pleasant, very close to everything"
20926,174619,4,chally,14/08/2017,"The squares that are in the street and that are seen in one of the images are bus size, although without signaling. Perfect place to park and visit La Granja."
20926,152365,4,antoniobena,15/07/2017,"Ideal place to visit the town. restaurants, pizzeria chiringuito in the gardens. Overnight without problems. they are in it for AC zone."
20926,149531,5,ElChispi71,09/07/2017,"Quiet parking very close to the Palace. It is no longer fenced because they have completed the recovery works of the glass factory environment. We have not used it to sleep, just to visit the Real Site. Highly recommended"
20926,74622,2,fdi,25/05/2016,Free parking but little charm. Good to visit.
20926,74601,3,tomyjp2,25/05/2016,"Some parking spaces in the area of la Verrerie, it can help, no service."
20926,49844,1,dune91,17/08/2015,Does not exist anymore
20926,33216,2,virginiaher,07/04/2015,Right now that area is fenced by works being able to use only the area intended for buses and the truth is that it has enough inclination is necessary to put on shims to be able to sleep well
20934,3290829,3,FannyCamp,13/09/2023,Nice campsite with a real super chill hippie atmosphere! The only downside is no drinking water and a reek of sewer odor.
20934,3278707,1,SSD,09/09/2023,"A lot of noise at night, people playing music and shouting. No shade, only for fixed caravans. Spicy food, according to the cook and waiter, is normal. Forget if you want to relax."
20934,3226658,5,Azeth,27/08/2023,"Incredible place with super nice people, we went in two cars. The showers are phenomenal, the only problem is that you have to have 0.50c coins for 5m of hot water, they do not accept other types of coins or payment because they are machines, 100% recommended"
20934,3225645,5,tempetefam,27/08/2023,"After 4 nights spent in this place just atypical, friendly and filled with benevolence. Not knowing this spot on your route would be a shame. People are cool with a lot of respect. The pool is a plus. I will come back for sure. Thanks to Mikky's"
20934,3225177,1,camperplaatseuropa,27/08/2023,unfortunately too expensive. go find another place.
20934,3224168,5,larulietta44,27/08/2023,"an atypical place as we like them!!!! the staff is very pleasant and attentive. you arrive at a hippie campsite with large pitches, here they are very dog friendly and we love it!!!!! moreover free stay for them the restaurant / bar on site is full of charm and we eat fresh! unbeatable value for money in high season (€27 with electricity for 2 adults and 2 children)"
20934,3213387,5,jorconde,24/08/2023,"We have come by recommendation and really, although with many motorhomes, the space transmits peace and relaxation. We came for one night, we stayed 3, a good family atmosphere with children of 8 and 11 years old. we recommend."
20934,3213193,1,qb2,24/08/2023,"It's a shame how this site has gone to waste. Not long ago you paid €12 for the first night and the rest €9, per motorhome with passengers included. At the pool, at rush hour, we were 3 or 4 families, I have photos from several years and you can see it. This year €26 with 2 children. More than double, the pool does not fit, the abandoned park. In short, I've been recommending this site for years... well, I never come back."
20934,3198333,1,blasjose,22/08/2023,We entered and saw that there were countless plots occupied by caravans that seemed to have been there forever. We didn't like it and we left.
20934,3162148,5,carlos.rassy,16/08/2023,excellent experience. I strongly recommend.
20934,3145435,4,rrodpin259,14/08/2023,"We have spent two very pleasant nights. For those who are very demanding, it will seem abandoned and not very clean, but it is a kind of camping only for caravans and motorhomes. As a negative point, the slightly cleaner pool water is missed."
20934,3115389,1,CristelBurgt,10/08/2023,"Dirty camper place. Stray dogs and very busy. Hippie place with special people who seem to live there permanently. Special scene, we left immediately."
20934,3111412,4,xevipuche,09/08/2023,curious place to see a world apart
20934,3084723,5,GaizkaVan,05/08/2023,"We are doing the Algarve route and this is undoubtedly the one we have liked the most so far. The places are spacious, the toilets and showers are small to say the least, however, the bar and the pool are very good. It should be taken into account that the place has two entrances, one is ostensibly official, while the other sends you down a track to the street. The price is right. They make pizzas in the bar for €10"
20934,3077757,3,catess,04/08/2023,"What a disappointment when we came in 2017 and loved it. Too many caravans, and comings and goings of cars, it is no longer an air of camping car. It remains atypical and welcoming"
20934,3030449,5,LuaRes,27/07/2023,"Great to rest from Albufeira. The common spaces are very charming, the natural pool a luxury. Super nice staff. We found everything clean. Hot water at 50 cents, not necessary for this heat. An AC with a lot of personality."
20934,3018541,1,sun.on.wheels,25/07/2023,"Unfortunately I cannot recommend the place. You can only visit the toilets directly after cleaning, everything after that is pretty disgusting. Especially the people who have lived there for a long time are really a problem. The pool is muddy and smells like sewage. Don't recommend it to anyone."
20934,3015241,4,Carlosmude,24/07/2023,Second year that we come and everything remains the same. A great atmosphere and very good attention. We will return for sure
20934,2989728,5,cparker2023,19/07/2023,"We spent 5 nights here and loved it. Very quirky, hippy vibes with lots of long termers parked up. Plots were spacious and most had shade. Our daughter loved the animals and swimming pool."
20934,2971994,5,dasafru,16/07/2023,"It is a charming place, swimming pool, spacious squares, you can see a farm with different animals."
20934,2959764,5,Bushtrece,13/07/2023,"For little, it is almost a campsite. The “natural” pool is great. The bathrooms and toilets are scarce, although very clean. The staff is great."
20934,2922439,5,winonae,04/07/2023,"We had a great night here. Was our last with the van so we could dispose of our sewage & toilet. There is no drinking water, instead there is flushing water, and I found the showers and toilets to be clean. The smell mentioned is there with 4-5 parking spaces, with 120 no problem avoiding it. The pool is great, 20€ in July/Aug. for 2 people, electricity & laundry for 5 € extra."
20934,2903050,5,Tendinha.Roadtrippers,28/06/2023,The Eden of Campervans. the best places we've had to date. Differentiated place with plenty of activities and a feeling of being in a magical place.
20934,2889570,5,tamara35,25/06/2023,just great. We went in a caravan and with a dog and everything was fine. The pool is a success to cool off. The environment and the climate of 10. We will repeat for sure.
20934,2848696,4,PabloIturriaga,13/06/2023,"Without a doubt, it is the most special place I have ever been. I'm not giving it five stars because perfection doesn't exist, but it is a unique space, cheap, with large plots, abundant vegetation and a quite unique atmosphere. The pool and bar are 10. A great place to spend a couple of days on your route through the Algarve."
20934,2825247,5,2F,06/06/2023,"A very beautiful place that our hosts have created from nothing. what happiness this swimming pool… In short, paradise… thank you"
20934,2749317,3,ABdeW,14/05/2023,"Large outdated campsite, many regular guests. Love all the animals. After 2 months in Spain it was a relief that everything is so open (no fences!). Good cycling to a beautiful beach and small village. Still only stayed 2 nights, we found it too big and plumbing is really a thing. We saw someone emptying the chemical toilet at the toilet building. A more extensive and personal check-in would prevent this."
20934,2741668,3,Danielk1988,11/05/2023,"First of all: we stayed longer than planned. The atmosphere is really great, the people and the place too! BUT: everything is very old. Especially they sanitary facilities. The fecal stench, which has already been mentioned several times, is difficult to endure. (in some parts of the square) The price of 19 euros for 3 people showers for 50 cents are too much. It's a shame because of the potential"
20934,2736675,4,mherrm,09/05/2023,"Lots of seats, great restaurant with bar and good pool. The sanitary facilities were okay, hot water costs extra. Depending on the wind, it sometimes smells strongly of sewerage."
20934,2726079,5,Marco156,05/05/2023,"A great place with a great atmosphere. The toilets and showers are getting old, but are cleaned twice a day. Great pool and nice staff. On Saturdays there is always a delicious pizza and otherwise you can eat delicious there. There are also rolls... We'll be back..."
20934,2721318,5,heikemaxontour,04/05/2023,"A sensationally great place, with everything your heart desires. Very pleasant atmosphere. Are now 1 month here and have extended by another month. Traveling in 2 years, the best campsite we have had so far. We feel super comfortable here, feels like at home. Very great."
20934,2713002,5,tomabety,01/05/2023,"Nice place, swimming pool great for kids. Lots of campervans in the end of April, seems to be popular. Carpet in each spot is super convenient."
20934,2688189,5,maildajoana,22/04/2023,This park is wonderful. It has a relaxed atmosphere and a fantastic blend of nature and art. The pool is beautiful. The restaurant is charming. I recommend you visit this place because I know you will leave as delighted as I was.
20934,2653792,5,Elcristo88,09/04/2023,Very happy with this campsite when you arrive you look for a place where you like to park and then you go to reception a luxury very happy with all the super friendly staff and for the children the animals the pool and that's perfect. The playground should be more careful because almost everything is broken
