placeId,reviewId,reviewRate,reviewUser,reviewDate,reviewContent
20702,1621939,2,anitana,02/10/2021,"Site in the middle of nature and on the road too. Ideal to spend the day at the picnic area and stroll but to sleep somewhat uncomfortable due to the inclination and noise of the cars, luckily few passed. little traffic of people. ample space to park ac and vans."
20702,1515798,5,ega_85,26/08/2021,"Good place to pectonize and rest with a park, two beach bars and a river pool. The squares are inclined and there is drainage. It is better to arrive in the late afternoon."
20702,1482156,5,olatzi,19/08/2021,The bathing area is very cool. Cars park in the AC zone. It has filling and emptying. Slightly sloping. The area is attached to the road.
20702,1463093,4,juanjoie,15/08/2021,"To get there, look for the Carixa recreational area in Merza, which is a ""neighborhood"" of Vila de Cruces in which it is located."
20702,1461617,4,joseonevision,15/08/2021,"Perfect place to take a bath, but better to arrive at the last minute as you can see they do not respect the areas for cars and you may not find parking"
20702,1402092,3,ferdy21,04/08/2021,"We have spent the night, it is next to the road but it has very little traffic, a bar in the same place even a river with a natural pool and some pools."
20702,1329633,3,pinaken,16/07/2021,Eye forbidden dogs throughout the premises
20702,1166531,3,trillonyotero,04/04/2021,Nice place but people do not respect the parking areas of the motorhomes.
20702,1158540,1,palomita,27/03/2021,The environment is beautiful but the area is right on the road which makes spending the night dangerous and very annoying. it's very good as parking
20702,1154024,4,jorconde,20/03/2021,"Great place, with all the services advertised. the 4 for the inclination even that it is survived for one night. ideal for a nature getaway."
20702,1045492,4,NOC,13/09/2020,Beautiful place even though the squares are inclined and occupied by cars we had to wait for them to leave. Close to visit Fervenza do toxa
20702,1044423,4,titovigo,12/09/2020,"A beautiful place, as of today 09/12/20 the natural pools are closed, 15 large squares with a lot of inclination, with the use of chocks it is fixed ... drinking water, gray and black"
20702,928051,5,Fordusha,04/08/2020,Very nice place especially with kids. Lots of place to run around and big playground. Cafe bar area serves food/drinks till late. Full free services. River is deep enough for a swim. Monastery is  40 mins walk. BBQ area. Very empty on the week day. Highly recommend! 40 mins drive to/from Santiago.
20702,875714,3,Nomadas2020,17/07/2020,"Beautiful site, sloped parking and attached to the main road, the pools as of today 07/17/2020 are closed"
20702,840834,4,HotelRodinhas,28/06/2020,"Thanks to the Comcello de Vila de Cruces for the initiative to create a pleasant area for motorhomes with water discharge and sink. Unbeatable environment with natural leisure areas equipped with tables, children's playground and barbecues. It coincides with the Deza River route halfway between the Toxa Waterfall and the Carboeiro Monastery. I am asking for greater control of car parking."
20702,709709,4,DaPads19,01/10/2019,"Stayed for one night. Clean and tidy parking. Lovely recreation  area - most of it is closed (possibly all seasonal). Sloping parking - chocks required. Although parking is on the side of a road, it was surprisingly peaceful overnight. Thank you to the town for this facility."
20702,681354,4,mpestana,08/09/2019,"The area is fine, with all services for water changes and even a sink. There are about 15 places. It has next to river pools, tables and playground. The only negative is that it is next to the road and is inclined but it is solved with some chocks."
20702,630313,5,joselekun,15/08/2019,The area itself is inclined but worth it. With children it is perfect. Barbecue tables park and natural pools. It has water and emptying. next to a river. the parking is tilted and next to the road but fine. We have spent the night alone and without problem. I don't remember number of places but there were 8 or 10 like that by eye
20702,596176,3,Guagua,03/08/2019,"Very nice place, but we went for the issue of showers and there is none."
20702,189019,5,macamen13,02/09/2017,"Recreational area, fluvial beach with two swimming pools and possibility of jumping into the river. Barbecues and stone tables, playground for children, 4 seats of Motorhome .. Fabulous site, nature and tranquility"
20702,176037,2,antoniomt,15/08/2017,"Spectacular area, with natural pools and an ideal recreational park, but the problem is the lack of respect for the cars that occupy all the motorhome seats and even the emptying area // filling, it is impossible to park on a public holiday"
20702,175547,4,largo78,15/08/2017,"Ideal place if you go with children, playground with natural pool games, and a spectacular landscape recommended, a little uneven"
20702,167372,5,juanjoneli,07/08/2017,"Nice area. Ideal if you go with children. Bathroom area, games, barbecue, shade, chiringos.recomendada."
20702,165348,5,mcanasg,04/08/2017,Great site! We came out of the hustle and bustle of visiting Santiago de Compostela and we were amazed with the place. Great for children; park and swimming area. Barbecues and a couple of beach bars.
20702,163624,4,MarcMoreno,02/08/2017,Good area in a better environment. Up to 15 marked places.
20702,129888,2,Emma3,21/04/2017,"Parking spaces are very slanted, ramps are not enough. Place is right on the recreational area with barbecue grills and tables / benches."
20702,88544,4,MarcMoreno,02/08/2016,Picnic and barbecues. Bath area
20710,2741675,2,dany-leo,11/05/2023,"Well placed to go for a boat trip and enjoy the nearby restaurants. But beware, 3 motorhomes close to ours were broken into this morning. The police confirmed that there were frequent break-ins and thefts. It is very unfortunate and pitiful! Park as close as possible to the buses which will ensure your safety."
20710,2617570,1,l.mormol,20/03/2023,Do not park here! There has been a burglary and theft ...
20710,2515724,4,zucche,07/12/2022,We parked to eat and paid €2. You cannot stay overnight.
20710,2440028,3,dasafru,12/10/2022,good to visit the town. we only stop to eat
20710,1769478,5,malcon,28/02/2022,"I have a 7.40m car and it's a bit difficult to get around the area and it's almost impossible to park inside the town. I don't know if I've been lucky or the robbery situation has changed, I only stopped to eat and everything was great."
20710,1484690,3,luz11,19/08/2021,"Today, after I know that our motorhome has been robbed, I have read the theft notices. We have put the complaint in the civil guard, and they have told us that every day they have complaints from that site Be careful, you cannot park they are stealing every day"
20710,1340889,1,FamilyMaspairet,19/07/2021,"DO NOT PARK, THEY STEAL !!! In 2 hours, while we were eating at noon, the windows of 2 AC have broken us (2 families are going). The owners of a pier in front have informed us that this is not the first time that it has happened and that they take advantage of this hour since there is no one watching."
20710,1340607,1,FamilyMaspairet,19/07/2021,We have parked two motorhomes and the two motorhomes have opened them. Neighbors have told us that many have already opened. DO NOT PARK HERE
20710,1160003,3,santiCP,29/03/2021,"Be very careful about getting into town with the motorhome. At the weekend it is a chaos of badly parked cars. The canal streets are the narrowest. If you are lucky to be able to pass, you will most likely get a scratch. This car park is the best option to visit the town and not complicate your life. Yesterday I got in ignorance with a profile of 7 meters and it took me a lot of work to get out."
20710,940309,2,RoseRuiz,08/08/2020,"Very large plot, without shade. They have charged us € 2 to ""watch over"" the vehicle (immediately afterwards the watchman has left). He told us that there was no hour limit so I imagine you can stay overnight. Near the Albufera restaurant and boat rides area. In the village there is also parking on the street."
20710,749603,2,mumdventure,03/12/2019,"Simple parking, no access to the pond without paying a passage in boat. Not very interesting compared to the beautiful surroundings."
20710,628557,1,I8BD,14/08/2019,"Do not come July August, stop reserve the client wishing to go for a ride in a boat."
20710,428007,4,Louise71,10/02/2019,"We slept on the parking lot without problems, quiet, not heard the roosters, no service, many restaurants. Rice fields, barca, birds, very pretty landscape. We arrived in the afternoon we paid € 2 parking a Saturday."
20710,123631,2,adadu,21/03/2017,"After one night, the roosters are very very morning and many, if not very quiet in this month of March."
20710,122829,2,calou535,13/03/2017,"Spend a quiet night, the rooster only sings in the morning, and the restaurants are rather nice to plan the emptying to stay 2 days"
20710,122816,1,adadu,13/03/2017,Stationed but not slept! the roosters of the neighborhood are very very morning.
20710,65813,3,Nsicart,20/03/2016,"Solar at the entrance of the village, nothing special, but quiet to sleep. Next to the town, good chances in the morning."
20710,64401,1,taillonnais17,26/02/2016,Large car park without services. Nice place to walk around and discover nature.
20712,449667,4,RafelJiJa,06/04/2019,"Recommended the bar that is right in front. Bar L'Avinguda, good quality and reasonable prices. Excellent calamari sandwich."
20712,441926,1,lilyjo83,19/03/2019,There is a sign indicating that the car park is closed from 8pm to 8am and we see chains. We did not stay
20712,149247,2,YANNBZH,08/07/2017,"A lot of road crossing near the comings and goings of motorcycles and scooters, we went elsewhere"
20712,149169,4,Los5,08/07/2017,"Quiet parking at night and weekend without forgetting that there is a school next door and during drop-off and pick-up times students get full. Gas station in front and Civil Guard from behind. Several parks around with pipican area. Facing the gas station about 50 m on the left we find a pharmacy and following about 150 m there are several supermarkets, burguer, hospital, etc."
20712,107302,5,retrocat,25/09/2016,"Very quiet in front of the school, already 200 m from the exit of the motorway towards north-N II Barcelone Lleida. // Very quiet area. In front of the school, there is 200 m from the exit for the north dual carriageway N II Lleida Barcelona"
20721,3273037,2,maxxl,08/09/2023,"Great place, beautiful beach but the kings of camping gather here all year round. Park 30 cm next to you and leave the engine running all day for air conditioning and electricity. Of course, just let the wastewater flow onto the square. This is not an isolated case but normality. By the way, in summer and winter (I stop here a few times a year)"
20721,3249454,5,Nereban,02/09/2023,"This site was occupied by the fair and barracks, but next to it there are several parking lots. There are no services, but the atmosphere in the town is excellent, they welcome motorhomes very well and are very friendly to tourism. It is the second year that we go and return. Thanks to the town hall and the town for allowing us to spend the night and park. The beach is very good, with public showers and bathrooms."
20721,3247660,5,lidiaserrano,01/09/2023,"Thank you very much to the town for being so wonderful, the beach is very good, I totally recommend the bars in the area. If they love us, they consume and spend in the town. Thanks to the city council for allowing us to spend the night. PLEASE TAKE CARE OF SITES LIKE THIS."
20721,3240837,4,Yeliso,31/08/2023,"It is a luxury to be on the beach, it is very safe next door is the civil guard barracks. It is dirty because the same people in the motorhomes empty gray water and also the water tap there is not for washing dishes or brushing teeth, if we do not set an example of taking care of it, the time will come when they prohibit parking."
20721,3226903,5,tcha3,27/08/2023,"Ideal parking, on the beach, with showers next door. Very spacious for many caravans and vans. There were a lot of vehicles but it was very quiet at night, the worst thing was the heat. It is true that there are wild boars, I saw a javelin with its piglets at 1 in the morning in the parking lot. Be careful, do not leave any rubbish around the vehicle."
20721,3216450,1,viajero.,25/08/2023,"A lot of caution, at nightfall. Wild boars invade urban areas and can be a circumstantial danger. For the rest!, people with good businesses, willing and very professional."
20721,3212610,4,CarlosCaravanista,24/08/2023,"A big parking lot, with a lot of space and a lot of caravans, quiet to sleep, great view and in front of the beach, if you have a motorcycle is good to park there and see the best spots around."
20721,3080232,5,naroa8,05/08/2023,"Perfect for sleeping, seeing that in the entire natural park if it is not an urbanized area they do not let you sleep, a very good option. ATTENTION! From August 8 to 16 parking is prohibited, Fair and concerts in that area."
20721,3041729,4,anthea0101,29/07/2023,Parking on the beach with fountain and comfortable showers. We spent a quiet night with the windows open. Convenient to the seafront promenade with numerous bars and restaurants.
20721,3037143,4,madmaddi,28/07/2023,Very large and level parking lot. Directly at the sea. Showers are on the beach and the toilet only opened after 10am. We only spent the night there as the surrounding beaches were much nicer.
20721,3029983,4,joseiglesia,27/07/2023,"Good place on the beach, at night we slept great since it was a little windy, keep that in mind."
20721,2997992,2,isabel1947campe,21/07/2023,The only incentive is that it is facing the sea. It looks like a camp. It doesn't look safe.
20721,2992214,4,ccigronlocation,20/07/2023,Great big carpark but busy spot on the beach with water & showers. Beach can be hit & miss with cleanliness - it does get tractored which is great for the sand but the water can be lovely & clear one day & dirty & murky with rubbish the next.  Didn’t have any issues but did sometimes feel a little dodgy as alot of people throughout day & sone permanent campers.
20721,2958115,1,caravanista88,13/07/2023,"There is no one who rests in this area!!! At sunset the mosquitoes eat you, dirty terrain, the ugliest beach in the entire cape, we do not recommend it even to spend the day !! WE WILL NOT BE BACK"
20721,2955726,5,novemberlilli,12/07/2023,"Spent one night here. Supermarket, restaurant, pharmacy and trash cans nearby. Shower on the beach (no shower gel, shampoo!!!). Everything was great! Note: Busy on weekends."
20721,2955477,5,RFLL,12/07/2023,"We stayed two nights without any problems. Peaceful, close to cafes and the beach."
20721,2899101,3,JorgeKatie,27/06/2023,"We arrived at 5:00 p.m. and there was plenty of space, it is quite quiet but after sunset there were a lot of mosquitoes, more than we have seen in other places in that area. there is a shower on the beach and a fountain. There are public toilets on the beach but with restricted hours."
20721,2882416,4,Tonioga,22/06/2023,"A special place. Close to the sea, level, relatively clean (some users, very few, do not behave as they should), with litter bins. After 12 at night total silence. Angelita Restaurant you eat well and not excessively expensive, very friendly. Do not park on top of the platform, MULTAN. We will return, without a doubt."
20721,2841834,3,molly95,11/06/2023,Good place to park right next to the sea. Pizza takeaway 150m in town is the best we’ve ever had.
20721,2775222,5,Bennilein,22/05/2023,Was perfect for one night more also not imaginable just too much noise anyway thanks that this is still free for parking
20721,2764905,5,ika26,19/05/2023,"excellent area, clean, level, with all services, park, barbecues... we took the opportunity to see the town and do some shopping"
20721,2691202,4,Hoogoo,23/04/2023,"great free camper place with drinking water tap and waste bins near the beach, delicious restaurants and cozy bars, busy but pleasant"
20721,2690603,3,Reiziger14,23/04/2023,Don't understand why it's so busy here. The campers are close together and there are people / locals around the campers all day long. The supermarkets have limited opening hours (what is stated on Google is incorrect). On Saturday morning there is a small market 100m from the car park. Beach is nothing special. There is a tap with drinking water. Restaurants within walking distance.
20721,2676083,4,vittel,17/04/2023,"We come back to it every time we pass through Almeria. Compared to what is offered on the coast, there is no photo. Very pleasant, fishing boats, the sea, the promenade... what more could you ask for! we must respect the place if we want to come back without disturbing the residents too much."
20721,2653409,5,tibu77,09/04/2023,"Large parking perfect for spending the night. Fountain on the seafront. Lots of bars and restaurants in the area. Fabulous cafeteria three min. walking, in the town square."
20721,2645634,4,mariona21,07/04/2023,"parking lot full of vans, caravans and motorhomes. there is no prohibition sign and you can sleep well. the views and the beach are not the best"
20721,2645035,4,soniamav,06/04/2023,"Large parking without problems to spend the night. There are plenty of ACs and campers, connected to a busy boardwalk. There is a fountain next to it. We have spent a night with a mini camper. There are no additional services."
20721,2642097,3,temarga,05/04/2023,Parking full of caravans and vans in front of the sea. There is no overnight problem.
20721,2622792,4,mikensue,24/03/2023,"Quiet stay by the beach. Only downside is that there is a concrete block approx 2 metre wide and half metre high in the middle of the parking area of a similar colour to the ground. The day before we arrived a motorhome had run into the block. It had to be dragged on to a low loader to be removed. Debris was still around, so beware."
20721,2609064,4,albatros21,14/03/2023,Quiet car park by the water…in March.
20721,2600673,5,AguayoM,06/03/2023,Quiet night spot near the beach
20721,2600030,4,dani29chico,05/03/2023,"I spent 2 nights at this place. During the day I went to the nearby beaches. Don't be late - it gets very crowded! The location on the beach is very great! One star deducted due to the noise of arriving cars from tourists, fishermen and locals. Felt very safe as a woman traveling alone!"
20721,2598688,3,Helios2latour,04/03/2023,Very good base in the Cabo de Gata park during this period...
20721,2596015,4,sezrelf,02/03/2023,Had a good quiet nights sleep here.  Flat parking.  Lovely sunset views.  Dogs allowed on beach
20721,2585488,4,RosayJorge,21/02/2023,Good parking by the sea! we spent the night in peace
20721,2579844,4,lucilla65,16/02/2023,"We have P here. Few campers. Water is always available luckily they have padlocked the ""drain"" for everyone's benefit. There is a parking area and a BP dispenser for emptying."
20721,2577003,1,miticoarpege,13/02/2023,"Today February 12, 2023 the car park is no longer accessible. Works in progress. You can stay a little further back on a dirt road full of the usual debris and droppings."
20721,2570332,2,mamelix,06/02/2023,Crowded on the weekend
20721,2569674,1,sunfish,05/02/2023,"Been warned that some people in the area like to puncture tires on parked RVs at night. In view of the other comments, this is not surprising... We preferred to use official campsites at low prices."
20721,2562979,1,VanonUK,29/01/2023,Over-used. Avoid. There are better areas than this - even if you have to pay for them.
20721,2556154,5,Kakoulilimilky,20/01/2023,"beautiful view, flat parking, quiet, facing the gray sand beach"
20721,2550194,5,CasaStradaCom,12/01/2023,"top spot

in the front of the beach"
20721,2539084,4,TonyMar,03/01/2023,"We spent a quiet night, a flat car park with no services."
20721,2531487,2,MuJu4Ever,28/12/2022,Without interest. Just a parking lot. We can't imagine spending the night here.
20721,2530409,4,Yolanda-Chantal,28/12/2022,"We have slept one night and no problem, very quiet."
20721,2528751,1,Zztop,26/12/2022,Keep emptying your cassettes everywhere even around the cemetery and one day soon we will be asked to leave. Shame on you. It's going to be like in roquetas.
20721,2524678,3,Chcol89,19/12/2022,"Glad to find this very nice place, we had no problem, we were about twenty Motorhomes."
20721,2515018,5,AkilesAroca,07/12/2022,"We spent a super quiet night, you sleep listening to the sea in the background and you wake up with spectacular views. There is a tap right in front of the beach. Free parking at least during the time we came in December, it is not suitable for emptying anything, so if you plan to charge electricity and empty water, this is not the one for you. They usually park most are caravans."
20721,2511201,4,fotodansen,02/12/2022,Beautiful spot on the coast on a beach with fishing boats.
20721,2502602,4,mortyetboulette,22/11/2022,a lot of people on Saturday so we went to the parking lot further. Sunday we slept here we were only 5 camping. quiet night.
20721,2502299,2,maminadia,21/11/2022,"I have just learned that the boss of the BP is also the owner of the Camper Park ""Cabo de Gata"" next to the village, that is why the tires were punctured."
20721,2501422,4,cagire,20/11/2022,we have been coming here for several years. But given the comments on the flat tires this year we will avoid. Too bad for us and for the merchants of Cabo de Gata.
20721,2488388,4,micT,09/11/2022,"Very pleasant place by the sea, ideal for long walks, clean sea, nice neighbors a little noisy in the morning"
20721,2456459,2,ElenaLara,22/10/2022,The site is very good but when we got up the wheels had been punctured in 4 or 5 motorhomes. Luckily we got rid
20721,2454344,1,Kisita_kis,21/10/2022,This morning we woke up with 6 punctured campers or flat tires. Better to look for alternative sites to avoid scares the next day. Too bad because the site is great.
20721,2453742,1,malepere,20/10/2022,"I confirm the previous comment ... ""punctured"" tires on 5 motorhomes (ours being part of the lot unfortunately) ... from now on we will avoid Cabo de Gata !!! I just saw the comment on the supposed responsible ... we should force them to compensate all their victims !!!"
20721,2446620,5,nuquesu,16/10/2022,Ideal car park to spend one or two nights and visit Cabo de Gata. Well leveled. It is in front of the beach with showers and a water point. if we take care of it we can continue enjoying it.
20721,2443567,3,agnes246,14/10/2022,"Simple parking, close to a beautiful beach."
20721,2439058,2,NJMC,12/10/2022,"Parking at the foot of the promenade next to a Civil Guard Barracks. Large area, although it is filled with ACs, although the area is not equipped for it. There is a public water point. Somewhat abandoned place but it is good to rest after a long day of travel. For the moment they allow overnight."
20721,2437677,5,D_O_C,11/10/2022,"Quiet flat free parking lot with a great location right on the beach for swimming, showering, bins. Part tar, part sand"
20721,2434335,3,dasafru,09/10/2022,parking to spend the night in the company of other AC and campers
20721,2434288,2,paquito,09/10/2022,"We slept there the night of 07/10 a lot of CCAR more than 25! Convenient in some cases but without charm. Quiet night though. Small market on Saturday. It is unfortunate to see locals coming in vans to fill dozens of large bottles of water from 5 to 10L! Without any embarrassment, some tourists are no better ... I pity the municipality."
20721,2428963,4,HighbornRanch,07/10/2022,"Parking directly by the sea (pebble beach). Beach showers available, toilets were closed. Several restaurants within walking distance but very expensive (salad 12 euros)."
20721,2416886,4,xwasabi,01/10/2022,Ideal car park to spend one or two nights and visit Cabo de Gata. Well leveled. Occasional car noise at night but chill.
20721,2354835,5,IturraldeJosu,09/09/2022,"Perfect parking to spend the night, walk and bars nearby, areas and camping nearby to load and unload waters To take care of these sites that allow us to the AC"
20721,2340554,4,Patricia.capinetti,05/09/2022,The site is fine to spend the night and walk around the town a bit. The only downside is the noise from workers and AC outlets and inlets.
20721,2335289,2,amaiavelez,03/09/2022,"Decadent parking to get out of trouble. Quite noisy at night, there is AC that seems to live there all year round. It didn't give us much peace of mind. Fountain and beach showers nearby."
20721,2296309,5,Copi12,24/08/2022,"Great place to spend the night, it was full of AC and vans. The beach is very good with a shower and a fountain to fill a bottle. Consumables store nearby. Maybe a tad bit of noise from AC going in and out."
20721,2255813,3,trillonyotero,17/08/2022,bo parking for a day of beach
20721,2253592,5,ruizk,17/08/2022,"Good place to spend the night and that for the moment they allow us, let's respect, let's try not to take out the tables and chairs and of course not empty water of any kind."
20721,2224389,3,merisu,12/08/2022,"There is a fair until Monday occupying the entire parking lot. in other areas you can not be because it is a natural park, do not come these days!"
20721,2178476,4,Maroy2022,05/08/2022,"Place 10 to spend the night and rest by the sea, clean and quiet place. The promenade is right next to it with bars and ice cream parlors, and the rest of the town's services are super close. Definitely to come back!!"
20721,2143314,4,joelmiguel,29/07/2022,"one of our favorite places. free, in front of the beach, flat and with water. top!"
20721,2134689,4,Dragan63,28/07/2022,"It's free parking on the beach, super nice, by people who empty the gray water on the spot before the door of the house opposite. Too bad, the culture of the people"
