placeId,reviewId,reviewRate,reviewUser,reviewDate,reviewContent
20279,1679704,4,Artiach14,06/11/2021,Good place and good attention from the guard and the civil guard. The guard passed by and asked if everything was ok and simply if we were going to spend the night and after a while the civil guard for the same. Some flat area the rest too much costs.
20279,1225532,2,ivanuri,30/05/2021,Quiet place but a secarral there is nothing we did not sleep there just passing through
20279,679371,3,macormac,06/09/2019,"You can sleep, but the watchman may come to you. By telling him that you want to sleep, that's okay, no problem. It is true that it is a little inclined but it is not so much, the worst of the site is the amount of flies and bugs given that there are animals (sheep and cows) nearby and the noise of their cowbells all night. In the bar they don't give hot breakfasts until 10:30, at least in September but you can use outside tables with your own food."
20279,496426,2,1mass,30/05/2019,"The caves are very good. but the place is not the best to sleep. It has a lot of slope, it's dirt and it's quite far from everything."
20279,38177,4,pequenos,31/05/2015,Idéal to visit the caves. Vending machines lit at night. Restaurant.
20283,1731064,2,SOLILLUNA,09/01/2022,"parking not recommended, factory and road next door, could enable motorhome parking area in the park ... we go by motorhome and at night we need to rest well and safe ... thank you"
20283,1518173,2,Garrotada,27/08/2021,"Very noisy and little space. to visit the village yes, but to sleep peacefully, no"
20283,1361558,3,rhoyo77,25/07/2021,"Road to the side, but little traffic. There was no noise from the factory. At the station there is a water source. Very close to the center of town to visit the town with a bar, grocery stores, etc. Great to do the true route."
20283,1160013,1,pintado080,29/03/2021,"Much noise from traffic, even at dawn. Not recommended 0/10."
20283,1155187,4,gorka1,21/03/2021,"We have slept very well, neither the factory nor the road has bothered us. The town center 5 minutes away, a lot of routes to do with the family or for people of level. Communal toilets for the day and a small bar. The only drawback is that it is next to the road and if you have a dog like us, you have to be careful that it does not escape towards it."
20283,1033877,1,Laskechis,08/09/2020,"There is a factory right next door that has some fans that run all night and make noise, plus loading and unloading trucks arrive all night, trucks also pass by continuously on the road next door. And in the morning they come to empty the rubbish bins. The bar and toilets are closed on September 8 for holidays."
20283,1028221,5,ViCh,05/09/2020,"Quiet night, in front of Bar with toilet and hot shower. It passes the greenway, perfect for taking walks and visiting some gorgs."
20283,864214,4,ftorradeflot,12/07/2020,quiet night Suitable for getting up and doing an affordable piece of the green way with the family
20283,552337,4,SilviaCM,13/07/2019,Parquing highly recommended to make bike route on the Carrilet. In summer you can enjoy several gorges of the Brugent river along the carrilet. Parquing in the old train station that offers public toilets and a shower that are not bad. In the bar you eat the sea well.
20283,406479,4,rulori,11/11/2018,"Very quiet at night, there are public toilets next to the bar which is also a point of information. It is next to the greenway and point of departure of several routes, to go see the volcanoes of San Marcos and Puig Roig. A lot of car movement from 7am is next to the road."
20283,193048,4,jordi_iorgos,12/09/2017,Just in front of the Carrilet greenway that connects Girona with Olot by bike. municipal parking in front of the bar. Very close to the center of the town which is very beautiful. It is recommended to visit
20283,112087,4,jlluti,29/10/2016,"Very calm village. Bar service, toilets and showers. Next to the verde road."
20291,3210912,3,MarcosAlonso,24/08/2023,"Sleeping here is a lottery, you can spend a quiet night or young people come with music and drinking at night. Ideal place to stop in the shade."
20291,2974552,3,Lospanchos,16/07/2023,"We spent a quiet night, very close to the natural pool, beautiful town."
20291,2915800,2,marune,02/07/2023,"Very crowded on weekends. Today 2/7/23 we arrived but left right away, the parking lot was pretty much full and it was stifling hot. We went to the Mirador de Las quebradas about ten km away in the direction of Avila, magnificent view, cool and we were alone."
20291,2625042,3,Burgaillo,26/03/2023,"Level parking, ample, several motorhomes and large ones fit. highly recommended"
20291,2593401,5,amilpin080,27/02/2023,"Very level squares, near the center. Something noisy the river. Town worth a visit."
20291,2515935,4,bella6644,08/12/2022,Very good for an overnight stop. We spent a good night there lulled by the river which passes by.
20291,2348729,4,sparkur,07/09/2022,"It is quite good, there is not much noise and there is a municipal swimming pool nearby, if you keep climbing the stones there are very nice pools"
20291,2142546,3,MarcosAlonso,29/07/2022,"It is good to sleep, with some benches and a very large parking area, 5 minutes from the town and the natural pools."
20291,2046230,4,marialed81,07/07/2022,"Good place to sleep, very quiet and next to the town and the first natural pools (to walk). It has no services, only garbage cans. The very beautiful town and the spectacular pools. To go up to the others, the green puddle, 5 min in the van."
20291,1906204,5,Channelchallenger,22/05/2022,"Good place to sleep, I'm sure that due to the date there are no bottles, in summer it will be worse, we have spent two nights and the truth is that very well, level ground and no services."
20291,1409033,3,robalibis,05/08/2021,"Good place to stop and visit the shady town. Next to the park house, chiringuito, routes in Gredos ... We slept one night and it was horrible .... bottle just above AC, until the early hours of the morning ... just passing by .... a real shame, since Guisando and its area are worth visiting calmly."
20291,1384362,1,yapagare,31/07/2021,"It is an area for bottles on weekends, starting at 3 in the morning when the bars close, they gather in the area of the abandoned disco and continue drinking. A local told us, and recommended us to go up to the green pond."
20291,1361477,4,lyndavincent,25/07/2021,Parking at the foot of the village and the swimming pools are close. the village is magnificent as is the environment.
20291,1266247,1,qwe,20/06/2021,Bottle area on weekends
20291,1252909,4,Jesus188,13/06/2021,Quiet place to park and spend the night (although possibly the young people have a party). You can visit the town and the natural pools of El Risquillo and Charco Verde (we walked to the latter as the car park is much smaller and fills up quickly). It was worth it because it was very hot and the temperature was very pleasant
20291,1236058,4,Shalindra,04/06/2021,"Stayed here with another motorhome during the night and day on the 2nd of june. No problems,  no prohibition signs. Quiet during the night. Nice view on the Village, great hiking and biking."
20291,1183066,4,yoyasa,01/05/2021,"We stayed one night, very quiet, walking to the center of town. Shadow zone, we were almost alone. Not a noise."
20291,1180993,4,Wario86,28/04/2021,"We spent a very quiet night, flat and close to the town. There is water right behind the park house."
20291,1091562,4,Transiperra,12/10/2020,"Quiet place, we spent there one night and without any problem, very close to the center of town, very beautiful both the town and the surroundings, fountain, garbage area and bicycle repair station at 25m"
20291,1036284,4,GusHigueruela,09/09/2020,"The site is very good. It has a fountain, shade and garbage area. The only problem is that during the weekend at night it seems that it is a meeting area for young people, so noise is guaranteed. For the rest, a good place to spend the night during the week or in times where those youthful stays do not occur."
20291,750462,4,granpa,06/12/2019,Perfect to spend day and night. very nice area
20291,354542,4,trastras,26/08/2018,"A lot of noise at night from 23:00 came young with music, and that we have been 2 nights during the week. Otherwise everything very well. the natural pool and the village are very close"
20291,331815,4,rollercamper,13/08/2018,"We have spent the night here and the truth is that quite quiet, the village pool is next. To be full August very well and without parking problems."
20291,128602,3,DVD,17/04/2017,"Great parking for overnight, a pity that there is no water change service."
20291,124231,2,TurboClimber,27/03/2017,We were sleeping one weeknight in the parking lot near the park house and it was great .. I suppose in high season it will be more difficult .. We asked the staff of the park house and they told us without any problem.
20291,124230,3,Rapocaravaning,26/03/2017,"If we had discovered it before, we would not have paid € 25 at Camping Los Galayos, for a terrible service, cold water, bad plots, I DO NOT recommend the Camping ...... money thrown ..."
20291,84187,4,victormartin,22/07/2016,"Parking without services, very quiet and no problem for the night. In summer natural pool next door."
20302,2661921,4,zebulon007,11/04/2023,Pleasant car park with a footbridge for access to the old town. No ban seen!
20302,2127933,4,Thomas29840,26/07/2022,a nice parking lot for the day visit (I didn't sleep there) when all the others are full. there is a small footbridge near the bus parking lot and you are a 10-minute walk from the cathedral.
20302,1780290,4,caliarocristian,11/03/2022,"Immediately found a place with the camper, huge parking also for sleeping. Not very far from the center. I recommend, completely free."
20302,1697479,1,webowo,25/11/2021,Parking for campers is prohibited!
20302,916958,5,kai1,01/08/2020,"We have slept very well, with cargo, discharge of water, a lot of space and well leveled, containers."
20302,766705,1,Mariechen,09/01/2020,Great care. They steal a lot. It is totally insecure. There is a group of young people dedicated to breaking glass and stealing
20302,521393,4,sardine35,19/06/2019,"Parking in town close to the historic center. From the shade and quiet at night, we spent 24h"
20302,486745,5,mattetmarion,18/05/2019,"Large parking 4x4 + trailer without problem or motorhome and others, pedestrian footbridge to reach the shore side town center"
20302,433818,4,Philou49,26/02/2019,"Attention to the sign at the entrance of the car park: parking allowed for caravan cars only by day, camping is prohibited."
20302,389888,2,Josephinemarteens,08/10/2018,"A bit far from the city center, but good for the night."
20302,386668,3,andr4535,02/10/2018,"Parking is shady and located near the old town. Since the place is also used for through traffic, it is not quiet. Vehicles drive through quickly. If that does not bother you, there will be satisfied."
20302,366539,3,sandra1345,06/09/2018,Parking pretty good to visit the city center of Gerona. 15 min walk on center. on the other hand to spend the night not sure that it is suitable.
20302,286266,3,aurel89,11/07/2018,"Parking very good and free with the opportunity to put in the shade. We stayed there the day, 15 minutes walk from the cathedral."
20302,268706,1,krikri29,15/06/2018,"Large parking where we have lunch thinking we walk to the city center. Unfortunately young people roam around the vehicles. We went our way. Noisy at night, I think."
20302,250268,3,spr35,10/05/2018,Free parking very well located and big. Direct access to secure city by taking the footbridge next to Pavella Fontajau. 10-15 minutes walk.
20302,221895,3,Vilma,08/02/2018,Free parking and near the center. It gives more feeling of security than the parking area of ​​the city to spend the night. Without services
20302,212209,5,Domi9221,22/11/2017,Parking very well and woody if you go further round the roundabout access to the city very nice through the park and the footbridge 17 minutes exactly from the cathedral
20302,151987,3,marty33kill,15/07/2017,"Quiet, a short distance from the center. beautiful city"
20302,136275,5,pepvivo,20/05/2017,Jcaste42 we've found your Park4night. He's gotten hooked
20302,136273,5,pepvivo,20/05/2017,"Jcaste42, we made a night here, in your Park4night"
20302,131599,2,toni60,29/04/2017,"Great place to spend the night pity that you do not have dirty and clean water, you have to do something with the town hall because space is left over"
20302,114195,2,lauran,13/11/2016,"Parking where overnight is allowed, near the center of the city. There are no bathrooms nearby."
20302,66006,2,rdr57,22/03/2016,"The neighborhood is not ideal ... It is a city and there are many passages and traffic. Access to the city is actually a bit far, but achievable."
20302,58006,2,valdipie,20/10/2015,Large parking a bit far from the center (2 km) with stroller but close enough to shops.
20324,3274558,3,Lospanchos,08/09/2023,Thanks to the city council for this area. We only use it to spend the night and follow the route. Quiet and well lit.
20324,3208195,3,caracolitl,23/08/2023,"Small area but the fact that there is an area is appreciated… there is a municipal swimming pool in this very cool town, it opens at 12 and closes at 20:30 the price is €4/Adult (mandatory cap) if you don't have a car you can buy there."
20324,3195883,3,CarmeMartinez,21/08/2023,"Exclusive area for AC and campers. There are fences but so that cars do not use the area. We have been relatively well, nights a bit noisy due to car traffic, super well located area next to the castle. We recommend a dramatized visit as well as a San Basilio restaurant 2 minutes from the area. SHADE is missing, soulless area but we must thank the town hall for offering this space"
20324,3175574,2,CACAHUEfamily,18/08/2023,Closed with some fences - it is not clear if you can park we have turned around
20324,2948039,3,GusHigueruela,10/07/2023,Something soulless but with the basic equipment for our vehicles. Central but some shadows are missing. Thanks to the town hall for thinking of us.
20324,2868313,4,fareta,18/06/2023,"EXCLUSIVE area for campers, with water (clean, gray and black), fairly flat and free... it would lack some shade, but there are no things to complain about"
20324,2820883,3,pepepepone,04/06/2023,"area that is fine, you can spend the night and it is quiet. I recommend the pass to the dramatized castle, the actors are very professional, thanks to the town hall for both, area and actors."
20324,2713137,4,Robertuky,01/05/2023,perfect place to spend the night and visit the town. Many thanks to the council for not allowing cars to park in the area. I give it 4 stars because it is dirt.
20324,2603473,3,sermarjo,09/03/2023,"The area is fine, but it has two problems, it is slightly sloping and the parking lot is shared with cars that don't leave you room to get out"
20324,2594509,4,VeraLis,28/02/2023,"Area with a good location, quiet, the only thing is a road and there can be traffic, we went on a Saturday and it was perfect without noise."
20324,2540498,4,XuanAlonso,04/01/2023,"Area in front of the Castle very illuminated, it is at the foot of the road so it is somewhat noisy, 5 minutes from the town center, there is a bar very close."
20324,2536921,4,SalvaCastilla,01/01/2023,Services working correctly today.
20324,2527475,2,adoarmel,24/12/2022,"We stopped for lunch and loaded water. All right., but it doesn't seem like the right place to stay overnight. noisy road, slightly sloping terrain and cars parked in reserved spaces."
20324,2517725,4,Franquilo,09/12/2022,"The services work fine. Small area with a sandy floor, except for the emptying/filling area, which is made of concrete. Perfect for Ac's of 7.40 or even more. Green area nearby. Thanks to the people of Cuéllar for this space"
20324,2500479,5,labicha,19/11/2022,Very quiet place and next to the castle. Highly recommended. Thank the city council of Cuéllar.
20324,2445035,5,carbajal,15/10/2022,"In the Car area, well-matched, they enter 7/8. We stayed during the day, at the foot of the castle and visit the town uphill, downhill. The other parking lot can be used if the area is full."
20324,2357452,3,rafaydana,10/09/2022,"The area fulfills its function very well, especially given the scarcity in the area. Thanks to the municipality."
20324,2350662,4,LuisFernandoJimenez,08/09/2022,"the idea of the town hall is exemplary, few uneven squares recommended"
20324,2009606,4,AgustinDominguezMartin,25/06/2022,"Right next to the castle, small but very well located to see Cuellar, we do not give it 5 stars because they also have it as a Parking and it is full of cars. Water filling and emptying area."
20324,1955554,4,luzmisan,07/06/2022,"Good area for motorhomes a bit small, with filling services. Too bad it was full of cars. Recommended for its proximity to Cuéllar Castle."
20324,1913488,4,wap_vlc62,24/05/2022,"Good area at the foot of the castle, filled and emptied of grays and blacks, to put a but slightly inclined area and cars that do not respect the signs and park in the area. Thank the city council for having places like this. We spent a quiet night with two more ACs."
20324,1847205,1,Burgaillo,23/04/2022,"Possibility of loading and unloading, very central but it is next to a very busy road which means noise at night and at dawn Good for parking and seeing the town but horrible for an overnight stay. oh! Cars park where and how they want in the area, they have little respect so they have to be careful to get out, they always leave them in the middle."
20324,1837746,3,JIvan77,19/04/2022,"It has to empty and fill for free, there is rubbish, it is not very big, 3 or 4 motorhomes if they park well. It is right next to the castle, ideal for visiting the old town. To sleep is fine, although in the morning there is movement of cars."
20324,1818325,3,felitoborrallo,13/04/2022,"we had a great day and night, very nice town thanks to whom it corresponds"
20324,1813129,4,anasc,10/04/2022,"Good place to spend a night. Recommended to enjoy Cuéllar. Next to the castle and a nice park. The only drawback is that it is very close to the road, but it is not very busy. Be careful with the GPS that can send through the middle of the town."
20324,1703823,2,arba,05/12/2021,They park their cars in it. The area has all the services. It is a bit uneven.
20324,1702306,3,cesarmga,03/12/2021,Area with all services and on one side of the castle. It would be interesting if they delimited and / or marked the parking areas.
20324,1682106,5,365puestasdesol,08/11/2021,A quiet place with views of the castle. Gray and black loading and unloading area. We will continue to take care of these places.
20324,1660948,4,hanelie,24/10/2021,A lot of parked car prevented any motorhome passing through the area from staying. Super quiet place to sleep and very well located.
20324,1659112,4,Lanapangea,23/10/2021,"A great area, right in front of the castle, with all the services, water, drains and garbage (underground). It is true that they park cars, but when we were there there was no problem of space. I give it 4 stars because it is tilted, they could level it a bit. Even so, thanks to the City Council for this Area."
20324,1649997,5,alprpas,17/10/2021,"We did not have any problem. No cars to prevent maneuvering, no noises from the high school boys ... For us a 5. Castle views ... perfect."
20324,1617420,4,saladaresort,29/09/2021,"My beautiful town, the area is a bit left but apart from what should be said that you can not park cars, because there are always a few. The others are fine."
20324,1568937,5,Aquilino23,11/09/2021,"quiet service area, to spend the night. Well located to see the town and the castle."
20324,1546259,5,Manucc,04/09/2021,"Free area with emptying, filling service, we had no problem with the site in August, but it is true that between 9:30 p.m. and 11:00 p.m. there were chef, beast and plug with the blue focus, they would be bored in their house and they were in need of attention, and they made the pertinent passes along the road in front of the area, thank you nonetheless."
20324,1528247,2,Nostramo,29/08/2021,"Correct area, although it is well signposted as an area reserved for housing vehicles, cars park between motorhomes making maneuvering difficult. After a visit to the city my AC had a broken side light and scratches from a vehicle. We called the local police who showed up, I'm sorry for what happened, fine the parked cars and left."
20324,1430255,5,KaneloAntonio,09/08/2021,"Very good Area with all the Services very quiet with Serca Restaurant, acceptable eats Recommended"
20324,1429625,3,jabidelafontaine,09/08/2021,"Good as parking to visit the castle, to sleep next to a road without separation, inclined, and land area, better anywhere else"
20324,1320655,5,anasolbes,13/07/2021,Super good and in a strategic point to visit the most important. I like very much. better than the pictures.
20324,1283025,4,Pryska,28/06/2021,"Thanks to the town hall for the area, the photos don't do it justice and very close to the old town. The only complaint is that the back house must be the rehearsal place for a rock group that ""entertained"" us on Friday, June 25, from 11:30 p.m. to 2:00 p.m. with their repertoire ...... in fact it seemed that the battery was in our bed…."
20324,1205730,1,lagartijaonroad,18/05/2021,Well located but it seems like a field ... next to a roundabout and without separation from the road ...
20324,1177880,3,JOSEMARIA10,22/04/2021,"It is next to the wall, perfect for visiting the town. The road next door is not very busy, so the cars do not bother too much"
20324,1097189,2,chiquitin,18/10/2020,"It is good to change waters, eat and visit the city, but to sleep badly, a lot of noise does not stop passing cars with loud music and besides they do not respect and park in our places. We don't sleep here anymore."
20324,1096723,2,navarroivann,17/10/2020,Nothing without water service. People pour the toilet where the gray ones. They don't see the RED lid for the toilet. The well located place to visit its walled area.
20324,1037528,4,Flagoneteros,09/09/2020,"The site is somewhat inclined but offers potable and dirty water service. Every day the castle is an institute so there will be a crowd of people until 8 when classes start. You discuss the problems at night, you just have to notify the local police ..."
20324,1014229,3,Analber,30/08/2020,"Good place to visit Cuéllar. Central, right next to the castle. With emptying services and chemical toilet. Slightly inclined, solvable with a wedge. We have spent the night and it seems to us a quiet place."
20324,979621,3,magrillas,19/08/2020,"Good morning, I come from Alicante and I have spent the night here, you sleep very calm and cool"
20324,957432,1,Juan63,13/08/2020,"We had to leave, we arrived and we were alone, soon after, vans began to arrive and they began a transfer of melons from one to another. Then more came, and began to close us, although not entirely. At two o'clock in the morning a car entered doing a rally that totally awakened us, before my wife's fear we decided to go to the Henar esplanade"
20324,836431,4,LCT,25/06/2020,Something inclined but everything correct and calm to spend the night
20324,751828,4,kiwionavan,09/12/2019,It is quiet next to the castle wall. Small car park with black gray water services. Recommended both for visiting the castle and the rest of the village
20324,513876,4,MDWinsborrow,13/06/2019,Good  clean stopping area nestled at the corner of 2 roads. A little noisy during the day but quiet at night. The location is at the base of the castle walls that are all lit up at night - very pleasant. There is a fantastic bar just opposite. 2€ a pint with free tapas - always a winner for me.
20324,473621,4,Suco75,02/05/2019,Area with space for 4/5 Motorhomes and noisy. A good option is to go to sleep 5km to the Esplanade del Henar.
20324,440257,5,lalilaila,16/03/2019,Cool
20324,440256,5,lalilaila,16/03/2019,"We were on a Saturday night and the next day there was a race. We slept very well, we did not notice noises and the truth is that the area is perfect. Small, but with services. We share night with 3 other motorhomes and without problem"
20324,433505,2,ea1qa,25/02/2019,"Area full of cars, very noisy, it is a pity that a town like Cuéllar with so much history and as much as there is to see, has such a limited area for this type of tourism. Anyway, thanks"
20324,420716,2,ben8719,06/01/2019,"Very basic but great parking for the castle, there is no height restriction on the parking but do t drive in town, roads are small and many height restrictions"
20324,413349,1,Robledal,10/12/2018,"Located right next to the castle, which is well worth visiting, but the area is ... tremendously noisy! Completely equipped as a motorhome area, yes ... but the noise is what made me qualify so low luck!"
20324,391829,4,robertoph,12/10/2018,"Thank you very much Cuellar. A parking lot in the center of the town is appreciated. In weekend there is no cole se this phenomenal. There are only three areas in the entire Province !! We are not here to protest, but to thank you for not cheering us and letting us sleep. There is always the possibility of going to the gas station in the northern entrance of the largest and longest village. If not the campsite of Lastras."
20324,239008,2,camidalella,20/04/2018,"At 8:30 in the morning the emptying and filling space is filled with cars. Coincidentally there is a neighboring institute that must open at that time. Gentlemen of Cuellar, if you want to appear in a population guide to visit the caravanners, please indicate the prohibition to park in this space. If you do not delete it, we will visit other towns."
