placeId,reviewId,reviewRate,reviewUser,reviewDate,reviewContent
81462,2945887,3,borja.martins,10/07/2023,"a little expensive for the camping that it is, €25 a night for two adults and a girl in our own van and without electricity, there are no shades, you spend the day in full sun and that is torture in a van, you were supposed to see the In the photos there were trees, but it seems that they fell due to the wind and had to be replanted, right now there are no shadows. clean common areas, good pool, quiet place"
81462,2922131,5,Mareike232,04/07/2023,"We didn't expect that from the description and the reviews - it's a super campsite with all the necessities such as a pool (even quite warm with 26 degrees incl. baby pool), nice playground, mini market, restaurant, washing machine, dryer and children/baby toilet /sink/bathtub.. and the best thing is the direct beach access to the huge, little-visited beach, super great!"
81462,2892855,3,marielcaramel,25/06/2023,"23,30€ for one night with a camper, two persons and no electricity. You have to be lucky to find a plot that's not too sloping. Too expensive for what it offers, but still the best that we could find in this region. Right at the beach. Good service station and shower."
81462,2806534,4,Paule30629,31/05/2023,"A very open space without many trees. Therefore hardly any shade. The sanitary facilities are clean, there is a restaurant and the beautiful beach is a stone's throw away."
81462,2782164,4,BerndHarbrecht,24/05/2023,very nice and clean place with direct access to the sea. with pool unfortunately neither on foot nor by bike a possibility to see the city. 23 € with Acci card too expensive for the location. but only our opinion
81462,2748525,5,Tornie,14/05/2023,"The best of four Orbitur courses we've visited this year. Very clean, marble fittings in washrooms. beach access. Unfortunately it was very stormy, so we didn't use the beach. Washing machines, tumble dryers and clothes lines available. Good place to visit Coimbra."
81462,2742488,2,MrToretto,11/05/2023,"Not really nice. But first the positives: the sanitary facilities are neat and well maintained, the staff is very friendly and helpful and the direct location on the beach is also very nice. What we didn't like at all is that it's more or less a large, sandy meadow. Not a big tree, hardly any vegetation except for a bit of brown grass. A pretty desolate place"
81462,2734826,2,moshemeged55,08/05/2023,The shower is the only thing that we liked. The place for the tent was very uncomfortable it was very spiky and ruined all of our camping equipments and there was a lot of snails all over our staff when we woke up. Super expensive for this kind of experience
81462,2698787,4,chregu83,26/04/2023,Everything you need is there. Nothing going on in mid-April. There is a direct path from the square to the beach. WLAN simply in the entrance area. Could freely choose the place. ORBITUR standard.
81462,2697364,4,cristinavil,26/04/2023,Well equiped and very clean. Paid 19e per night for MH and 2 adults. No shadows because trees are still very young and small.
81462,2697118,4,dfx1,25/04/2023,"Great location, 3 minutes from the beautiful beach. Good sanitary facilities. But too expensive in my opinion."
81462,2663149,3,LeandroNorte,11/04/2023,"I found it absurdly expensive, they charge €5.95 per person €7.90 and if you want to use electricity €5.00. We decided to continue our journey and stop at Praia do Pedrogão."
81462,2660540,5,happyholiday2022,11/04/2023,"Beautiful pitches for campers, very clean sanitary facilities in the rear area, even with a children's bathtub. Playground in front of the reception. 5 minutes to the beach. Restaurant was still closed. You can walk to the next village in 15 minutes."
81462,2648438,4,Furgoneto,08/04/2023,"Very big and quiet, clean sanitary blocks with hot water, very friendly reception. AC spaces at the end of the campsite, watch out for pitches with sand. Access to endless beach in 5 minutes from the campsite. Bus to Figueira from Sao Pedro, walking to stop 20 '(Figueira on foot very, very far and by road). Now there is a free electric boat every hour to cross. Taxi about €11."
81462,2636414,4,exparkpert,02/04/2023,"Pretty little going on, but nice pitches and clean sanitary facilities. Beach access. Directly next door is a military training area, where (albeit not very loudly) shots are fired."
81462,2612871,4,CarmEn2023,17/03/2023,Right on the beach with access. Bit sad in the off season. But everything is there what you need. Prices for washing and drying are exorbitant (6 € each) and everything has to be paid for with small change.
81462,2597942,2,PHP,04/03/2023,"Sad campsite, far from everything, without any charm. Very mixed reception! That's all!"
81462,2552246,2,Patrickbarra,15/01/2023,this campsite burned down in part in 2017 there are no more pines the pitches are small for a cc and risk of silting up beach accessible on foot 5 minutes away swimming pool convenience store provide mosquito repellent expensive price 1 cc 2 adults 1 dog electricity 34 euros per night in high season not justified
81462,2523492,5,JanaHz,17/12/2022,Great campsite 3 minutes from the beach (direct access). WiFi at the reception is good. The sanitary facilities are very clean. Hot water also for rinsing.
81462,2503681,5,Bellaraupe,23/11/2022,Everything great! Are all alone at the campsite. Neat sanitary area and nice staff.
81462,2498631,5,sunnycamper80,17/11/2022,"A nice place, we were almost alone in the off-season. Super clean new sanitary facilities, friendly staff and a deserted beach."
81462,2491015,4,Lumi17,11/11/2022,Excellent campsite of the Orbitur chain. clean shower and toilets. Located directly on the beach. nice and quiet. You hear the sea but also the road when there is no wind. Basic supermarket. We stayed an extra night and paid almost 40 euros with 2 adults in a small dog bus. WiFi does not reach camper fields.
81462,2416043,4,MaAnMaFi,01/10/2022,"Quiet, sunny place right on the beach. Partly sandy ground. Free choice of seats and Wifi at the reception. Showers/toilets modern and clean. Small supermarket with fresh rolls and croissants available. There is a restaurant, but we didn't visit it. Pool closed from October."
81462,2414077,5,platoon64,30/09/2022,"Super campsite by the sea, very quiet and ideal for dogs. Lots of sandy space, large and practical. Large and practical motorhome emptying area. We are going to stay there for several days, we are so well."
81462,2394462,3,Partner446,22/09/2022,Beach camping. The soil is sandy and the wind usually blows. No shadow The pitches for campers are quite irregular and it is necessary to shoe the vans or motorhomes. Very complete services.
81462,2356503,4,aloga,09/09/2022,"The campsite is fine, swimming pool very good, clean toilets, direct access to the beach... But there is no shade."
81462,2289147,4,Miguel...83,23/08/2022,"A 4 for mosquitoes when there is no wind. Well-kept pool area with sun loungers. Little shade, most of the plots are level, be careful in the sandy area. Restaurant food good. Children's park, tennis court, basketball, exit to the beach. Very clean, spacious bathrooms and everything in general very well, recommended. We had children's cinema. Orbitur rates within normal"
81462,2270716,2,waxy,20/08/2022,"Plots (supposedly the best) with an incline that didn't even fit the AC in an acceptable way. In addition, the ground is sandy with the risk of getting stuck. Camping staff not very friendly or attentive. We stayed 6 nights and we wanted to stay another one but the management seemed so difficult that we preferred to leave. The positive of the site, its location. A stunning beach on the doorstep"
81462,2248563,4,estellefm,16/08/2022,"Quiet campsite, very close to the beach with very well maintained sanitary facilities, always clean and with hot water at all times. Pitches are a bit small and crowded with no separation or shade. Value for money ok with the swimming pool, the bar and the mini-market"
81462,2170674,4,neelepark,03/08/2022,"The campsite is highly recommended, we will definitely go here again! Located in a very quiet area directly behind the wide beach, you can hear the sound of the waves day and night. The majority are locals, the atmosphere is totally relaxing. Sufficient and 3 times a day cleaned sanitary facilities/washing facilities, very nice staff. A small minus point is the dry, sandy/very prickly ground."
81462,2094410,4,Sirius2693M,19/07/2022,"Very nice place, but quite uneven, but very spacious. Sanitary facilities clean, but internet only in the reception area. Friendly staff."
81462,2074111,2,sophiewass,14/07/2022,"beautiful campsite but be careful with the pitches, we got bogged down in the sand and no one from the campsite cared about us leaving us called a tow truck when they have a tractor and could have made it easier for us (92 euros of tow truck for 3 minutes of travel). positive point, toilets and showers are rather well kept. negative point, too many mosquitoes."
81462,2072971,5,sebisoof70722,14/07/2022,Super clean campsite and good location. Lots of flies and mosquitoes.
81462,2040548,4,BettinaZ,05/07/2022,"Nice campsite with clean sanitary facilities and a great location right on a beautiful beach. However, the pitches for campers are close together and there are no trees/hedges that would provide shade and privacy."
81462,2012921,4,Romanini,26/06/2022,"Good road access. Very friendly at reception, excellent bathrooms, good pitches without shade. The sea at 300 meters. It lacks a walkway to the beach."
81462,2012555,5,UteKolbe,26/06/2022,"Friendly staff, very clean spacious area. Medical supply store from children's toilets to the changing room immaculate, sea about 300 m away and it weighs you to sleep.. definitely recommended"
81462,1996137,4,SarahChrisW,20/06/2022,Big Orbitur campsite with only a few minutes walk to the beach. Very clean facilities!
81462,1944215,2,jacqies,04/06/2022,"The good reviews of this campsite let to a small disappointment on our side. It is simply a large beach camping with many bungalows and permanent caravans. Yes, clean showers and toilets and also beach access. The latter goes by a gate which closes as early as 8 Pm. Swimming pool has restrictive opening hours."
81462,1887557,5,curdinho15,13/05/2022,"One of the best campsites we had in Portugal! Free choice of pitches (low season), direct access to the beach, very clean sanitary facilities and a view of the dunes. The price of around €20 per night was also okay."
81462,1858646,4,Naedz,28/04/2022,"I was only there for the shower. I had to pay 5 euros (daily rate for visitors) but it was worth it to me. The sanitary facilities were well maintained, the shower was warm and I had everything to myself. I can't say anything about the place. The woman at the front desk was nice. But she also said that this is not possible in the high season, as there is a lot going on. One star less just because of the price."
81462,1800146,4,Eckeschneck,29/03/2022,"Very nice campsite with short, direct access to the sea. we stayed here for a week and felt comfortable. Very clean, with all the trimmings and not very busy at this time in March. We were often alone on the extensive beach. Friendly staff, great service, exemplary sanitary area and waste disposal station. Campervan 17€/day with electricity. We'll definitely be back."
81462,1778574,2,jeannettehunziker,09/03/2022,"The site and the sanitary facilities were clean, the access to the sea was great, but there is a military shooting range next to the campsite, we left in the afternoon even though we had already paid for the site. The shooting noise was unbearable for us and our dog, who panicked."
81462,1772216,4,HaMoSprinterVan,03/03/2022,"Great place in a desolate environment. With luck you can see flamingos in the bay, but that's the only highlight here. The place is well maintained and clean."
81462,1747643,3,lasskris,04/02/2022,"The CP is very close to the beach. Toilet & showers ok. Washing machine & dryer €6 each. Wifi only in the entrance area. €20 for 2 p, bimobil, 1 dog & electricity."
81462,1637073,4,didoudu10,10/10/2021,A bit far from town direct access to the very clean beach
81462,1468709,3,jancablemanhymerc524sl,16/08/2021,Very little shade as storm Leslie ripped into this area in 2018 and the trees were knocked down. Clean and very nice beach but very cold water….
81462,1280155,3,KB-Car,27/06/2021,"Average place with a very nice beach, many permanent campers. The rear area we stood on is currently being remodeled, it looked like it was - so not really a lot of choice!"
81462,1212698,1,fariafamily,23/05/2021,"Bad value for money, the internet doesn't take the space reserved for motorhomes. Everything was out of order including the park for the kids and the site was in working order. It is far from everything and the internal market has nothing and what it has is quite expensive. However, the bathroom is very clean. The city park for camping is much cheaper."
81462,1201509,4,carboeder,16/05/2021,"All good, quiet place with wide and flat parking areas, several buildings for showers and toilets, all clean and well cared for. The staff is friendly, close to a spectacular beach and you can cycle to Figuera da Fox, the somewhat expensive but to be expected supermarket with fresh bread in the mornings."
81462,1112503,4,franzsea,05/11/2020,"Nice campsite, clean bathrooms, great service. Not every pitch with electricity (which was the case with us in Portugal but everywhere). However, the place was deserted in September 2020. To the super surf beach by bike 10 minutes"
81462,1078819,4,LenaDl,02/10/2020,Very clean and well maintained facilities. The place is not cozy and the area around is not so beautiful.
81462,1013261,5,chrisda14,29/08/2020,Perfect on the beach with all services and a very nice pool
81462,991247,5,catiabranquinho,22/08/2020,"Fabulous park. Good access, clean, organized, competent and fast reception, clean and generous swimming pool (with swimming pool for adults and children, sun loungers and shade). Nice area for cycling, close to beaches and Figueira da Foz."
81462,942130,5,Störti01,09/08/2020,"Great camping, despite the road from which you don't notice anything. As my prescribers already reported, the sanitary area and the place itself are very clean. Nice reception and uncomplicated. The proximity to the beach is great."
81462,930116,4,superpaddle,04/08/2020,"Beautiful campsite with access to the beach, extremely clean sanitary facilities, pitches in a sparse pine forest"
81462,920364,5,OlisaT4,02/08/2020,Absolute top campsite! Extremely clean and very friendly. T4 with 2 people for 24h 22 € including showers etc.
81462,739085,5,BundT,06/11/2019,Great clean place. Can confirm everything said positive. Are alone in the square tonight. The drumming of the rain on the camper and the sound of the waves were our companion to sleep.
81462,709627,5,daucus,30/09/2019,"Great location, in a few minutes you are on the beach. There is a playground and very clean baby baths, as well as fast Wi-Fi."
81462,709108,4,Clama,30/09/2019,"Clean, good sanitary, lot of space, unfortunately a big storm last year took most of of the lovely pinetrees that gave shade. Big Beach 250 m away, nearby village not much to offer"
81462,694498,5,popnfio,17/09/2019,"Great campsite with clean and functional bathrooms, swimming pool and uncrowded beach."
81462,678866,4,annanils,06/09/2019,Camping is nice. 200m to the beach. The little village can be reached by bike within 5 minutes. Toilets and showers are ok. For two / three nights perfectly fine.
81462,613286,4,Romaxel,09/08/2019,"Pleasant camping to land 2/3 nights, good for children with the pool and the beach next door (we hear the ocean at night ..) we did not find anything special to do or see in Figueira da foz."
81462,603579,5,speedraph,06/08/2019,"Nice campsite, super clean, speaks English well. Pool and nice beach. Pleasant pitches under the pines (be careful not to bother). Only thing, supermarket very small and not very full, which is a shame because the city is far and without public transport"
81462,598443,2,laikatita,04/08/2019,"I returned to this park after being here and enjoying it a lot. But this time I was disappointed. The shadows almost disappeared with Leslie. But worse was finding many poorly manicured, overgrown plots that looked like abandonment. An Orbitur-branded park should be more careful with its facilities. For the rest nothing to point out. It is waiting for the pines to grow back."
81462,590230,5,Sorquis,01/08/2019,22eu a van and two people. Of the quietest campsites I've encountered. Beach with direct departure from camping at 4 minutes. Correct and clean bathrooms. Plots with little or no shade. With a canopy everything is solved. We were passing through for a day and we repeated ..
81462,562971,5,JensD78,19/07/2019,"Price top, location top, sanitary facilities okay. Could choose the place (it was enough free). In short: I can only recommend"
81462,559609,4,Willi_der_Camper,17/07/2019,Beautiful place with direct access to the beautiful beach. The toilets were very clean.
81462,511274,4,tinono,10/06/2019,"Quiet campsite. speak French. 2 indoor areas to drain and refuel. there's even a karsher to wash the bodywork. small snack, small shop, swimming pool and 3mns from the beach on foot. you choose your location which is correct."
81462,491005,5,ClaudiAlinaGregor,23/05/2019,"Top well-kept toilets with extra Babybaderäumen. Nice place, nice staff, mini market available. We are satisfied."
81462,474186,4,Walek,02/05/2019,"Very friendly welcome. Large flat sites. Sanitary ok although the faucets are very powerful, unusable. Direct access beach. 13 € for 2 people in van."
81462,426756,5,dietmar-g,05/02/2019,"A nice campsite, very nice and helpful staff. The price of 17 € is completely justified. You get clean spacious showers and enough long hot water. The complex is very spacious which is also given privacy. We can recommend this place and have fun and recreation here. ;-)"
81462,407949,1,supersaendi,16/11/2018,Closed at the moment: they have to clean up the damage!
81462,390712,4,Dazzles,10/10/2018,"Good campsite, all facilities. Wi-Fi only at reception area. Large quiet beach, big waves. No public transport."
81462,386986,5,arnski,03/10/2018,Great place with direct access to the beautiful beach. At the end of September he was not crowded. Good sanitary facilities with nice showers. Price ok.
81462,351361,5,Reyitta91,24/08/2018,"Great, unbeatable services, super friendly and good price. Near the beach"
81462,350479,5,BUS87,23/08/2018,"Perfect, everything is there. Medium size, very clean at only 300 meters to the sea."
81462,313050,4,Remi89,03/08/2018,"Very nice camp site, a good halt with swimming pool, very nice staff correct price attention to the sanding, but they are accustomed, they quickly came to us to tow with a tractor"
81469,2468137,4,4n777,29/10/2022,"Wonderful pitch. Warning: the height restriction applies to the entire car park, not just the lower part. Unfortunately, there are few signs that make this recognizable, especially in the dark. Unfortunately we got a ticket, we were almost at the top with 3 others. Parking is permitted on the side streets or in the official parking lot at the entrance to the town."
81469,2074975,3,ISSLP,15/07/2022,"A car park with a very beautiful view of the dunes, the mountains, the bay. Magnificent sunrise. BUT car park until late due to restaurants and musical atmosphere. Parking lot and surroundings quite dirty."
81469,2055027,5,Forus1959,09/07/2022,"Fairly large parking lot with a beautiful view over the dunes and the sea, 2 good restaurants and a shop directly at the parking lot. Very nice long beach, partly for naturism."
81469,1881190,4,Jakob.K.,10/05/2022,very nice. Unfortunately the beach was full of seaweed in May. a very good restaurant with a sea view on the corner of the parking lot. keep clean please
81469,737267,4,vladsteva,03/11/2019,No problem with a van. Nice beach and super good restaurant!
81469,571235,1,pau1974,23/07/2019,Inclined parking PROHIBITED for vehicles over 5.20 d long or 2.10 high. In summer there is always police throwing or fine those who do not comply.
81469,453092,1,alexluque13,12/04/2019,The police have come and I have thrown half a meal
81469,438159,1,The.Wicksy.Wanderers,09/03/2019,Only motorhomes of a certain size allowed. see photo.
81484,1882700,2,AlbaCantera,11/05/2022,"The site is beautiful, the reservoir is spectacular, but I don't know you can spend the night, or park near the shore because it is a flood zone. The civil guard passes often. The track to get there is a bit bad."
81484,1555823,5,sodrij,07/09/2021,"Beautiful spot, we were all alone !"
81484,1042300,5,Dinbour,12/09/2020,"Great place, we settled a little higher under fir trees, flat ground. Access complicated for large vehicle. Seen on the mountains and amazing lake!"
81484,1010567,5,dtejero,28/08/2020,"Nice site, with spectacular views .. difficult road to access for motorhomes. At the foot of the swamp!"
81484,844972,5,vgcn,02/07/2020,"Accessible and very quiet place for the night. During the day, a tree provides shade, and makes it a very good, almost perfect place. In addition, access to the lake is a real plus, a small morning swim is compulsory!"
81484,681804,4,Pattiam35,08/09/2019,"Isolated and very quiet place. A little passage on weekends (some fishermen). So that this place remains preserved and our presence tolerated, do not hesitate to pick up some rubbish around your camp even if they are not yours. Little tip, the little bag to go do your needs. Even though toilet paper is biodegradable, it's always cleaner not to have it behind all the bushes."
81484,530613,4,VanDeVacas,27/06/2019,"The road is a bit complicated, I do not think a motorhome or large volume can go down quietly. The environment is indisputably alternative. Nudist area."
81484,402426,5,baladeur74,01/11/2018,"For the amateurs of space there is what it is necessary, possible to go down all along the way, narrow by place but I passed with a 6.30 m at mid-slope, there are large esplanades who actually serve a festival"
81484,295331,5,joycolin,21/07/2018,"Amazing spot right next to the lake. We had no trouble getting down here in our extra long wheel base van. No services. We followed the signs for Own Spirit Festival which had finished a couple of days before, otherwise follow the signs for the campsite but continue straight when it asks you to turn right."
81490,2779375,3,IngeLarsenOnTour,23/05/2023,"Free parking before June. We were here for one day for the Lidl and Mcd, easy to go to the ocean"
81490,2491821,1,Twoandhalf,12/11/2022,"Cool and clean place to park. Staying over night is risky though (as in the whole metropolitan area judging from the comments everywhere). We were robbed during the night here, too. In a very elegant way. The went through all the locks, took a little cash and my manicure. But did not break anything and left my cards and passports folded neatly behind the wheel. We did not hear or feel a thing."
81490,1876336,5,sunjay,08/05/2022,"We spend 2 days here. Nice view, next to ocean, very calm at night. Felt safe because of supermarkets nearby. Toilets at McDonalds (open 11:30-23:30 h) or lidl. Beach showers 5 minutes away. Ideal to take train or bus for day trip to Barcelona. Parking was free. From the first of June to the 30 September you can only park for 1 day there."
81490,869609,3,Buda_790,14/07/2020,"Sleep ok. Near the beach, there are some trucks, a MC Donald nearby, generally quiet, you can hear the cars on the general road a little but if you are not very tikismikis everything is fine"
81490,581370,4,maksimus3,28/07/2019,"Stopped at the parking lot store Lidl. Of the amenities there is a toilet in McDonald's. There are stones on the shore (located across the railway), but there are islands of sand and stones where you can swim. We need to go to a normal beach (about 500-100 meters), we did not go. In principle, you can spend the night, but it's better to go to a more beautiful place."
81490,270334,1,oski,17/06/2018,"A place not to spend weekends, botellón better to get to Cabrera de mar"
81511,2950423,4,Boso01,11/07/2023,exceptional view of the mountains The setting must be preserved so take your rubbish with you (popo included) because it is a nature reserve. I put one star less because there were scabby mosquitoes quiet night without noise
81511,2684370,5,Philsi,20/04/2023,Extraordinary place with a magnificent view and a royal calm. For nature lovers
81511,2642068,5,anczi,05/04/2023,"The spot is amazing! We were supposed to stop for one night, we ended up staying three. If you’re into cycling or hiking you will not be bored, and the spot is truly fantastic. We were there alone for 2 nights, for the 3rd night another van joined us. There are some cyclists or hikers passing by, but barely any cars. If the spot is taken you can find more places to park in the gravel road that is right around the corner. Thank you for marking the spot!"
81511,2622051,5,Japanner,24/03/2023,"Very nice location. Fun little mountain pass in a beautiful area. Road is nearby the first lot, but you can drive further behind the ruins. From there, the road is not visible. Hikes and mountainbike rides can start from there!"
81511,2563776,5,Passata,29/01/2023,"Super nice location, highly recommended!"
81511,2420233,2,McHeck,03/10/2022,I don't know how the RVs shown in the photos got there via the narrow mountain road. Vehicles over 2.10 m wide and 6 m long do not go there at all.
81511,1874159,5,eufecio,06/05/2022,"A wonderful place, normally quiet. impressive routes from here, walking or cycling Thanks for uploading it"
