placeId,reviewId,reviewRate,reviewUser,reviewDate,reviewContent
20768,103376,3,darbo,06/09/2016,"Super nice place cheap held by two frenchi beautiful beach and it's good in the morning! Shower, toilet, electricity 10 amp ideal for planchas. Quiet area in the Portuguese countryside!"
20768,102718,2,rictot,04/09/2016,Very narrow passage to access the motorhome area of more than 7 m be careful at the sidewalk
20768,95421,5,garrice,16/08/2016,"All is said ! Hot showers in the evening, dream beach not crowded, not supervised so dogs allowed, 20 minutes on foot via a super pretty path. Exemplary welcome. Prices more than fair. Cool !"
20768,93353,5,MUSE0816,12/08/2016,"Very warm welcome by a French couple, quiet and beach 10 minutes by bike in a small cove, super friendly, fair price, LIDL and Intermarche nearby."
20768,93015,5,adelinemike,11/08/2016,"Great welcome from Joëlle and Peyo! The area is already very good, as described above, but in addition Joëlle and Peyo really make sure that we have a good stay. 6 € the location. Electricity is paid to the conso with a minimum of 1 € for 4 Kwh on the 1st day then 0.25cts the KWh. Barbecue available. The wifi works very well. Shower pay 1 € for 3/4 minutes (no cold shower, you have to go to the pipe or take his jump!). The beach 20 minutes walk, by a nice path, is beautiful and little visited even at this time (full August). At low tide, you can walk to discover other beaches."
20768,85120,4,figueiracaravanpark,25/07/2016,"Figuera Caravan Park. The restaurants are 100 meters, the beach is 1.4 km (20 minutes walk) and the opening hours of the reception are 9am to 20:30 (closing grids at 20:30)."
20768,85075,4,napier92,25/07/2016,"Run by a very friendly and helpful French couple who live onsite. clean facilities. 3 min hot showers for 1 €. 6 € for camper overnight plus 1 € for power. cheaper rates for longer stays. WiFi provided... Which is good, but can be temperamental. 1.8 m walk down a track to a lovely beach. Cheap bar and a couple of restaurants in the village near by. An enjoyable rest stop for a couple of days."
20768,78076,4,titi07,23/06/2016,"Area in the countryside, friendly welcome run by 2 French people, the superb beach a short walk away, 13 km from Sagres, nothing more to say, great"
20768,77274,4,Papapizza,17/06/2016,"Very nice area, all comfort, reasonable price. Warm welcome by one hundred percent managers available. (preferred). For the grumblers you must know that a cock it sings in the morning early and it's very pleasant."
20768,72700,4,jg2lemet,11/05/2016,"Very friendly welcome, reasonable price. Small typical village, the comment of 02/17/2016 sums it up well. For the rooster and the barking dogs: we are in Portugal and in the countryside."
20768,64335,3,Inspiro,24/02/2016,"Well, correct rates only downside the rooster noise that sings even at night ... And dogs barking in the middle of the night and it lasts and it lasts. Otherwise very friendly."
20768,63929,4,chatbouille,17/02/2016,I forgot to say water and wifi included in the 6 €uros.
20768,63928,4,chatbouille,17/02/2016,Do not hesitate to enter this park. Great home. You are in the countryside and only 1800 m from the beach which is superb. 7 € uros the first day and then 6 € + 0.25 € of the kw used. Washing machine 4 € uros. Tumble dryer 3 € uros. Shower € 1 uro. WC available Grocery and restaurant in the village a few steps from the park.
20768,63602,4,Kartara,12/02/2016,"Great place for 1/2 nights. Nice welcome, funny showers. Good solid performance for € 6, - plus electricity 1, - €. but in the winter last arrival to check in 18h. We were lucky u arrived at 18.45 and should still be in! Thank you"
20768,62738,3,tortue26,18/01/2016,"Nice campervan area, but it is necessary to clarify the tariffs, it is 6 € the 24h + 1 € of electricity plan corresponding to 4 kwh, if you exceed this fixed price it is 0,25 € the additional kwh. The shower is € 1 for 3 minutes of hot water. The wifi is free and works pretty well."
20768,60125,4,voyageur18,18/11/2015,"It's 6 euros a day with water. For electricity it is 0.25 KW. The reception is very nice. The place is 10 minutes walk from the ocean while crossing the hills, very very well"
20768,59299,3,nicolas45,02/11/2015,Small very nice ground price € 7 24h with electricity for showers € 1 shower
20768,49125,4,renloan,14/08/2015,"Beautiful land, access via: rua da Fonte a little winding but quiet and well-equipped stage. Correct price. To discover and recommend."
20768,49124,4,renloan,14/08/2015,"Nice area, a little complicated to find access alley to Rua da Fonte, a little narrow. Otherwise a good corner in the heart of nature and quiet. To recommend !"
20768,36250,1,brigittajolifleurdejava,12/05/2015,Always the same in renovation
20768,31277,3,domy42,19/02/2015,Showers and toilets under construction. Washing machine at the Intermarché (1.5 km). Beach 1 km but beautiful. The wifi works very well.
20773,3278593,5,DeCocqPierre,09/09/2023,"Warm welcome by Xavier & his wife Fatima with a welcome drink! Place to stay equipped with all the necessary amenities. If you wish, Xavier offers you homemade bread and brioche; otherwise excellent! We recommend this superb stopover!"
20773,3276823,5,Marie-ClaudeSournet,09/09/2023,"Places as we like them!! small, super well-appointed structure and owners who are too friendly, super well organized and give good advice. Family atmosphere, beautiful walks through forests and vineyards, encounters with locals who are always smiling. We loved it !!"
20773,3269943,5,Bribriimb,07/09/2023,"We received an exceptional welcome from Xavier and Fatima the owners. the breads and buns made by them are delicious. All services in the area, water, empty cassette, 2 sinks for dishes, 1 for laundry, washing machine, 2 showers, 2 toilets, and bar and swimming pool. If we go back to the area, it is with great pleasure that we will come back. Brigitte&Simon"
20773,3256713,4,FannyCamp,04/09/2023,Great camper van look!! The bosses are ADORABLE and full of good advice!! I highly recommend !!
20773,3220920,5,GratienB64,26/08/2023,"Go there with your eyes closed, we regret not having known this place before. Xavier and Fatima are all just great and you feel like you've arrived at your best friends. Nothing to say about the facilities Do not hesitate to take the bread and brioche option at breakfast to start the day off right. If we come back to Portugal one day, we will stop here again, far from the hustle and bustle"
20773,3220612,5,Pablorivera,26/08/2023,"A cozy place, very quiet, with a pool, they treat you as if you were at home. Charming Xavier and Fátima make incredible homemade bread and brioche, a place to return to."
20773,3185739,5,JeanmarcFaye,20/08/2023,"Great welcome, French boss so no worries about being understood, as far as the area is concerned, at the top, everything is there, even the swimming pool, showers, toilets, everything to empty and fill in an irreproachable state. access is via a small street which should not be hesitated to take because motorhomes over 10m pass. to discover absolutely. Congratulations to Xavier and Fatima for their dedication."
20773,3168656,5,JimPrew,17/08/2023,Great location and really nice people.
20773,3164952,5,1868,17/08/2023,"How hard it is to leave you, Xavier and Fatima! Thank you again for your kindness, your dedication to your customers. The good bread and the excellent brioche from Fatima always on top! Appointment is made for next year! Denis, Marie and Groover"
20773,3158772,5,LaurenceBrun,16/08/2023,"How good it is to find remarkable and so humane people along the way! Despite a late arrival, without a reservation, we were welcomed with open arms! Thank you very much to Xavier and Fatima, for the welcoming place, for the brioche, the jams and especially their smile! See you soon ! Laurence and Christophe...and Sika"
20773,3138484,5,tifflanamalo85500,13/08/2023,"Great stay with Xavier and Fatima, great people who go out of their way for their customers. We had never been so well received! Large and flat pitches. All services are available, they are even kind enough to offer their swimming pool. The homemade brioches and jams are excellent!!! A big thank you we will come back next year with great pleasure!"
20773,3077390,5,fortunajm,04/08/2023,"Very warm welcome, Xavier received us warmly. We spent a very restful night and enjoyed breakfast with homemade bread, homemade jam, all in front of a magnificent landscape. To do again without hesitation."
20773,3074308,5,kriegelstein,04/08/2023,Very pleasant place where you can relax in peace and silence. Area not very busy at the beginning of August. Healthy air at 700 m altitude with magnificent views. Excellent welcome from the owners. Difficult to leave.
20773,3048361,5,lovaandersson,30/07/2023,"Perfect place to stay and relax, it has everything you need both for yourself and the camper. I even got hold on some Swedish books in the bookshelf exchange (and left some new ones of course). Highly recommend everybody to visit!"
20773,3040251,5,camju,29/07/2023,Thanks to Xavier for his very warm welcome. Reciprocal nostalgia for our youth on motorcycles. Nice place to start our vacation in Portugal. Francoise and Denis
20773,3004481,5,fabricechem,22/07/2023,Thank you Fatima and Xavier for your welcome. Everything is great on your area. We appreciated your hospitality and generosity.
20773,2940716,5,stoilovelena,09/07/2023,"Fantastic, an incredible place with all the services for a great price, clean and well-kept. The excellent attention of the owners and absolute silence to sleep. A delight of a place"
20773,2828140,5,kertzingermauricette,07/06/2023,a very nice discovery do not hesitate you will be very well received by Fatima and xavier
20773,2820543,5,manuelnovo,04/06/2023,"A very nice place to stop, seen on the vines and the mountain. Very warm welcome from Xavier and Fatima. Very clean toilets and showers. We recommend this stop. Manu and Delphine"
20773,2805848,4,OliverGreen,31/05/2023,"Lovely site. Very warm welcome from owners who also offered a welcome drink. Toilets and showers very clean. Homemade bread on sale, whenever you want some just ask and it will be made fresh. Fresh water taps around site. Swimming pool free to use. Closest village is around 4km away.

The only downside I would say is the amount of flies around the site and around the reception/sitting area."
20773,2786200,5,djack0311,25/05/2023,"What an amazing place , Nice and quiet . Lovely welcome from two great people Fatima and Xavier . Everything you need is there , and the view is amazing ! We will definitely be back in the very near future . 10/10"
20773,2776447,5,andreamase,22/05/2023,"what to say? everything you could wish for! services, showers, small swimming pool, maximum tranquility and super panorama! very nice manager and in the morning you can also have fresh bread!"
20773,2768581,5,santosnadia,20/05/2023,"we come back for the second time, extra welcome, very clean, helpful, if you go there don't hesitate it's great for the price."
20773,2678370,5,freesphere,18/04/2023,Great welcome. Clean and spot sanitary facilities with a superb view. The pool is still too cool for us!
20773,2658349,5,kristine1960,10/04/2023,"Nothing more to add to the very good comments, except that for our part it was very difficult to leave. But we will come back That's for sure. Another big thank you to Fatima and Xavier."
20773,2650392,5,291063,08/04/2023,"exceptional area, a warm welcome. Fatima and Xavier are always very caring for us. we stayed there for 2 nights"
20773,2639826,5,kriesvdb,04/04/2023,I agree with all the positive comments! Super welcome by Fatima and Xavier. Thanks bien!
20773,2626200,5,Riska,27/03/2023,"super friendly owners, beautiful place with a view, beautiful walking area directly from the CP, very quiet, friendly villagers, everything available regarding CP, disabled shower and toilet, super clean, delicious fresh homemade bread, in short, we will definitely come back here."
20773,2622543,5,JosephinevO,24/03/2023,"The 3rd time here at O Tempo Parou, so nice and relaxed to be here with such hospitable and friendly people: they do everything they can to make you feel comfortable, Xavier is very helpful and speaks several languages. And Fátima bakes delicious bread! Fantastic view! And if you want to get acquainted and have contact with the real life in the Portuguese country, then you've come to the right place."
20773,2608985,5,MiloIOS,14/03/2023,"Great place to relax in the countryside. Warm welcome from the owners and fluent in many languages. Everything you need, including hot showers. Perfect place to hike or ebike from.."
20773,2591204,5,Praothus,26/02/2023,"If you are looking for a place with beautiful views , nice walking Track. Friendly owners and good facilities, than you must go here. Fatima males very good bread,if you asked for it. 3 km away is a little supermarket. we stayed with pleasure for 3 nights. Merci beaucoup pour toutes!"
20773,2576045,5,HeinrichBraun,12/02/2023,"Shouldn't be missed. Everything from the best available. Warm water for washing dishes, a heated room with hot showers!!!!. A small lounge. Authentic village, great view. Yes, a stay is recommended. Thank you for this opportunity."
20773,2562674,5,jmamdy,28/01/2023,"Thanks to Fatima and Xavier, 2 beautiful, authentic and warm people. a great welcome, services like you rarely see on Cc areas. a very reasonable price in view of the services. another 1000 thanks for everything. We will come back without hesitation at another time to visit you and more than 2 nights Sylvie and Jacky"
20773,2561273,5,looms,26/01/2023,"incredibly beautiful cp, super friendly owners. possibility to do your laundry. beautiful walks made here."
20773,2478268,5,Eaton76,02/11/2022,"Hello, the owners will be on vacation from December 23 to December 26 inclusive. They are back on the 27th to welcome all the motorhome friends. A nice journey to all of you."
20773,2472693,5,AlexandreMartins,30/10/2022,"Xavier and Fatima were the perfect hosts for our stop between Chaves and Bragança along the N103. A very quiet place in the wild that provides electricity and hot showers. For your breakfast, a tasty homemade ""brioche"" bread. If you're nearby, it's a mandatory stop. Safe travels, Vânia, Alexandre and Arya."
20773,2456129,5,cled,22/10/2022,"It's not directly on the route, but it's worth the detour! We spent four very nice days here with hiking, cycling and simply enjoying. Xavier and Fatima are perfect hosts and their wood fired bread is a treat. The place is well equipped and very clean. Many thanks to you two, we would love to come back!"
20773,2450796,4,Joon03,18/10/2022,"Very warm welcome from the owner. He does everything he can to make you feel comfortable. We stayed here for one night because it started to storm hard the next day, otherwise we would have stayed longer. There is not much to do in the area. You really need to have a scooter or motorbike with you to go anywhere. At night it is exceptionally quiet."
20773,2449943,5,anaistak,18/10/2022,"really pleasant welcome, there are all the services available and it is very well maintained and clean. it is in the middle of nature with a beautiful view. Xavier is really very nice and caring. it is much more than a motorhome area. We will come back for sure!! Thank you again I recommend 10000000 times"
20773,2431146,5,B.Niebroek,08/10/2022,"This is the best motorhome I've experienced so far. A very warm welcome with welcome drink by owner Xavier. He is very friendly, helpful, speaks different languages. The fresh bread is baked by his wife Fatima. Sanitary perfect and clean, also suitable for disabled people. Lovely swimming pool. 10 stars from me."
20773,2429984,5,MartinLubbers,08/10/2022,"Excellent motorhome location. The village, Vilartao, has very narrow streets with right angles. From the South, continue clockwise and drive from the West to the motorhome. Follow the motorhome signs."
20773,2383814,5,Laikak209,18/09/2022,"A quiet, friendly and quiet place where you can be very comfortable. Very clean and spacious showers and toilets. Xavi approached us without precedent to a nearby restaurant from which we walked back. It is only 3.5 km. They are very kind and they even bring you the bread made by them in the morning if you ask for it the day before. We will be back."
20773,2372180,5,Philippepp,14/09/2022,area at the top the 5 stars are not enough exceptional welcome the brioches and the bread of Fatima just exceptional we will be back very soon congratulations to you two Philippe and roxane.
20773,2369240,5,PereiraChantal,13/09/2022,a place just sublime the owners are exceptional always ready to help adorable and welcoming they deserve more stars the bread and brioches of Fatima it is a killer to do absolutely you will not be disappointed Tonio and Chantal
20773,2365451,5,DamienMunch,12/09/2022,"We spent several very pleasant, serene and peaceful days. Xavier and Fatima are really caring, welcoming and very friendly people. The environment is warm and spacious, the various services offered are very clean and above all access to the swimming pool which has made all its charm for us and our children. Excellent homemade brioche delivered in the morning."
20773,2333300,5,natba28041193,02/09/2022,"We can recommend the place so much. You are welcomed so warmly. There is a pool. The sanitary facilities are so clean. Everything is made with love and you can feel it. You can ""order"" bread that is brought to the van freshly baked in the morning. There is a trolley with fresh fruit and vegetables. It's just the right place to relax. We'd love to come back. Niclas, Nathalie with Finn"
20773,2328653,5,Dominic1961,01/09/2022,"Exceptional place, very clean, 
and welcoming. 
Best place to relax ."
20773,2275098,5,1868,20/08/2022,"At Xavier and Fatima you are welcomed as if you were family with a welcome drink. Very nice area accessible to all well equipped, very clean with swimming pool. Don't hesitate to enjoy the bread cooked over a wood fire, the excellent brioche and the gizzards in sauce, all made by Fatima. Thank you both for your kindness, your smile and your honesty! Mary, Dennis"
20773,2256738,5,polipoli,17/08/2022,"You can go there with your eyes closed exceptional welcome swimming pool hot shower washing machine if necessary everything is spot on the owners Fatima and Xavier are great, you have to take Fatima's brioche, Xavier takes great care with motorhome drivers it is very rare an area like this one we paid for a motorhome electricity a trailer for 3 nights 42€ we will be back thank you"
20773,2230740,5,Jean-Michel77,13/08/2022,"More than warm and friendly welcome by Fatima and Xavier, you feel at home. Sanitary at the top, the swimming pool is a plus for children. Don't miss Fatima's bread and brioche either. We went there by chance when we arrived in Portugal, we didn't want to leave without stopping there again :-)"
20773,2211645,5,ManuGONCALVES,10/08/2022,"You can go with your eyes closed to this rest area. The welcome and the services are at the TOP. We were delighted to use the swimming pool. Xavier and Fatima the owners are very welcoming, very friendly... You feel like home. Try Fatima's bread and brioche you won't be disappointed. As soon as possible we return to this area. Only +++++ Manu Séverine Nino"
20773,2181028,5,Cirviz,05/08/2022,"A great place! Not so much for the place itself (that too!) but for the kindness and good treatment of the owners. You feel as if you were ""one of them"". And the breads made by Fatima are unsurpassed. Because it is far from home, but if we were Portuguese we would definitely go back!"
20773,2166400,5,thometlaeti,03/08/2022,"Very quiet place with a beautiful view of the valley. The owners are more than charming and offered us an aperitif on our arrival. The toilets and showers are very clean and in good condition, the swimming pool is a plus with children. Washing machine and dryer available (at no cost). We paid 11€ for the night (14€ with electricity). We highly recommend!"
20773,2155488,5,Fabriceheirb,01/08/2022,"Warm welcome, swimming pool water electricity emptying laundry. Very nice owner and the view is magnificent over the valley, I highly recommend"
20773,2118767,5,olean35,24/07/2022,"Thanks to Fatima and Xavier for sharing their little paradise with us. Warmest welcome. Breathtaking view of the surrounding mountains. Impeccable services, impeccable sanitary facilities. And what a joy to find bread baked in a wood fire and brioche on site! Without forgetting the excellent moelas cooked by Fatima. Bretons and Beaucerons-Portuguese"
20773,2103030,5,Quenicar,21/07/2022,"We can only agree with most of the comments. For those who seek rest and calm. Possibility to walk as far as the eye can see. Fatima and Xavier are always ready to help you and make your stay as pleasant as possible. This is our second visit to them, and we can say that we found FRIENDS."
20773,2064790,5,fannymonnard,12/07/2022,"night from 11 to 12/07 Aire as we would like to find more often, smiling and warm welcome!! quality services with swimming pool available. hot showers and toilets in immaculate condition! nothing to say except a big thank you to Xavier and Fatima for their welcome, above all stay as you are. We only stayed one night and it felt like we were leaving friends! signed Les Lyonnais."
20773,1988159,5,gerard170109,18/06/2022,Very difficult to add other comments than those given below. If not that the owners are amazing and the place is great. Again thank you very much to them we will come back with great pleasure gege31
20773,1983687,5,MarcKosterink,16/06/2022,"Great place. With a beautiful view over vineyards, cherry trees, etc… super cool reception."
20773,1964313,5,campingcar8059,10/06/2022,"Hello, we spent 4 nights with Xavier and Fatima. calm, beauty of the landscape and above all you will feel at home. Fatima and Xavier are at your disposal and will make you good bread and good fresh brioche. An experience not to be missed!! Between Chaves and Bragança. Peter and Mary"
20773,1963922,5,EvaVaneeckhaute,10/06/2022,"very friendly welcome, quiet and beautiful surroundings. The positive comments are certainly justified, highly recommended!"
20773,1885469,5,Pigeot,12/05/2022,Exellent welcome the owners Fatima as well as sue Xavier super friendly we had a very good stay highly recommended. thanks to them
20773,1870970,5,Michelwuillot,05/05/2022,excellent welcome at Fatima and Xavier everything is done to make you feel good always available and helpful do not hesitate we recommend 200% friendship of the Bretons Stella and Michel
20773,1841759,5,c.rodrigues,20/04/2022,"Excellent reception. Xavier is a great host, he received us at his property with all the sympathy. The parking place is next to your house, very quiet and peaceful. It has all the services, including a small bar. I strongly recommend."
20773,1800788,5,gitano,30/03/2022,"Thank you, Fatima and Xavier, for our happy time here with you. We enjoy the walkings and the silence up here. We wish you all the best :-) 
chris béatrice = laebdintraum.ch"
20773,1789887,5,lorenzo.dp5,20/03/2022,"Xavier's welcome and Fatima's good bread are exceptional. A magnificent view. All the services you expect from a campsite. Hikes in the mountains. What more. We spent 2 restful nights. Prices: €11 per night, €3 for electricity, €3.5 for the washing machine and €3 for a large homemade bread."
20773,1769412,5,STARMCLOUIS,28/02/2022,"Very quiet, breathtaking view, extremely warm welcome, Xavier and Fatima are of absolute kindness. The motorhome area is flat and very well equipped and planted with trees: Magnificent"
20773,1731432,5,bellavie02,10/01/2022,"Private area run by Xavier and Fatima who have planned everything to make your stay a smooth one. Heated and impeccable sanitary facilities, washing machine and dryer available, and I certainly do. You will also have the opportunity to buy good baked bread made by Fatima. Thank you for your welcome !"
20773,1712533,5,gaby76110,19/12/2021,"Hello, the owners are on vacation to enjoy the end of the year family holidays from December 20 to January 10, 2022 will be back on January 11, 2022 to welcome you with great pleasure"
20773,1653795,5,Lion7152,20/10/2021,"FYI, normal that the owner places the vehicles in the right direction if only for the opposite and the privacy of each and safety. a society organized according to its rules, no offense to the incivility of some, as for the swimming pool always better than being crowded on not very clean beaches."
20773,1653759,5,Lion7152,20/10/2021,"Exceptional family welcome at Xavier and Fatima's, their kindness has not been ""eroded"" at all, sanitary facilities in very good condition and very clean nickel, super quiet place with beautiful swimming pool. also a living room is available with various board games, a good choice of books etc ... washing machine and dryer, finally everything for 11 euros. Thank you again and see you soon Michèle and Bernard from 71."
20773,1604118,5,ptitgris,24/09/2021,"Very happy to have been able to meet the owners of this very beautiful area, very well equipped and above all very friendly, thank you again for your welcome and see you soon guiness"
20773,1601785,5,aureline,23/09/2021,Very nice place very friendly we will come back do not change a thing
20773,1597006,5,valxav,21/09/2021,We stayed 3 days in mid August. what more can we say than the previous posts. we do not understand those who do not put 5 stars. Xavier lent us his car to visit Chaves. succulent Fatima bread and brioche. we had a reception beyond our expectations. we will come back for sure Valérie and Xavier
