placeId,reviewId,reviewRate,reviewUser,reviewDate,reviewContent
25564,2085850,5,Javi_Coyanza,17/07/2022,"Very comfortable area on the beach and with a recreational pool with 3 slides not included in the price of the stay (€10 per day in July) but at an affordable and reduced price for users of the area (€4 per day). To put some downside, some bakery-type store service is missed, but as I say it is to put some but since everything is great"
25564,2085652,5,fedegarci,17/07/2022,"A very nice caravan area, with basic services, but good value for money. The pool is great for children and adults, €4 in high season if you have the caravan inside. Very easy and close access to the beach and a nice walk along the beach dune. Very good deal. Service to bring croissants and breakfast rolls to the caravans for breakfast."
25564,2073917,1,Arriluce,14/07/2022,"I put a point because I can't put less. The ground where Sand and Dust touched us and I almost got stuck. They have charged me €10. All very dirty, and to top it all off the dogs only where the Motorhome, we had them tied up and we had a fight since they didn't tell us that we couldn't walk with them. So we finally left. Where they don't want my pets, neither do I. Agur"
25564,2062517,5,Guiem78,11/07/2022,"We have been two nights and great. With children it is perfect, entry to slides and pools for 4 euros per person, minigolf for 1 euro, barbecues... wooden walkways to a lively village. spectacular place"
25564,2061868,4,SidiMoy,11/07/2022,"It is my second visit. On weekends it fills up. €10 in high season. Perfect for the beach and as a base to tour the area. It is not my case, but whoever has children is perfect with the water park. Surf school next door."
25564,2060911,5,h1p3rcub3,11/07/2022,"The toilets and showers are inside the water park, a little away from the parking area. They can be accessed from 19 to 10 in the morning, while the park is closed. If you want to access while the park is open, you need to pay the park entrance fee (€4 for campers). The slides are turned on 2 by 2, and are turned off the first and last hour, as well as at mealtime."
25564,2056734,5,AmyWH,10/07/2022,Great park for a family with children under 14 years. After travelling along way it was a welcomed find.  We don’t speak Portuguese and the staff had very limited English but the owners couldn’t have been more accommodating. Great find we will definitely re-visit.
25564,2054806,4,lolags,09/07/2022,Recommended place to spend the day on the beach. We came with a van and the place to park was an esplanade with dirt and rubble. Bathrooms are ok but can't be used from 10am to 6pm (if you don't pay for the pool). Very nice staff. The beach is great and you can get to the town on foot without any problem. €10 per night.
25564,2050181,5,spannekoek,08/07/2022,Great place to stay for a few nights. Behind the dunes and next to a water park. Very friendly hosts and great services. Quiet nights too and beautiful sunrise and sunset. Highly recommend!
25564,2045131,5,luismisanta,06/07/2022,"We are here right now and the place, the services and the treatment is incredible. We came recommended and it is much better than what we had been told. To repeat and many times, if it weren't for the distance, I would come every weekend."
25564,2042865,5,Lucaslanza,06/07/2022,it is a very good place next to the beach with pool and light the employees speak several languages and are charming
25564,2037604,5,txokolatess,04/07/2022,"Good Area, next to the beach and the pool. If you spend the night in the area, the entrance to the pools with slides is €4. Familiar trade. 100% recommended"
25564,2036350,5,Maryfereina,04/07/2022,"It is a great place, one of the best we have seen, a very nice beach with dunes, a swimming pool with slides, barbecues and great attention too."
25564,2031386,5,PaMa94,02/07/2022,"Beautiful small campsite right by the sea, surf school next door (with rental). Nearby village with restaurants and bars. Very friendly staff and very cheap (13 € with camper including electricity)"
25564,2031380,5,MariaM.2022,02/07/2022,Beautiful campsite right on the more and good for surfing! Would go here again and again!
25564,2022150,4,Dorothea2022,29/06/2022,"Very nice place near the beach, friendly operators and the bread service is great. Sanitary facilities are outdated and could be a little cleaner."
25564,2021920,5,QuiqueOlas,29/06/2022,"Spectacular site with great treatment. All services, close to the beach and the water park, which is small but very well managed. Everything is very clean and a very reasonable price, €11.50 with electricity in low season and €13 in high season. They offer you to bring the bread and pastries in the morning that they leave you in the car. A 10 minute walk from the town of Vagueira along the beach promenade."
25564,2021082,5,gloecker,29/06/2022,"Highly recommended place. The lady is a charm and there is a very beautiful sunset. It has all the services at a reasonable price of €8.50. If I return to the area I will repeat for sure! Be careful, there are a lot of bumblebees!"
25564,2012404,4,Minatchyalexia,26/06/2022,"a friendly place, largely affordable in terms of price! the managers are nice and here there is everything you need, very nice place, the beach and the water park glued to the air of a motorhome a big plus! We had planned to spend only one night there and finally we extended our time here with an extra night! we love it!!"
25564,2006748,5,Linlinche,24/06/2022,"The owners are very welcoming and friendly. We passed by twice and the last one, for their sardine festival, nice festive atmosphere. X"
25564,1987846,5,Tlm01,18/06/2022,Perfect. Spent a night lulled by the sound of the waves!!! Everything is clean thank you
25564,1985746,5,peterkarlkunze,17/06/2022,Great big place. Directly behind dunes. Friendly welcome. Level pitches. Clean. Good starting point for trips to Aveiro and Porto. Great long beach. Gladly again.
25564,1981973,5,JefDuc,16/06/2022,"Very nice area, very good services, for a fair price. we recommend."
25564,1976434,5,natxinterlenque,14/06/2022,"The couple that runs it have a super nice treatment and they help you in everything they can. Direct access to the beach, barbecues, swimming pool, showers, etc... of 10"
25564,1975542,4,HetzmannJean,14/06/2022,we liked good air certainly a bit crowded on weekends but comfortable near the sea beautiful village nearby recommend
25564,1974000,5,travel2022jt,13/06/2022,"A beautiful place! The welcome was very warm, everything was shown to us in detail. We felt welcome straight away. Unfortunately we drove further south because of the bad weather. But would recommend it anytime. The beach is gigantic!"
25564,1973330,5,valenteAntonio,13/06/2022,"really very nice the owners are very nice and helpful, we came last year and since then they have made improvements. it's really very good I highly recommend"
25564,1973136,3,CarlosP.M,13/06/2022,"We arrived in the morning and they gave us a land site without electricity, so the electricity thing is .... luckily the plots do not have to download or water, there is only one place for everything There are showers and toilets in the water park : it is free on Mondays and Tuesdays, then there are times when you cannot access the beach is next door, there is a walkway that leads to the town"
25564,1971627,5,bidegain,12/06/2022,"Magnificent area. Next to the sea, protected by a dune. Impeccable facilities, spacious pitches and very friendly staff. Take as an example that under order they bring you bread to the AK"
25564,1969017,1,Axmoe,12/06/2022,"A crowded, dusty, dirty parking lot with RVs packed tightly together. Terrible!"
25564,1962302,5,Fleury,09/06/2022,"We were welcomed by super nice managers in this place all the more nice! What more can be said ! the previous comments are more explicit. very affordable price, with all the services. We recommend !!!"
25564,1958660,5,Tarsen,08/06/2022,"Great parking space that you can really recommend from the heart. Super nice service, everything clean and beautifully situated behind the Dühne. Miles of beach with a jetty and the perfect spot for shell collectors. Top price/performance--> €8.50 per day/ €3 for electricity. Next door small outdoor pool with slides (discounted entry). Showers and toilets in the outdoor pool may be used (between 6 p.m. and 10 a.m.)."
25564,1958418,5,roserobinsonnz,08/06/2022,"Lovely staff, great facilities and as close to the beach as you can get. Bonus of the pool!"
25564,1955649,5,lokomoko,07/06/2022,"Cool Spot! All you need after some weeks on the road. Hot shower, BBQ, Beach, Wifi and fresh water. All for 8,5€ “thumbs up” p.s. the hosts are awesome!"
25564,1955011,5,Sina90,07/06/2022,"If you don't need electricity, you should definitely stand directly behind the dune. Super idyllic place with the sound of the sea and direct access to the beach. €8.50 for 2 people including a van is unbeatable. We could order rolls, which were then brought to the car in the morning. Totally nice, helpful staff. We extended one night straight away."
25564,1951319,5,kleu00,06/06/2022,"We had the best time here. The owners and employees are incredibly nice and will put croissants in front of your car in the morning. With a pool, showers, toilet, barbecue area and right by the sea and all for only €8.50 (without electricity). Cooking with sand under your feet, just great."
25564,1921357,5,Brestan,27/05/2022,"Friendliest reception. Everything as described. €11.50/day for campers and 2 people including electricity. Showers with mixer taps. Sanitary spotless. Top price-performance ratio. Direct beach access. Beach bar currently in progress. Bar Casablanca and restaurants 1 km away by bike via a wooden dune bridge. Clear recommendation, would come back anytime. With the best place we had."
25564,1898534,5,miche07,18/05/2022,great area .... top reception .... nestled behind the dunes .... you can hear the ocean roaring .... maximum services for a price of 11.5 out of season ......
25564,1897409,5,chachaaure,18/05/2022,"We were only supposed to stay one night and finally decided to stay another day. Very nice space at the edge of the beach, a great welcome and access to the swimming pool for the sum of 10 euros per night…. Ideal for walks, a 2km path above the dunes which leads to the local fish market… If you are passing through the area, I highly recommend this place!"
25564,1897294,4,masterhh,18/05/2022,Great place with direct access to the water. With the windows open you can even hear the waves. Everything available what you need. Only the Wifi was very weak and the sanitary facilities were getting a bit old. €8.50 but very cheap!
25564,1896113,5,DianaGil,17/05/2022,"5 *. The owners first for their kindness and facilities. The beautiful environment, protected behind a huge dune, a very large and beautiful windy beach. The wooden walkway to the town of Vagos is 1.5 km away, a very nice walk and only 20 minutes. The area is very comfortable, all the necessary services, clean, and with swimming pools and locker rooms with free hot showers for customers in the area."
25564,1894208,5,PetziLanz,16/05/2022,"Great big place, everything available what you need. Beautiful beach directly behind dune. The owners are super friendly and very helpful. Laundry is washed and dried for €5. Highly Recommended. Any time!"
25564,1892909,5,SanvandenBerg,15/05/2022,"Super nice reception, the boy who pointed our place even said thank you in Dutch :). Everything is clean, hot showers, on the beach, possibility to use the pool and all for a very reasonable price!"
25564,1880136,5,sgalonska,09/05/2022,"Goreti and Mário are pouring tons of love into this place and you can see it. They took a dated water park and transformed it into a holiday experience. The beach is on the other side. You can't ask for more. Parking will cost you less than 10€ which is a bargain, given the opportunities."
25564,1878797,5,jmvila,09/05/2022,"Perfect location spectacular place, very clean friendliness and super correct price 11 euros, thanks to the people who start this project with this respect and enthusiasm for the environment"
25564,1871712,5,myv_an,05/05/2022,A super nice place with very loving owners. They do everything to make your stay as pleasant as possible. Come back here anytime. Thanks very much.
25564,1865946,5,PaulaOR,02/05/2022,"A wonderful place, level and spacious plots, 2 meters from a beautiful beach. The owners are a love, they help you with everything you need and always with a smile. Without a doubt, we put it on our list of TOP sites in case we have to return. Price of €11.50 per night motorhome, with electricity, and supply showers."
25564,1865281,5,esthermartin,02/05/2022,"Excellent place, I of you would not miss this area, plenty of space next to the sea."
25564,1855026,5,DieFrauensteins,26/04/2022,"This time 5 stars due to the fantastic location directly on the dunes facing the Atlantic. great beach The reception (unfortunately we are dependent on English and hands and feet) was again very friendly and problem-free. Supply and disposal class and bread service to campers :) With the bike to Aveiro ok, where there are bike paths. Clear recommendation."
25564,1850082,5,GabrieleRenz,24/04/2022,"A wonderful place, direct access over the dunes to the Atlantic. We were welcomed very friendly. Shower, toilet at the Aqua Park. There is even a bread roll service that is delivered to the camper. Unique!"
25564,1849021,5,Wanderfalke-Mobil,23/04/2022,"Top place. Good pitches with sufficient electricity boxes. Dishwashing area with some barbecue areas. 11.50 € for camper and 2 people incl. electricity, water, waste disposal. Apparently the showers are not always available in the high season. Really friendly staff. Top beach at 50m. Another beach bar is being built, probably ready in summer 2022. We will definitely be here more often!"
25564,1844337,4,Volkeryuma,21/04/2022,"A wonderful pitch with direct access to the beach. We only wanted to stay 2 days, it ended up being 5 days. Individual places and supply/disposal top. The somewhat outdated sanitary facilities belong to the adjacent outdoor pool and cannot be used during the day during the season. The operator (with a charming smile) is very nice and helpful. We would definitely come again."
25564,1843211,5,sumace50,21/04/2022,Great quiet place and near the dunes. A very nice break in the middle of the top dunes.
25564,1841924,5,tatirizziolli,20/04/2022,"We really enjoyed our stay here! Gorete, Rafael and Mario were very attentive, helpful and friendly throughout. The space structure is very good, all spaces worked perfectly. The location is also privileged. We stayed for 1 week and for sure if we come back to the area we will stay here again!"
25564,1837743,5,leyenda67,19/04/2022,"Excellent everything, large squares, swimming pools with large slides, mini glof, very clean toilets and showers, beach next door, except for windy days, everything perfect."
25564,1832929,5,luisseara.salgado,17/04/2022,"Fantastic place, very close to the beach and with very friendly employees!"
25564,1823145,5,arsame,15/04/2022,"We loved it. With all the services of electricity, water etc. and also with a toilet building and showers. Direct access to a huge beach. Large plots and well delimited. No shade but highly recommended for beautiful and quiet. Breakfast can be ordered. Very friendly staff and try to make themselves understood even if we don't speak the same language. Price for 2 people with electricity €11.50"
25564,1822459,4,JenniferundMathias,14/04/2022,"It was really nice here and we received a very friendly welcome. 1 star deduction because of the older sanitary facilities. We also missed a few trash cans on the pitch. As a result, many simply left their rubbish by the sinks and the barbecue area."
25564,1816059,4,mabreizh56,11/04/2022,Very warm welcome. Unfortunately the weather was very very bad and we couldn't take advantage of it. Shame...
25564,1815709,5,Josla,11/04/2022,"The location right on the dunes is worth 5 stars, plus bread service to the mobile home, reasonable supply and disposal (drinking water). The very large space is still passable even after heavy rain, partly gravel, partly grass, even for very large mobile homes. Dog-friendly very nice operator, good for several days vacation."
25564,1809123,5,AMR86,07/04/2022,"We felt very comfortable and safe. Playing mini golf is possible without extra charge. Very nice facility that is being prepared for the summer season. You can order rolls, which are then delivered to the mobile home in the morning. Older sanitary facilities with very warm shower. Great for the price, even if it's outdated. We will be back!!!!"
25564,1803304,5,lr110ht,01/04/2022,Super. Everything you need . Price without electricity per day 8.50 euros top. Staff super friendly and helpful.
25564,1801133,4,klr40,30/03/2022,We spent four nights at this beautiful campsite. The price in relation to the services is just right. The man at the front desk was very friendly and gave us good tips for activities and breakfast choices. The WiFi is great. The only reason it didn't get 5 stars is the outdated sanitary facilities. We would definitely come again.
25564,1800374,4,VOJEDANIEL,29/03/2022,Very nice area with a very warm welcome. Possibility to order bread and croissants which are delivered to your CC by the lady of the campsite Huge hot shower.. And all that for a small price 8.5 € 3 € for electricity To do absolutely because at the edge of the ocean and park aquatic Congratulations to the people who take care of it
25564,1796359,5,shellt69,26/03/2022,"Loved this site which is so close to the beach. All the services plus bread delivered (so cheap) and laundry done too (€5 per load dried for you!) Staff were really friendly and helpful so we stayed a couple of nights.
Would go back in the future."
25564,1795904,4,Joebarteam69,26/03/2022,"Very good, welcome, the lady speaks French! Everything you need, only small downside, the showers and toilets are quite far from the pitches. We could not visit the surroundings which seemed really nice because of a capricious weather (wind + rain)."
25564,1791019,5,ReinerWilkus,21/03/2022,"It couldn't be nicer! You feel welcome and just fine, although the place itself still has potential. Beach and landscape wonderful, the place Vaguera is unfortunately a pure vacation spot with little soul. Despite the negative points around it, the space and above all the hosts make it family."
25564,1787870,5,jordennabbe,19/03/2022,What a nice reception. Large Park with all amenities and possibility for breakfast delivery. English speaking owners. The best shower I've had so far! And also close to the beautiful ocean!
25564,1787285,5,JakubRacek,18/03/2022,"Maybe the best place you can visit with your motorhome in Portugal. Cheap, all service included. Beautiful beaches 2 minutes from your car. You can order bread or pasteis and they bring it to your car in the morning! Bar, common room, showers, pools. The owner is super friendly and helpful. Definitely recommend!"
25564,1786659,5,elbkindHH,18/03/2022,"Warm welcome, wonderfully quiet. In winter, the sanitary facilities of the swimming pool can be used."
25564,1783104,5,MoriHH,14/03/2022,"Lovingly managed place directly behind the dunes of the Atlantic. We were greeted warmly and shown the place. Showers in the aqua park next door. All day in low season, high season only when closed from 7pm to 10am. Shower hot and as long as you want. We paid €8.50, electricity costs extra. Supply and disposal is being renewed. Really great and loving place."
25564,1777852,4,ruru12,08/03/2022,"Pleasant area, well equipped (clean showers with hot water, barbecues, washing machine etc). Possibility to order bread for the next day. Mini golf. Friendly welcome. And a great common room with TV games and coffee machine."
25564,1773878,4,STARMCLOUIS,05/03/2022,Very quiet site but very windy hot shower clean sanitary facilities. The only downside impossible to empty its gray water the access ramp was under construction
25564,1771033,5,marcadme,02/03/2022,Super recommended. Excellent treatment and idyllic setting Thank you.
25564,1758378,5,albjaeger,17/02/2022,"Very nice place right behind the dunes; operator very friendly and helpful; perfect for bike rides along the water, everything very clean and well maintained; also suitable for large mobiles"
25564,1756549,5,lenication,15/02/2022,"We stayed a week. Water, shower, WiFi and all of that right behind the dunes. We loved it!"
25564,1756217,5,WindySouls,14/02/2022,"Great campsite! Everything you need, wonderful staff. Do not hesitate to go there."
25564,1744179,5,jnielsen,30/01/2022,Really nice place close to the beach. All facilities available. The sweetest hostess we've ever met.
25564,1743957,5,RSX2020,30/01/2022,"Lovingly furnished place, nice reception. A small house with a fireplace, TV and supply options, really great. We stayed here for two days in January. Many Thanks."
25564,1743512,5,cati85,29/01/2022,Kindly received. Everything is explained when we arrive. Great location. I do not agree with the sanitary not clean. We would love to find lots like this anywhere we go. Many thanks to the owners. They love what they do and it shows.
25564,1741131,5,MaikaeferWW,25/01/2022,"Beautiful CC area, warm welcome and in French. We spent 5 wonderful days, from January 19th to 24th. We recommend."
25564,1731588,5,Fredetpierre,10/01/2022,"Dec 30 to January 1. Perfect area consistent with all comments. Welcome very well, except that we do not choose where we stand. It is more a campsite than an area elsewhere (motor homes, bungalows, reservations ...) the proximity of the beach and the installation of the footbridge over the dune in the background a unique and brilliant place in winter in good weather. We were lucky !"
25564,1726126,5,paologallo77,04/01/2022,Very nice area! Owners were very kind. Services all good and clean. If we travel again in this area we will pay a visit for sure.
25564,1714390,4,4516,22/12/2021,"Very friendly welcome, wild sea, short walk to the beach."
25564,1711785,3,jana95,18/12/2021,"Showers not heated and cold in December, water relatively warm and clean but a lot of mold. 5 € for 2 people to shower, 4 € for gray water & co. Friendly but for € 8.50 a night our prices were excessive. So we only showered."
25564,1708247,3,anissabou,11/12/2021,"The owners are very friendly & the beach is beautiful! On the other hand, the sanitary block is several minutes walk from the pitches and the first 3/4 days when I was there the showers and the toilets were not cleaned. I don't know how often it's done but it was dirty. On the other hand, the shower water is hot and it's super nice to have the beach 20 meters away."
25564,1704782,5,Darek69,06/12/2021,"For this time of year a wonderful place. Deserted beach, total tranquility. 100% nature. Very helpful and attentive owners. Complete facilities. Someone with a pet is not stressed as there is plenty of room to enjoy. We will be back."
25564,1703038,4,Cruizer76,04/12/2021,"Top friendly. Everything you need is available. A few meters to the beach. Sanitary not so buxom. Bread roll service even now in December, phenomenal. Price performance impeccable!"
25564,1700947,5,teeneeweenee,30/11/2021,"Super nice owners, right on the beach. Parking space directly behind the dune. Bread delivery service with delivery to the van in the morning! Toilets and showers okay, but very far from the pitches without electricity. Beautiful beach, about 10 minutes walk to the beautiful beach bar. Clear recommendation!"
25564,1699032,5,titi976,27/11/2021,"For the services only, it is 4 €: full water 100l and emptying. The place is great"
25564,1698765,5,Chaladrian,27/11/2021,"Super friendly, beautiful beach, everything was great :)"
25564,1697317,5,NaKlatravel,24/11/2021,The welcome and goodbye make you feel at home. Near the beach. Quiet. All you hear is the ocean. A little further on is a beautiful tidal nature reserve. Worth a bike ride. Highly recommended!!
25564,1697096,5,MitMichel,24/11/2021,"Spacious place in a great location, nice operators, everything was great."
25564,1687782,5,sunflowernomads,13/11/2021,"Hello again! I was originally going to explore more of the coast and try different places, but Daniel and Mélanie are just so god damn sympathetic and great hosts that I tossed the plan. They have everything I need, and I will be back again for sure as soon as I can. When you leave you are sad but you also have a smile on your face for all the good memories. I feel they genuinely care about their place and that they love meeting and talking to new people. They are also a great team. I was here with my daughter from Friday to Sunday. We just wanted to have a beach to throw a frisbee and the normal facilities. I love the atmosphere of this place, and if you want you can order bread that will be delivered to your door in the morning from these charming hosts. I will see you soon again. Just go there is what I am basically saying?"
25564,1681771,5,janitravels,07/11/2021,"Super clean, good location! Right behind the dune and bread service! And very personable couple who host this place. We'll be back for sure! Highly recommended!"
25564,1680556,5,josemin55,06/11/2021,"Great area! Welcome in French Everything to have an excellent stay: very large pitches (our cc is 9 meters), bread delivered every morning, water available, emptying of the cc, electrical connections, possibility of washing and drying clothes, swimming pools, toilets and showers. And in addition the sea is just behind the dune, with a beach and great sunsets!"
