placeId,reviewId,reviewRate,reviewUser,reviewDate,reviewContent
97542,2489464,5,ArturKrenik,10/11/2022,"Beautiful pitch with direct water connection to the pitches. Everything was clean and tidy, the shower costs 50 cents for 3 minutes, access to the toilet also 50 cents. Super nice reception from the staff. It was a very quiet night. And they even loaned us a vacuum cleaner because we needed it badly."
97542,2485513,4,jcsgalvez,06/11/2022,Very quiet and comfortable area. The only drawback is that it is far from the historic center.
97542,2484098,4,Miguelmora,05/11/2022,"The area is perfect, quiet although our plot is a bit sloping. The guy at the entrance very friendly. The drawback is that you have to pay to go to the toilet, the same as if you go to shower. Other than that, everything is very clean and neat."
97542,2480853,1,van4fan,03/11/2022,Very spending! For a bath 5€ only in Portugal
97542,2473542,5,Katka74,31/10/2022,"Nice, purpose-built parking for motorhomes with all the necessary services. The kind owner is willing to help with everything from finding the right place, advising on accessibility to the Fara or the beach, to providing bread for breakfast. We can only recommend this clean, pleasant, closed area."
97542,2472672,5,francoisebrevot,30/10/2022,"good evening, very warm welcome from this young man who speaks several languages, listens, delivers the bread in the morning to your cc, thoroughly disinfects the emptying platform, very smiling and available."
97542,2471268,5,thierpatou,30/10/2022,"small very clean area €11 per day all services available hot shower €0.50 for 3 mins available wc 0.50 washing machine and dryer quite large location, the car can park there at least on certain places close to the airport but not really embarrassing no plane at night."
97542,2467971,5,Mjhon,29/10/2022,Very friendly welcome and the services are quality and clean! We went there for the services of the motorhome (in the evening it was closed at 8:15 p.m.) but we went back the next morning and it was perfect...
97542,2465887,5,PirataDucato27,27/10/2022,"Small area but very clean and well maintained. The guy at the reception very friendly. €12 van, 2 adults and 1 dog, with electricity. Showers and WC €0.50. Perfect to visit Faro."
97542,2456302,3,lacamp20,22/10/2022,"very clean area, well done services, price 12€ with electricity... it deserves 5 stars, but the noise is really annoying between the road and the planes. For 1 night it's fine, but no more."
97542,2448003,5,mlh38,17/10/2022,"The five stars speak for themselves, the comfort is perfect and the space between each bedroom too. hot shower possible. advice for access do not look for cc but a sign on the left going up the street. The place is not visible because between the houses. Congratulations to the smiling young student for his welcome, his French, and his morning bakery service!"
97542,2434108,5,Alaien,09/10/2022,"Nickel showers, services too, clean, 5kms from Faro with bus nearby. And the welcome is overwhelming, a smiling and very available young man speaking French, thanks to him."
97542,2432314,5,gongovan,09/10/2022,"We spent the night in October, after touring the entire lighthouse center and its beach, we arrived in the afternoon. They are spacious plots and all the facilities are very very clean. Very good value for money, we paid 12 euros for 2 adults, a 6m van and electricity. We have not noticed neither airport, nor noises I recommend using this type of facilities set up for us !! very nice owner"
97542,2430793,5,igor.u,08/10/2022,"Exceptional treatment from the owner, he helped us with everything we asked for, very very very clean facilities and the price seemed more than fair. We went in a van and the price for two people and electricity was 13 euros (in August). super recommended."
97542,2421764,5,Hasen,03/10/2022,"Great pitch! Highly recommended when passing through, to visit Faro it is unfortunately a little out of the way unless you drive in... but otherwise great!"
97542,2421020,4,sendverkansie,03/10/2022,A great place to stay for 1 night if you are traveling. Do not expect too much. The facilities are clean and the host is nice. It is next to the highway and airport so do not forget earplugs.
97542,2420547,3,levyjoelle,03/10/2022,Person who speaks French very good welcome friendly and helpful. Cons: close to the road and a few planes but for 1 or 2 nights no problem. I recommend
97542,2420004,4,estellepesola,03/10/2022,"Secure place with gate; the receptionist is very helpful. 11€ for the pitch and 0.50€ for 3min of shower and for access to the toilets. Very quiet apart from the noise of cars (near highway). No real possibility of getting around on foot, however (bus, bike, Uber, etc.)."
97542,2419342,5,bamanico,02/10/2022,very pleasant and secure area. we came there for 2 nights finally stayed 4 nights. close to bus services to Faro. beautiful walks around on foot or by bike. the welcome is excellent and you will be informed about what you can do in the area. no nuisance with the airport. we liked this place. reasonable price.
97542,2409907,5,AnnieEmme,28/09/2022,"Very nice and quiet area, a little bit of altitude but with the wedges we have solved the problem. Very large showers (50cent x 3 min) and separate men's / women's toilets. The manager is very nice and helpful. It has Wi-Fi and there is a restaurant right next door. A bicycle is required to reach Farò city center and the beach. Otherwise there is a parking lot nearby. We'll be back!"
97542,2401485,4,MichaelScofield,25/09/2022,"Area with all the services (showers and toilets for a fee), perhaps a bit far but well connected both to go to the center (lines 16 and 19), and to go to the beach by bike (bike lane). On the beach you can also take the boat to the center. All this information can be explained to you by the person who runs the Area, which is very nice. If you arrive after hours, by calling the phone at the entrance, if there is room, they will open"
97542,2399050,5,Chantalgiardina,24/09/2022,"very nice and welcoming cheap we spent 2 nights. Faro at 5 km, see fast very close a lot of passage because airport next door. thank you to the little youngster for his kindness."
97542,2398011,4,caocaoye,23/09/2022,"We drove in twice for service. Place close to highway and Faro City. Disposal and filling station is well attended and sufficient. 4€ for service, toilet and shower are not included in the price - a pity."
97542,2392475,5,losdopi,21/09/2022,"A perfect area, little more to add."
97542,2391569,4,0212576119,21/09/2022,"Super area, all services, calm, the owner is nice, shower 0.5ct, 11€ per night including elec, beach 3km away, I recommend"
97542,2376164,5,BigErnie2019,16/09/2022,"Great location, clean facility. We paid €12 for 2 people, including electricity. Large plots. Nice contact with tips from Alfredo = good choice of restaurants in Faro. Many thanks."
97542,2373031,5,nicole340,15/09/2022,"very clean area, well-defined pitches, welcome in French and very friendly. park closed at night."
97542,2366544,4,Zigotto34,13/09/2022,"Very very good . Clean, Well thought out places. The friendly owner. Ideal for visiting Faro. Bus station nearby. . Very clean and new black and gray water drain station. Electricity and water practically next to location Trade and restaurants nearby. A little noisy during the day because of the airport. €11 with electricity. Those who need showers and toilets provide 0.50 €"
97542,2363237,4,MafaldaAraujo,12/09/2022,"Very good and pleasant space to be with the motorhome. Tidy space, arranged, very good conditions. We did very well!"
97542,2362935,5,Henri3413,11/09/2022,"Great place to park in Faro, the owner is super friendly, the place and very clean and well thought out. Well done and thank you"
97542,2353246,4,AldericPORTO,08/09/2022,"A clean and practical area, very warm welcome, all amenities on site. a little noisy (highway and airport) but we are close to faro."
97542,2345283,5,ghirom,06/09/2022,very friendly welcome near bus to the beach and downtown we spent 2 nights pitches very good I recommend be careful however of the resin under the trees
97542,2342435,3,jessyh22890,05/09/2022,We arrived around 9pm and there were still a few spots left. You have to pay 50 cents each time for the toilet and also an amount for the shower. We paid €14 a night for 2 people plus van. At night the gate is closed so is very safe. There is also WiFi
97542,2333159,5,Jowybs,02/09/2022,"We arrived late and caught the boy who runs it, very hospitable. I recommend arriving before 9:00 p.m., then you can leave something to store the plot if you want to go to the city to visit. €13 a night for two people with electricity in August, he lent us some chocks because some plots have some unevenness (little). Clean toilet at €0.5. Shower 3min €0.5. Filling and emptying included."
97542,2311648,5,gubattel,28/08/2022,Excellent location for visiting the city and for taking the nature trails that lead to the beach. We have ridden them with an electric bike on a very well made cycle path. Wooden walkways between observation points of the lagoon spaces. Very kind parking area managers
97542,2304582,4,Jaochavo,26/08/2022,"We have only been one night. The place is small but comfortable, only one toilet and two showers but everything is clean. The stay per night has cost us 13 euros and the showers and services work with 50-cent coins. Shower time lasts less than 5 minutes. All the parking lots do not have electricity, so if it is not full there should not be a problem."
97542,2299429,5,alvaroalcala4,25/08/2022,"Area of 10, small, quiet and familiar. The super attentive and very top staff, both the young girl and the man, both Venezuelans, charming and very close. To put some downside the number of bathrooms and showers, but being a small area you do not have to wait for almost anything. 100% recommended"
97542,2298040,2,jule20,25/08/2022,"Young man greeted us after we rang the bell. Nice in principle, but we were squeezed into a place for a caravan for two with our VW bus and another van. However, we were allowed to pay the price for a large space! As a result, we sat in the middle of the square and everyone could see us eating! No privacy at all although there were still plenty of places left!"
97542,2290117,5,sucrette2012,23/08/2022,super welcoming gentleman who speaks very good French. all services. well maintained grounds. nice to come back
97542,2282311,5,VadoVan,22/08/2022,"Fully recommended area for location and facilities. The boy was very kind and attentive to us, he lent us the light adapter and the shoes without a deposit, which is not usual. A better number of bathrooms, but it is true that we did not have to wait at any time."
97542,2282107,5,axarmango,21/08/2022,"Very quiet area, very nice reception guys. A single WC and 2 showers perhaps insufficient although I have not had to wait. 50 cnts 3 minutes of shower and 50 cnts the WC. I prefer to pay and for them to be clean and not have to wait 10 minutes because we already know what happens when they are free. definitely recommended"
97542,2280857,1,Vichi,21/08/2022,"The description is not right. To the overnight price you have to add all the services you use, which are paid with 50-cent coins. everything works with coins: WC, shower (50 cents 3 min), refilling water... It seems a bit out of place to me."
97542,2278407,5,caroymanu,21/08/2022,"very quiet, neat and clean area to spend the night. with all the services, the guy at the reception very nice and pleasant. recommendable!!!"
97542,2266537,4,JLAVENDANO,19/08/2022,"Very quiet, well-kept and clean area. I don't give it five stars because it still lacks a bathroom and one more sink. Very friendly and helpful staff. We would repeat"
97542,2258720,5,elinatapia,18/08/2022,"Perfect parking lot to spend 2 nights to visit faro, the islands and faro beach. Close to everything, the staff is very nice and friendly, and speak French very well, the showers are very clean as are the toilets, despite the airport nearby, you can't hear a thing. I recommend"
97542,2250653,5,Gabrimr,16/08/2022,Very well. Near the beach. Quiet place with all services. The staff very friendly. 100% I recommend it
97542,2249491,4,Damkil,16/08/2022,"very friendly welcome, easier for us because the person speaks French. very clean place. arrive early zn high season because limited space. shower and toilet works with coins of 50 cts"
97542,2202879,4,cristina29,09/08/2022,"Ample spaces for ac, level and shaded. Guys responsible for the charming area and very helpful. Showers 50 cents 3 minutes. A single sink in the entire area. Water connection in each plot and electricity, which is included in the price (€12/day). A couple of days are enough to visit Faro center and Praia de Faro. Bus 5 minutes from the area to go to both sites."
97542,2200783,5,mies2001,09/08/2022,"We arrived here at 10:30 PM and depart tomorrow morning at 7:30 AM for our flight. Reception was closed but Alfredo answered immediately. The places were full, but we were allowed to use the parking space in front of the gate, which is also fine! For 13 euros we got the code, hot shower, drinking water, toilet use and WiFi code. Really very attentive!!"
97542,2184227,5,AC2J,06/08/2022,Great welcome. Very well located for visiting Faro. Pitches a little sloping but they lend wedges. I highly recommend.
97542,2181033,5,catchaway,05/08/2022,"Great parking for the night around Faro, it has everything you need. Showers and toilets payable 0.5 €, camper service included in the price. When you are staying for one night + € 1. Very nice owner of the facility."
97542,2154112,5,waddle82,01/08/2022,a super cc area. A bus to go to Faro beach and another to go to the city center. The young people who hold it are adorable. I recommend.
97542,2151590,5,Bibiche013,31/07/2022,Quiet and practical motorhome area. Pleasant staff.
97542,2139637,4,GloriaM89,29/07/2022,"Although it is a bit far from the center, we recommend it. Despite reading the price in the comments, we were charged €13 per night. The WC and the shower work separately with €0.50 coins. For the first one with a coin is enough, for the shower you have to recharge. Very quiet place despite having quite a few fires and AC."
97542,2114358,4,Agavic,24/07/2022,"Nice area with all services. washing machines, dryers, the night is 12€. Paying showers and toilets. Count 5km for the super beach with bikes. Only downside, the noisy road that you hear if you leave your skylights open. I recommend"
97542,2113839,4,guiry,24/07/2022,"Great place, very friendly and polite staff, they have explained everything to perfection, the plots quite well and with electricity included, we also crossed the pedestrian bridge and entered the town until we reached a small roundabout and bar just in front of the right eats great and very bratito."
97542,2099105,4,jeannegamar,20/07/2022,Very friendly welcome...in French and English: everything is clear. The tip for the beach ferry to Faro (round trip) is great: I loved the crossing! 12 € per night shower at 50 cents is reasonable. Thanks
97542,2059947,4,odilecarbonnet,11/07/2022,"very good but it lacks a small shelf in the shower to put its products we have to put them on the floor. if you arrive at 7 p.m. for example, you have to tell yourself that you have to leave before noon the next day otherwise you will pay another day anyway it is very good"
97542,2056035,4,grobje,10/07/2022,great place! Spent 3 nights. Everything is clean and they are super friendly and helpful.
97542,2052357,5,corinnelehmann,09/07/2022,"very clean, has everything: electricity, toilet, shower, water etc. and nice staff with good knowledge of english. relatively calm. 4 people with mobile home approx. €15"
97542,2050466,1,hmo001,08/07/2022,"I sent an email and then immediately called. I wanted to book a place for 10 days. Response from the park""we don't make reservations, it's on a first-come, first-served basis""I arrived today…one week before the concentration…I went there and they said they only had one spot and it was just for one night, because the rest of the spots were already reserved for customers who were going to arrive …. THAT IS, THEY RESERVE TO SOME AND NOT TO OTHERS… I didn't understand. But it is what we have."
97542,2042848,4,Migueaxn,06/07/2022,"Motorhome area very close to Faro. Nearby there is a bus stop that takes you to the center although from the same ""campsite"" in uber it takes 10 minutes and you pay 6-7€. The area is very well maintained, it has electricity, water and drainage included in the price and the workers are very nice and help you in everything they can. The price is €13 one night and €12 the following nights. Highly recommended."
97542,2038675,5,gabyschimpf,04/07/2022,"nice parking space, good way to cycle into town and to the beach. nice personel"
97542,2016706,5,3Amigos3,27/06/2022,Very clean facilities and super friendly staff.
97542,1994084,5,jean-claude65200,20/06/2022,"Very well laid out, wooded area, worthy of a campsite. Very good WIFI. We didn't find it noisy at all. Excellent welcome in French by a young Venezuelan who suddenly speaks Spanish very well and makes great efforts to speak French"
97542,1983802,4,liliboyyz,16/06/2022,"Parking place with all the necessary amenities (washing machine, dryer, toilet, shower, electricity, emptying place, WIFI, classic + sorting bins). We paid 12€ for the night. You have to leave before noon the next day. There is a charge for the toilets: €0.50/3min of showering and €0.50 for going to the toilet. Be careful, there is only one toilet, the wait can be a little long… On the other hand, the toilets are very clean, and the parking lot too. There is also a sink for washing dishes and the water is drinkable."
97542,1955713,5,AndreFritz,07/06/2022,"Stayed one night from 6-7. 6.2022, 12 euros with electricity I think is totally fine. Showers and toilets 50 cents, everything very clean and would come back anytime. Friendly staff gives a code for the gate if you want to drive back in later. RECOMMENDATION!"
97542,1955411,5,omp1910,07/06/2022,"Stayed from 23/05 to 25/05 / Great and warm welcome. The parking space is comfortable and the old town of Faro, like the beach and the Ria Formosa, can be easily reached by bike. Showers and toilets very clean. Absolutely recommendable for a short stay to explore the city and the surrounding area. 11 euros including electricity are absolutely fair."
97542,1940939,5,remMacMiller,02/06/2022,"Very friendly and helpful owner, clean sanitary facilities and tidy campsite. If you are not bothered by occasional to rare aircraft noises. 50 cents for a warm shower (3 minutes) and 50 cents for using the toilet. Would come back anytime!"
97542,1929996,5,loppieontour,29/05/2022,Super friendly staff. Beautiful camper pitches with clean sanitary facilities. €11 for 2 people and electricity. €0.50 for a 3 minute shower. From the motorhome you can enjoy cycling / walking in Rio Formosa Park. We took an uber to the city (+- €6). Definitely recommend this place.
97542,1913827,4,MiradaErrante,25/05/2022,We have been at Easter one night 12 euros and more nights 11 €. Perfect for visiting Faro. Very large squares.
97542,1910852,4,zorzal31,23/05/2022,"We priced an Uber to The Cathedral for 5.60, why deprive it."
97542,1907495,3,Ibs,22/05/2022,"Extraordinary motorhome area. Very friendly owners, everything clean and organized. We asked for a taxi (it was not an official taxi driver) to take us to Faro and he charged us 15 euros when in reality it was worth half. We had the feeling that it was put to good use. Ask for taxi service with fixed rate."
97542,1900326,4,DominiqueBARET,19/05/2022,"Area located 5kms from the city center, continuous traffic noise especially early in the morning. Electricity water drainage, included in the price. On the other hand, the toilets are paying (50 cents) even the toilets! Correct reception, speaks French.."
97542,1894605,5,myv_an,16/05/2022,Perfect place to visit Faro. The showers and toilets are very clean. The owner is very friendly and helpful. He gives great tips.
97542,1887370,5,jpveroul,13/05/2022,"very friendly welcome, very clean if you go by bike to faro remember to take the footbridge to pass over the 4 lanes"
97542,1882255,5,Fendi01,10/05/2022,"Conveniently located to the center of Faro, by bus line 16, approx 20 mins €2.35. Bus stop about 200 m. Very nicely laid out, very well maintained and clean. With the bike in the city ??? Everything for campers available."
97542,1880449,5,Minorca58,09/05/2022,Great stay. Staff very kind and helpful. Top cleaning. I will return and highly recommend it
97542,1878770,5,Aliciadani,09/05/2022,"Perfect place to spend one or more nights, the staff is kindness personified, everything is facilities. To visit the center of the lighthouse and a natural park that is next door, they offer you electric bikes for €25 a day and which are also in perfect condition."
97542,1872274,5,arno252,05/05/2022,"Positive points: super friendly welcome, tips for getting to Faro by bus, impeccable cleanliness, top wifi, great place for only 12€ with electricity, very clean showers for 0.5€. No negative point."
97542,1869942,5,Tomkampie,04/05/2022,Very good everything clean and good WiFi
97542,1869652,3,Costablanca,04/05/2022,"We were a couple of days in this area and very happy, ideal to get to know Faro if you have a small motorcycle in the motorhome. Land with quite a slope in some plots, and somewhat complicated to move around it with a 9m motorhome as is our case."
97542,1864742,5,VincenzoT4,01/05/2022,"Very good place to spend one or more nights. Very friendly staff, super clean services, several trees to leave the van in the shade. And with 12 euros you can spend the night, not like the campsites that charge you 50 euros for one night..."
97542,1861603,5,JohnnyFonteyne,30/04/2022,"Safe place to visit Faro. by taxi you are there in 10 minutes, price about 10 € with bus 16 you also get there quickly. very friendly welcome and all services available. there is a restaurant at the entrance but it was closed when we were there. We stayed there for 2 nights."
97542,1859334,4,esojcamper,29/04/2022,"Area well organized and well maintained, with very attentive staff. Low prices. It's a space with few seats and only one shower, but it works well."
97542,1851569,4,ppois41,25/04/2022,"Very well maintained area, quality services including washing machines, cash dispenser, etc. Friendly owners who speak French. For 13€ per night for 4 with electricity, it's really a great discovery!"
97542,1851420,5,michellec1989,24/04/2022,"Stayed for 1 night. just 1 toilet and shower but it was so cheap, we didnt mind. we paid €12 for 1 night, plus 50c everytime we needed the toilet or shower. The Lady at arrival was brilliant. she was so helpful with food suggestions and showing us what was in the area. would definatley recommend"
97542,1835696,5,mccaravana,18/04/2022,"Very nice play to spend the night. Quiet, with all services and helpfull personal"
97542,1826916,5,patritri,16/04/2022,We stopped to do the water change (4 euros). Clean facility and very friendly staff.
97542,1820961,4,Peterpwh,14/04/2022,"Quite good area, electricity emptying and filling with day of stay €12. The person who attended us is very nice.Bathrooms from €0.5, filling and emptying from €4 to €6. The planes are hardly heard. Perfect to rest a day. I will be back"
97542,1817427,5,herby2022,12/04/2022,"Perfect place if you want to stay one night or also a few nights! 12€ only, service station included. There‘s a bus going into the city, we used uber."
97542,1815661,5,cbn,11/04/2022,"Ideal place to visit Faro. By taking Bus 16 you are in the historic center in 12 minutes. The parking spaces are well delimited, electricity for all, 1 toilet and 2 very clean showers. The staff is really nice and professional. We stayed there for two days with no problem."
97542,1804891,5,TDausend,03/04/2022,"Great spot near the airport without hearing the air traffic. Very quiet. Parcels big enough. Everything very clean including the showers. Above all, very nice, friendly and helpful operators. Faro can easily be reached by bike or even on foot. Walks through the dunes are also possible from here. Actually only wanted to stay one night and it became 4."
97542,1803235,5,Chris9422,01/04/2022,"Secure place, very well located for visiting the city. Excellent hospitality and affordable prices."
97542,1799455,4,gajettelaiv,28/03/2022,"We came only to use the showers. It's a small lot for camping with everyone very close to one another (10€ per night, all services included). For showers only, it cost 4€ to use their services plus 0.50€/3 minutes. The 4€ also gave us access to water fill up and dump station. The showers were very clean and hot. The staff was lovely and spoke excellent English."
97542,1793542,5,TeeBaynen,24/03/2022,"Neat, good wifi, draining and filling options. € 0.50 shower and toilet. Quiet and cozy place."
97542,1787291,5,AMR86,18/03/2022,Super great place! Great and modern sanitary facilities. Wifi super fast and good. Could watch movies with it. We felt very comfortable and can only recommend the place. Super nice operators
97542,1786345,5,LaurenceLabusch,18/03/2022,"Great place, great value for money, WiFi faster than ever. Owner incredibly friendly. Come again!"
97542,1784218,5,flashhusky1,15/03/2022,"Clean, well-run facility with very nice owners. The boss even cooked or grilled on Sundays for a small fee."
97542,1782313,3,HindrekSepp,13/03/2022,"small place. Beach 3km. We are 1 night only. Clean. Reception nice. Other edits are all 0.50e. So to use the toilet, take a shower, you must have 50 cents with the bag. Stop by ok."
