placeId,reviewId,reviewRate,reviewUser,reviewDate,reviewContent
82859,3241449,5,Tucha,31/08/2023,"It is not a caravan park. It is a space where you can park and there is no prohibition sign. We spent a day here and stayed overnight. Very peaceful. In front of the hotel, bus 16 passes directly to the center of S. Sebastian every 30 minutes. €1.85 each trip. It is regrettable that there are no paid motorhome parks in S. Sebastian. Wonderful city but not caravan frendly."
82859,3070782,4,benjaminestable,03/08/2023,"Nice location on a dirt parking lot, the places are a little sloping but the site is good, on the GR with a great view and hiking trails and not far from the city center on foot and from a bus stop, ideal <7m"
82859,3055033,4,TomiBacon,01/08/2023,A quiet place among greenery
82859,3037675,3,Pepperli,29/07/2023,"Here we stood one night. Unfortunately, people still came at night who wanted to use the parking space, and not exactly quietly. The garbage disposal also emptied the bottle container at night. But otherwise it worked. The amusement park above offers unique views of San Sebastian. Be sure to stay until sunset."
82859,3026438,4,ImaGIN22,26/07/2023,"Nice spot for camper vans: around 8 places. Quite small, the place quickly becomes friendly. In the shade. Right next to the road, but from the 22hoo everything gets quieter. Near hotel, hiking trail, and superb view. No amenities on site. Perfect for a night without the need to cook or anything."
82859,3016756,5,jeanden,25/07/2023,great. quiet.. great view at 20 meters. parking lot with 8 large spaces max. it is slightly sloping to put on hold and perfect night .. we immediately feel in the Basque country on waking. the ewes. view . the Basque hotel .. at the top.
82859,2691702,4,stessyrivalin85,23/04/2023,"Parking near the city, possibility of a short hike with a great view. No convenience, relatively noisy with the road, not many level places."
82859,2603482,5,TimdelaT,09/03/2023,"All paid parking around the center and not here, there were more campers so it felt safe. The branch end down is quite okay and you can walk from two sides, so a nice circle around, if you take the less passable path you will reach a beautiful view of the bay after a few minutes!"
82859,2523224,4,kundalininomad,17/12/2022,"Free parking overlooking the city and the sea, can be noisy with cars, walkers and rubbish collection trucks, but it’s fine for an overnight stay…… 30 min walk down to the beach and old town……it is what it is, don’t expect paradise but I’ve stopped at worse spots……"
82859,2283667,3,sil_van,22/08/2022,"to sleep if you can't find another place. Passage of the Camino de Santiago, next to the hotel (they do not provide breakfast if you are not staying) Quiet night despite having the road stuck"
82859,2207688,2,HansElfi,10/08/2022,Only suitable as a day parking space. Way too loud at night. Busy activity and traffic noise from the street.
82859,2179996,5,celine35290,05/08/2022,Super nice little parking lot!! But very small. You can walk down to the beach in 10 min. There is a funicular and a playground a few meters away. Be careful if you continue the road you must necessarily enter the park and pay.
82859,2130834,5,Gian.luca,27/07/2022,"great spot, very quiet at night and during the day. we left the camper all day without worries. To visit the city you can go down a small road and in 10 minutes you are at the Hondarreta beach. Or bus 16 in front of the hotel. There is also a path that takes you to a cliff in 10 minutes."
82859,2077847,3,mariiietee,15/07/2022,"Without further ado, to spend one night and that's it. Quiet night but nothing special."
82859,2001422,4,Farlafinita,22/06/2022,Good place for 1 night
82859,1955468,5,albacano,07/06/2022,"Very good place, it is very quiet, I arrived after 10pm and got a place. you have the trash so you don't leave anything, if you come use it. We slept several vans. It's great and you don't have to worry about paying for the blue zone!"
82859,1747035,5,unbekannter,03/02/2022,"Small gravel parking lot next to the hotel parking lot. Quiet, a few hikers pass by. 30 minute walk down hill into town. There are dumpsters on the square."
82859,1734100,3,Montezelin,14/01/2022,"Great but not flat, too bad we would have stopped there for the night."
82859,1700340,4,victorm.94,29/11/2021,"Small parking, but with sea views and several garbage cans for recycling and everything"
82859,1595681,4,Vivi92,20/09/2021,Really top location and close to bus stop 16 which leads directly into the center. Near Mount Igueldo
82859,1493617,4,Bruno_P,21/08/2021,"Beautiful view of the city, a free spot without amenities but given the hassle in the city it was welcome when arriving at almost 6.30 p.m."
82859,1304567,2,viajeroslocos,07/07/2021,"Too far away of the beach and the city. Although we enjoyed the 30 min walk on the way down, later it was very exhausting to go uphill. During the night we were bothered by all the noisy trucks coming with 1-2 hours of intervals to collect the different trash bins. Also early in the morning trekkers are passing through the parking spot."
82859,1265488,3,Frost_Viking,20/06/2021,"Dwarf place, for 3-4 Ac at the most and if you have room, half an hour from the beach, yes, then it is time to go up and climb telita. You have a dirt road that starts from there that will lead to a viewpoint with beautiful views of San Sebastián. If you just want to spend the day without spending the night, it is best to pay the blue zone next to the beach and you are 5 minutes from the beach"
82859,1029493,3,MartaSampaio,06/09/2020,"I spent one night here, there was only another van. Maybe because it was a Saturday night, but there was a lot of people coming by night and in the morning a lot of noise too. 30 minutes walking to the beach. it's a bit far from everything as it's up hill. free parking."
82859,933462,3,tipexvan,05/08/2020,"A very good site for troubleshooting. No convenience, a bit of passage in the evening and in the morning but very useful for sleeping in such a touristy city."
82859,716244,5,AlexBabi,08/10/2019,"We were complicated to find parking in San Sebastian. We decided to depart a little from it and this reference place is a small area where you can make a good stop, or even spend the night, if the road is not very busy, I do not know."
82859,702434,4,Lootsssss,23/09/2019,"Finally a place rather easy to access, with room and rather quiet in St Sebastien. Rather Flat, shady, garbage cans nearby. We had shot so much in the city that we were happy to be here. Superb view. Just walk a bit to reach the beach (15/20 minutes) by a path. By bus from 12m KarasGo"
82859,650162,1,magnickfico,22/08/2019,Quiet next to the road and a hotel. Without services If you go down the grass path there are beautiful views of the ocean.
82859,537140,1,Estel31,03/07/2019,"To avoid in high season because noisy night at any time, passage and cars without stopping, the car park is constantly filled, garbage truck every hour (for what purpose ..?) ..Damage because the view is nice, 2/3 places van or camper, finally in the company of chickens and roosters nearby that ultimately prove the least annoying."
82859,508593,3,lolojerem,08/06/2019,A bit noisy at night (car dumper) and morning hiker but we had a good night. Descent to the beach by the hiking trail 15-20 min. free and practical spot.
82859,469042,2,3surlaroute,27/04/2019,Rather noisy but it helps for one night. Great view of San Sebastian. On foot take the small dirt road on the left to discover a splendid view of the bay and the cliffs. I would not leave my motorhome alone for the day.
82859,324838,2,sasegar,10/08/2018,"Acceptable place to spend the night. Without any service and something noisy, usual passage of vehicles and walkers. It is full of campers and campers, so it's better not to arrive too late."
82859,274850,3,Dje72,25/06/2018,Nice place seen on the city illuminated at night. 20 minutes from the beach on a hiker's path. Not too much noise at night in the direction of Mercury Hotel.
82863,2011481,5,Xavesp,26/06/2022,"Perfect and quiet place to spend the night, at the entrance there is a sign that says that it is allowed. It is 4 km from the start of the Mu route (walkways)."
82863,1900113,2,Madge21,19/05/2022,Next to main road so not private although not too many cars pass during the night. Much better at the other area in the village near the river. Handing for parking up to village for bakery or restaurant. No shade.
82863,1796103,5,furgonetiis,26/03/2022,quiet place near the village and the bakery
82863,1778143,4,furgolola,09/03/2022,"Quiet parking you can spend the night, specified in the sign at the entrance. no wc bar and bakery nearby."
82863,1416227,3,Olminen,07/08/2021,"Very quiet parking for the night, specifically allowed on the entrance sign"
82863,1355516,3,Remolin,23/07/2021,"Quiet parking where you can spend the night, nearby there is a highly recommended restaurant where they serve a good menu."
82863,1257341,4,Kenny_castil,15/06/2021,We were in another one that is further down. Next to the pools. It is an area enabled for AC Very quiet. It has no services. The town has a beach bar next to the river (where you can bathe) and it has a commissary and a bakery.
82863,1184486,3,elsdos,03/05/2021,"We parked to eat, very comfortable since it is located next to the road to Balaguer."
82863,1053380,4,Perot,17/09/2020,"It is to be thanked. Almost inside the village. A normal car park, but with a very interesting note: Motorhomes can spend the night !!! Thank you very much town hall. Despite being on the side of the road it is not too noisy. Nearby a good restaurant for lunch, dinner or fork breakfast."
82863,278505,5,maripili77,01/07/2018,"Parking in the village. We have spent the night very quiet even being close to the road, in the morning more movement. Bar / restaurant nearby, bakery with good pastas and breads .. Near the river."
82867,3186468,2,Jr7231,20/08/2023,Shaded parking close to the city center. But extremely noisy due to its proximity to the main avenue and the fire station (we were there on the night of Saturday to Sunday).
82876,1135848,1,hasenteufel,07/02/2021,Just ugly. High-rise buildings without end.
82876,975512,1,IgnacioJ,17/08/2020,One more street. in summer crowded with cars and people
82876,440924,4,sagareca,17/03/2019,"Throughout this area in low season you can park without problem. We have stayed one night and very well, next to the beach, restaurants and shops"
82876,304423,1,Nicocampingcar,28/07/2018,No place in July.
82885,1825352,4,posvasereso,15/04/2022,"To go on the road is fine. We spent Holy Wednesday night in the middle of another camper and a trailer. Very quiet night, the only noise (logical) when the truck started to continue its route. We had breakfast in the restaurant and the waiters were a bit dry, like someone who deals with people passing through and if they don't come back, it doesn't matter."
82885,334107,3,Toniomorrosco,14/08/2018,Acceptable place to stop or even overnight. Without services
82907,422335,1,Heinz54,13/01/2019,This can only be achieved with a very off-road mobile home. The journey is not worthwhile. Except for a normal picnic area nothing is offered here.
82911,2914619,3,roadtripLV,02/07/2023,"Camping that does the trick for one night. Average sanitary facilities, toilet paper is outside the toilets, it's a concept... lots of noise and lots of mosquitoes, bring mosquito nets and mosquito repellents. I still give 3 stars because the campsite is directly on the beach, which is very nice!"
82911,2527351,3,familieHommes,24/12/2022,"Great campsite, neat shower, nice lady at reception. Unfortunately nothing to do for children. 1 playground at the restaurant, but our 4-year-old daughter was too small for that. Beach is forbidden for dogs, but camping guests are not addressed about this, so unfortunately a lot of turds on the beach"
82911,2461743,4,fanthi34,25/10/2022,Pleasant campsite during the week numerous and clean sanitary facilities restaurant very correct and good price
82911,2101277,2,MaudDoux,21/07/2022,"disappointing because not restful a lot of noise day and night. many people, children shouting, many dogs barking, signaled and as an answer: the Spanish dogs louder than the French.... oops! No regulation on the hours of night activities it seems? The cleanliness and the beach ok hence the 2 stars stayed 3 nights instead of 10 Too bad !!!!"
82911,2020134,5,mochibike,28/06/2022,"We were on the bridge in May and we were delighted with the site, you have the beach 1 minute away and the parking spaces were quite spacious. recommendable"
82911,1888403,3,Valli83,14/05/2022,"In fact, avoid weekends. Everyone knows each other and parties late into the night with barking dogs and screaming kids. Sanitary outdated and not very clean. Wifi and mobile data at a minimum."
82911,1877382,3,dodogun,08/05/2022,"Camping not very cozy but with a beautiful beach by the sea .. be careful a lot of permanent caravan then… the weekend is the fiesta .. barbecue, it smokes it sings it speaks loudly so it makes noise … we can like but that's not too cool"
82911,1468764,5,borjaymaria811,16/08/2021,"Good campsite, in a beautiful place, we will return for sure, very quiet midweek, the weekend is already a campsite like any other"
82911,1466427,3,Melones,16/08/2021,The campsite is very well on the beach the facilities are good the only thing that has terrible is the bar insulting attention bad service hot beer and expensive price
82911,1208170,4,Selvaprada,20/05/2021,"The front row a hit, right on the ocean. Great, clean sandy beach. Friendly welcome, clean sanitary facilities. V&E. Only, the guy in the shop could be a little friendlier…. In May 2 nights with a dog 56 euros, reasonable."
82911,884262,1,larambla,20/07/2020,"Very expensive, € 48 a night, they charge you even for the dog"
82911,788763,4,sylser,29/02/2020,"Good campsite, clean shower, on the beach. ACSI price 18 €"
82911,776339,4,jammumad,04/02/2020,"On the beach, good facilities and good treatment. Cleansed . We were first weekend of February and very quiet. recommendable"
82911,543057,4,Buho,07/07/2019,"Good camping on the beach, very clean, spacious plots with shade. Clean and modern services. Parcel price type B = € 42 per day 2A / 2N for motorhome, with electricity included. Recommendable."
82911,533741,5,rokittoz,30/06/2019,Excellent camping on the beachfront. Very good facilities and very quiet in low season and rest very well. Acsi accepts and car plus caravan and two adults plus light and large plot 18 euros
82911,450189,4,Melina85,07/04/2019,"Good campsite quite economical but very noisy. Positive point the showers, the building of the showers is heated and clean."
82911,423649,4,sam'plais,20/01/2019,"Very good, quiet and sanitary heated and clean, emptying of sewage and water outside freely available."
82924,3204388,2,HugoMiguel,23/08/2023,"Good park near the river beach, but unfortunately in August it becomes impossible for an AC to park there. Very funny beach, but when I was there almost no one could move there, as there was a huge crowd in and out of the water. car parking was down the road up to 1 km. AC Micas do Jaime gives 2 stars"
82924,2922985,2,beccyanddan,04/07/2023,"Heaving with tourists. Zero mobile phone coverage anywhere around so couldn’t stay, (vodaphone, meo & nos!)"
82924,2020079,5,van_142_,28/06/2022,"Good parking lot to access the beach. The spots are large enough but be careful because cars tend to park in the other side of the road, making it difficult to leave!"
82924,1837626,5,byexinha,19/04/2022,Parking place to go to the river beach which is quite pleasant.
82924,1406175,3,zigalpt,04/08/2021,"The village and the natural swimming pool are lovely. although the water is cold, there are all the facilities you need (changing rooms, cafe, bathroom, etc). During the day it's really hard to find a parking, especially during tourist season (and it's very steep and uneven)"
82924,626978,3,ruimartins,14/08/2019,Spectacular beach in the middle of nature. To park it is convenient to arrive at night because it is full during the day and there is a lot of confusion.
82977,2383176,1,rufach,18/09/2022,"VERY UNLEVELED place. A LOT. This app is called PARK4NIGHT to be able to park and sleep, and in such a sloping place I don't see fit to sleep there."
82977,2007245,3,Burgaillo,24/06/2022,"Let's see, the site is what it is, a parking lot for cars that are going to visit the cave. It is quite inclined, you can sleep, but come on, it is for what it is, to visit the caves and, if anything, to do a route, forget about sleeping"
82977,1813486,3,ourworldheritage,10/04/2022,"Parked to visit the cave. With our van of 6m we already had to take three places. Quite sloping, so I wouldn't recommend this for an overnight stay. Beautiful view. Cave visit recommended, the disadvantage is that the tour is only in Spanish."
82977,1797553,3,beloncete,27/03/2022,"Perfect for us, but if you measure more than 5'40 you will occupy two seats or part of the islands. There are no larger squares. We arrived at night and no one was there. Then it fills up, the caves are very visited."
82977,1406452,5,maikelWeisenberg,05/08/2021,"We have spent the night here very quiet. We even put the heat on. As they say, some unevenness but the site deserves it. Perfect for visiting the caves now in the morning."
82977,780982,3,thegatehouses,15/02/2020,"Parked for the day to see the caves. 
As people have said, slopping parking but good views of the town below. 
Caves were very good,  well worth the entry."
82977,496369,3,gepetto66,29/05/2019,While waiting to visit the caves we spend the night on this parking lot. Sloping our big holds just enough.a beautiful view of the village.Calme except some dogs that bark in the bottom of the valley.
82977,410676,4,bumblebussing,28/11/2018,"Great spot to park if you are visiting the caves.(which is very worthwhile... 3 euros  pp to see some of the most prehistoric cave art in the world) 
The ground is on a slope and if busy the car park might be quite tight to turn in. We were fine in LWB van.
 Great views and a nice 30 minute walk to the top of the hill with incredible 360 views. We didn't stay the night but I am sure you can."
82978,2356016,4,Sarahnoa,09/09/2022,"Were on 01.09. there. Very quiet pitch. we were alone We were probably there during the holidays, so no other people to be seen in the morning, except for a member of staff from the school or the gym."
82978,2217603,3,johancindy,11/08/2022,Next to the gymnasium. OK for a quiet night. No service. OK all templates.
82978,2029076,5,jerogib,02/07/2022,A quiet car park for a break or for the night. No problem for large jigs.
82978,1845776,5,Kaesekuchen,22/04/2022,"A hike to Ermida starts one place further in S. Miguel. It's a circular route. We recommend. The map can be found at the church of S. Miguel. There are also a few parking spaces at the church itself, but only up to 5.40 meters in length."
82978,887657,4,meguils,21/07/2020,Quiet parking in July (because there is no school). Passed a night no problem.
82978,535837,4,Cristinaha,02/07/2019,"Parking of a flat and quiet school to sleep. We spent Sunday night and there was no one, perhaps in school days there was more movement."
82979,3099719,5,FannySalHer,08/08/2023,"We slept super quiet, with the smell of nature and wonderful views, there were more cars parked but we were alone to sleep. Difficult entrance for motorhomes. well leveled. Drinking water source about two minutes walk"
82979,2234575,4,carmenmone,14/08/2022,"A very quiet parking lot, with views and close to the historic center. When we went in the middle of August we were alone and without any problem. It has no services, but there is a fountain to fill water in the next street. Difficult access for motorhomes, since it is reached through somewhat narrow streets, but no problem for campers or small ACs."
82979,2222075,3,Marratxi,12/08/2022,"For motorhomes or campers of more than 6mts it is difficult to access. After a right turn on a narrow street, there is a steep ramp with loose gravel. Otherwise, very nice place and seems quiet"
82979,2201494,4,CokeCisternas,09/08/2022,"Very quiet place to spend the night. You sleep with a slight incline. We sleep one night during the week, it may be that on the weekend there is more movement and noise."
82979,2147027,4,erligothur,30/07/2022,The parking lot was empty when we arrived this morning. No difficulty of access by van. The water point is a fountain on the street that follows. We stayed for a few hours. Possible to spend the night there
82979,2110831,5,Chulapinha,23/07/2022,"The great site although we recommend it only for vans. Quiet, very nice views and a few steps from the historic center."
82979,1997575,5,vancitan,21/06/2022,"One of the best places we have found in Galicia, we have come by van and we have spent a super quiet night, at night they light up the cathedral and there are beautiful views. The townspeople are incredibly friendly and the town is one of the most beautiful in Spain. This stop is highly recommended."
82979,1618739,4,yoyasa,30/09/2021,"Very nice and very quiet place, the AC has it more difficult to get there, the vans without problem, next to the town."
82979,1590460,3,Boltthrower,19/09/2021,"The site is very good, parking surrounded by greenery on the outskirts of town, we were in mid-September. We were unlucky because it was Friday and at 3:30 in the morning the bottle boys came and we had to go to the motorhome area of the town. If it weren't for that I would give it 5 stars. I guess there won't be that problem on weekdays ..."
82979,1485549,5,Carlester,20/08/2021,We have spent a very quiet night. The town is about to knock but you can't hear anything. Narrow streets but no problem for a small van.
82979,1440314,1,Miranda05,11/08/2021,For AC it is not worth the stress of trying to get there. Narrow streets with parked cars etc. The AC area is right next door and it's pretty cool.
82979,1321945,5,soanpre,13/07/2021,"We were the only parked van and we had a great, quiet night. You also take four steps and you are next to the historic center. We had dinner in the cathedral square at “Bodegón a catedral”, a recommended place if you like quality homemade and traditional food at a good price."
82979,841550,3,OlXt3873,29/06/2020,"Beautiful area on interlocking cobblestones, unlit close to the historic center. Difficult access and avoid for large motorhomes."
82979,629636,4,jpz,15/08/2019,"In fact the exit turn on the left passes alone, without maneuvering and at once."
82979,625287,4,jpz,13/08/2019,Superb parking. Empty: we spent the night at 2 CC. Only for small CC Maxi 7m. To leave the same road only to go (watch out for balconies) where turn left on the small square. Feasible in 2 or 3 times.
82979,501928,3,RoamingFree,02/06/2019,Super nice park and very quiet. The town is lovely and well worth the stop. No amenities but shops/restaurants within walking distance.
82979,366005,3,Gubouchecar,06/09/2018,"We stayed one night at 2 RVs. Very quiet, access a little narrow but it passes. Nice view."
82979,294398,5,fabadin,20/07/2018,"Incredible views of the bell towers of Mondoñedo, very lonely parking ideal to sleep. A tasca nearby to try the broths of the ribeira sacra. Supersitio."
82979,275305,5,busbusCH,26/06/2018,"We spent a very calm night there. Local police showed up to count the cars, but didn‘t react on our van at all :-)"
82991,3268191,5,Fleur1808,07/09/2023,A beautiful little park with barbecues and benches by the water. Quiet and with space. I recommand it ! Small shop and bakery in the village 20min walk
82991,3187816,4,demamidema,20/08/2023,toilets closed. Otherwise nice. Lots of space - all in the shade. Think many campers are overnight.
82991,3160576,4,AlejandroOG,16/08/2023,idyllic location and perfect place to spend several nights but the bathrooms are closed.
82991,3151409,4,HooLee,15/08/2023,Quiet area surrounded by nature. Nice views. squares not fictionalized
82991,3144176,5,spujolt,14/08/2023,"Very good place to stop to rest. We spent the night and super good! Many campers, green area to do yoga, water points and tables."
82991,3143129,5,RaulJorquera,14/08/2023,"Beautiful place, allows bathing in the swamp. It does not allow camping, but if you sleep in a vehicle or AC, the police passed by making rounds at night (9:00 p.m.) and everything was correct. There's even maintenance cleaning the place. The bathrooms are closed, but there are some outdoor sinks with water (not very clean). Picnic tables, barbecues and shade everywhere."
82991,3120292,4,slavenant2,11/08/2023,"Great place, great view of the lake. No problem of space and picnic table available. Only problem…dogs barked in the evening and in the morning."
82991,3097108,3,Muedra,07/08/2023,It is a very nice place but the squares are not flat and the vc 24h has been closed for so long that it has graffiti complaining about it. We did not spend the night since they told us that it was not possible and someone would come and we preferred to leave before looking for another good place.
82991,3084624,4,FernandoViader,05/08/2023,"The site as commented. The only thing to be aware of is that there is wildlife. Be careful with keeping the rubbish inside, it is not pleasant to listen to the wild boars at night hanging around the vehicle."
82991,3060130,5,PapaCho,01/08/2023,"super nice, even in low season. arrived around 7 p.m. when people were leaving so no problem with space. The large park allows children to play without problems. we haven't tried swimming, which doesn't really make you want to. on the other hand great area for fishing in the evening or in the morning."
