placeId,reviewId,reviewRate,reviewUser,reviewDate,reviewContent
97542,1223113,5,MoellToeps,28/05/2021,"Well-organized, very clean, quiet (despite the proximity of the expressway and airport) parking space with a warm and very helpful welcome, electricity and water / disposal for € 10 all inclusive. Super clean toilet for 50c. Less than 10 minutes with the Uber (if you want to leave your vehicle) to the old town of Faro (6 €). We recommend!"
97542,1190769,3,deepbluesky12,09/05/2021,"Reception ok, but the operator is nice. The place is quite uneven and with large gravel, the plots are big enough, sanitary facilities and washing machines are great. It is quite noisy due to the nearby street and the neighbor dog. Toilet costs 50 cents. Which is rather disadvantageous for vans without a toilet in the long run. 10 euros including electricity. It can be recommended as a stopover."
97542,1175439,5,camilathevan,18/04/2021,"We stayed here for three nights and we can say that this was one of the best service and stay areas we already visited. Warm welcome, all clean and tidy, very quiet at night and even during the day. There’s also a restaurant nearby that we recommend as well as Praia de Faro. Surely we will come back."
97542,1173693,5,ElysaJ,14/04/2021,"This small motorhome area is very pleasant. There is a lot of space and it is very well maintained. The manager is very friendly and I felt very welcome. There are some noises from dogs, chickens and the road next door but we had no problem sleeping in our van."
97542,1170558,5,Laercio,08/04/2021,One of the best Camper Van parks in the Algarve!
97542,1130773,4,dan13ll3,15/01/2021,Clean place. You need 50c to use shower for 3mins and 50c for toilet. Only one toilet.
97542,1122345,5,ViFamily,19/12/2020,"Park for motorhomes very good. Wide seats, the person who received us very friendly, laundry service, shower, bathroom work with coins. Stay and services 10 €."
97542,1121769,5,GerardAngland,17/12/2020,"Stayed for 3 nights. Enjoyed my stay here.
Good base to explore Faro area"
97542,1104782,5,LucasE,25/10/2020,"Very wide, very comfortable parking space .. Excellent value for money .. 1 night: € 11 per night, more than 1 night: € 10 per night, including electricity services, emptying and filling of water. A great luxury. Also very well looked after by Arnaldo and his partner. Eskerrik asko, Aguyje, Obrigado, Thank you guys very much."
97542,1094747,5,diegolopez,15/10/2020,"A highly recommended place to sleep near Faro, from the first moment who attends you very kind and attentive. there are noises, but nothing out of the ordinary, you rest and feel very comfortable. more than affordable facilities and very clean dump / fill points."
97542,1070080,1,gerdje,26/09/2020,"The worst campsite ever. Far too expensive, noise from traffic all night and to make matters worse a pack of dogs barking loudly along the wall. Actually worth 0 stars."
97542,1069596,1,gerdje,25/09/2020,"Expensive for what it is, very noisier"
97542,1020117,5,AgustinaCandela,02/09/2020,"Excellent for motorhomes, € 13 per night plus 0.50 shower services and € 5 to wash clothes, € 3 for the dryer. € 0.50 the bathroom. Light, water, electricity and change of black and gray water included in the € 13 per night. Everything very clean and well cared for, a luxury to stay here! You can enter with dogs."
97542,1020112,5,AgustinaCandela,02/09/2020,"A perfect place to spend a couple of days, it has all the services and very friendly people, the guy who attended us was very helpful and explained every detail. Wax supermarket and other services, well connected and easy to get to. We will surely repeat! We loved it!"
97542,1018802,5,InakiA,01/09/2020,"Area that is very good, clean and very quiet. The guy who attended us was very friendly and attentive. Everything worked out for € 12"
97542,1010229,5,RedCaliforniaKids,28/08/2020,"We spent 4 nights at the beginning of our trip through Portugal and we did not hesitate to spend another 4 on the way back, we arrived without expecting anything in particular more than one night to change waters and it became our particular oasis, an exceptional treatment and kindness on the part of the curators of the place, good advice and an exquisite cleaning of the services, 100% recommended."
97542,1008177,5,txolineta,27/08/2020,"Excellent place! Unbeatable treatment, showers, toilets, sewage discharge and water loading."
97542,1000030,5,RaQuelGuaza,24/08/2020,We did the 3 water changes for € 3. A very clean place and the person who attended us was very friendly. You can stay overnight. It seems very calm.
97542,973345,5,lamonrita,17/08/2020,"Clean, well-kept place, with all services. Very very friendly staff. If you travel with dogs, leaving to the left and taking the first path on the right, you have a very pleasant walk that takes you to the pine forest. To repeat. ;)"
97542,969160,4,susiwapa,16/08/2020,"Good area, clean, attentive, washing machines, water, wifi, electricity, showers, toilets, ... little shade."
97542,967940,5,iosebap,16/08/2020,"If you need to take a break on the Algarve route, this can be a good parenthesis. Your owners will take good care of you, they will care about you and the place is relatively comfortable to go by bike to the beach and visit Faro, ... 5kms to both, ... with the bike well"
97542,967031,5,CamperJo94,15/08/2020,"Very clean, very friendly & helpful staff! 12 € including water & electricity. Showers & toilets € 0.50."
97542,958816,5,campingcarlaureetclaude,13/08/2020,"Laure and Claude motorhome. The owner is very welcoming with very comprehensive explanations in French. The Cc area very pretty and flawless. 11 euros with electricity and wifi the sanitary facilities are very clean and you can wash your clothes for 5 euros. We are not far away from the center of Faro and a Portuguese restaurant adjacent to the area. We spent a quiet night, we love it and we recommend it par excellence."
97542,958813,5,Carmenj,13/08/2020,"Great place, very friendly owners, very quiet to rest. We will repeat"
97542,949161,4,daysan27,11/08/2020,"We stopped to update clothes and get light. Good place, very friendly people, all services at prices between € 3 and € 5. A bit far from the center. Bike or taxi. Night ok, perhaps the biggest problem the noise from the road until a certain time of the night then quiet."
97542,949123,5,Sonandoporelmundo,10/08/2020,Great place to spend the night and get to know the whole area of Faro ... very good services run by very good kind people who will help you with whatever you need ... thank you very much # dreaming by the world
97542,946200,5,hernandez28,10/08/2020,Excellent
97542,942772,4,dorinejulien,09/08/2020,"Laundry service, water to recharge (3-5 €), shower ... very well equipped and pleasant staff!"
97542,936650,4,petriple,07/08/2020,"Good place to rest a day with all services and with some shadows, dirt floor. The only problem is that it is far from everything. The price is 12 euros with electricity"
97542,921752,4,Arkaitz-Txiki,02/08/2020,"I would give them 5 stars, but the location in my opinion is not good at all, but with bikes arranged to move at your whim. Thanks to Arnaldo and Alfredo for your hospitality and good work. Super attentive and they provide you with everything in their hands. People of 10. We would return."
97542,915863,5,jfrance,31/07/2020,"Very good, excellent conditions. Easy access to the beaches and 5 km to the center of Faro, 12 € 1 night 11 the following, all included with good wifi."
97542,906263,4,calili69,28/07/2020,We spent one night there. The owners are very friendly and attentive to everything not that they can help you. They even went looking for us because we couldn't find the access. Very quiet place despite its proximity to the airport. They don't seem to fly at night. Highly recommended.
97542,837710,5,crienoloog,26/06/2020,Very nice and friendly service. extremely helpful owner.
97542,795083,4,Perrot86,13/03/2020,Clean area and sanitary. Friendly staff.
97542,790365,5,cathie49,03/03/2020,"Very friendly welcome, very correct price 10 € services included / night otherwise 3 € for services. Very clean coin operated washing machine and dryer. The owner and his employee are very concerned about cleanliness. The pitches are spacious."
97542,787147,3,Yannick35,26/02/2020,"We just spent a day there, the staff are very friendly and speak a little French. The facilities are clean yper, the places are delimited which avoids that some take up too much space. The four lane which is not far did not bother us to sleep. We recommend. ."
97542,785828,5,Anakin,24/02/2020,Area very well located to visit Faro or make short bicycle routes to go to the beach or to the natural site. Reception staff very attentive. Highly recommended.
97542,783653,5,Motorhome.life.l.l.c,20/02/2020,Fantastic place to stay. 10€ including electric. Showers are 1€ for 6 mins and are extremely clean. One of the cleanest we have seen. The road is a little noisy but quiet by 10pmish. Close to airport but didn't notice the aeroplanes. Definitely recommend. We would stay here again and the man who works here was very friendly and helpful. We stayed 2 nights.
97542,782050,3,PapetNanni,17/02/2020,"Warm welcome, dedicated staff. Very clean area. A lot of noise from the four-band track near the area, much noisier than the few planes heard only during the day. Too bad because it would be perfect."
97542,777106,5,benbirnie,07/02/2020,Absolutely perfect. Showers are nice and hot and powerful. Toilets are very clean. The people who run the site are very friendly. 100% would come back.
97542,776877,4,Europetravelor64,06/02/2020,"Quite a newly created parking space with super clean, modern sanitary facilities. Bus to Faro leaves nearby. Operator is extremely friendly and always strives for the well-being of his guests. The only downside, space is near an expressway that you can hear at night. All in all a good place, would love to come back."
97542,776012,3,ccfsc,03/02/2020,Very nice home. very clean. good locations with the 220 v in 6 amp and a tap for drinking water. but an important noise nuisance with the big dog of the neighbor who barks constantly night and day.
97542,767362,5,wicklow86,11/01/2020,We stored our van here for 17 days while we returned to the UK for Christmas. The owner was incredibly friendly and helpful and we had no concerns leaving it there. On our return we stayed overnight and were very pleased with the facilities. Its very convienant for Faro airport but quiet at night as the planes stop around 11.30pm. Highly recommended.
97542,765644,5,Anusia,07/01/2020,"Super,super,super.very good place by night, owner is the best.toilet and shower very clean"
97542,764138,5,jovin1242,04/01/2020,"Really very clean area. The owner welcomed us warmly and couldn't do enough for us. This being so rare, it is important to point it out."
97542,761553,5,lasiniai,01/01/2020,Very good service at a good price.  Fast free internet.  Very safe.  Everything is thoughtful for the convenience of visitors.  I spent 4 nights here.  I will gladly come back.
97542,750241,4,ColinL,05/12/2019,€11.50 for van + 2 people in December 2019. Electricity was included but toilets had to be paid for (50c per visit). Nice site and friendly staff but let down by the constant barking dog from the Villa next door.
97542,748179,4,al11370,29/11/2019,"Access a little tricky for the big C Car, cars parked on the side side of the maneuvering access. The area is ok, friendly reception by noise nuisance by dogs barking at all times."
97542,747447,5,davaym,26/11/2019,"I only went for the drain, a perfect service and a very clean place. It's worth 3 €."
97542,747196,5,Jeannot08,25/11/2019,Air near the airport. Quiet and quiet except for a few dogs at night in the area. Stayed two nights. Impeccable. Welcome to the top.
97542,746340,5,Stewill47,23/11/2019,Great location for airport storage at 3 euros a day. Very clean aire and cheap at 10 euro with electricity.
97542,743123,5,Mbwa,14/11/2019,"We were there only to empty (3,00 euros). On top, clean and friendly welcome. We would like to find another place like this one! Go for it"
97542,742990,5,Lucienkiffer,14/11/2019,"Superb area for motorhome and acceuil since warmer, very helpful and in French. The facilities are very clean. To recommend to visit or a stay in Faro"
97542,728233,5,phiphi40,23/10/2019,"Very good, confirmation of previous comments. Beautiful mountain bike ride in the reserve with stops at both beaches, a beautiful day. Website manager very available and friendly."
97542,724743,4,Serge26,18/10/2019,"Very welcome, very friendly manager. The place is very clean, only flat a little noisy with the 4 lanes nearby and the airport very close. Otherwise very convenient to get to Faro with buses nearby. I recommend a nice bike ride to the beach 7kms, along the salt marshes, the nature reserve and the gulf."
97542,717432,4,pat7370,09/10/2019,Very good area and very very clean we stayed 3 days. well secured too
97542,714950,5,unocualquiera,06/10/2019,"Perfect place to stay. Showers, WC, Wifi, plug, washing machines ..."
97542,712028,2,jo28,03/10/2019,Just pay for one night. a lot of traffic right next door. noisy. too far from the center and beaches.
97542,700542,5,ophiusito,22/09/2019,"Excellent. Clean and smooth operation of everything. Bus to Faro nearby. Good attention. Very friendly and € 11 overnight, electricity and water change. Laundry machines. 2 restaurants next door. Highly recommended."
97542,684998,4,Chipie92,10/09/2019,1 night early September. Package 10 € with electricity 1 CC and 2 adults. Reserved only for the motor home on the outskirts of the city. Very friendly welcome. A local restaurant nearby.
97542,680083,4,JGuy17,07/09/2019,"Good location only for motorhomes. Friendly welcome, location near a 4-lane road that serves the nearby airport. Bus to reach Faro historic city center. Bikes essential to reach the beaches and visit the protected area of Formosa. Low price for parking, paying services, WC, showers."
97542,666174,5,saligue,29/08/2019,"We stayed here for 2 nights very nice, consistent with the reviews. I recommend without worry."
97542,664147,4,mdm9@wanadoo.fr,28/08/2019,"Very clean, we were afraid of the planes next door but no noise?"
97542,657276,5,nono01,24/08/2019,Owner very friendly and speaks several languages so French. spacious location. Very clean area. Shower and toilet. 0.50 cents. 11 euros water and electricity and wifi. Beach a bit far but we are in scooter so no worries. Bus nearby. Frankly nothing to say. Given the price of some campsites !!
97542,654802,5,elisaas,23/08/2019,"Very clean and maintained area. The staff very attentive, we spent two nights there and if we return to that area we will distribute without a doubt."
97542,648085,4,roiggc,21/08/2019,Very correct and clean area. The staff very attentive. good place to spend the night and rest
97542,647486,4,avjavi1,21/08/2019,"Very quiet and spacious plots. Very friendly staff and speak in perfect Spanish. 12 euros for 24 hours. I do not put the fifth star because it seems good to pay for the shower, but not for the WC."
97542,647468,5,lorenzo0333,21/08/2019,Very good as a campsite.
97542,641045,5,qubik,18/08/2019,"We were to use the available services, everything went well, and the boy who was there has treated us with kindness and sympathy, although we have not stayed overnight, we see a fairly quiet area."
97542,638183,4,Nanou5,17/08/2019,Owner very nice. Great location. Very clean. 22 € For a camper and two adults and electricity. € 0.50 for the three-minute shower. € 0.50 to use the toilet. € 4.50 for the washing machine. If you are walking you are a bit far from everything. I recommend all the same.
97542,637108,5,cysalila,17/08/2019,The owner is very welcoming. The pitches are spacious allowing campers over 7 meters to park easily. The site is very clean. To recommend.
97542,634700,3,Xupi8,16/08/2019,"Positive points: large plots, friendly staff, you can empty gray and black water and fill with drinking water. Negative points: you have to pay for the shower and the sink."
97542,630379,5,emiwls98600,15/08/2019,Great place great home any amenities
97542,628933,5,LesSteffs36,14/08/2019,"TOP ?? Small area, limited but spacious location. For a night in T4 with 2 adults and 2 children with elec = 16,50 €. Owner super nice, is doing well in French. Sanitary (shower wc) very clean. Works with coins of 50 cents. We slept very well despite the airport not far. Just miss a dishware item with sink? but strongly recommend."
97542,628460,4,ludichaart,14/08/2019,Very nice area I do not stay at night because I had to hit the road but I was able to empty and load water. Very clean. Just not allowed to carry a washing machine if you do not stay at night. The young man who received us speaks French very well and is very friendly and helpful. If I have the opportunity to go back I would go.
97542,615085,5,salvataro,10/08/2019,"Excellent area, a little noise from cars but it is very safe because at night they close it. Super bathrooms"
97542,613371,5,agarciagaraiko,09/08/2019,Add to the previous comments that there is the possibility of entering later. They provide a code for the door and by pressing a button on reception the door opens.
97542,611450,3,danytony,09/08/2019,Pleasant area but far from the beach
97542,609171,5,leirux,08/08/2019,"The most remarkable thing is the good treatment he has given us, he is a person who knows many languages (French, Dutch, English, Spanish and obviously Portuguese) a positive point. It shows that the area is new. The bathrooms are great and the plots are large. In general We have been very comfortable. We went to a restaurant that is here next door called ""presumably two place"" typical Portuguese food and we liked it. It was recommended by the boy in the area."
97542,607105,5,sebetvic13470,07/08/2019,Very welcome and great services!
97542,603332,4,Ninavv,06/08/2019,"Very cozy area clean bathrooms kept well token 50 cents. Shower. tip, sink for washing dishes. highly recommend. kiss Kiss"
97542,593902,4,Rennais,02/08/2019,"Very friendly welcome and all services available. Reasonable price, 12 € the night, toilets with 50c and shower 50 c the 3 mn."
97542,562222,4,Gillou420,19/07/2019,Attention limited places in high season. Otherwise the manager is nice.
97542,558613,5,Tonyvegas,17/07/2019,I recommend 100% everything very well and an unbeatable treatment from the owner.
97542,536319,2,mathedidier,02/07/2019,"We do not agree too much with the other comments. 2 paid showers, no washbasin or wc. Sad place near a ubiquitous traffic and the bike path does not take near the place. Besides, we were all alone!"
97542,530940,5,ClaudeLili,27/06/2019,Super welcome. Very good information on walks from the area. Very clean and well equipped facilities. Very large and well defined sites. Good starting point for cycling to the reserve and the beaches. To recommend
97542,525041,5,wpuh12,22/06/2019,"Hello Womomobilsten, this pitch has earned 5 stars. 1. very clean. 2. very friendly. 3. very well located. 4. very large parcels. 5. very good quality. Everything we need and want ..."
97542,519107,4,XQlero,17/06/2019,"Very good aire, lacks nice views and it's a bit far away from everything really, but if you're (pro) active you can get to most of the places you want, either by bike or bus. Other than that: clean, quiet, super wifi and showers. And a special acknowledgement for the owner and his help at reception. Will definitely come back."
97542,513458,5,ruthdale,12/06/2019,"What a find - lovely quiet spot. Very close to wonderful bike route Quinta do Lago to see flamingos and end at 5* beach. Portuguese restaurant and bar next to site on quiet local street, very pleasant, some shade - olive trees, can put awning out and relax. Very helpful welcome and local knowledge from owner."
97542,509288,5,riclaire49,09/06/2019,Very pretty area. Very clean. We do not hear planes. The National is not disturbing. Impeccable shower. A toilet would be a plus. The owner super friendly and always ready to answer any questions. To recommend. We spent 2 nights
97542,485062,4,biquet5155,15/05/2019,"Excellent welcome by Mr very kind always ready to help. Airfield, recent sanitary well kept. Slope. Supermarket 10 min walk. Bus to the center and small restaurant cheap on the other side of the 4-way through the bridge. Small flat for the 4 ways very close and noisy. Calmer at night."
97542,482602,5,passiflore55,12/05/2019,"We went there to drain and take clean water for 3 euros. It is a very clean private area. The owner is friendly and good advice. In the enclosure There is also a laundry for your laundry (4,50 € washing, and 3 € drying and it takes a total of 1:30 and laundry is provided.This is practical.Fractly, no hesitation! really."
97542,478754,4,filad,08/05/2019,Very slightly noisy with the proximity of the N125 but well received there are showers for 1.5 € shops 10 minutes walk and bus to Faro 5 minutes super convenient I recommend this place
97542,475072,5,Labra,03/05/2019,"Very friendly and unpretentious welcome. The owner is available and smiling. Everything is clean, the showers, the ground etc .. No toilets yet, no problem we have in our vehicles. Easy to get info, bus to the city not far away."
97542,466071,5,pierllos,24/04/2019,"Very very good, very clean area, very good reception, speak a little French so no problem. We recommend this area. Price 10 € for an all-inclusive night electricity and water drain."
97542,465582,4,mimari,23/04/2019,"Very friendly welcome, available for any information. Well-appointed area, spacious spaces, easy emptying and clean. Noisy during the day, quieter at night."
97542,465463,4,jorgeb,23/04/2019,"Great area, beautiful, with good plots and showers under construction. The owner is very friendly and gives you a map with itineraries to get to the city center or the beach by bike. It even has a swing for children, which is a success. The only downside that has is the noise of the cars because of its proximity to the road. For the rest it is a fantastic area and evolving."
97542,450831,5,wutelli,08/04/2019,"Highly Recommended! Good connection to look at Faro and the airport. Safe place, with gate closing at night, but it can be opened from the inside at any time. Washer and dryer are also available. All service installations are super clean. Toilets, as well as showers are under construction. We used the place over 4 weeks. the owner is totally helpful! Thank you!"
97542,449797,4,bumblebussing,06/04/2019,"Good clean services black, grey and drinking. Washing machine, dryer. Friendly. Didn't stay but would. Would also be a good place if needing to fly anywhere."
97542,446337,4,jpo.neuville,29/03/2019,"The area is very clean, functional but you need some holds. Very good for a night and refueling, very little for walks around."
97542,439174,4,DanielleGal,12/03/2019,"Great place to park and visit Faro. good pitches, water supply in each, laundry machines at the reception. easy access to town."
97542,439092,4,Cordys,12/03/2019,"Very nice operator, the most well-maintained service station we have seen so far! 3, - for disposal and water or 10, - per night is a very good price."
97542,436916,5,nau3012,06/03/2019,"Ideal both for spending the night and for their services in impeccable condition. It cost us € 5 to be about 4/5 hours of electricity, water and emptying. The day / night € 10 with all services included. Very friendly he owner"
97542,430858,5,foy74,18/02/2019,Passage from 9 to 12 February 2019. A beautiful area for motorhomes with a very nice and warm welcome. Very spacious pitches with water and electricity. A service area to blush many countries and France as well. A very helpful owner and always nice. Really a place to discover!
97542,429045,5,Bizisfab,13/02/2019,"Visited today (13 Feb 2019) - only paid for services at €3, but the facilities were spotlessly clean, new and efficient. Although I didn’t stay, the site looked great with spacious parking, the manager was very welcoming and really friendly too. Would definitely consider staying next time I’m in the area."
97542,427574,4,Treasurebox,08/02/2019,"Good sized pitches. Friendly, helpful welcome from Arnaldo, the manager who spoke excellent English. Easy and pleasant cycle ride into Faro old town, and to the beach and nature park area (maps provided at site). Easily accessible, clean services all functioning. Some background noise from nearby road but not intrusive. We would definitely use again."
97542,427030,4,valpat,06/02/2019,"Ideal for taking a flight to Faro: possibility to leave the camper safely and airport 20 minutes walk. Very friendly and always available to give you good addresses of restaurants and walks. Very clean and maintained services, delimited pitches. We will come back."
97542,421380,5,Brazma,09/01/2019,"Quiet location, very clean, fair price, very attentive owner, great laundry, UBER € 7 up to the historic center of Faro, does not yet have bathrooms but will have."
97542,421084,4,LesPoulous,07/01/2019,"We went there to do the service only: € 3 great setup and very clean. Very nice welcome. Certainly it is not a place to spend the night but it is very well done, very clean, electricity, WIFI, etc. .. € 10 included the service and it has the merit of existing. I do not understand the previous comment."
97542,420557,1,dobigeon,05/01/2019,A real ruin this parking. Hyper buyant
97542,405417,3,dreno,07/11/2018,"We stopped for one night, pity it is noisy with the road crossing nearby because this area is well thought out and pleasantly arranged. The young couple is charming and caring for these hosts. Thank you"
