placeId,reviewId,reviewRate,reviewUser,reviewDate,reviewContent
25149,3039162,4,villambrosa,29/07/2023,"Very large area with some shade under cork oaks. Very well located, you can get to all the places on foot. Beach 10 minutes. Supermarket 3 minutes away (Aldi) Restaurants 5 minutes away. At night you can hear the music from the disco on the beach. Next to the bus station and GNR police station."
25149,3033271,5,ikaner,28/07/2023,"As mentioned in other feedback, a very good area, large and with all the facilities. An interesting city to visit with a very nice promenade that has a playground."
25149,3023335,5,victorAst,26/07/2023,"Area with all services. Very wide and some squares, counted, with shade. 4G coverage"
25149,3006367,5,Paichi,23/07/2023,"Huge area. It's quite quiet as long as you park far from the bus area because they also park cars and if you're sleeping you don't feel like partying people coming for your car at 2 AM with afternoon conversations. So if you follow my advice you will rest better. The beach is a short walk away, there is a long walk. It's cool to spend the day. aldi next door"
25149,2996876,4,jotabelatz,21/07/2023,"Very large area, without parking problems. When we were, a bit noisy at night from people talking. Close to a supermarket, walk to the beautiful center although remote and somewhat complicated by narrow sidewalks at first."
25149,2992154,4,Vince2776,20/07/2023,Nice CC area with toilets at the bus station. Very quiet at night 800 m from the beach. I recommend...
25149,2957270,4,harley23,13/07/2023,"Big and useful area but not very close to the beach, it has the Aldi next door and the bus station, and the national guard so it's safe, good area in general."
25149,2918049,3,miticoarpege,03/07/2023,large area. all that you need. some nocturnal noise of music
25149,2908564,5,DerTobi1978,30/06/2023,TippiToppi! Really great! All you need! Also nice shady places under trees. Enough distances! ALDI 150m away.
25149,2883451,5,Laviexlavraie,23/06/2023,Very large space with water available. There are places under the trees so I parked there like other travelers in order to have shade in the morning. Great place for a night or two! I recommend.
25149,2803970,5,CarolinaCoelho,30/05/2023,"Plenty of space to park and stay overnight. Very good gray and black water exchange place with shade. Pay attention to the days, mentioned in the photos, when you cannot park."
25149,2778950,4,potuspark21,23/05/2023,"Perfect , quiet and spacious !! Thanks to the municipality!"
25149,2744676,4,ayoinviaggio,12/05/2023,"Thanks to Esposende for this free area. The area is really big and the spaces wide. Not recommended perhaps in the middle of summer, given the total absence of shade. Opposite the bus station and almost to the side the police station. At 150 m a large supermarket (Aldi)."
25149,2712746,4,luigi1945,01/05/2023,"Large area, be careful on Mondays there is the market and therefore many stalls occupied by cars. Thanks to the community for availability"
25149,2691248,3,HPM1961,23/04/2023,"The place is okay, for V/E and also for one night, we drove on and didn't sleep there, but still a compliment to the city."
25149,2671599,3,TayHan30,15/04/2023,"Large car park next to a bus station. Toilets are in the bus station, nice and clean and open all night. Wi-Fi was in and out. Lots of motor homes here. Drinking water tap near the large bins/ closed toilet block."
25149,2667485,3,Kutzop,13/04/2023,"As already described, large parking lot. WiFi works like this. Certainly ok for one night. Lots of mobile homes, some of them have definitely been here for a long time. Still, you don't feel uncomfortable."
25149,2665572,2,thilotravels,12/04/2023,"You definitely feel safe next to and between the numerous mobile homes. Ultimately, it is a large parking lot, the path to the beach is not the prettiest, the city itself offers various jewelry shops. There is a nice children's playground 20 minutes away. Everything subjective. It was fine for us for one night, but that's about it. Bus service right next to it."
25149,2654091,4,Charlie0604,09/04/2023,A great big place with supply and disposal. 3 minutes to Aldi is of course awesome and it only takes 15 minutes to get to the beach. Thanks to the place Esposende.
25149,2649984,5,acorgon,08/04/2023,"good parking, highly recommended, with green areas, an Aldi supermarket next door"
25149,2624771,4,huthpi,26/03/2023,"Good, free and quiet place near an Aldis. Supply and disposal good, we stood quite straight and felt safe."
25149,2619464,4,DorisundBernd,22/03/2023,Many thanks to the community for this great place. Felt safe right next to the GNR. Aldi within walking distance. Supply/disposal perfect and clean.
25149,2608189,4,0laf1979,13/03/2023,today is Monday and today is no market
25149,2601308,5,sainzajump,07/03/2023,It's very good... Good loading/unloading area... And many places... Better to stay away from the Bus Station to avoid noise.
25149,2600962,4,SimonSarahSumo,06/03/2023,"Stayed on 2nd March 2023, clean, services, bins, not the prettiest place but space for a hundred motor homes.  Police next door, Aldi 100 meters. 20 minute walk to the town centre. Great for a stop over or dump and free fill up."
25149,2580621,5,Olli85,17/02/2023,Thank you for this place. We stayed for one night and it was very pleasant. Thanks to the city for this possibility of disposal.
25149,2544661,5,chantaldante,07/01/2023,Very nice and large free area with services without electricity behind the bus station and close to the Aldi store. Pretty town at 900m. We spent 2 quiet nights. Thanks to the municipality.
25149,2543141,4,ROBY,05/01/2023,"Very large area for CC and caravans... The wifi does not work, but the 4G is perfect. Close to the bus parking lot, but that's not a problem. Not far from a very decent ALDi. Good..."
25149,2531699,5,lagertha89,28/12/2022,"We only stopped for emptying, thanks for the possibility! Signs to find this place are easy to follow in the city. The parking area is big and spacious and there were only a few of campers now in december."
25149,2521224,5,yannSaracchi,13/12/2022,"huge rest area. Brilliant, all-inclusive toilet service and restaurant at the bus station... only problem, motorhomes who do not respect others and who think that the places belong to them..."
25149,2511531,5,egoman,03/12/2022,"large, level square with many mobile homes, close to the center and very quiet at night."
25149,2507525,5,jesushortal,27/11/2022,"We only used the water services, but the area looked well-kept and crowded. thanks to the town hall for making this infrastructure available to us"
25149,2500714,4,jacky60,20/11/2022,a big thank you to the municipality very large practical parking for large gray and black water drain cc it's perfect not too far from the city which is also very pleasant with lots of shops. we were supposed to stay one night but we extend day by day.
25149,2499120,4,EdyBouhof,18/11/2022,Great place to spend the night with all empty and filling options. Town is not really picturesque.
25149,2498145,5,jeanguyandre,17/11/2022,secure area because at 50 meters GNR I recommend passing in front of building on area take paved road straight for center pretty pedestrian streets and very close restaurant CAFE SALE super 8E50 menu day fresh copious all inclusive tb reception Not to be missed then promenade seaside
25149,2486470,4,Bajonska,07/11/2022,"Free site. Very convenient for disposal, but otherwise not too attractive - just a large slab of concrete with room for loads of vehicles. No size limitations. I decided to move on. Thanks to the municipality for providing this space."
25149,2455905,5,burstner1,22/10/2022,Good for a stopover. Everything is summarized in the previous comments.
25149,2436523,5,lombraracing,11/10/2022,"very good area, good floor and very large, super ALDI at 150mts, recommended"
25149,2417143,3,Zigotto34,02/10/2022,"Free. Without electricity. C is a huge tarmac car park, a small part is shaded. Very good for spending a night. Close to an ALDI. Flat land. Drainage station with free drinking water too. Not very far to take beautiful walks on the seafront. Be careful on market day or it is forbidden to park the night before. Thank you ESPOSENDE."
25149,2370451,5,ketxa,14/09/2022,Free AC area with services and very wide. Next to the police and an Aldi. You can connect to the Wi-Fi at the bus station. He sleeps very peacefully. Thank you Esposende.
25149,2362303,5,MC1960,11/09/2022,"very large car park for easily 80 CC, close to Aldi, black and gray water service, water refill possible. 1 km from the center. free. to recommend."
25149,2359784,4,ptcarlospt,11/09/2022,large area with lots of parking spaces. it is possible to open awning. wifi near the bus terminal
25149,2352643,5,0212576119,08/09/2022,"Super area very quiet, apart from the buses which in the morning, but well at 7:30 the night is over and people are working, very well out of season in September"
25149,2343409,4,familiarebelo,05/09/2022,"Fair park where they placed Wing services, free services. Close to shops and gnr. Smaller than usual water tap thread."
25149,2337240,4,bautisjp,04/09/2022,Large flat area. Close to the center and the beach. ALDI next door. All services but a bit closed to enter. An area to care
25149,2323291,5,Eltorado,30/08/2022,Very big place. We used it as a one night stopover. Good services but long waiting times.
25149,2295901,4,albjaeger,24/08/2022,"Large space also suitable for teams; very nice city, shopping in 100 meters (Aldi) The disposal facility is a bit contested and not really suitable for large mobile!"
25149,2270479,5,TxusetsRuth,19/08/2022,"Very large and very quiet area. To put a downside is that there is only one emptying and filling point. The rest all very well, highly recommended."
25149,2265644,5,Edgar13ch,19/08/2022,"Free parking for motorhomes, a very clean and apparently safe area, next to the GNR police station, it is a quiet area, you do not have to get very close to the buses so as not to hear them. It is sheltered from the air even when it is strong on the coast."
25149,2255724,5,Steeo,17/08/2022,a clean and quiet place where there are all kinds of services. supermarket 200 meters away and national police right next door. very good place to rest for a while. thanks to the municipality of Espodense
25149,2252212,5,joanes,16/08/2022,Large parking for AC. Super market next door and El pueblo is worth it. Great beaches and in August very good atmosphere.
25149,2251877,4,VANNY114,16/08/2022,"It is huge, well located and with all services. Be careful on fair days, we have to vacate."
25149,2247072,4,park4nightYHN,16/08/2022,"Large area and very close to the beach, with a supermarket next door and a good atmosphere. On the avenue there is a wide bike lane to explore the beaches. Sites that respect ACs like this one are appreciated. highly recommended"
25149,2243978,4,qrzchango,15/08/2022,"Very good and quiet place to spend a few days, almost 100 caravans parked there, supermarket two minutes walk, beach 10 minutes. You open an awning, set up a table outside, emptying and filling area, public toilets. place to return"
25149,2228495,5,FMFO,13/08/2022,"Very large and comfortable area, near the sea, the supermarket and the pastry shop. We slept very peacefully. The only flaw: a single place for loading and unloading is not enough for the number of campers that are parked. We didn't use it, there was a queue."
25149,2215663,5,dacleme,11/08/2022,"Very large perfect area, calm quiet night. I recommend. We did not use the services."
25149,2208636,5,cirdecA464,10/08/2022,Perfect for spending the night and performing the services. Very quiet night. Your close to an Aldi mall. Lots of places available on flat ground!
25149,2199970,4,YannTlse,08/08/2022,Functional and secure area for a break
25149,2199150,4,NagoreZam,08/08/2022,"A very wide space, one part on asphalt and the other in a field with trees. A very pleasant place to spend a quiet night. There is a supermarket next door, and the beach is a short walk away. We enjoyed our stay."
25149,2173494,5,Biomol,04/08/2022,"Very spacious area. The most level plots do not have shade, but this is not a problem because the temperature is very pleasant and it does not get hot. Supermarket 3 minutes. Beach 15 minutes walking (with small children). Bike path and wooden walkways that allow you to go around the entire perimeter of the coast and even skirt the Cávadas River estuary. A beautiful place and highly recommended."
25149,2169102,3,Danikrack,03/08/2022,"Large esplanade to spend a night, bus station next door, at night we did not hear noise except the fireworks (rockets) for the parties of some nearby town. people take everything outside without problems, the GNR is next door but without problems. filled with water and emptied of grays and blacks, which was a bit muddy but useful."
25149,2168233,4,bcbg79,03/08/2022,Very clean area. Not far from the beach and a supermarket. Just a little bit of a queue to use the water….
25149,2164254,4,papaours44,02/08/2022,Space everywhere including under the trees an Aldi close by overall the space is quite clean perfect for a quiet night
25149,2129865,4,Javi_Coyanza,27/07/2022,Wide area next to GNR and bus station. Aldi stuck. level squares. Only one loading and unloading point
25149,2123914,4,BeaCO,26/07/2022,Large area with water filling service and grey/black water emptying. The toilet was out of order.
25149,2113721,5,PabloRios,23/07/2022,A very large perfectly level surface and an area of trees next to it where some users also park in the shade. Correct filling/emptying services but with a bit of a queue as there are so many vehicles.
25149,2109072,5,SiiriAndLauri,22/07/2022,"Lot of space, clean toilets in bus station building were open at night. There were 20  other campers staying the Friday night, felt safe."
25149,2096688,4,AbelR,20/07/2022,Spacious area to leave your motorhome. It has a fountain and emptying area for gray and black water. Quiet place to sleep and guarded by the police office that is right next door.
25149,2087407,5,krusa,17/07/2022,"Large parking space, quiet and close to the center."
25149,2055356,5,Jaimerg,10/07/2022,"Public, free with loading and unloading service. Above all, very spacious."
25149,2033395,5,Andrea-Dinis,03/07/2022,"As always, very good area. We have been there several times but we had never stayed overnight and the truth is that it was very good. We went June 25-26 and there were plenty of ACs and vans. Aldi supermarket 3 minutes walk. The GNR glued to the area. If you go down to the beach, you take the kilometric wooden ecotrails attached to the beach where you find a dog beach. Services OK."
25149,2022373,5,Toja22,29/06/2022,"We stayed one week in this quiet,clean and huge area!There's an Aldi at 3minutes walk and the area is close to the town,where we advice to try the amazing pizza at ""Pizzeria Di Pappi""! There are also nice natural paths nearby. There are about 2or3 market day a month, when parking is not allowed..but you need to check the data displayed on the poster."
25149,2009929,3,trillonyotero,25/06/2022,"The village has a huge walk, and beautiful"
25149,1997066,3,paulgo,21/06/2022,Good location 15 minutes walk from the first beach and the same from the city center. Next to a supermarket so convenient for shopping. No predefined location but enough room to be comfortable
25149,1994956,1,ValeKangoo,20/06/2022,"The description of the place is not exact. The market is not every Monday, we discovered it today when we wanted to go to the market and we arrived and saw all the parked campers."
25149,1959192,4,joseab,08/06/2022,"Area with loading and unloading service, and with many spaces, silent, better if you separate yourself from the bus area. Promenade at 300m. Aldi supermarket at 150m. Village with shops at 800m."
25149,1956111,1,ptichat,07/06/2022,"Far from tt., unattractive area, has the merit of existing but for a night without day, too isolated from the greenery. far from the ocean we could not stay there. thanks to the municipality."
25149,1947802,5,aileen108,05/06/2022,Great spot. Very spacious - you could probably arrive at any time of the day and get a space! There are very clean toilets in the bus station next door which seem to be open 24/7. There is also a small bar/ restaurant in the bus station.
25149,1936613,5,Luka40CC,01/06/2022,"Good place to stay for all sizes of motorhomes. Aldi right around the corner, beach within walking distance. Bus station does not bother."
25149,1933882,5,shaunthevan,31/05/2022,"Nice place to park the car and walk to restaurants in the town nearby. There is lots of space to park and it feels safe.

You can refill water for free (have to keep pushing a button) and empty grey and black water. There is even a toilet in the bus stop nearby."
25149,1919215,5,tobiandlaura,26/05/2022,Huge area behind a bus station and GNR building. We spent a few nights there and it got loud in the mornings. Water and sewage are available free of charge. Urban Wifi is also possible. There is more going on at the weekend than during the week.
25149,1913106,3,EMAJAC,24/05/2022,"Good for a quick ride or to stop for the night. Free area, including loading and unloading."
25149,1902106,5,Mabrahel,20/05/2022,"Large area, well leveled and partly shaded. Free, with all services except electricity. Separate emptying/filling area for parking, right at the entrance to the area. Next to the Republican Guard. A perfect place to spend the night, near the town. There's an Aldi nearby. Great for katesurfing."
25149,1893255,4,xsacho,16/05/2022,"Spacious site with many places, right next to the GNR, an Aldi supermarket two minutes away on foot, two and a half kilometers from Esposende beach."
25149,1877729,5,CagouilleExpress,08/05/2022,Very quiet with clean toilets accessible from the outside in the bus station. Aldi next door. Emptying and filling of water as well as emptying of black water. The walk along the water is pleasant and about 15 minutes on foot.
25149,1862490,5,biquet5155,30/04/2022,"Thank you to the municipality for this vast area where large sizes can park. Nickel services. Aldi a stone's throw away. The ocean is very close, beautiful promenade, beach. Small town with a very pleasant human dimension. The bus station is not disturbing. Laundry 10 minutes walk."
25149,1845994,5,Poutchouc,22/04/2022,"Very large parking lot, flat and on tarmac. Next to the bus station (but no noise pollution) and the GNR. We spent a very quiet night there. Free water and garbage. If you like fish and good Portuguese cuisine, go to the Barra Azul restaurant, behind the bus station. Next arrival, Seafood and Fish in the morning, at affordable prices. Very nice boss. I recommend."
25149,1835171,3,bertip,18/04/2022,"A very wide and very quiet area, no noise and right next to the GNR. It also has an Aldi 5 minutes walk away. Free emptying and filling. Walking distance to town nearby, with great bike ride. In summer they commented that it is usually very crowded. Recommendable."
25149,1829165,4,manel21,16/04/2022,Quiet place to stop or simply to empty and fill water
25149,1804711,5,MaryPer,03/04/2022,"Quiet place, opposite is the bus station, Aldi supermarket next door, the town center is close and very nice ❤️"
25149,1797290,4,Alexiapg,27/03/2022,"Quiet place to spend the night although quite crowded, but with enough space. Next to the bus station and about 200m away there is a supermarket."
25149,1789210,5,myskay,20/03/2022,"Perfect for one night. It was quiet. Not really nice because full of mobile homes. ALDI right next door. According to the sign at the entrance, it has a market twice a month on a Monday and is therefore closed."
25149,1771576,5,KikoTouza,02/03/2022,Large and quiet area next to the bus station.
25149,1770997,3,couramiauds,02/03/2022,great area .. large spaces .. emptying and filling area ... calm and close to the city center ..
25149,1756819,5,Alf1990,15/02/2022,Slept great and was supplied and disposed of free of charge.
25149,1710210,5,jff,14/12/2021,"Great opportunity to stay overnight, quiet and generous. Larger teams are also suitable for large teams. Aldi and a very good restaurant within walking distance."
25149,1709561,5,Alegoncalves,13/12/2021,"we stayed for 2 nights here at the stop in Esposende...quiet place, very quiet and very spacious. We will be back!"
25149,1694166,4,viajandogeral,20/11/2021,"Traveling general been here. on monday it is very crowded, the fair is very good. 4 nights of peace and quiet, close to the river and the sea. worth the visit"
25149,1649276,3,sorinp,17/10/2021,A big camperstop with a small zone with grass and tree. Near the bus gare station. A little noisy. Flat and with camperstop services free. Aldi are to 100m. City center and promenade are closely.
25149,1624273,5,luispolo,03/10/2021,"From July to December, there are some days when it cannot be used; otherwise, it is a great place."
25149,1620031,5,Andrea-Dinis,01/10/2021,We only stopped for a few hours to eat and rest but the area is huge with a lot of capacity and a 10 minute walk from the center of Esposende. The emptying and filling area is fine.
25149,1615665,5,juanignaciosalv,29/09/2021,"Very quiet and well located motorhome area (September). Very good access, wide and with a good road surface. Good water area. Aldi supermarket next door and a little further laundry"
25149,1584751,4,Ligia291,16/09/2021,"Very good area with free basic services, about 50 places, some with shade, good level area, Aldi just around the corner."
25149,1584740,5,KaneloAntonio,16/09/2021,Great area with all services and flat squares with an Aldi 100 meters away. Highly recommended.
25149,1558045,5,aussteiger1993,08/09/2021,"Excellent, lots of space and shade, quiet and centrally located, thanks to the city"
25149,1545593,4,gus85,04/09/2021,"Very cool, not by the sea (900m) but with all the services This night 50 cc and still a lot of places"
25149,1541161,4,BIG-MARLIN,02/09/2021,"Parking with well-leveled motorhome service area. Somewhat far from the downtown area, but with many services around."
25149,1518997,5,patoune65,27/08/2021,"Thank you to the city of Esposende for the camper van area which made it possible to park the car with the trailer, not easy to find suitable areas but no problem and in addition next to a super market what more could you ask for and the city and the beach 15 minutes on foot again thank you to the municipality"
25149,1475666,5,AnaIsabella,18/08/2021,"Very good place, with many places. Next to the GNR station and the bus station. An aldi right next door and beach not far away. You can pour water, pour water and pour water from the toilet."
25149,1474201,4,kalamidad0,18/08/2021,"Perfect place, but no toilet. There are about 50 seats or more and it is a 15 minute walk from the beach. Neighboring the bus station and the GNR barracks. I guess it's safe."
25149,1471805,3,GabiBergwerff,17/08/2021,"Great place to stay overnight. Toilets are closed, but toilets are available at the bus station. Park your RV in the area with trees due to noise from the early buses. Facilities for discharging gray and black water are fine. The Guarda's office is adjacent to the site, so it feels safe. Currently, there seems to be a corona test street on the site."
25149,1450340,3,Titopomi,13/08/2021,"Due to the new law there are more caravans than usual at night. Functional, close to the center and the Aldi. Under the trees it is more pleasant."
25149,1440478,5,Laercio,11/08/2021,"Thanks to the municipality to have this space for us! Bellow the days in 2021 that is not possible to park because the market, is advisable to don’t park the day before either since the market start early in the morning: August 23, September 6 and 20, October 4 and 18, November 1, 15 and 29, December 13 and 27."
25149,1423615,3,elprofedetoro,08/08/2021,"There are days in 2021 that you cannot park. And what bad luck that we had, although I asked some Portuguese who had a caravan nearby, and they told me that at the end of the car park you can park on the other side of the wall that delimits the car park. DAYS 23 Aug 6 and 20 Sept 4 and 18 Oct .. .."
25149,1284337,4,EvaDominguez,28/06/2021,Area with emptying service and clean waters. A large part of asphalt and level and another of earth and trees. We did not see the bathrooms and NO LIGHTING. It has a supermarket very close. We had two great nights accompanied by 30 ACs.
25149,1249361,5,lrr88,11/06/2021,"Perfect place and enabled to spend the night. Quiet place, there were more motorhomes but quite spaced. The toilets were closed."
25149,1222062,4,nofrills,28/05/2021,Free parking with good V / E spot!
25149,1206657,5,Maudfrancis,19/05/2021,"Large parking lot, close to the center. regular public toilets closed, but the large building also has accessible toilets (opposite the test center)"
25149,1201887,5,javipi30,16/05/2021,"Quiet place and good parking spaces, next to the bus station, all ok"
25149,1194939,5,AfonsoBorges,13/05/2021,"Calm and safe place with bus and local police station around. With toilets (outside, from tbe bus station) and AC services working (water and disposals)"
25149,1175407,4,MidlifeCrafted,18/04/2021,Mid April ‘21. Plenty of space. Toilets closed but AC facilities working. Covid testing station on site...
25149,1135051,5,Maikyu,04/02/2021,Well located next to La Guarda. All the services there are a lot of places and it is not filled out of season despite the confinement. It's really very practical and you feel safe. No complaints
25149,1123980,5,paulinefrate,26/12/2020,"All right, next to the police. We had no problem. Everything available for the CC and it's free! Laundromat at 450m"
