placeId,reviewId,reviewRate,reviewUser,reviewDate,reviewContent
25323,637727,5,Vanfurgen,17/08/2019,"Clean bathrooms and the beach is amazing, it is surrounded by forest, there are showers and it is very well maintained. Level parking area near the bathroom. Very good atmosphere and a very popular restaurant, yes, in August you must make a reservation before."
25323,611093,5,txomingi,08/08/2019,"The site is ideal. The beautiful beach, clean bathrooms and a restaurant with coffee pot."
25323,606795,5,Miki-Nata,07/08/2019,"Excellent landscape. Good access, very clean bathrooms, showers on the beach, flat parking, amazing beach !! Highly recommended."
25323,565282,5,troitas,20/07/2019,"The place is spectacular, picnic, beach at a step wc, showers, restaurant, we had a great night !!!"
25323,557076,5,nicola33,16/07/2019,"Quiet night, pleasant space."
25323,551399,5,pacasu,13/07/2019,"Parking with picnic areas, bathrooms and shadows. Very quiet and good beach. Highly recommended"
25323,438538,5,Gijon,10/03/2019,"I confirm previous annotation, the beach is spectacular"
25323,357755,5,tanialogo,28/08/2018,"The place is ideal for sleeping, although it is best to arrive late in the afternoon or very early in the morning, have toilets, beach showers, picnic areas ..."
25323,353232,4,nereadz,25/08/2018,"Very quiet to sleep, has wcs, picnic, fountain, containers ..."
25323,334156,5,furgosargantana,14/08/2018,Ideal for nightlife. WC and showers on the beach. The bar very good price. Very quiet beach
25323,330044,5,nagorebikan,12/08/2018,An ideal place to eat and sleep
25323,329450,5,Hp31,12/08/2018,Great beach for kids. The access road is a little narrow in some places but do not be discouraged it's worth it.
25323,321095,4,Fredrc,08/08/2018,Top !!!!
25323,317032,5,papacabeza,06/08/2018,Very beautiful site Services are lacking but only the landscape deserves the 5 stars
25323,286221,3,tata13,11/07/2018,"Picnic on the beach. Bathrooms, fountain. Chiringuito nearby, price / quality good. Parking 7m."
25323,278128,5,amaro,01/07/2018,"Great place to spend a day at the beach and mountains. From here comes the O Fuciño do Porco route. Very beautiful beach and ideal for children, since at low tide there is a kind of lagoon with warm water and shallow depth. There is also a picnic area in the shade."
25323,263333,4,stuartandsandra,03/06/2018,"Ps we are  9m long, twin tag, some of the bays have no wall at the back so we were able to reverse in and overhang, can’t believe we are the only ones here. I only gave 4 stars because there is no purpose built waste for the toilet cassette.  But as I said it is wonderful. Beach, trees, boarded walk ways, restaurant,"
25323,263326,4,stuartandsandra,03/06/2018,"Amazing, beach, trees, dogs allowed on the beach before 10.00am and after 9.00pm May-September, just need to read the signs. Had a nice meal and a good bottle of wine, pushed the boat out 50euros and had their fish special, could have spent much less."
25323,224955,5,mistert,27/02/2018,"Site highly recommended. We have spent the weekend there and at night, although a car passes, it is very quiet during these dates. The beach is very beautiful, and as they say there is a picnic area. The only downside is that in summer you can not go with a dog to the beach, only from 9 o'clock at night. Out of season you can go at any time without any problem."
25323,200613,5,rvanvugt,06/10/2017,"Lovely place, very quiet during the night and good acces to the beach, perfect. Just the roads to this place are a bit tricky: steep and partially very narrow. My campervan is 7,5m long and has 4,5t, I was happy that I just managed to get there and lucky to find a beautiful spot for one night. The parkings are too short for my van, but as there were no other vans, I could use 3 places. Showers are great for filling up some water and clean your feet after the early morning beachwalk... lovely!"
25323,188039,5,marteta,31/08/2017,"Calm and beautiful place !!!! We have spent the night, highly recommended!"
25323,171591,5,tottical,11/08/2017,"We have spent the night with the camper and everything very well. Washbasins and bar service, in front of the beach. Take the opportunity to make a fucino por porco route."
25323,160774,5,mcanasg,29/07/2017,"Brilliant. Beautiful place, services and beach bar."
25323,157751,5,Robertocampo,24/07/2017,"Very quiet and beautiful area. With beautiful beach, picnic area, tables and even some caves nearby. Good place to spend the night. Without too many people (in July, only 2 motorhomes and 1 camper) but it seems quite safe. Very close also to the beautiful walk ""Fuciño do porco""."
25323,152395,5,izan6,16/07/2017,"Beautiful and very very quiet beach bar and beach, what more could you ask for?"
25323,152394,5,izan6,16/07/2017,Quiet and very nice place
25323,145378,5,appellover,24/06/2017,"Very nice spot on the beach in weekend many day visitors, narrow access road. Enough space. From May to September, dogs are allowed on the beach from 9 pm to 10 am."
25323,99986,5,MarcMoreno,25/08/2016,Perfect! What a beautiful place
25323,92587,4,terradas,10/08/2016,A great place
25323,91994,5,stopplay,09/08/2016,"Flat parking, lighted, luxury toilet, nice restaurant, beautiful and deserted beach in August (ok it was a month in December) picnic benches even though not all places can accommodate large motorhomes."
25323,91189,5,clochette19,08/08/2016,The top! the weekend a little populated but a wonderful setting!
25323,44352,5,osertz2012,27/07/2015,A great discovery this quiet place we are in July and on an excellent day and we will only be about 40 people on the beach I hope to go back and everything will continue like this (I did not do well to publish it jajjajaj)
25368,2942308,5,Dennis_Emma,09/07/2023,We were able to fill up very cheaply here (diesel = €1.29) and then took a shower (€3). Everything was very clean and super friendly service.
25368,2918797,5,mattshop,03/07/2023,Confirmed that the gas is cheaper here and shower costs 3 euro
25368,2052267,5,Mayte1973,09/07/2022,We had dinner in the picnic area and then we slept very peacefully in the truck area. In the morning coffee at the bar
25368,404552,5,galgoneta,04/11/2018,"True low cost price of fuel. A supermarket with all kinds of products. Very complete. Cool. I know you can buy butane. You can put air to the wheels, machine with manometer, free."
25368,238411,4,Trapi,19/04/2018,You can also buy butane.
25368,209724,5,eledede,05/11/2017,"We use € 3 showers, cleaner than anywhere. Excellent. I do not know if you can park"
25368,118314,3,maeletcaro,14/01/2017,Shower in the p7 store for 3 €
25407,2663227,3,Txavito,12/04/2023,"It's okay to spend the night, level"
25407,1797858,3,ApaCamper,27/03/2022,Parking between the river and the road. The quiet night without noise. In the morning you can already hear the cars. It is the only town with movistar coverage in the area.
25407,1435248,3,Ismailov,10/08/2021,"Quiet parking by the river and the park. There is a nearby tap to load water. It is highly recommended to visit La Tahona de Mari Carmen, a gastro bar with a beautiful terrace."
25407,1117121,3,FelixF.,22/11/2020,"It is a parking lot next to the river and the road, but we slept well, careful with the branches of some trees."
25459,3292180,4,AndreLaunay,13/09/2023,"very nice spacious campsite, pleasant and quiet, especially in this season, we will come back with pleasure, the welcome is most favorable"
25459,3223014,1,fcouette,26/08/2023,"we were well received but the pitches are tiny. We managed to pass between all that was lying around, mower, pipes, games, chairs... we were tired so stayed but when I saw the showers I really regretted it. No packaging bins either here. screaming kids playing until 1am then dogs, no respect. I obviously do not recommend"
25459,3192815,5,Furgozblai,21/08/2023,"The girl at the reception very nice. Clean and adequate services. Shady pitches. Tranquility from 23:00/23:30 (earlier in hot summer it is difficult to sleep). River next to bathe. A campervan and two people in high season, €13.50. You can not ask for more. Camping like before and unfortunately few are left."
25459,3191182,1,carpunto,21/08/2023,"The girl at the reception is great. The plots at the bottom are horrible, bugs fall from the trees and bite. We change plots and it's better but here there is no calm, it's 1 in the morning and they don't let us rest. The showers are great but the toilets smell terrible, they tell us the river is here Just when we go, we're sorry to say that there are rats… in short, for one day it's okay, but no more."
25459,3159726,4,michtopelo,16/08/2023,Very well placed for a stopover visit to the city bathing washing machine shade quiet and very affordable
25459,3069409,5,Forshizzel,03/08/2023,"Cheap, shaded, all the facilties, and right by the towns river where we swam happily in. Recommend"
25459,3064216,5,matiasqueipo,02/08/2023,"We did a few nights, and it was a good experience. No-frills campsite but clean, cheap, close to town... we'll be back for sure!"
25459,3036564,4,AbdulaHatchali,28/07/2023,"Simple, but appropriate. Lots with good size and in good condition. The river passes through the back of the campsite and you can bathe. It is appreciated in such a hot city. The services are simple but well maintained."
25459,3026685,5,sofida8,26/07/2023,Well placed place ideal for visiting the city of Ciudad Rodrigo which is worth a detour. campsite good value for money
25459,3004641,4,Brinkhoffs,22/07/2023,"13.50 euros for 2 people without electricity, large pitches, many with shade. Beautiful location, close and within walking distance to the city of Ciudad Rodrigo, which is well worth seeing. Swimming possible in the river in front of the barrage. Sanitary ok. Washing machine also ready for use.."
25459,2978686,4,ColinLangmead,17/07/2023,For a small busy site we found it very quiet. There is a beautiful river within a few minutes
25459,2972265,5,jacou,16/07/2023,"Campsite with a family atmosphere, shaded, good welcome, sanitary facilities a bit dated but clean and doing their job, close to the tourist area. Price 13.5e without electricity. Perfect"
25459,2945635,4,JanundAnja,10/07/2023,"A good place to visit the nice city. The place has a great location, quiet, very close to the bathing area at the barrage of the river. The site has spacious pitches, everything is very uncomplicated, the sanitary facilities are actually in need of renovation, but as far as clean, the site could be a bit more well-kept overall, we expected more based on the reviews."
25459,2878940,4,Haddock4485,21/06/2023,"Small, very friendly campsite, large shaded pitches. Close to town for sightseeing. €13.50 without electricity with ACSI card. Clean and new toilets. What could be better."
25459,2875376,3,gerardpoitou,20/06/2023,campsite quite nice but no more 17€ per night a motorhome for 2 people with electricity quite cold reception when at the level of the bar very cold for drinks they have to go to the bar to take to the terrace at the level of the showers almost to get naked outside the shower and for the dishes at noon and evening almost cold otherwise the locations are correct
25459,2853213,4,sannesimons,14/06/2023,"Nice, green campsite. Lots of grass and trees. Also ideal with a young child, they can cycle exactly one round. There is a cafe at the campsite and right next to the campsite is a park with a playground. You can walk straight into the old beautiful city. Excellent sanitary facilities, you have to change outside the cubicle. We stayed 2 nights in transit to northern Spain."
25459,2849344,4,REGRENY17880,13/06/2023,"Very pleasant small campsite, near park and river. Only downside we get dressed outside the shower. Nice step."
25459,2832922,3,MJPp4n,08/06/2023,"Small site with adequate facilities, within 10 mins walk from town which is fantastic. Suitably priced."
25459,2829956,5,lepetitcamion,07/06/2023,Very nice and smiling little welcome At the foot of the citadel and the river. nice ride
25459,2796773,5,Imanolx,28/05/2023,Small but very nice camping and quiet. Very friendly people and 10 min walk from the old town Rodrigo. A wonder we will return.
25459,2764806,4,josmallbones,19/05/2023,Small campsite within 10-15 mins walk of the town. Very friendly staff and enjoyed freshly baked baguettes in the morning. Site and facilities are a little tired but a good site for stopping over on route to Portugal.
25459,2763826,5,jpded,19/05/2023,"Small, clean, quiet and shaded campsite. Very close to the old town, 12 min walk. In May we paid €13.50 per night for a cell and 2 people."
25459,2717920,5,Elgus10,02/05/2023,"Small campsite and very well cared for, super family-friendly and very well located, as other comments say, it's nice that people are so friendly and treat us so well. A 10 and 5 stars of kindness."
25459,2707808,4,mifeve,30/04/2023,"The campsite is small but it's ok. 10 min. from the medieval area, we slept great, nothing to object to."
25459,2678106,5,JessTinski,17/04/2023,"great small campsite on the edge of town. quiet. friendly staff. hot showers, washing machine, emptying of toilet available too. 19.90 for camper, two adults and two children. bar on site. perfect for a nights stay and safe."
25459,2676347,5,SteffiWittig,17/04/2023,"Great little square, walking distance to the beautiful old town. Hot showers, warm water to rinse off. Washing machine available, but we didn't use it. Pitches big enough, partly shady. Costs in April €6.70 for the car plus €3.40 per person."
25459,2651305,5,Txema2001,08/04/2023,"A great place, next to the river, very nice. A 10 m walk from the center of the town. The lady at the reception and cafeteria was wonderful. Spacious, level and comfortable pitches. Water included."
25459,2650772,4,kripau,08/04/2023,"Very nice campsite near the very beautiful center. Spacious pitches. Plumbing is ok, but outdated. We did not have the correct coupling available for filling the potable water (there is a 2-inch connection). The campsite is definitely worth repeating."
25459,2648237,5,dolarshibapits,07/04/2023,"Small but cozy campsite, the bathrooms are clean, they let dogs in, we only spent one night and it was great, it's next to a river. The people in charge of the campsite were nice. The price is very cheap for a camper. The dogs did not pay."
25459,2645847,5,Pedroazov,07/04/2023,Small and comfortable campsite. Updated and clean restroom and shower facilities. Excellent atention.
25459,2626207,5,Steinbock56,27/03/2023,Very nice place and impressive city
25459,2620604,5,patrick42300,23/03/2023,Very quiet sanitary campsite very close to the old town all for 17€ with electricity
25459,2618147,5,wirsinddannmalaufreisen,21/03/2023,"Great campsite, hot showers. Old town within walking distance."
25459,2596696,5,dorsetian,03/03/2023,"Small, quiet, well laid out site. Excellent showers which look newly furbished. Short walk across river to old town. 13.50 euro for camper and two. Electric 3.50."
25459,2566555,3,Ma.Eugenia,02/02/2023,"At the foot of the wall, next to the river. The staff very nice. A good place to spend the night and visit the city, which can be reached on foot in a few minutes."
25459,2549399,5,campinglapesquera,11/01/2023,The campsite is closed until February 1 for holidays. sorry for the inconvenience
25459,2536014,4,poobly,01/01/2023,Perfect for a stop over. Open all year round until 11pm. There is a hotel with restaurant next to it. Clean quiet and easy access to motorway. Good free Wifi on Tue campsite. we used it as a stop over on our way to Portugal.
25459,2440811,5,Basoline,13/10/2022,"Simple, small-scale campsite with good facilities. A bit old fashioned but fine. Places are not too big but fine for a camper. We had 7 meters and just fit on it. Lots of shade. There is a bar which is also used by the locals. In the “mini market” you can only get sweets. Fortified town in the background. You can easily go there on foot."
25459,2410494,3,BerndBlaschke,28/09/2022,"Uncomplicated campsite, great surroundings. City in the fortress worth seeing and easy to reach on foot. Ideal place to stay to get to Portugal. 2 people WoMo electricity €17 is OK."
25459,2402685,3,caroline55,25/09/2022,"Small quiet site, by the river, with adequate facilities. Sanitary clean, friendly bar that also serves pizza. OK place in transit, we would not choose this place for a longer stay. Fortified town within walking distance is worth a visit. Restaurants and shops are closed in the afternoon until 8 pm. Price is fine! €17 for 2 adults and a dog, camper and electricity."
25459,2394440,5,Partner446,22/09/2022,"Very good place to spend a night or two. Next to a bathroom area. Perfect for making the jump to Portugal. The city is very monumental and in the surroundings there are archaeological sites of the first magnitude (Siega Verde, Iruñea ...) Very good facilities"
25459,2358375,5,anita25186,10/09/2022,"We have spent two nights and very comfortable to sleep peacefully and good bathroom and shower facilities and a lot of shade in the campsite and at an ideal price, I recommend it and we will return."
25459,2344293,5,gmkiki,06/09/2022,"really nice campsite under the trees, clean sanitary facilities, large sinks for dishes and washing machine. the manager is very responsive when a malfunction is reported to him. you have to visit the old town and leave the campsite on the left then 1st street on the left to go down to the river. we recommend this campsite."
25459,2330787,5,olivavan,02/09/2022,"Very familiar and quiet campsite, 10 minutes walk from the old town. Next to the campsite, the river with an excellent bathing area and beach bar. Camper and two adults €13."
25459,2289505,3,Anaye,23/08/2022,"We spent 2 nights, cheap price €17 per night, motorhome and 2 adults, near the city and next to the river, a beautiful area with beach bars."
25459,2275185,5,ramfarre,20/08/2022,"Great car park located in an unbeatable location for visiting the city. A lot of shade, near a river where you can bathe, 15 minutes from the historic center. Correct and clean services and those responsible are a great couple."
25459,2258605,4,ovamar,17/08/2022,"campsite with all services. 10 walking from the city center. lots of shade. Super cheap price, 2 adults and 2 children with van and electricity €23.80 per night. Next to a bathing area in the river with a very good beach bar."
25459,2239509,5,gloriavandita,14/08/2022,"Campsite with lots of shade, located a minute's walk from the river (you can swim and there are beach bars) and at a very good price. Two people, dog, camper and electricity for €17 per night. Good treatment by the staff. If you go out to dinner outside the campsite, we recommend the pizzas at Pizzeria DeMaria."
25459,2202430,5,GurutzeEtxaniz,09/08/2022,A very cozy family car park. Large plots. The river just behind the campsite. Recommendable!!
25459,2175987,4,jcordeiro,04/08/2022,"A typical municipal camping. Affordable and well located. Don't expect nothing fancy from services or the bar, but they will certainly do the job. We bought a loaf of bread for €1 freshly baked. staff very welcoming. 1 min walk from the river beach and nice pubs. 10min walk from the city centre."
25459,2166141,4,Chaumois85,03/08/2022,"Small campsite for a very nice evening stopover. The setting is magnificent with access to a river with swimming area just behind the campsite. Admittedly, the sanitary facilities are not new but are very helpful and the showers are large. The people at the campsite are very nice. Thank you for your welcome. Recommended campsite."
25459,2154225,4,YpoFirst,01/08/2022,"small campsite without artifice. The sanitary facilities are not of the latest generation but they do the job well. the big advantage of this campsite is the access to a bathing area well known to the locals, 2 mins walk away. the kids loved being able to cool off in the Rio."
25459,2101894,5,Elmendas2,21/07/2022,"We have spent two nights, basic services and without a pool (although it is not necessary because the natural pool is next door), €17 per night for two adults and a medium-sized camper with electricity, without a doubt we will return, the campsite staff are super friendly! important it has a lot of shade!"
25459,2055566,4,pielago,10/07/2022,Small campsite with lots of shade and perfect for visiting the town and enjoying the river pool. I would repeat
25459,2031323,3,camperfamilyy,02/07/2022,"We were in August 2021. Basic camping, clean but outdated. Near the river."
25459,1842969,4,DeBus1310,21/04/2022,Great campsite. Nothing wrong with it. Why the whining? Everything is well taken care of. A nice quiet place and shady. Next to a river. Overlooking Ciudad Rodrigo!
25459,1795717,2,martinpats,26/03/2022,"Beautiful place on the edge of historic city and river. Too bad the site is not maintained, site is dated and in need of refurbishment."
25459,1776279,3,Christinevillar68,07/03/2022,"Small clean campsite, clean sanitary facilities but so cold. They are not heated and the access doors are always open. It was 4 degrees when we arrived on March 6, the showers had nothing to put or hook things on. If you want to do the emptying, nothing is provided except for the chemical toilets."
25459,1771282,5,stronsaychris,02/03/2022,"Super little site perfect for visiting the incredible old fortress town. Just off the motorway so great for a night stop.  Good showers etc. Just a thought we arrived and thought it was closed as some others have said, but the gates are not locked, open them and drive in. The owners live on the left inside and will come out to you. €17 per night motorhome and 2 adults with electric."
25459,1747640,1,lasskris,04/02/2022,The opening times are incorrect. Allegedly open from 01.02; were there on 2/4 and the place was closed.
25459,1687453,1,MANANU21,13/11/2021,The date is wrong. We have arrived on 11/13 and it is closed
25459,1661420,4,titidu40,25/10/2021,Just before the border. very good for a stopover. visit to the charming old town. on the other hand not for the races. plan to stop before or after. no drain for cc. very large water pipes for recharging not planned damage. friendly welcome but not in French. not serious. we went there again on our return from Portugal.
25459,1556510,4,algo1953,07/09/2021,"The accesses to the city until reaching the river are through a neighborhood that is not very attractive or not at all attractive, the camping is quite correct,"
25459,1426295,5,ElZede,08/08/2021,"Spent the night of 07/08 in a van, really nice campsite and well located, the owner is nice and not annoying at all, perfect for a night where two and the medieval city at a hundred meters on foot is to be visited."
25459,1420130,4,beriweb,07/08/2021,"Ideal location. One minute from the bathing area in the river. Ten minutes from the town center, going up the slope of the ""M"". Acceptable bathrooms. It is essential to order eggs with farinato at the bar ""el sanatorio"" in the center of town."
25459,1398253,4,unpardedos,03/08/2021,"We have been very comfortable, super spacious pitches, we had AC and a trailer, a quiet place, no frills but with what you need to enjoy the surroundings, the river and a very large field with a beach bar behind, near the center and the SUPER friendly staff."
25459,1393378,4,arsame,02/08/2021,"Very quiet night. Small, functional campsite with clean facilities. With all the services and economic. 2 adults, van and electricity € 17 in high season (August). It has a barbecue area."
25459,1355983,5,van-des-globes...trotteurs,23/07/2021,"Nice little shaded campsite arranged in a star around the recently renovated sanitary block. Right next door, access to the river for swimming, and the medieval city a few hundred meters away. You can get there on foot easily. Unbeatable value for money: € 13.50 for 2 adults and a van. No additional cost for our dog. This is our favorite!"
25459,1325863,5,Roberto47,15/07/2021,"Very familiar municipal camping, the couple that runs it is great, very quiet, a lot of shade, near the town next to the river, good price, we were on 07/14/2021, we will be back for sure, thanks Javi and Lorena"
25459,1285467,5,picaro42,29/06/2021,"Very well located to visit the town. It is very small and quiet. On 06/27/21 in the evening we were two AC, two caravans and I think a tent. It seems like a good place to later cross to Portugal."
25459,1280869,5,Jorgel1985,27/06/2021,"Very cozy campsite, it meets all the requirements to spend several nights. Near the center of Ciudad Rodrigo gon a nice walk along the river until you reach the castle. 100% recommendable"
25459,1236783,4,zunzu,05/06/2021,Washing machine € 4. 2 people and motorhome € 13.50. perfect to spend a day of rest and visit C. Rodrigo.
25459,1229540,4,Krux,01/06/2021,"Small and quiet campsite next to the river, which meets all the necessary camping requirements. Lots of shade and clean services. Free washing machine. Motorhome, two people and electricity 17 euros. The people who run the campsite, fantastic."
25459,1213363,4,GreletNina,23/05/2021,"Small, very simple and very nice campsite. shaded and the town is within walking distance. Along the river. very clean sanitary hot shower and washing machine free. affordable price, 6.70 for the camper van and 3.40 per person it is necessary to add 3.50 for electricity."
25459,1202809,4,NewBartolita,16/05/2021,"Small but pleasant campsite on the outskirts of the city, next to an old and run-down neighborhood that gives another aspect, with light in all the pitches, clean toilets and very quiet. € 17 AC 2 adults and electricity. Reasonable This weekend 4-5 BC and several solo campers. The river next to it that will make it more crowded on other dates. In general, it complies with what we all seek."
