placeId,reviewId,reviewRate,reviewUser,reviewDate,reviewContent
24908,3213038,5,carrascosad,24/08/2023,We do not sleep under the trees but in the parking lot where there is an area for caravans.
24908,3199392,5,ordeso,22/08/2023,"Very quiet place, among eucalyptus trees. Not on the pk of the beach, on the road or access to it. There are showers and restaurants. 20m walk from the center."
24908,3180557,5,Sarostra93,19/08/2023,"Very relaxed place to spend a few nights, quiet and surrounded by nature under the pines with great views. Easy access."
24908,3178724,5,Marioberja,19/08/2023,"Easy access, space and pleasant nature. A 20' walk from Navia along the promenade. We had dinner at Sidrería Antolín, highly recommended!"
24908,3174460,5,fanromn,18/08/2023,"Plenty of parking between trees, perfect for a picnic and a swim"
24908,3158337,5,dbarreira,16/08/2023,"We spent the night a lot of vans and AC, no problem. The Civil Guard passed by at midnight."
24908,3127942,5,AzulAbril,12/08/2023,"We stayed one night and wish we could have stayed more! The beach next to it is beautiful, the water is great. There is a lot of shade, we sleep a lot of vans and caravans and everything is super quiet and super clean. There are showers, bathrooms, a fountain with drinking water... Come on, a 10th place! I would repeat without hesitation."
24908,3120179,5,AnnaMoclo,11/08/2023,"We stayed in the eucalyptus forest area, the whole next morning the air conditioning smelled of eucalyptus, for that alone it deserves 5 stars. The place is very quiet and beautiful, we arrived late and the gambling dens did not bother us, we had dinner at the Antolín de Navia cider house, a 10 Just remember that it is not a camping area, there were many campers with tables, chairs and clothes lines, it is not good."
24908,3076819,4,Eu04,04/08/2023,"We park under the eucalyptus trees, quiet night. Very close to the beach and a very pleasant walk around the pool that is right in front. A highly recommended place to spend a couple of nights and visit the area."
24908,3067475,5,chity1,03/08/2023,"Paved and level parking. They fit about 6 AC. Next to a lake, a beach (dogs are prohibited), a park for children and several beach bars, cars pass by until 12:00-1:00 in the morning because of these. Before reaching the car park there is also an area where you can park under the trees. At 6:00 the garbage truck passes."
24908,3065819,5,luckyfamily31,02/08/2023,Perfect pitches very close to the beach and under eucalyptus trees. No services but taps to do the dishes if necessary. Games for children. Very calm.
24908,3063684,5,CharoGaray,02/08/2023,"Beautiful site with parking spaces for about 6 AC yesterday we were only 3 at night and we were alone during the day although there was more under the eucalyptus forest. There are beach bars but it was not particularly noisy. At night quiet. Parking next to the beach entrance, there are showers, there are clean toilets, there is a children's play area, swings, a zip line, forest. Highly recommended!"
24908,3059721,5,siggimueller,01/08/2023,"Very good parking lot, if you want you can stand under tall trees without sun. There are 8 parking spaces for RVs on the street with lots of sun :-) The beach is very nice and only a minute away ... can recommend with a clear conscience, a good place for children.."
24908,3010793,2,indina,24/07/2023,"The place is very good but a family of about 30 arrived and they looked like a mess, so we went to the one that is a little earlier. It has beach bars and is among eucalyptus trees."
24908,2991650,5,zucche,20/07/2023,"Very beautiful place. We pull into the trees before the car park at the end, which is quieter and has plenty of space. We stayed two nights very quiet, it is close to the beach, and a good walk around. And at night we went to the pasodoble bar, which has good music and cider! 5G Vodafone to work perfect"
24908,2962658,3,marzar,14/07/2023,Car park was currently closed due to white lining.  We didn't stop but it looks like they are possibly putting in dedicated spaces for motorhomes but not entirely sure.  Plenty of available parking in the surrounding area.
24908,2949465,5,malucars,11/07/2023,"Excellent place, beach 100 meters away, restaurants 40 meters away and playground 50 meters away, ideal with children, talk to the local police and if chairs, awning tables, etc. are not taken out, you can stay overnight"
24908,2855225,5,itchyfeetfiona,14/06/2023,"Wonderful couple of nights here. Toilets , beach and bar all nearby.  Peaceful. We are only van here tonight and only a few others last night ."
24908,2634166,1,AoifeRedmond,01/04/2023,5pm on a Saturday and people on quad bikes and cars doing doughnuts in the carpark spraying the van with gravel and stones.
24908,2575529,5,Alondra,12/02/2023,"As said, splendid next to a bar with light all night, a beautiful sunrise, surrounded by Ria and beach a grove of eucalyptus"
24908,2458124,4,JesusMarta,23/10/2022,"A good place to spend the night without restrictions, there are garbage containers and a bar right next to it, the GC passed by and they left without saying anything to us, right next to it there are some stairs that lead to a very nice viewpoint."
24908,2445090,5,zzak,15/10/2022,"20m from the beach, 20m from the restaurant bar, playground for children, beautiful walks to do in a wild environment. at the top this place. cc prohibited in summer, but no PB tonight."
24908,2337489,4,danimarga,04/09/2022,"Good place near the beach, very nice wooded area and games for children. Chiringuitos open without disturbing noise on this date and paved parking. We stayed one night and continued our journey."
24908,2243490,5,Jcri,15/08/2022,Good place to spend the day and night. Several beach bars and bathrooms during daytime. About 4 beach showers and 2 sources of drinking water. I liked the beach but bathing is complicated in this area because it is very exposed. Before reaching the beach bars on the right hand side there is a eucalyptus grove where there are several Furgos roll camping and it seems that there are no problems. Trash bins. a 10
24908,2220753,4,uprootedvan,12/08/2022,"Nice space but it had minimal 4G so we left. If you're not reliant on having phone signal, great spot!"
24908,2003224,4,DianaRios,23/06/2022,"Parking at the beach. We were alone in June, very quiet at night. The waves of the sea are heard perfectly."
24908,1669144,4,aston2,30/10/2021,Great place ... no problem.
24908,1667663,5,ViztorRivas,29/10/2021,"Highly recommended out of season! I was staying one night with my van and no problem. You can park practically on the beach, just a few meters from the sea, and there are plenty of places. Next door there are 2 or 3 beach bars, which is cool to be able to have a drink or dinner. Also, as I have gone at the end of October, they closed early and there was no annoying noise, only the waves of the sea"
24908,1614139,4,frannetpat,28/09/2021,Quiet night next to the small beach. Beautiful walk along the path along the estuary to the pleasant town.
24908,1368826,1,JJunior,26/07/2021,We went to spend the afternoon on the beach and around 6pm the police invited us to leave if we did not want to be fined. A shame as we will not be returning to this site.
24908,1349577,1,lauradel,22/07/2021,"The place is beautiful but I do not recommend it, unless you come wanting to party, music and groups of people until late."
24908,1346772,4,africabicho,21/07/2021,"I spent a night with my van among the trees that are just before reaching the beach bars. The place is very beautiful, there were 2 other vans staying overnight. The police passed by a couple of times and they didn't even look at us. The only bad thing is that the beach bar has a lot of atmosphere and cars do not stop passing continuously until quite late. Otherwise very good place to spend the night"
24908,1239883,4,Quicolas,06/06/2021,Beautiful area next to the beach. It is a pity that there are always many cars and the squares are small. There are several trails to the town and a walk along the river. Cool
24908,980095,4,adrianpallin,19/08/2020,"The parking enabled, with many cars, Right next to it between pine forests, there is a very cool area, also near the beach. The truth is that I really liked the site. If it happened again I would repeat. Black beach sand"
24908,887622,3,dasafru,21/07/2020,"Nice place, few places, watch out for cut logs when parking."
24908,883828,1,Amayajubileta,20/07/2020,Good place for small vans and small camper. Motorhomes a trick. According to how I got out. The site is cool.
24908,694405,4,patriciaboquet,17/09/2019,"Near the city 2 minutes. The snack serves us to eat at 15h, games children, place raised, tables of picnic. No service but upon arrival, there is a free point that is reported to drain and fill the water. The waitress tells us we can stay overnight"
24908,676532,5,nicolatapp,04/09/2019,"Beautiful place to wake up in, pine forest, beach, sea. Has toilets and a cafe. Lots of space to park."
24908,622018,5,RecOn,12/08/2019,Very good place! For 2 or 3 nights perfect. Good view for river and ocean! Near town
24908,597865,4,milo1980,04/08/2019,Very good site With shade between trees if necessary. I spent two nights and every night we were just another motorhome and us. Very calm
24908,563244,3,Aquadrathalbe,19/07/2019,"Beautiful place but only in the low season or better in winter, if you have a mobile. A van or bulli is great, but if you're bigger than a car parking lot, you should not drive in the street."
24908,558707,4,Magtou,17/07/2019,Perfect for picnic there are swings and games for children. You can shower ... you can sleep but not wild enough for my taste
24908,493544,4,Dieguinvan,26/05/2019,"May and semi empty parking, an AC and me. The site is quiet, has a bar nearby, the center of navia at 1 km, showers in the parking lot, picnic tables, routes to do near and next to the beach."
24908,488636,5,Beaglecamp,20/05/2019,Flat place nice beach and walking around the lake. Cafe nearby.
24908,463276,4,mvina,22/04/2019,"Just fantasize that the wc are open all year, then it would be perfect."
24908,458213,3,Andoni.G,18/04/2019,Very cool site to come with children and pets. But the long motorhomes do not enter.
24908,330859,4,d.l.t,13/08/2018,"Perfect place to arrive late in the afternoon to park without problems and enjoy the beach, either in the afternoon or the next morning. The days of a lot of sun seems to fill up a lot. It has showers on the beach and toilets, which are closed at night, and picnic"
24908,327472,1,danymh,11/08/2018,"Super narrow, for the day full of cars, once inside, very difficult to turn around, if you see cars on the sides before entering, better not to get into"
24908,244943,3,autostar47,02/05/2018,"Super parking ideal for the day and the night, splendid in good weather, quiet corner, to advise"
24908,214017,3,clarita,08/12/2017,The site with swings is fine. but they were working with machinery in the access to the beach. we do not stay to sleep.
24908,201913,4,ferrolanos,11/10/2017,Perfect site for overnight. It is about 2 km from the town of Navia to where you can take a walk on a small bridge. There is a beach bar.
24932,2867840,4,Lorrainenono,18/06/2023,"Pleasant campsite near Rupit, friendly welcome, impeccable toilets but a bit expensive... 40 euros per night for a 2-person van"
24932,2714409,5,anigwei,01/05/2023,Great small camping with more than enough and clean facilities. Very warm showers.
24932,2591055,3,enricblanco,25/02/2023,"area without TV signal. and parking is €7 per day. eye. if you stay one night, they charge you €14"
24932,2286369,3,ideatika,22/08/2022,Camping near Rupit. You can go to the town taking a walk.
24932,2184681,5,marthin,06/08/2022,"Very nice campsite, clean and uncrowded even in August, at the foot of lots of hikes. Rupit is worth visiting."
24932,1554586,4,lluisrp78,06/09/2021,"Camping very close to the town of Rupit where you can access it through a path that leaves from the same campsite and about 5-10 min walk. Simple camping, without great luxuries, but correct, clean and with the necessary services. We stayed one night with AC on a plot surrounded by trees and the children had a great time, especially in the pool. The swings should be renewed due to their age."
24932,1454543,3,chlomkell,14/08/2021,"Very pricey, €47.50 for myself only and my dog, plus van. Its the most expensive campsite I've ever been to. However, it's super peaceful and beautiful. Up in the mountains with fresh bread and nice clean facitilies. Nice for a treat!"
24932,1429297,5,alidenis,09/08/2021,"Very nice campsite; very calm. Pleasant swimming pool and very clean sanitary facilities. Small, very practical cafeteria where you can order bread. Very pleasant and attentive staff. 10 minutes from Rupit on foot; beautiful and authentic village!"
24932,1381271,3,Mbyford,30/07/2021,Bit pricy at 47 euro for the night. But super friendly and nice cold beers. We were also the only van parked up so it was nice and quiet.
24932,1364499,5,susanamoraal,25/07/2021,Quiet campsite and spacious pitches. Great pool and very friendly staff. Visit to the town of Rupit is within walking distance.
24932,1360351,5,xtemporal,24/07/2021,Very close to Rupit on foot. Highly recommended.
24932,996934,5,eloymx5,23/08/2020,Camping small and without luxuries (what we wanted) The plots are large. Clean pool and toilets.
24932,987774,4,xdomingo,21/08/2020,Peaceful camping. Ideal for rest. Near the village. It is accessed by a fun path of stairs. Rupit is very pretty.
24932,327255,4,Kry76,11/08/2018,Very nice campsite to visit Rupit even on foot or by bike. Pleasant pool. Correct home. Spacious location in the heart of nature (with a little luck you will see even small rabbits walk). Only downside sanitary are too precarious and a little dirty
24932,308462,5,bb13011,31/07/2018,Home super nice quiet campsite with a nice pool. 15 minutes from the pytoresque village of rupit attention to return about 150m altitude!
24943,3282620,5,alepues,10/09/2023,"Nice place to spend the night, there are only some pitches with electricity, €15 per night. Next to the road but quiet at night."
24943,3257350,5,Toecuter407,04/09/2023,"Well-kept facility with electricity, water, whatever you need. Carlos the manager is very concerned about the space and the well-being of the mobilists. We spent 6 nights here in total peace. A typical bar with a good restaurant is integrated into the camping area. Somo beach can be easily reached in 20 minutes on foot. We'd love to come back."
24943,3223331,4,albertoyjennifer,27/08/2023,"Quiet area. Nice location, and flat terrain. Enough places. A couple of bathrooms with outdoor showers, if they had been interior I would have given it 5 stars. Sinks with uncomfortable faucets. The boy who received us was quite nice."
24943,3197383,4,ScottCSchank,22/08/2023,"Perfectly adequate site. Not much here, but we knew that going in (and don’t need more). Two clean bathrooms and areas to walk the dogs. Safe, clean, and orderly. The price is right."
24943,3174991,5,AngelCarmen,18/08/2023,"Great area and charming Carlos, the person in charge of it. He is aware of you and helps you in everything. It's nice to meet people like that."
24943,3172289,2,pollitos,18/08/2023,"Exceptional treatment from the guy in charge of the area, very kind and friendly. The area is too basic, just two outdoor showers and two very basic toilets."
24943,3156629,5,javipirriky,16/08/2023,Good area to rest. Very clean and spacious plots. Very quiet nights. Close to supermarket. Toilets and showers outside. Carlos very friendly. Repeat.
24943,3140317,4,condestinoalmundo,13/08/2023,Receptionist Carlos very nice and helped us a lot with a battery issue. The area is very well located and the services are very clean. We will be back
24943,3140294,5,hawaii2022,13/08/2023,"The area is very good and quiet. Carlos, from the reception is very kind. He helped us with a battery problem. We had dinner at the campsite next door, delicious burgers. Close to Somo and Santander. It is the second year that we come. we will repeat"
24943,3132377,5,cchacon86,12/08/2023,The guy at the reception is very friendly. Right price. Beach 20 min walk.
24943,3117504,5,ellla312,10/08/2023,"Needed help because our number plate was not accepted, then everything went smoothly, nice place, the owner is really very helpful and very nice, cold outdoor shower available, toilets available"
24943,3105940,4,palbp,09/08/2023,"Very nice and clean. The receptionist is very friendly and helpful. Parcels are a bit narrow, but overall it serves the purpose of a short stay (2 or 3 days) for visiting Santander."
24943,3103181,4,patouto,08/08/2023,"Pitch well defined, clean and in a quiet environment. Very nice home. Perfect for one night."
24943,3093332,4,htatras,07/08/2023,"License plate is registered at the entrance and you pay in cash at the machine. Two toilets and two cold, unprotected outdoor showers. Use of the washing machine on the campsite is ok, but not the washrooms. With the bike you are in 10 minutes on the beach. With the ferry, on which you can take your bikes with you (€10 pp return) you can get to Santander. Good value for money."
24943,3067846,5,Mas518,03/08/2023,"Very good area, very quiet, with electricity €15. I will keep coming back."
24943,3059859,4,Lucette1973,01/08/2023,"Quiet area with spacious sites, 2 toilets and outdoor showers. 2 km from Somo, a tourist seaside resort and for those who love surfing, this is the ideal spot! Schools and surf rentals on every street corner."
24943,3052899,3,vagabondi661,31/07/2023,"Spacious pitches even if sunny. there are only two bathrooms as well as showers, unfortunately external! with bikes convenient to reach the beautiful beach. 11 euros per night without electricity."
24943,3021056,4,JCPORFIRIO,25/07/2023,"For a modern and paid area, it is regrettable that, of the 66 places(?), few have electricity points nearby and only one access point for water and flushing, far from the places with electricity, which makes it uncomfortable for more than a couple of nights. Otherwise, everything works as expected."
24943,3019320,5,vivicampers,25/07/2023,"Good quiet place, with two bathrooms, and outdoor showers to give you water on very hot days, 11 euros a night without electricity, the best thing is the guy who runs it, a certain Carlos, a very attentive, friendly person, you can take out tables and chairs, a spacious plot"
24943,3013003,5,tiburon,24/07/2023,"Area, very well prepared, quiet, where you can remove the table and chairs. The manager named Carlos is a great person, attentive and willing to answer any questions you may have. It is a little separated, but there is a pedestrian walk from the same door"
24943,2943496,5,Nellean,09/07/2023,"Park CC reasonable price for the season, electricity on the first plots draining possible, filling also after shower at CC is better because outdoor shower, tranquility no problem for moving plots. We tested the restaurant and the bar at the campsite next door, perfect nothing to complain about Thanks to Paolo for his kindness... I recommend if you don't need comfort"
24943,2940433,4,marcberrocoso,09/07/2023,"Good area to stop, fair services. We have been comfortable."
24943,2935339,1,Laida2007,07/07/2023,"It's 11:30 p.m. The children keep screaming in the area, I don't know what time they are going to let us sleep... 11 euros wasted, for this I don't enter an area"
24943,2924642,3,AlbertoGR1974,05/07/2023,"The area is just right, attached to the campsite but you cannot use its facilities, the bathrooms are not clean, the showers, two with cold water, just for one night. The price is not updated, 15 euros per night with current ."
24943,2871690,4,Home79,19/06/2023,"Signing up at the machine is a bit tricky. No languages selectable. Places up to 8m ok, but a bit too narrow, but quite flat. Good access protected by roller shutter. Good supply and disposal. The monastery bell rings at 8 a.m. Road traffic unremarkable. Very quiet at night. Good place to visit Santander. The best way is to take the ferry (10€ with a bike, there and back) from Somo (approx. 2km)"
24943,2838921,1,llcan,10/06/2023,"Covered prices, we have stopped to download, €5. They should put the prices visible"
24943,2797330,5,MatthewElaine,29/05/2023,Perfect and peaceful last night before catching the ferry next day.  basic facilities but clean and very well kept.
24943,2794158,4,tsigan,28/05/2023,Lovely clean site with all pitches flat and firm. Toilets clean with outside open air showers. Water and cassette easy to use. Would be better to have drinking water further away. Difficult to leave. Gate needed the site next door to come and open. Very quiet
24943,2706811,1,familybusroad,29/04/2023,Arrival at 6:00 p.m. Has 2 vehicles. The area was deserted. Only 3 motorhomes on site. We ask the person on site if we can sleep there. His answer is no. Because too long. 12m.and 10m. No worries we can get to the bottom. And we leave tomorrow morning. The person told us that we had to pay 4 places for 1 vehicle. Be 44th. Out of the question.
24943,2706791,1,LesRootards,29/04/2023,"Access denied or else I am asked to pay 3 spaces to put the truck in length since we are long. while the air is empty ..... it does not matter, we found free by the sea ...."
24943,2689674,1,columpetas,23/04/2023,"The area is fine, but it is very far from the beach, forget about taking the fridge, material, etc. on foot. Apart from a campsite, next to it there is a cattle farm, with its smells. There are places closer to the beach WITHOUT USE to put this area"
24943,2651710,4,Inmalaca,08/04/2023,"Good area, very well leveled plots, bike path to tour the area. A very big drawback!! It's the showers (they're outside, that's not a problem) because the jet of cold, frozen water (there's no hot water) splits you in half... Suitable only for the very brave... they should be repaired, a shame. Either way we are thankful for the area."
24943,2526426,1,RayH.,22/12/2022,On arrival today everything was closed off with red and white ribbons and a sign closed. Too bad because the motorhome looked fine otherwise.
24943,2497846,5,Lemarelta,17/11/2022,"beautiful and perfect place to rest, sleep, and fill and empty. Reasonable price."
24943,2490283,4,Virtass,10/11/2022,"Perfect camper. Quiet, safe and fully equipped: complete camper service and clean toilets and 2 outside showers (cold water). Next door campsite with bread in the morning."
24943,2477801,4,JavierParra,01/11/2022,"Large, level pitches. The two restrooms were clean, just missing a sink area and more picnic tables. The quiet night and the town on foot in 15 minutes."
24943,2466725,5,jeromefalc,28/10/2022,Everything you need to empty and refill water. cost of 5 € in credit card only.
24943,2459102,4,phes710,23/10/2022,We got there after a long day. The squares are large and without incline. €11 per night. Quiet and pleasant place.
24943,2349906,4,jungaljohn,07/09/2022,"this place is what it is, simple aire style Park with water, empty and toilet facilities.  handy for brits at the end if their trip. waiting for the ferry.
the restaurant at the campsite next door serves epic burgers."
24943,2341993,1,JanMx,05/09/2022,The operators are really only out to make money. Price board in Spanish only and the prices taped over. The machine also only in Spanish. For emptying the toilet 5 €. This is rip off! The faucet sprays in all directions. Catastrophe!
24943,2341794,4,molleda007,05/09/2022,"To spend the night and change water enough. For €11 it is what it is. Outdoor showers and bathrooms no one will enter. Restaurant of the campsite next door, impressive hamburgers and good treatment. Comfortable seats and good distance. Somewhat remote village but we did not need to go."
24943,2338428,3,sentonio123,04/09/2022,"Good motorhome area with ample spaces, located 20 minutes walk from the Somo and Loredo beaches, but it lacks in terms of cleanliness, the bathrooms leave much to be desired."
24943,2330163,4,Tucha,01/09/2022,"Good place to stay overnight. It offers water exchange, black water discharge, clean water supply and electricity for €15. Outdoor cold water showers. Has toilet. Don't miss the campsite restaurant: 5-star food and 6-star staff! I recommend."
24943,2324014,4,Serflorido,31/08/2022,"Quiet site, I used the water services but not the showers as the water was cold. Somewhat far from Somo to walk, by car it's next door. From Somo you can then go by lancha (boat) to Santander to visit it for €5.50."
24943,2296692,4,Alcazarteam,24/08/2022,"Quiet place, a short walk of about 20 minutes to the beach (something more if you want to go to the prop with the dog). Electricity only in the first seats (about 12-18 in total). The showers are outdoors and with COLD water. The bathrooms were not particularly clean. Emptying and filling of water in good condition and comfortable. There was quite a good vibe."
24943,2291068,4,greenpeli,23/08/2022,"Quiet place, with water, filling and emptying. Electricity in some places (charged separately). Friendly staff."
24943,2267969,1,Carlosb1,19/08/2022,We did not like anything. away from everything. Expensive for the services it offers. Mosquitoes galore. Unhygienic facilities. very fair plots. Loading and unloading difficult to put the connector in the faucet. we will not repeat
24943,2246883,3,AnnaAigner95,16/08/2022,The place itself was great but the mosquitoes bit us all night. There were so many we didn't sleep.
24943,2206307,4,Nodisel,09/08/2022,"Cozy and friendly place to spend the night. Lots of space, with and without electricity. Cold outdoor shower, great for cooling off in the Spanish sun. No tent and you are not allowed to cook outside. Great place!"
