placeId,reviewId,reviewRate,reviewUser,reviewDate,reviewContent
83442,2033076,3,Flaviocorreia,03/07/2022,"practically empty car park, nothing happens, apart from cars passing by on the national road. we spent the night peacefully"
83442,993332,3,Familiacapela,23/08/2020,"Quiet place, a little isolated, we stayed for two nights, no problem. We only park from 8pm"
83442,350314,1,fsacramento,23/08/2018,It's just a parking spot. There is no service area. It is a very secluded place to spend the night. We were not afraid.
83462,3076227,1,Jomareyes,04/08/2023,"Impossible area to park motorhomes, it is full of cars seeking shade and also the branches of the trees make parking impossible."
83462,604529,5,Michel2272,06/08/2019,Great and silent place. Charming village has nice river beach with bar.
83462,549753,4,NunoMiranda,12/07/2019,"Quiet place in a beautiful population that justifies a visit. Great for spending the night or going to the river beach (100 m). Next to the supermarket, and cafe and bakery, where you can buy bread and drink a coffee in the morning."
83462,382261,5,lentillecornichon,26/09/2018,Had a quiet night. No service. Along the river. Impeccable for one night. River Praia next to it.
83501,728506,2,dd40,23/10/2019,"Parking area 20m from the road, separated by a guardrail. there is some idea in the layout, but lack of maintenance. Non pruned pines so difficult to pass between. Warning: the entrance is very upstream coming from Sant Jordi (700m)."
83541,3118496,3,coco524,10/08/2023,"We slept well, I put 3 stars because personally we had no problem but it's true when arriving on site, 2 suitcases were on the ground and empty. The morning of the departure we observed 3 young people who lapped around the vehicles looking inside with a suspicious look because they were watching us out of the corner of their eye. We didn't dare leave the vehicle another day."
83541,2645809,4,ManuMalaga,07/04/2023,"Despite the negative comments that we read, we only share our experience and say that we stayed 2 nights and nothing of theft happened to us. It is true that we were very alone because there was no one, the location is great. Services, a portable toilet and field... We had a small van, it was Easter 2023"
83541,2581418,5,MarkusAust,18/02/2023,Huge parking lot! at 7.2 m it was not easy to drive in the parking lot as the lane was very narrow and car to car. Parking lot was full. Then found a place and off to the nearby town. Easy to walk. Slept perfectly at night and never felt unsafe. For me the only alternative to park a large camper in Porto.
83541,2515431,3,Mendijur,07/12/2022,"Really large parking lot with a creek running along it. Garbage containers and portable toilet. Asphalt floor, flat in places. Quiet to sleep and march. We did not leave the vehicle because we had heard that they often robbed."
83541,2307086,1,parkcamperdog,27/08/2022,"No parking!!!! We have been robbed by breaking a skylight, the police did nothing to help, they took all the electronics and backpacks, loss of great value."
83541,2307034,1,Angeloix,27/08/2022,We've had a skylight broken and been robbed on a street near this parking lot. DO NOT PARK IN THIS AREA.
83541,1525227,1,Lenahoeper,28/08/2021,Someone Broke into my car! Please do not park there!!!!
83541,714825,1,PedroXr,06/10/2019,Watch out. Dangerous park to park. There are several robberies of motorhomes and other vehicles taking place here. After the robberies they throw their bags to a stream on the perimeter of the park.
83541,626521,3,killelle,14/08/2019,Actually large parking. Chemical toilets currently. 10 min to the descent to return ..... stayed 2 days and 2 nights. Have escaped the visit. But it's true isolated parking. Parking is empty between 17 and 18h. Fills up at 7:45. Not easy access for large CC.
83541,323136,1,philteo,09/08/2018,"Large parking certainly, but unfortunately we were also visited during our stay here. Broken glass and stolen objects. According to the police, this happened regularly on this car park. Beware! Do not leave your vehicle unattended."
83541,321835,1,JulienC,08/08/2018,Parking very convenient to visit Porto. Unfortunately I also visited the van! Broken glass and truck searched !!! How desolate to see that in the evening when returning from visiting such a beautiful city
83541,320954,1,pacospain,08/08/2018,"The place is perfect for visiting Porto, but they ROOTED us. They opened the window with destruction. When we returned to the night we were surprised to see the parking lot so empty ..."
83543,3126323,5,familycurly,12/08/2023,"very quiet town, next to the highway, ideal for spending the night, level squares and exterior lighting, especially those in front of the municipal pavilion. right next to it, sports and children's area with swimming pool and bar ideal for eating."
83543,3055206,4,Txortas,01/08/2023,"good place to spend the night around 8:30 the cars leave the pool and park there since it is on the street and you are a bit inclined, pool bar dnd there for lunch and dinner"
83543,3018945,1,carinekreutzer,25/07/2023,I never found this parking lot and yet we turned around too bad
83543,2664754,5,susy83,12/04/2023,"I was on Holy Thursday night! The site is spacious, enough cars fit, it is flat and you are close to the town. I slept super calm"
83543,2648937,4,anisko210482,08/04/2023,Quiet night next to a couple of other motorhomes. Passage area because it is very close to the highway. Many parking areas. We dined in town and the deal was shale. It does not have any service.
83543,2613391,4,albertogalindo,18/03/2023,"Very quiet and level place, ideal for spending the night"
83543,2492379,4,Squishy,12/11/2022,Quiet place to spend the night but keep in mind that it is at the door of a school and at 9am it is full of people passing through.
83543,2468695,4,IndarZizur,29/10/2022,"Good place to spend the night, if you don't go to the sports center, good places to park. And in the morning, if you want to have breakfast, you can have a good breakfast at the pool bar, today, at least, there were tapas, snacks..."
83543,2446133,3,tyrion,16/10/2022,Ideal for spending the night safely near the A2. It is better to approach the sports hall car parks which are 100m further down than on the street. There are many completely flat pitches there and you can use the wifi from the pavilion itself or from the swimming pools in front
83543,2437112,4,tamudito,11/10/2022,"I put 4 stars because the views are not particularly beautiful nor does it have services. But it is a very quiet and good place to stop along the way and rest. Near the town and a sports center. We stayed one night, few cars passed and in the morning people walking the dog. We recommend it."
83543,2192573,5,uelortegi,07/08/2022,Good place to spend the night and continue with the route. Next to the sports center there is a very quiet car park and a bar with a huge swimming pool. Totally recommended!
83543,2079341,5,Ibiltariak,16/07/2022,"We have slept next to the sports center, a quiet night. It is good to stop near the highway."
83543,2032806,5,jorfer,03/07/2022,We have spent the night and very quiet! if you go with dogs it is very good because there is a lot of land to walk them!
83543,1987362,4,Luisigasteiz,18/06/2022,Perfect place to stop on the way
83543,1918639,5,arianeD,26/05/2022,Very calm . Very good to spend the night. very friendly people
83543,1740810,5,marcdop,25/01/2022,"We didn't park here because it's uneven. There is plenty of room to stay overnight. Next to the orchards there is a path that leads to the river, there it is more level and there is the possibility of emptying gray water where the sulfatadoras do it. Few cars pass."
83543,1729536,5,pasner,08/01/2022,"Very quiet place, highly recommended. From 100 meters onwards, the school and swimming pool car park is replaced and Wi-Fi is available free of charge."
83543,1634389,5,neus2504,09/10/2021,"Infinity of room to spend the night, like 4 blocks of free space. Perfect for cycling or scooters so that the children can let off steam after a long trip, fields for dogs to relieve themselves. There is a dirt road at the end of the football field to walk, on the way to the orchards. On the other side (direction against the orchards) there is a playground.WATCH OUT SUMMER, NO SHADOW!"
83543,1455661,4,taniacamarillo,14/08/2021,"Very good area to spend the night and continue the trip, super quiet."
83543,1431251,5,Neku,09/08/2021,"We parked in the parking lot of the sports center .... we went to see the town and on the way back there were another 3 more motorhomes. Without any noise, very quiet night. I encourage the people to make a motorhome area. Thanks people !!"
83543,1232987,4,meduxask8,03/06/2021,Quiet place. Ideal to spend the night and continue traveling.
83543,938719,5,ikerlee,08/08/2020,Very quiet night. He sleeps perfectly.
83543,787206,5,elrebecu,26/02/2020,"Very comfortable not to waste time with detours. Near the highway, without services, but ideal for sleeping and following the route."
83543,658144,4,gramos,25/08/2019,"A good town to spend the night and continue on the road. We did not stop exactly at this stop because there was a party next door but we walked away like 1klm and it sleeps well, there is a lot of terraced chalets where Trankilo sleeps and there is a lot located to park and spend the night."
83543,617148,5,borjasl,11/08/2019,A very quiet area to spend the night and continue the trip.
83543,552777,3,trotaglamys,14/07/2019,We made a stop on the road and we slept very quietly.
83543,392322,3,Jeannesanab,12/10/2018,"Great for a quick stop, we must even be able to sleep there. By cons in summer, not a single tree for shade."
83545,3191891,5,jnolting,21/08/2023,"What a great campsite! Incredibly friendly and helpful. Everything clean and tidy. Great pool, delicious food and bread service. There is a pitch for all sizes. A solid 5 for me."
83545,3176658,5,paulkapa,18/08/2023,"Campsite of excellent quality. Framed in full nature. Note that in the summer months it is necessary to make a reservation, as it is always full."
83545,3173613,4,traianBRJ,18/08/2023,"somewhat crowded campsite, well equipped and clean."
83545,3110936,5,fredtaty,09/08/2023,perfect welcome services and equipment at the top clean campsite and sublime environment we recommend 200%
83545,3031264,5,Heidi-Christoph,27/07/2023,"Nice quiet campsite. ideal with children, 2 large swimming pools. When we were there we almost had the pool to ourselves. 30.30 € for mobile home, 3 adults and 1 child aged 14, incl electricity. clean sanitary facilities, friendly staff, services available. at 300m beautiful lake around which you can walk / jog (1.5 km is the tour)"
83545,2963833,5,Martapampin,14/07/2023,"WONDERFUL, quiet, very very clean, huge pools, lots of shade and a good price (29 euros for two adults, 2 children and electricity in high season) to repeat. Tip: take an extension cord as you can get a plot a little far from the current and so you don't have to rent (although they are only 3.50 euros)"
83545,2867314,5,kaxu,18/06/2023,"Top-notch well-maintained campsite, the staff are welcoming and friendly, spacious pitch, everything is done for you to have a good stay, swimming pool, restaurant and small supermarket for basic necessities. A nice walk around the lake for doggies."
83545,2867310,5,Betty2612,18/06/2023,"superb area where the bungalows are reminiscent of a Gallic village, I love it, pitch for a campervan tent canvas, gray water, black water, swimming pool with 2 pools, children's play area mini-market with everything you need, it's worth the detour, lake two minutes away to walk with the dogs €20.10 for 2 dogs, 1 cc, 2 people, washing machine €3, free wifi, come and see!"
83545,2829826,5,Mzelou,07/06/2023,"Quiet campsite, highway not far but you quickly forget it. Home at the top! Stop here without hesitation !!!"
83545,2821077,5,ftfilipa,04/06/2023,Fantastic camping! SUPER friendly staff. Clean and maintained toilets and showers. very well maintained and spectacular space for children to play. to come back soon
83545,2815294,5,josmallbones,03/06/2023,"Lovely campsite with a wonderful nature reserve next door - fabulous walks with our dog. The sanitary facilities and pool area were very clean and the showers were fantastic, plenty of hot water. Had a fantastic couple of nights stay."
83545,2810788,5,corann,02/06/2023,"Great site, friendly staff and excellent toilet facilities with fantastic showers, all spotlessly clean.  It has a large swimming pool plus childrens pool and is only a few minutes walk from a beautiful lake. Cost was 16.80 euros per night including electricity which is optional, I highly recommend this site."
83545,2783227,4,EvaKlemm,24/05/2023,"Very nice and pleasant place with a very friendly welcome, spacious and shady pitches, modern sanitary facilities, swimming pool, WiFi on all pitches, good restaurant, highway noise"
83545,2701336,5,riejannn,27/04/2023,"Perfect! Everything is nice, clean and functioning. The pitches are spacious. The park fits into the area. It is not big, uncluttered and clean. The pool looked great, opens from 1-6. There is a beautiful lake next to the campsite. Great for walking. It's not bathing water."
83545,2611366,3,Bruzbi,16/03/2023,"Very nice place, friendly welcome. The service buildings are not heated, sometimes no hot water, it was never cleaned during the 5 nights, but the prices are higher. The surrounding nature made up for it."
83545,2598471,5,Daantje1,04/03/2023,"Add nothing. Great place. Bicycle trip made works fine with electric bicycle but better for mountain bike. Place to relax, only 3 campers in March."
83545,2373195,5,GGTravel11,15/09/2022,"Best campsite we've been to in Portugal so far. Small campsite, beautiful pitches and clean sanitary facilities, with super nice showers!"
83545,2323302,5,rfsose,30/08/2022,"very clean, reception very friendly. there are some spots for AC with Shadows. a Little Supermarket with essencials (but overpriced)."
83545,2068293,4,beloncete,13/07/2022,"Small campsite with few places for motorhomes, but everything is correct and very clean. Music from some campers at a very high volume, but after our complaint, the kind women at the reception managed to turn off their device (the next day, again the same, there are people who do not respect anyone). Except for that, calm down."
83545,2057689,3,rene.legave,10/07/2022,very nice clean quiet shaded campsite € 16 for two in July with the camper friendly staff next to very pretty lakes
83545,2056115,2,jopinho6610,10/07/2022,"It's a pity not to enforce the regulations of the pool enclosure regarding the presence of pets! When there are animals in the park, which is allowed, the owners let their animals ""walk freely"" next to the tents, bags, chairs, etc... Not worrying about where the pet needs to go. An unfortunate situation! As for the positive aspects, we also know them and are described in several comments."
83545,2051637,5,Manolo_13,08/07/2022,"superb campsite, spacious pitches under the pines, gigantic swimming pool, the sanitary facilities are impeccably clean.... you can't do better"
83545,1953444,4,AV1959,06/06/2022,"High season starts 1/6. Price incl. Electricity with CC and 2 persons 20.20 euros per night. Swimming pool open. Nothing further to add to the previous positive comments. As in many places in Portugal, it is also difficult to cycle safely here."
83545,1932776,4,jacqies,30/05/2022,"Great campsite with swimming pool and shady places. Showers are hot and plenty water coming out. Price for one van and two people was 12,50 (no power) which is one of the cheapest campsites we had so far."
83545,1886810,5,hganhao,13/05/2022,"5 star location. All services working, very clean changing rooms, very restful night. Friendly staff and night security. I advise you to visit Lagoa do Alvão, very close."
83545,1881444,5,Europatour2022,10/05/2022,Just incredibly good campsite. The location is very very good. Everything clean and well maintained. Take a trip to Peña Adventure Park from here! And WiFi works and is free of charge.
83545,1811484,5,FoxyloveVan,09/04/2022,Wonderful place! Everything you need! Nice people! Always my pleasure!
83545,1803521,5,Britziarosa,02/04/2022,"By far the best campsite we've seen in Portugal. very friendly welcome, everything very clean and well maintained. Great environment. We'll definitely be back!"
83545,1777312,5,Rarbarargis,08/03/2022,"Super service, best showers (including free hot water) I've had in ages! Total price for 2 adults, one child and a camper (5m)... A shocking 12 euros!"
83545,1703782,5,NatashaBOK,05/12/2021,"Stayed for a quiet night €15 (2 adults, campervan, electricity). Pool closed due to winter but hot showers included. Free gray and black water disposal and water refilling. The walk along the local lake is nice."
83545,1692074,5,db1511,18/11/2021,"Very pleasant, very friendly welcome, and indeed open all year round!"
83545,1630761,5,Combilove,07/10/2021,"Very nice place, very quiet, easy hikes all around, the lake at 3 'to walk ... Sanitary, laundry, at the top. During the week we were 2 CC. Great for families. Excellent value for money, I recommend!"
83545,1551420,5,InesVicencio,05/09/2021,"Very Good (staff, cleaning, facilities and proximity to the Alvão lagoon). Only the hours of the pool bar and the pool could be the same."
83545,1537517,5,sueycameron,01/09/2021,"We intended staying at this campsite a couple of years ago and were put off because it was so busy (it was a September weekend).
However we've just returned - mid week at the end of August - and loved everything about it. 
The site is beautifully maintained, everything is of the highest quality and the staff and very welcoming. Excellent price too; 7m motorhome plus 2 adults at

 €16.10."
83545,1362724,5,mdpadilla,25/07/2021,"Magnificent, quiet location and good facilities. Free parking for AC entre los Pinos."
83545,1032805,5,Alexandremeneses,07/09/2020,"Very well received by very kind and helpful people. Very nice place with all services, pool, market and cafe. There is a road with car noise. Baths and facilities very clean and in excellent condition. Congratulations"
83545,1030576,5,joanapacheco72,06/09/2020,"Ammazing park. Yes, you need to make your reservation because the space you have for each group is really big. You have shadows, good hot bath, swimming pool, a lot of pines and all for 23€, 4 persons, a Motorhome with electricity."
83545,1013399,1,ToInfinityAndBeyond,30/08/2020,"They don't let you go there to service the motorhome (and pay for it), it's rather sad they use the Covid-19 excuse for it."
83545,992140,1,packngo,22/08/2020,"We were there with our motorhome and they said we couldn't stay unless we had a reservation. Sounds fair. So can I please have look around so I can see the place and know what to expect when we are back? No, because the rules she said. Sounds fair, but I'm not coming back. Who knows what other rules they might have."
83545,907935,5,hcpina,28/07/2020,"Located near the Alvão Lake, very quiet and peaceful and with a great natural surrounding. The showers and facilities have great conditions, with hot water, washing machines, swimming pool and electricity (slightly overpriced though)"
83545,904167,5,RuiMoreira,27/07/2020,"41.5066889, -7.6611021 correct address Park clean and very good condition! clean pool and well treated water"
83545,739905,4,Staceo,07/11/2019,Great campsite. Toilets and showers very clean and tidy. Pool closed as off season. But grateful to find it open in November.
83545,687400,5,alexop12,12/09/2019,"Perfect camping, showers and new and very clean bathrooms. For 2 people and the SUV they charged us € 12.50, very good price. You can take your pet and there are some beautiful stone houses (bungalows). It has a pool that I will have at 10 am; bar and supermarket open until 12 at night. The receptionist very friendly. Nearby there is a beautiful lake and you can make walking routes. Just attached there is a restaurant. The site is amazing, we will return."
83545,662417,5,svensvans,27/08/2019,"A terrific spot! Super nice laid out, very clean and modern. Showers hot, staff was super friendly and helpful! English possible :) Quiet, relatively cheap and much to discover. At any time again and only to be recommended!"
83545,645315,4,LiLo8,20/08/2019,"Beautiful campsite, new. Perfect home thanks to the French speaking lady. Spirited night spiritually speaking. Location loaded."
83545,613225,5,Romaxel,09/08/2019,"Everything has been said, beautiful campsite built in local granite, super nice and clean, the staff is attentive and attentive! The lake next door is also very nice, do not hesitate to make a stop! 20 euros for 2 children and 2 adults in van"
83545,569287,4,laurelecoeur,22/07/2019,"Very nice home, clean and quiet campsite at this time. Beautiful lake next"
83545,523173,5,momojuju,21/06/2019,"Very nice and welcoming staff, clean and spacious bathroom. Very calm and very pleasant place, natural setting (stones, woods, trees) on top! Lake ride in front to do!"
83545,498238,5,seelenverwandt,31/05/2019,"Topp, beautifully located incredible, that was not busy. Clean is understated and the location is gorgeous!"
83545,356325,4,0609832829,27/08/2018,Very good for a pose with the hello children pool nickel small stroll along the pond next to nice 24euro night for 2 adults 2 children with electricity 1camping car trailer home in French
83545,338289,4,lagirafe8,16/08/2018,"We arrived late, around 19:45 and unfortunately we could not find a place for our motorhome of 6m because there are many tents and it is free placement ... It's really a shame because it had the look very good .. So we parked next to the lake. Quiet ..."
83545,334001,4,galoubreizh,14/08/2018,I confirm the previous comments. Missing just a little shade for some sites and a pity that the soil is still only earth and sand ...
83545,308996,5,Romar1317,31/07/2018,Beautiful area. Helpful and pleasant staff. Very clean and comfortable. I recommend this place.
83545,297416,5,isabellejacky,22/07/2018,Superb camping in nature very clean sanitary. 4 washing machines at 3 € per machine. 2 swimming pools bar and restaurant. count 18 € per night with electricity camper 2 adults. Very nice home
83545,277473,4,spaiva,29/06/2018,Camping in Vila poco de aguiar
83549,2847530,3,juanini,12/06/2023,"Five level paved squares. Next to the children's park where on Saturday night there were young people at night shouting. Gray and black water with source. Obviously if the town has its water cut off, it is normal for the area's source to be cut off due to drought. Hopefully everything will be fixed soon. Thanks to the City Hall."
83549,2603937,4,SleepingAround010,09/03/2023,"Quiet place, sheltered. Great place to spend the night. Unfortunately no water on the taps today"
83549,2585785,1,MIREILLE40140,21/02/2023,Still no water damage
83549,2578791,1,Carlosfigura,15/02/2023,The water doesn't work.
83549,2531538,2,velavela,28/12/2022,thanks to Villanueva del duque for this area but we stopped to visit the town and sleep but the pity is that there is no water and it is cut off
83549,2437160,5,jtham66,11/10/2022,"A great place, with a playground for the children right next to it. Place is a bit hidden. Google maps will lead you to the parking lot on the other side of the playground. Just drive around the block and you're there."
83549,2414653,5,Meandmedog,30/09/2022,"Excellent. Very quiet by 21h. Google maps led me to the wrong side of the playground. Confusing at first but swiftly sorted. No water but it wasn't long before somebody from the ""marie"" made contact and offered an alternative source . Very friendly.  Sadly local restaurants were not open but that doesn't alter the fact that this municipality has made a superb facility available at no cost"
83549,2402052,2,josemleon2,25/09/2022,Without water (I guess because of the drought) and without signaling. Otherwise it seems like a good place in a nice town. We do not spend the night
83549,2368040,5,ertruji,13/09/2022,"A great area, very quiet, clean and very well maintained, with all its preparation, a 10 for the Villanueva town hall."
83549,1959445,4,rvanvugt,08/06/2022,"What a surprise and superb engagement of this little village. A perfect spot to spend the night including all services we need and want, what more can we expect. Thanks to the municipality for this initiative. But why do Spanish keep installing watertaps with a push button? I attached a strap to keep it pressed, especially as the water pressure is not too high. Quiet night, wonderful!"
83549,1791202,5,ManfredEk,22/03/2022,"We stood alone and had a very quiet night. It is a very nice parking space, which is a bit in the background. Everything available what you need. Thanks to the small friendly town! (Easier to find if you approach by coordinates)."
83549,1761956,4,Alfon80,21/02/2022,"Area with water and separate taps working, quiet night, nice walk to the hermitage of Guía. New playground for the little ones. Thanks to the town hall"
83549,1706296,4,BasilBolty,08/12/2021,"The water has been disconnected.  The area seems nice and quiet.  Bar restaurant around the corner.

EDIT Some local council workers turned the water on for us.  The pipe has a leak... Very friendly."
83549,1703791,2,rafaydana,05/12/2021,"There's no water. Paved, level, quiet. Too bad that something as important as water is missing. Thanks to the municipality."
83549,1193038,4,PerfiladaLyfe,11/05/2021,"It seems to be a very quiet place, a bit off the national highway. the only thing there is a gym that opens its doors and you can listen to music during the day. I'm going to spend the night to see how it goes. Access is right next to a dirt esplanade with a booth, the GPS sent me to the main entrance of the children's park that is right next to it."
