placeId,reviewId,reviewRate,reviewUser,reviewDate,reviewContent
97689,1966877,5,mazoy49,11/06/2022,"nice car park, free at night paying during the day, €6 until 3 p.m., during the day no idea. nice spot, surrounded by the mountains on one side and the hospital on the other, but very quiet spot. possibility to have breakfast at the small cafe facing the sea. very recommended"
97689,1842993,5,quiberon07,21/04/2022,"Very quiet place. Flat floor, no noise, very close to the beach and no noise."
97689,1647189,1,Iruya,16/10/2021,"For occupying three parking spaces, they give me a fine ... but they also give you a fine x occupying for occupying a space because the nose comes out. ... in the end they take away the fine, after we leave"
97689,1609271,1,karibu39,26/09/2021,"Site ""non grato"" makes it impossible to park in ac or, let alone spend the night, I do not recommend it, nothing attractive to see except the beach, which is like the others, nothing recommended"
97689,1326395,1,Danielyanaich,15/07/2021,Penalty for occupying more than one place. Impossible to occupy only one for a motorhome.
97689,960767,4,JoDoGo,14/08/2020,"We arrived from 8pm, outside of payment hours and spent the night without problems. Very calm. There are beach showers. The toilets were closed at night."
97689,868903,3,RVs,14/07/2020,"Payment in two strips until 8pm (€ 5 each or € 8 a day) there is an area with a height barrier (next to the hospital and the beach: flatter) was open in July and we were advised to park there due to AC size. In the street that goes down there are narrow, sloping and short squares next to a pine forest with barbecue tables and a fountain. Maximum stay 24h."
97695,2889983,2,HoffmannFamily,25/06/2023,Really tilted parking lot with many comings and goings all night long. Strongly discouraged during the day and to be used only as a last resort. We arrived at midnight and left at 8am.
97695,2546870,1,Turbo2310,08/01/2023,"We too were victims of a burglary in the afternoon - window smashed, PC, Ipad, Macbook, money, keys, passport gone. With that, our vacation in Spain was over."
97695,2291870,1,Syotos66,23/08/2022,"We parked our converted van in this car park in the middle of the afternoon. We left for two hours at the beach, which is indeed close. However when we returned our van had been visited (window broken) the van was turned over and some money was stolen from us. On this same car park when leaving, we also met another van which had suffered the same fate!!!!"
97695,2245976,5,Andreea1004,16/08/2022,"Plenty of spaces, quiet and safe sorounded by residential area. We've spent 3 nights in May and another 3 in August. Is not so flat and no services. Good sattelite and 4G reception. A small playground for kids. Beach so beautiful 10 min walk and an amazing restaurant there with playground too."
97695,2139968,1,Serenca,29/07/2022,"the place itself is as described, but we were the only transporter next to a few local cars. Just before 1am a car pulled up behind us and someone knocked on the window to check that the door was open. we could evict him. They came back at 5:45 a.m., the driver's door lock was now broken, but they couldn't get in the car. despite the quiet area, unfortunately no longer safe."
97695,2033128,4,Isaakvs,03/07/2022,"Good place to park at night, in the morning it fills up quickly with cars to access Cala de Canyelles. Quiet and very few cars at night. It has been a pleasant experience."
97695,2018182,3,isidoro65,28/06/2022,"Good parking to spend the night, no services, sloping, quiet and safe"
97695,1992226,5,xini,19/06/2022,"this one is good, the other two are worse. It has a children's park and it is an area with easy parking, quiet and a good place to spend the night."
97695,1684910,4,Saerilein,11/11/2021,"Here you could spend a quiet and safe night. In a residential area, however, there is a lot of forest around one and a few houses."
97695,1632757,5,AnneThomsen,08/10/2021,Great place for one night. Quiet. Only little traffic. With trash bins too
97695,1305348,5,YoannSouris,08/07/2021,"I spent a peaceful and quiet night there! We feel good there! However, allow a 30-minute walk to get to the center of the city. A beach is accessible 5/10 minutes away."
97695,1274918,4,domiho,24/06/2021,"Good, calm and quiet place. Lot of space even in high season. It’s good place to spend night, I think."
97728,1039581,1,iveco89,10/09/2020,Almost perfect park. unfortunately it is not allowed to take animals.
97728,603776,4,camp12345,06/08/2019,Lovely area also another parking area just before this one again on the river. Very quiet at night and good inexpensive bars nearby. Lovely swimming for us and our dog. No facilities but quiet no barking dogs
97728,481763,5,vicdanernie,11/05/2019,"We stayed for one night. There were plenty of car spaces, flat surface, toilets were open all night and there was a sink with running fresh water beside the BBQs (we drank it with no problems). We went on the 20km hike which starts and finishes at the location. Fantastic hike, quite difficult as some of the track is over grown and poorly signed. We had a refreshing swim after the hike!"
97728,360690,5,fsacramento,31/08/2018,". Wonderful place. It has a support bar, park for 50 vehicles, park for motor homes and an extensive beach for bathers. This park is part of the pedestrian trail of the mountain and is one of the most visited by the Aguedenses and tourists in the summer."
97737,3259438,1,NCDMOUNTAIN,04/09/2023,"Too many bottles everywhere... a shame. We went to the official area and it was worse... hahaha, bad luck maybe, but I don't think we'll go back. The city council can lose a line of tourism if it does not take care of these things."
97737,3114236,5,Adricollage,10/08/2023,one of the best places we have been. The views and the tranquility are the best. access for the AC without problems.
97737,3072385,1,lidiapeur,04/08/2023,"there is an Endesa thermal power plant next door, it looks like Mordor with more chimneys. In fact, it is classified as the most polluting in all of Spain and one of the most polluting in Europe. We stayed to eat and after half an hour I had an asthma attack. we ran out of there. I don't know how anyone can consider something like this a good site."
97737,2922199,4,patval974,04/07/2023,"Saturday morning impossible access to services because local market. At the parking lot you can go down to the edge of the lake, wow view. We slept there. very good. On 2/7 a national extreme sport competition took place. The car park remains open only the beach closes at 11 p.m."
97737,2920385,5,enbuscadelsol,03/07/2023,Nice quiet and different place. Town relatively close to walk. Incredible sunsets!!
97737,2613889,3,Kurt-Suender,18/03/2023,"You can stand super and safe. The ground is solid! We stood there for 2 days in the rain, driving away wasn't a problem. Actually great for the dog, but unfortunately it is not allowed on the beach side. There is no service!"
97737,2502842,1,egoman,22/11/2022,"Danger of getting stuck in rainy weather, continued driving!"
97737,2373120,5,albertocasaus,15/09/2022,It is a great place to spend a quiet night and sleep soundly. A huge lake in front and a very large level area with easy access. The worst thing is the proximity of the nuclear power plant…
97737,2366266,5,Malebo,13/09/2022,"Spectacular site, we stayed alone to sleep without any problem. Site without services but with beach, countryside, hiking trails and public toilets."
97737,2331250,5,Didacanis,02/09/2022,Pleasant surprise to find this site. Area still to be exploited that offers many possibilities close to Fragas do Eume. Idyllic place with a desire to repeat.
97737,2259278,5,nuriamm,18/08/2022,"Cool! Perfect place to sleep and spend the day. Quiet, and with almost no people, we were only 4 ACs, great to see the sunset. They close from 24h to 8h, but there is no problem staying inside."
97737,2258549,5,alexyanezdelacal,17/08/2022,"One of the best places I've been, a paradise, the brutal truth."
97737,2237580,4,SoraiaTeles,14/08/2022,"Plus: Nice place to spend the nigth with many other campervans. It is well preserved, the water is not so cold and is rated as good quality. There are very clean wc, a bar (with meals) and bike rental. The village seems nice.
Minus: wind can make the experience on the beach unpleasant. You can't find the place by inserting the adress in the gps!qqq
There was a fire when we stayed, we left early."
97737,2181242,5,flesespark,05/08/2022,"quiet night with 3-4 other campers-ACs. just above the lake, with a bar (terrace), tables to eat, and bathrooms. the water in these was a bit cloudy. They explained to us that it was drinkable, but just in case we didn't drink. It could have been a punctual breakdown, but just in case, take water."
97737,2168995,5,CharoCabanes,03/08/2022,"Cool!!! This is As Pontes beach. The enclosure is fenced and closed at night (from 12pm to 8am) but overnight stays are authorized. The place is committed to nature tourism. There are routes around the lake and through the Fragas do Eume. Rental of electric bikes, kayaks, sailboats, etc. A beach bar that opens at 10 am with good breakfasts and closes at 11 pm. Very well priced. Views 10!"
97737,2165983,5,volvov40folks,03/08/2022,"nice calm place, ideal for spending night there, surrounding was clean"
97737,2155774,5,Paichi,01/08/2022,"Spectacular place, especially if you don't catch it overcrowded. We spent two nights practically alone, very quiet. We did the route that goes around the lake, we took the sandwiches at the beach bar, very friendly people. The Endesa thermal power plant was not working, I do not know if there is noise when it does"
97737,2070114,5,aponz,13/07/2022,"We slept one night and it was great! The beach is well-kept and the lake has crystal clear water. There are 2 kiosks, one for food and drinks and the other for ice cream. They make great homemade pizzas and burgers! You can also rent a paddle surf board, kayak, everything is taken care of by the bar that is very nice. As of July 15 they close the parking from 00 to 7, but they let you sleep."
97737,2040490,5,Tirex,05/07/2022,Area enabled for motorhome parking with impressive views of the lake. Right next to the beach area suitable for swimming.
97737,2017669,5,elenagm77,28/06/2022,"area authorized as motorhome parking, put it at the beginning. It is grass but uneven. stunning views of the lake. ( dogs can not go down ) . hiking trails can be done. a short walk to town. in the morning some tractors passed by , but we slept 2 nights very well ."
97737,1853721,1,220658,26/04/2022,This place could be nice if it wasn't so close to industrial sites. We left immediately.
97737,1742037,5,Rasjahcor,27/01/2022,Parking on grass with some unevenness (necessary chocks). Very good access for large vehicles. Spacious quiet and cozy. A bit far from the center of town to walk. Nice views towards the lake.
97737,1739668,5,unbalconnoche,23/01/2022,Spectacular place next to the lake that was created where the old mine was. It has no services but the town area is nearby. We only stop to eat and take a walk.
97737,1587324,4,Primpiratas,17/09/2021,"Lake beach parking. At 100 meters there is a tourist office. Somewhat uneven. Quiet night, waking up with the sun reflecting off the water. The area is kept very beautiful. From there the path to Memoria starts around the lake."
97737,1574675,4,lgte,13/09/2021,"I did not sleep, but it seems like a good place to do it even though it is under electrical cables. there are several parking areas. It is forbidden to go down with dogs to the beach area but there are routes to do through the mountains with them tied (or so it says on the sign). there is good Movistar coverage but not stable enough to work."
97737,1571403,5,amainar,12/09/2021,"Excellent place to practice water sports and very quiet for the night. Thank you Council of As Pontes. In the town there are all the necessary services for emptying gray, black and filling. a 10."
97737,1527828,5,chispeantes,29/08/2021,"Lovely site. Park in the parking lot below, next to the water. Slight unevenness. We put chocks on but the police, who passed several times making the rounds, did not come near to say anything. Everything is great. There is even a very nice bar-truck where they sell pizzas and drinks. The beach is spectacular."
97737,1505725,5,jordaco,24/08/2021,Beautiful place where we have spent the night ... we will return !!!
97737,1503717,5,Iramalho,23/08/2021,Perfect sunset!Beach with showers and Wc!Great for any car!
97737,1503295,4,MC4333,23/08/2021,"Between the motorhome area in the city center and this magnificent place to rest, As Pontes is an almost perfect place. Ratified in previous comments. Thanks to the city council."
97737,1493336,5,FuXerxes,21/08/2021,A very nice place to spend a few days. Whoever drives down the street can stand directly at the water and has a beautiful view over the lake. There is also an artificial beach that is well frequented during the day and even has a beach volleyball court. The police drive by several times a day to check that everything is okay.
97737,1455428,4,madeincangas,14/08/2021,Parking next to the reservoir. man-made beach area with showers. good place to spend the day and sleep. no services.
97737,1396908,4,SalvaCastilla,02/08/2021,"Access is through the roundabout at the Repsol gas station, not through the one indicated by the navigator. There is more parking further down than the app indicates, next to the lake. A wonderful place."
97737,1347814,4,Carlosmunoz,21/07/2021,"Very cool place, pity that there are no services for the caravan, but the parking is very good. The GPS leads wrong, it is the second roundabout, not the first. Where is the gas station, opposite is taken for the parking of the lake"
97737,1158122,5,jorconde,26/03/2021,Very quiet place ideal to be isolated. We have called the municipal authorities and we can spend the night without problem. ideal for bikes and long walks
97737,1003950,5,Luipi,26/08/2020,Spectacular place to spend a bathing day on its artificial sandy beach. There are many parking places that are also shared with cars. As we are informed in the beach bar they no longer close the doors at night but it is advisable to make a call to the municipal authorities if you intend to stay the night.
97789,2630942,5,WestyP,30/03/2023,"Stopped here to have lunch, lovely spot by the sea.  Beautiful."
97789,2050990,1,flopes90,08/07/2022,Caravans prohibited!
97789,1463623,3,parktm22,15/08/2021,"Very quiet and sheltered from the wind. We didn't spend the night here, at 9 pm we were going to start eating something there, but the police appeared and asked us to leave."
97789,1237943,5,Vargmalade,05/06/2021,"Amazing spot, small path leading to the beach. We haven't slept there but no GNR in sight"
97789,1070305,5,MiguelCabral,26/09/2020,"The view is great! We stayed here for one night, and we really enjoyed it. There is one spot some meters downer that is more sheltered from the wind and from the road! However, this place worked out for us very well too! The GNR passed by us in the morning and didn't say anything. I don't know if they would have done something if there were more cars here. PLEASE do not leave garbage behind."
97789,1065459,5,HelmLeBus,23/09/2020,Very nice place on the cliffs next to a castle. Perfect spots for camping and parking with a nice rocky beach. There were no problems with the police.
97789,1016268,4,vicentevicent,31/08/2020,"Perfect place to spend the night, with spectacular sunrise views, we spent the night of September 1 and we were alone."
97789,951179,4,Sugorropu,11/08/2020,"Starting from the fort there is a passable dirt road that stretches several hundred meters. We have spent two nights. No problem. Although when we arrived the night before the police had passed warning that it was not possible. And yet we have slept with more than 10 AC, Camper and tents. Incredible views."
97789,943317,5,novamoon7,09/08/2020,"A heavenly place to stay! Lots of space and a fantastic view! The road there is a bit bumpy and you have to see that you are standing straight, but we got through well with our Sprinter. No service."
97789,867172,4,Manjerico,13/07/2020,"We spent 1 night, no problem. Excellent view of the island of peach. Little space for caravans, max 3. Close to the road, but not very busy."
97789,726317,4,Papillon14th,20/10/2019,"Great place with a fantastic view, uneven floor attention. Coffee and wc near (3 min)."
97789,388671,3,louishlt,06/10/2018,Parking at the top of a cliff overlooking the ocean. Many places.
97811,1684454,2,Gallma,10/11/2021,We arrived at night and couldn't find the path described....
97836,2947816,4,Marleenrit,10/07/2023,"Special place, it has something. However, on arrival you first have to clean up rubbish from the previous guests. A little further on is an old water mill, nice to walk to (2 minutes walk)."
97836,2761913,4,BBQontheRoad,19/05/2023,"A stream splashes and flows into the river. There is wild mint. Dusty, but you can bathe in the river. We travel with a Fiat Adria Twin. 6.5m long + bicycle carrier. Almost fully loaded. Turning at the bottom went perfectly. It was dry. To get back up it's best to turn on traction control and take a run up at the bottom of the last slope before you hit the street. Exciting but it went well."
97836,2713508,5,KerryAnn,01/05/2023,"Love this! we shared this spot with a local Fisherman who was so keen to see th3 van and very friendly. Didn't swim until later on,but rhe river was lush. Very private. 
The locals seemed to mainly gather on the other side. Walking distance to the main town."
97836,1841982,4,robert821,20/04/2022,Lovely little spot. Directions with Google maps took me in the wrong direction. When you get in the area- stop and take a good look at the map to work out the way there. Don’t take the village route from over the river as it’s very narrow and I scratched my camper wheel in the process because it was so narrow. the river had lots of frogs!
97836,814194,5,jacekpodroznik,01/06/2020,"Nice spot, clean and quiet, just in the morning some dogs barking on the other side of the river, it was nice tho :) thanks"
97836,549029,3,jlnb,11/07/2019,Actually a little dirty and very dusty sand. After the place is nice. Thanks anyway for the place
97836,477992,2,Geoff199,06/05/2019,"Such a shame - I dared not to take my 7 m van down the steep, sandy track to this location.  The pictures posted by the originator were so attractive.  
One of my Sat Navs wisely refused to direct me there but Navmii suggested going down the slope."
97848,3063606,5,Mimouche,02/08/2023,Excellent spot to spend the night. Indeed we vaguely heard the dogs in the distance but do not push it does not prevent you from sleeping. There really is a way to nab a spot in the shade when the sun is beating down. Superb city to visit a little away from the tourist paths. Don't miss the castle and the fort at the top of the hill ;-)
97848,2907798,2,Richard17,30/06/2023,Woken up at 6 a.m. by someone picking up the leaves with a blower. Dogs barking all night. Too bad because we wanted to visit the city.
97848,2606710,3,ElVeterano,12/03/2023,"Generally a quiet place to stay for a night, but campo dogs in the distance barking at 3am to 5am may spoil your night. An interesting town with a castle and some great restaurants. Swimming pool was closed but the restaurant was open on this Saturday night. Plenty of other eating and drinking places in town a short walk away."
97848,2539829,5,fonso66,03/01/2023,Great place. We spent 2 nights. Near the center. Nice town with a lot of beautiful corners. You can take a dip in the heated pool 30 meters from the car park. quiet and sunny.
97848,2518386,3,Titopomi,10/12/2022,Very quiet to sleep. 5 minutes walk from the center
97848,2356313,4,AnaOrtega,09/09/2022,"It is the parking lot of the sports area. Total tranquility. We stayed two days. Great and beautiful pool next to it Good restaurant in the pools, Beautiful and elegant town"
97848,2350090,4,fernandapilomeca,07/09/2022,"no services, but good for staying overnight and visiting the castle."
97848,2229305,2,trafalgar,13/08/2022,Good to visit town and even spend the night.
97848,1853989,3,JRosa,26/04/2022,"Parking zone only. No services. Quiet place, I stayed overnight without problems."
97848,1845964,4,MC4333,22/04/2022,Good parking. Please put a gray drain.
97848,1550174,3,Ralphdomi,05/09/2021,"We stayed there for 2 nights and that doesn't seem to be a problem. Superb municipal swimming pool right next door. We were able to hike after passing through the tourist office. Tip: have a drink in the bar open only at the end of the afternoon near the car park, after the swimming pool below. 2 beers 1 glass of white wine: € 3 and good music. Beautiful village. We feel good there."
97848,1092290,3,Laveloz,13/10/2020,"Good to park and spend a night. It is quiet, but if you park in the squares for this you will be on a slope, you must do it on one of the sides."
97848,875523,4,elysium3,17/07/2020,Perfect for parking and visiting the city
97848,781393,4,family04,16/02/2020,"According to Google maps, it is 1 CC parking lot but no sign indicates it. Good, level, no service. Movement during the day because soccer match, at 9:30 p.m., no one left, only one or two dogs barking ... all night. Town center at 500m on foot."
97848,405223,4,fbrunner,06/11/2018,We spent 3 quiet nights here. There is a bicycle service station nearby where you can get water. There are no other amenities nor public restrooms. Next to the supermarket Pingo Doce.
97884,3173151,4,DavidGarrido,18/08/2023,"Pretty good, busy but quiet at night and nice place, pool right next to it. More traffic in the afternoon. No problem with a nasturtium motorhome and a dog"
97884,3008145,5,profepatata,23/07/2023,"Complicated access as it is a narrow two-way road, but it is worth getting there. To spend the night in the exact place shown in the photos, it is recommended to ask permission at the beach bar. Also, if you notify them, they give you access at night to the toilets and showers. The place is wonderful with well-kept natural pools and you can eat well at the beach bar."
97884,3000014,1,Chrislan_at,22/07/2023,"Very narrow path. When you pass a car, it makes you sweat... I'm wearing a hood, and when I got there, and I saw the access ramp... I turned around where I could and took off. If you go with a nasturtium, you stick to the fixed branches, and the entrance is very narrow. I suppose that with a profiled or a camper, it will be easier."
97884,2908382,5,Maica978,30/06/2023,"Excellent large and fairly level car park. At night Eulogio who runs the restaurant leaves the women's toilet open for us. All a detail. It eats wonderfully. quiet during the week, on weekends how full everywhere. Tables to eat without having to consume. But it doesn't hurt to consume something either. It is just after the restaurant an easily accessible slope with shadows."
97884,2869869,1,Merchina,19/06/2023,"Very crowded in summer months, very narrow access and not suitable for motorhomes. Better the one on the other side of the river."
97884,2339870,5,solrrak,04/09/2022,"Ground esplanade just behind the bar. We spent a quiet night and ate at the kiosk/ bar. The access road is somewhat complicated. If you just want to go to the bathing area, it is not worth going here, parking is much easier from across the river."
97884,2232591,1,Patmorram,13/08/2022,We have not been able to sleep because they do not authorize overnight stays if you go with a dog.
97884,1837840,5,Irene35,19/04/2022,We have spent a very quiet night. Nice and very nice place. When the beach bar is open you have to notify to be able to park and stay overnight. Narrow access but it is easy to get there.
97884,1815114,5,andonimayo,11/04/2022,We have spent one night. Very quiet! Services were closed! Just like the bar that was also closed! For the time of year! The narrow access!
97884,1704729,4,Urbanfit,06/12/2021,"We have been two nights, the first there was a camper and the second alone. Yes, access is narrow but you can pass. We have a 7.5m AC and we have entered without problems. good place to do walking routes. We have been in the one that appears in the photo."
97884,1544641,5,Lolololez,03/09/2021,"Nice place, quiet at night. It is recommended to have a drink at the beach bar and ask for permission to stay overnight. Access with care no problems. Nice pools and interesting town. The parking lot in the photos is past the beach bar, that's the place. Clean showers and toilets"
97884,1092292,3,Lordexess,13/10/2020,Closed on the date of publication of this comment. Branches inside the bathrooms with closed bars. Probably by covid-19.
97884,955984,1,Onuzahori,12/08/2020,"Not suitable for motorhomes or large volume vans. The access road is very narrow and two-way. Large vehicles cannot enter the parking lot, it is not possible to make the turn. And the area that I have seen in the photos is just part of the narrow path."
97884,921995,5,Laufre,02/08/2020,"Good place, we have spent 2 very quiet nights. The access road is narrow and it was not very crowded, there was only one camper. You let us know at the chiringuito that you are staying in the parking lot and without any problem, they have told us where to better locate us. To spend the day in the natural pools and eat at the beach bar."
97884,669837,4,patricita,31/08/2019,Except for the guy who manages the place that is the town hall and does not like dogs the site is perfect. They leave the girls' bathroom open in summer and you have showers and shade.
